{"run": 326, "commit": "b63ee0a", "metric": 1.7712, "metrics": {"win_rate": 16.7, "net_pnl": 291.14, "total_trades": 6.0, "tp_exits": 1.0, "sl_exits": 5.0, "eod_exits": 0.0}, "status": "keep", "description": "cooldown sweep @best: cd=2", "timestamp": 1785880732, "segment": 0, "session": "newgen-orb-1h"}
{"run": 327, "commit": "b63ee0a", "metric": 0.6277, "metrics": {"win_rate": 6.7, "net_pnl": -786.9, "total_trades": 30.0, "tp_exits": 2.0, "sl_exits": 28.0, "eod_exits": 0.0}, "status": "discard", "description": "shorts ON @SL=0.05/TP=1.5/buf=0.3", "timestamp": 1785880748, "segment": 0, "session": "newgen-orb-1h"}
{"run": 328, "commit": "b63ee0a", "metric": 1.7712, "metrics": {"win_rate": 16.7, "net_pnl": 291.14, "total_trades": 6.0, "tp_exits": 1.0, "sl_exits": 5.0, "eod_exits": 0.0}, "status": "discard", "description": "EOD sweep @best: EOD=870", "timestamp": 1785880749, "segment": 0, "session": "newgen-orb-1h"}
{"run": 329, "commit": "b63ee0a", "metric": 1.7712, "metrics": {"win_rate": 16.7, "net_pnl": 291.14, "total_trades": 6.0, "tp_exits": 1.0, "sl_exits": 5.0, "eod_exits": 0.0}, "status": "discard", "description": "EOD sweep @best: EOD=900", "timestamp": 1785880749, "segment": 0, "session": "newgen-orb-1h"}
{"run": 330, "commit": "b63ee0a", "metric": 2.164, "metrics": {"win_rate": 20.0, "net_pnl": 359.66, "total_trades": 5.0, "tp_exits": 1.0, "sl_exits": 4.0, "eod_exits": 0.0}, "status": "keep", "description": "buf=0.5 + cd=2 combo @SL=0.05/TP=1.5", "timestamp": 1785880750, "segment": 0, "session": "newgen-orb-1h"}
{"run": 331, "commit": "b63ee0a", "metric": 1.7712, "metrics": {"win_rate": 16.7, "net_pnl": 291.14, "total_trades": 6.0, "tp_exits": 1.0, "sl_exits": 5.0, "eod_exits": 0.0}, "status": "discard", "description": "perturb buf=0.4 @best", "timestamp": 1785880761, "segment": 0, "session": "newgen-orb-1h"}
{"run": 332, "commit": "b63ee0a", "metric": 0.0, "metrics": {"win_rate": 0.0, "net_pnl": -308.98, "total_trades": 4.0, "tp_exits": 0.0, "sl_exits": 4.0, "eod_exits": 0.0}, "status": "discard", "description": "perturb buf=0.6 @best", "timestamp": 1785880762, "segment": 0, "session": "newgen-orb-1h"}
{"run": 333, "commit": "b63ee0a", "metric": 0.0, "metrics": {"win_rate": 0.0, "net_pnl": -235.2, "total_trades": 3.0, "tp_exits": 0.0, "sl_exits": 3.0, "eod_exits": 0.0}, "status": "discard", "description": "perturb buf=0.7 @best", "timestamp": 1785880763, "segment": 0, "session": "newgen-orb-1h"}
{"run": 334, "commit": "b63ee0a", "metric": 2.482, "metrics": {"win_rate": 20.0, "net_pnl": 399.25, "total_trades": 5.0, "tp_exits": 1.0, "sl_exits": 4.0, "eod_exits": 0.0}, "status": "keep", "description": "perturb SL=0.03 @best", "timestamp": 1785880763, "segment": 0, "session": "newgen-orb-1h"}
{"run": 335, "commit": "b63ee0a", "metric": 2.6787, "metrics": {"win_rate": 20.0, "net_pnl": 419.03, "total_trades": 5.0, "tp_exits": 1.0, "sl_exits": 4.0, "eod_exits": 0.0}, "status": "keep", "description": "perturb SL=0.02 @best", "timestamp": 1785880772, "segment": 0, "session": "newgen-orb-1h"}
{"run": 336, "commit": "b63ee0a", "metric": 2.9095, "metrics": {"win_rate": 20.0, "net_pnl": 438.83, "total_trades": 5.0, "tp_exits": 1.0, "sl_exits": 4.0, "eod_exits": 0.0}, "status": "keep", "description": "perturb SL=0.01 @best", "timestamp": 1785880773, "segment": 0, "session": "newgen-orb-1h"}
{"run": 337, "commit": "b63ee0a", "metric": 2.6787, "metrics": {"win_rate": 20.0, "net_pnl": 419.03, "total_trades": 5.0, "tp_exits": 1.0, "sl_exits": 4.0, "eod_exits": 0.0}, "status": "discard", "description": "min_entry=60min @SL=0.02/buf=0.5/cd=2", "timestamp": 1785880789, "segment": 0, "session": "newgen-orb-1h"}
{"run": 338, "commit": "b63ee0a", "metric": 2.6887, "metrics": {"win_rate": 20.0, "net_pnl": 419.96, "total_trades": 5.0, "tp_exits": 1.0, "sl_exits": 4.0, "eod_exits": 0.0}, "status": "discard", "description": "min_entry=120min @SL=0.02/buf=0.5/cd=2", "timestamp": 1785880790, "segment": 0, "session": "newgen-orb-1h"}
{"run": 339, "commit": "b63ee0a", "metric": 0.3396, "metrics": {"win_rate": 14.3, "net_pnl": -1163.98, "total_trades": 7.0, "tp_exits": 0.0, "sl_exits": 6.0, "eod_exits": 1.0}, "status": "discard", "description": "realistic regime SL=0.5/TP=2.0/buf=0.3/cd=1", "timestamp": 1785880791, "segment": 0, "session": "newgen-orb-1h"}
{"run": 340, "commit": "b63ee0a", "metric": 0.3233, "metrics": {"win_rate": 20.0, "net_pnl": -1252.84, "total_trades": 5.0, "tp_exits": 0.0, "sl_exits": 3.0, "eod_exits": 2.0}, "status": "discard", "description": "wide regime SL=1.0/TP=3.0/buf=0.5/cd=0", "timestamp": 1785880792, "segment": 0, "session": "newgen-orb-1h"}
{"run": 341, "commit": "b63ee0a", "metric": 2.7007, "metrics": {"win_rate": 20.0, "net_pnl": 390.86, "total_trades": 5.0, "tp_exits": 1.0, "sl_exits": 4.0, "eod_exits": 0.0}, "status": "discard", "description": "TP perturb 1.4 @best", "timestamp": 1785880800, "segment": 0, "session": "newgen-orb-1h"}
{"run": 342, "commit": "b63ee0a", "metric": 3.1182, "metrics": {"win_rate": 20.0, "net_pnl": 486.8, "total_trades": 5.0, "tp_exits": 1.0, "sl_exits": 4.0, "eod_exits": 0.0}, "status": "keep", "description": "TP perturb 1.6 @best", "timestamp": 1785880802, "segment": 0, "session": "newgen-orb-1h"}
{"run": 343, "commit": "b63ee0a", "metric": 3.4313, "metrics": {"win_rate": 20.0, "net_pnl": 558.75, "total_trades": 5.0, "tp_exits": 1.0, "sl_exits": 4.0, "eod_exits": 0.0}, "status": "keep", "description": "TP=1.75 @best (near ceiling)", "timestamp": 1785880844, "segment": 0, "session": "newgen-orb-1h"}
{"run": 344, "commit": "b63ee0a", "metric": 3.5148, "metrics": {"win_rate": 20.0, "net_pnl": 577.94, "total_trades": 5.0, "tp_exits": 1.0, "sl_exits": 4.0, "eod_exits": 0.0}, "status": "keep", "description": "TP=1.79 @best (exact ceiling)", "timestamp": 1785880845, "segment": 0, "session": "newgen-orb-1h"}
{"run": 345, "commit": "b63ee0a", "metric": 0.0, "metrics": {"win_rate": 0.0, "net_pnl": -285.51, "total_trades": 5.0, "tp_exits": 0.0, "sl_exits": 5.0, "eod_exits": 0.0}, "status": "discard", "description": "TP=1.80 @best (just past ceiling)", "timestamp": 1785880845, "segment": 0, "session": "newgen-orb-1h"}
{"run": 346, "commit": "b63ee0a", "metric": 0.473, "metrics": {"win_rate": 40.0, "net_pnl": -4536.38, "total_trades": 15, "tp_exits": 7, "sl_exits": 8, "eod_exits": 0}, "status": "keep", "description": "baseline tf=5 classic SL=2.0 TP=3.0 buffer=0.1 max_dist=5.0 min_entry=10:00 cd=30 shorts=0", "timestamp": 1785880695, "segment": 0, "session": "newgen-sr"}
{"run": 347, "commit": "b63ee0a", "metric": 0.4024, "metrics": {"win_rate": 41.7, "net_pnl": -4466.59, "total_trades": 12, "tp_exits": 5, "sl_exits": 7, "eod_exits": 0}, "status": "discard", "description": "tf=15 classic SL=2.0 TP=3.0 buffer=0.1 max_dist=5.0 min_entry=10:00 cd=30 shorts=0", "timestamp": 1785880706, "segment": 0, "session": "newgen-sr"}
{"run": 348, "commit": "b63ee0a", "metric": 0.7627, "metrics": {"win_rate": 40.0, "net_pnl": -729.54, "total_trades": 5, "tp_exits": 2, "sl_exits": 3, "eod_exits": 0}, "status": "discard", "description": "tf=60 classic SL=2.0 TP=3.0 buffer=0.1 max_dist=5.0 min_entry=10:00 cd=30 shorts=0 (only 5 trades, unreliable)", "timestamp": 1785880706, "segment": 0, "session": "newgen-sr"}
{"run": 349, "commit": "b63ee0a", "metric": 0.3454, "metrics": {"win_rate": 21.9, "net_pnl": -8662.91, "total_trades": 32, "tp_exits": 8, "sl_exits": 24, "eod_exits": 0}, "status": "discard", "description": "tf=5 SL=1.0 TP=3.0 buffer=0.1 max_dist=5.0 min_entry=10:00 cd=30", "timestamp": 1785880745, "segment": 0, "session": "newgen-sr"}
{"run": 350, "commit": "b63ee0a", "metric": 0.4604, "metrics": {"win_rate": 35.0, "net_pnl": -5422.14, "total_trades": 20, "tp_exits": 8, "sl_exits": 12, "eod_exits": 0}, "status": "discard", "description": "tf=5 SL=1.5 TP=3.0 buffer=0.1 max_dist=5.0 min_entry=10:00 cd=30", "timestamp": 1785880745, "segment": 0, "session": "newgen-sr"}
{"run": 351, "commit": "b63ee0a", "metric": 0.6039, "metrics": {"win_rate": 50.0, "net_pnl": -2669.7, "total_trades": 12, "tp_exits": 7, "sl_exits": 5, "eod_exits": 0}, "status": "discard", "description": "tf=5 SL=2.5 TP=3.0 buffer=0.1 max_dist=5.0 min_entry=10:00 cd=30", "timestamp": 1785880745, "segment": 0, "session": "newgen-sr"}
{"run": 352, "commit": "b63ee0a", "metric": 0.6235, "metrics": {"win_rate": 54.5, "net_pnl": -2458.06, "total_trades": 11, "tp_exits": 7, "sl_exits": 4, "eod_exits": 0}, "status": "discard", "description": "tf=5 SL=3.0 TP=3.0 buffer=0.1 max_dist=5.0 min_entry=10:00 cd=30", "timestamp": 1785880745, "segment": 0, "session": "newgen-sr"}
{"run": 353, "commit": "b63ee0a", "metric": 0.865, "metrics": {"win_rate": 66.7, "net_pnl": -635.2, "total_trades": 9, "tp_exits": 7, "sl_exits": 2, "eod_exits": 0}, "status": "discard", "description": "tf=5 SL=4.0 TP=3.0 buffer=0.1 max_dist=5.0 min_entry=10:00 cd=30 (9 trades, unreliable)", "timestamp": 1785880745, "segment": 0, "session": "newgen-sr"}
{"run": 354, "commit": "b63ee0a", "metric": 1.3795, "metrics": {"win_rate": 75.0, "net_pnl": 1119.87, "total_trades": 8, "tp_exits": 7, "sl_exits": 1, "eod_exits": 0}, "status": "keep", "description": "tf=5 SL=5.0 TP=3.0 buffer=0.1 max_dist=5.0 min_entry=10:00 cd=30 (8 trades, unreliable but best so far)", "timestamp": 1785880745, "segment": 0, "session": "newgen-sr"}
{"run": 355, "commit": "b63ee0a", "metric": 1.38, "metrics": {"win_rate": 75.0, "net_pnl": 1120.89, "total_trades": 8, "tp_exits": 7, "sl_exits": 1, "eod_exits": 0}, "status": "discard", "description": "tf=5 SL=5.0 TP=3.0 buffer=0.0 max_dist=5.0 min_entry=10:00 cd=30 (8 trades, unreliable)", "timestamp": 1785880784, "segment": 0, "session": "newgen-sr"}
{"run": 356, "commit": "b63ee0a", "metric": 480.6166, "metrics": {"win_rate": 85.7, "net_pnl": 3448.44, "total_trades": 7, "tp_exits": 7, "sl_exits": 0, "eod_exits": 0}, "status": "keep", "description": "tf=5 SL=5.0 TP=3.0 buffer=0.3 max_dist=5.0 min_entry=10:00 cd=30 (7 trades, unreliable but huge PF)", "timestamp": 1785880784, "segment": 0, "session": "newgen-sr"}
{"run": 357, "commit": "b63ee0a", "metric": 455.5721, "metrics": {"win_rate": 85.7, "net_pnl": 3268.37, "total_trades": 7, "tp_exits": 7, "sl_exits": 0, "eod_exits": 0}, "status": "discard", "description": "tf=5 SL=5.0 TP=3.0 buffer=0.5 max_dist=5.0 min_entry=10:00 cd=30 (7 trades, unreliable)", "timestamp": 1785880784, "segment": 0, "session": "newgen-sr"}
{"run": 358, "commit": "b63ee0a", "metric": 1.8626, "metrics": {"win_rate": 81.8, "net_pnl": 2562.86, "total_trades": 11, "tp_exits": 10, "sl_exits": 1, "eod_exits": 0}, "status": "keep", "description": "tf=5 SL=5.0 TP=3.0 buffer=0.1 max_dist=5.0 min_entry=10:00 cd=0 (11 trades, trustworthy)", "timestamp": 1785880784, "segment": 0, "session": "newgen-sr"}
{"run": 359, "commit": "b63ee0a", "metric": 1.8835, "metrics": {"win_rate": 88.9, "net_pnl": 2600.87, "total_trades": 9, "tp_exits": 8, "sl_exits": 1, "eod_exits": 0}, "status": "discard", "description": "tf=5 SL=5.0 TP=3.0 buffer=0.1 max_dist=5.0 min_entry=10:00 cd=15 (9 trades, unreliable)", "timestamp": 1785880784, "segment": 0, "session": "newgen-sr"}
{"run": 360, "commit": "b63ee0a", "metric": 180.832, "metrics": {"win_rate": 90.0, "net_pnl": 4891.43, "total_trades": 10, "tp_exits": 10, "sl_exits": 0, "eod_exits": 0}, "status": "keep", "description": "tf=5 SL=5.0 TP=3.0 buffer=0.3 max_dist=5.0 min_entry=10:00 cd=0 (10 trades, trustworthy, BEST)", "timestamp": 1785880791, "segment": 0, "session": "newgen-sr"}
{"run": 361, "commit": "b63ee0a", "metric": 174.2118, "metrics": {"win_rate": 90.0, "net_pnl": 4711.36, "total_trades": 10, "tp_exits": 10, "sl_exits": 0, "eod_exits": 0}, "status": "keep", "description": "tf=5 SL=5.0 TP=3.0 buffer=0.5 max_dist=5.0 min_entry=10:00 cd=0 (10 trades)", "timestamp": 1785880791, "segment": 0, "session": "newgen-sr"}
{"run": 362, "commit": "b63ee0a", "metric": 99.9999, "metrics": {"win_rate": 100.0, "net_pnl": 4929.44, "total_trades": 8, "tp_exits": 8, "sl_exits": 0, "eod_exits": 0}, "status": "discard", "description": "tf=5 SL=5.0 TP=3.0 buffer=0.3 max_dist=5.0 min_entry=10:00 cd=15 (8 trades, 100% WR, unreliable)", "timestamp": 1785880791, "segment": 0, "session": "newgen-sr"}
{"run": 363, "commit": "b63ee0a", "metric": 1.8633, "metrics": {"win_rate": 81.8, "net_pnl": 2563.88, "total_trades": 11, "tp_exits": 10, "sl_exits": 1, "eod_exits": 0}, "status": "discard", "description": "tf=5 SL=5.0 TP=3.0 buffer=0.0 max_dist=5.0 min_entry=10:00 cd=0 (11 trades, PF similar to run13)", "timestamp": 1785880791, "segment": 0, "session": "newgen-sr"}
{"run": 364, "commit": "b63ee0a", "metric": 155.1831, "metrics": {"win_rate": 90.0, "net_pnl": 4193.78, "total_trades": 10, "tp_exits": 10, "sl_exits": 0, "eod_exits": 0}, "status": "discard", "description": "TP sweep: SL=5.0 TP=1.5 buffer=0.3 cd=0 (worse than TP=3.0)", "timestamp": 1785880878, "segment": 0, "session": "newgen-sr"}
{"run": 365, "commit": "b63ee0a", "metric": 163.7327, "metrics": {"win_rate": 90.0, "net_pnl": 4426.33, "total_trades": 10, "tp_exits": 10, "sl_exits": 0, "eod_exits": 0}, "status": "discard", "description": "TP sweep: SL=5.0 TP=2.0 buffer=0.3 cd=0", "timestamp": 1785880878, "segment": 0, "session": "newgen-sr"}
{"run": 366, "commit": "b63ee0a", "metric": 197.9313, "metrics": {"win_rate": 90.0, "net_pnl": 5356.53, "total_trades": 10, "tp_exits": 10, "sl_exits": 0, "eod_exits": 0}, "status": "discard", "description": "TP sweep: SL=5.0 TP=4.0 buffer=0.3 cd=0", "timestamp": 1785880878, "segment": 0, "session": "newgen-sr"}
{"run": 367, "commit": "b63ee0a", "metric": 215.0309, "metrics": {"win_rate": 90.0, "net_pnl": 5821.64, "total_trades": 10, "tp_exits": 10, "sl_exits": 0, "eod_exits": 0}, "status": "discard", "description": "TP sweep: SL=5.0 TP=5.0 buffer=0.3 cd=0", "timestamp": 1785880878, "segment": 0, "session": "newgen-sr"}
{"run": 368, "commit": "b63ee0a", "metric": 300.5276, "metrics": {"win_rate": 90.0, "net_pnl": 8147.15, "total_trades": 10, "tp_exits": 10, "sl_exits": 0, "eod_exits": 0}, "status": "keep", "description": "TP sweep: SL=5.0 TP=10.0 buffer=0.3 cd=0 (monotone TP; R2 caps most, one +10% run)", "timestamp": 1785880879, "segment": 0, "session": "newgen-sr"}
{"run": 369, "commit": "b63ee0a", "metric": 153.5931, "metrics": {"win_rate": 90.0, "net_pnl": 4150.53, "total_trades": 10, "tp_exits": 10, "sl_exits": 0, "eod_exits": 0}, "status": "discard", "description": "max_dist sweep: SL=5.0 TP=3.0 buffer=0.3 cd=0 max_dist=2.0", "timestamp": 1785880885, "segment": 0, "session": "newgen-sr"}
{"run": 370, "commit": "b63ee0a", "metric": 400.079, "metrics": {"win_rate": 92.9, "net_pnl": 10854.95, "total_trades": 14, "tp_exits": 14, "sl_exits": 0, "eod_exits": 0}, "status": "keep", "description": "max_dist sweep: SL=5.0 TP=3.0 buffer=0.3 cd=0 max_dist=8.0 (14 trades, BEST)", "timestamp": 1785880885, "segment": 0, "session": "newgen-sr"}
{"run": 371, "commit": "b63ee0a", "metric": 401.1529, "metrics": {"win_rate": 92.9, "net_pnl": 10884.16, "total_trades": 14, "tp_exits": 14, "sl_exits": 0, "eod_exits": 0}, "status": "keep", "description": "max_dist sweep: max_dist=10.0-20.0 plateau (14 trades, PF~401)", "timestamp": 1785880885, "segment": 0, "session": "newgen-sr"}
{"run": 372, "commit": "b63ee0a", "metric": 201.99, "metrics": {"win_rate": 90.9, "net_pnl": 5466.93, "total_trades": 11, "tp_exits": 11, "sl_exits": 0, "eod_exits": 0}, "status": "discard", "description": "min_entry sweep: min_entry=9:45 (11 trades, PF lower than 10:00)", "timestamp": 1785880885, "segment": 0, "session": "newgen-sr"}
{"run": 373, "commit": "b63ee0a", "metric": 154.8833, "metrics": {"win_rate": 83.3, "net_pnl": 4185.63, "total_trades": 6, "tp_exits": 6, "sl_exits": 0, "eod_exits": 0}, "status": "discard", "description": "min_entry sweep: min_entry=10:30 (6 trades, fewer)", "timestamp": 1785880885, "segment": 0, "session": "newgen-sr"}
{"run": 374, "commit": "b63ee0a", "metric": 3.3491, "metrics": {"win_rate": 83.3, "net_pnl": 6922.48, "total_trades": 12, "tp_exits": 11, "sl_exits": 1, "eod_exits": 0}, "status": "discard", "description": "pivot sweep: fibonacci tf5 SL=5.0 TP=3.0 buffer=0.3 cd=0 max_dist=10 (PF much lower than classic)", "timestamp": 1785880925, "segment": 0, "session": "newgen-sr"}
{"run": 375, "commit": "b63ee0a", "metric": 99.9999, "metrics": {"win_rate": 100.0, "net_pnl": 8752.77, "total_trades": 11, "tp_exits": 11, "sl_exits": 0, "eod_exits": 0}, "status": "keep", "description": "tf sweep: classic tf15 SL=5.0 TP=3.0 buffer=0.3 cd=0 max_dist=10 (11 trades, 100% WR)", "timestamp": 1785880925, "segment": 0, "session": "newgen-sr"}
{"run": 376, "commit": "b63ee0a", "metric": 99.9999, "metrics": {"win_rate": 100.0, "net_pnl": 5243.64, "total_trades": 4, "tp_exits": 4, "sl_exits": 0, "eod_exits": 0}, "status": "discard", "description": "tf sweep: classic tf60 SL=5.0 TP=3.0 buffer=0.3 cd=0 max_dist=10 (4 trades, unreliable)", "timestamp": 1785880925, "segment": 0, "session": "newgen-sr"}
{"run": 377, "commit": "b63ee0a", "metric": 181.3166, "metrics": {"win_rate": 88.0, "net_pnl": 12331.25, "total_trades": 25, "tp_exits": 25, "sl_exits": 0, "eod_exits": 0}, "status": "keep", "description": "shorts=1 tf5 SL=5.0 TP=3.0 buffer=0.3 cd=0 max_dist=10 (25 trades, highest net)", "timestamp": 1785880925, "segment": 0, "session": "newgen-sr"}
{"run": 378, "commit": "b63ee0a", "metric": 92.4515, "metrics": {"win_rate": 83.3, "net_pnl": 10192.27, "total_trades": 24, "tp_exits": 24, "sl_exits": 0, "eod_exits": 0}, "status": "keep", "description": "shorts=1 tf15 SL=5.0 TP=3.0 buffer=0.3 cd=0 max_dist=10 (24 trades)", "timestamp": 1785880934, "segment": 0, "session": "newgen-sr"}
{"run": 379, "commit": "b63ee0a", "metric": 175.3225, "metrics": {"win_rate": 88.0, "net_pnl": 11921.33, "total_trades": 25, "tp_exits": 25, "sl_exits": 0, "eod_exits": 0}, "status": "keep", "description": "shorts=1 tf5 SL=5.0 TP=3.0 buffer=0.5 cd=0 max_dist=10 (robust to buffer 0.5)", "timestamp": 1785880934, "segment": 0, "session": "newgen-sr"}
{"run": 380, "commit": "b63ee0a", "metric": 4.5198, "metrics": {"win_rate": 84.6, "net_pnl": 10602.29, "total_trades": 26, "tp_exits": 25, "sl_exits": 1, "eod_exits": 0}, "status": "discard", "description": "shorts=1 tf5 SL=5.0 TP=3.0 buffer=0.1 cd=0 max_dist=10 (buffer=0.1 breaks PF -> buffer>=0.3 critical)", "timestamp": 1785880934, "segment": 0, "session": "newgen-sr"}
{"run": 381, "commit": "b63ee0a", "metric": 2.956, "metrics": {"win_rate": 84.6, "net_pnl": 5791.75, "total_trades": 13, "tp_exits": 11, "sl_exits": 2, "eod_exits": 0}, "status": "discard", "description": "tf15 SL=3.0 TP=3.0 buffer=0.3 cd=0 max_dist=10 (wide SL matters at tf15 too)", "timestamp": 1785880934, "segment": 0, "session": "newgen-sr"}
{"run": 382, "commit": "b63ee0a", "metric": 400.5471, "metrics": {"win_rate": 92.9, "net_pnl": 10867.68, "total_trades": 14, "tp_exits": 14, "sl_exits": 0, "eod_exits": 0}, "status": "keep", "description": "ROBUST: SL=4.5 buffer=0.3 cd=0 max_dist=10 (same 14 trades as best)", "timestamp": 1785880958, "segment": 0, "session": "newgen-sr"}
{"run": 383, "commit": "b63ee0a", "metric": 400.5471, "metrics": {"win_rate": 92.9, "net_pnl": 10867.68, "total_trades": 14, "tp_exits": 14, "sl_exits": 0, "eod_exits": 0}, "status": "keep", "description": "ROBUST: SL=5.5 buffer=0.3 cd=0 max_dist=10 (same as best)", "timestamp": 1785880958, "segment": 0, "session": "newgen-sr"}
{"run": 384, "commit": "b63ee0a", "metric": 400.5471, "metrics": {"win_rate": 92.9, "net_pnl": 10867.68, "total_trades": 14, "tp_exits": 14, "sl_exits": 0, "eod_exits": 0}, "status": "keep", "description": "ROBUST: buffer=0.2 SL=5.0 cd=0 max_dist=10 (same as best)", "timestamp": 1785880958, "segment": 0, "session": "newgen-sr"}
{"run": 385, "commit": "b63ee0a", "metric": 393.9268, "metrics": {"win_rate": 92.9, "net_pnl": 10687.61, "total_trades": 14, "tp_exits": 14, "sl_exits": 0, "eod_exits": 0}, "status": "keep", "description": "ROBUST: buffer=0.4 SL=5.0 cd=0 max_dist=10 (PF 394)", "timestamp": 1785880958, "segment": 0, "session": "newgen-sr"}
{"run": 386, "commit": "b63ee0a", "metric": 401.1529, "metrics": {"win_rate": 92.9, "net_pnl": 10884.16, "total_trades": 14, "tp_exits": 14, "sl_exits": 0, "eod_exits": 0}, "status": "keep", "description": "ROBUST: max_dist=12 SL=5.0 buffer=0.3 cd=0 (PF 401)", "timestamp": 1785880958, "segment": 0, "session": "newgen-sr"}
{"run": 387, "commit": "b63ee0a", "metric": 330.9447, "metrics": {"win_rate": 84.6, "net_pnl": 10515.34, "total_trades": 13, "tp_exits": 13, "sl_exits": 0, "eod_exits": 0}, "status": "keep", "description": "ROBUST: min_entry=615 SL=5.0 buffer=0.3 cd=0 max_dist=10 (PF 331, 13 trades)", "timestamp": 1785880958, "segment": 0, "session": "newgen-sr"}
{"run": 388, "commit": "b63ee0a", "metric": 1.1657, "metrics": {"win_rate": 47.0, "net_pnl": 3783.54, "total_trades": 66, "tp_exits": 16, "sl_exits": 15, "eod_exits": 35}, "status": "keep", "description": "tf=5|fast=9|slow=21|sl=1.0|tp=1.5|cd=3|shorts=0|eod=885|baseline", "timestamp": 1785880681, "segment": 0, "session": "newgen-ema"}
{"run": 389, "commit": "b63ee0a", "metric": 1.119, "metrics": {"win_rate": 48.1, "net_pnl": 1511.24, "total_trades": 27, "tp_exits": 9, "sl_exits": 11, "eod_exits": 7}, "status": "discard", "description": "tf=15|fast=9|slow=21|sl=1.0|tp=1.5|cd=3|shorts=0|eod=885|tf sweep", "timestamp": 1785880692, "segment": 0, "session": "newgen-ema"}
{"run": 390, "commit": "b63ee0a", "metric": 0.4064, "metrics": {"win_rate": 22.2, "net_pnl": -4121.94, "total_trades": 9, "tp_exits": 2, "sl_exits": 6, "eod_exits": 1}, "status": "discard", "description": "tf=60|fast=9|slow=21|sl=1.0|tp=1.5|cd=3|shorts=0|eod=885|tf sweep", "timestamp": 1785880693, "segment": 0, "session": "newgen-ema"}
