{"type":"config","name":"ORB High Beta","metricName":"profit_factor","metricUnit":"","bestDirection":"higher"}
{"run":1,"commit":"c147c0a","metric":1.4051,"metrics":{"win_rate":36.8,"net_pnl":128400.61,"total_trades":800,"tp_exits":128,"sl_exits":464,"eod_exits":208,"stocks_with_trades":23},"status":"keep","description":"baseline: EOD=15:00 (previously 14:45), SL=1.0 TP=1.5 CD=3 buffer=0.3 shorts=off","timestamp":1781455404,"segment":0}
{"run":2,"commit":"c147c0a","metric":1.2133,"metrics":{"win_rate":36.4,"net_pnl":69713.06,"total_trades":726,"tp_exits":117,"sl_exits":427,"eod_exits":182,"stocks_with_trades":23},"status":"discard","description":"CD=6 (30min cooldown): PF drops vs baseline 1.4051, overtrading still hurts","timestamp":1781455440,"segment":0}
{"run":3,"commit":"c147c0a","metric":1.3879,"metrics":{"win_rate":36.5,"net_pnl":96929.92,"total_trades":598,"tp_exits":95,"sl_exits":355,"eod_exits":148,"stocks_with_trades":23},"status":"discard","description":"CD=15 (75min): PF 1.3879, slightly worse than baseline 1.4051","timestamp":1781455440,"segment":0}
{"run":4,"commit":"c147c0a","metric":1.5387,"metrics":{"win_rate":36.1,"net_pnl":109026.96,"total_trades":507,"tp_exits":84,"sl_exits":306,"eod_exits":117,"stocks_with_trades":23},"status":"keep","description":"CD=30 (150min): PF 1.5387, best so far on high beta, fewer trades=higher quality","timestamp":1781455440,"segment":0}
{"run":5,"commit":"5960b06","metric":1.4414,"metrics":{"win_rate":50.1,"net_pnl":108731.64,"total_trades":451,"tp_exits":68,"sl_exits":151,"eod_exits":232,"stocks_with_trades":23},"status":"discard","description":"CD=30 SL=0.8 TP=1.5: PF 1.4414, worse than 1.5387","timestamp":1781455485,"segment":0}
{"run":6,"commit":"5960b06","metric":1.4326,"metrics":{"win_rate":49.1,"net_pnl":106530.49,"total_trades":442,"tp_exits":39,"sl_exits":151,"eod_exits":252,"stocks_with_trades":23},"status":"discard","description":"CD=30 SL=0.8 TP=2.0: PF 1.4326","timestamp":1781455485,"segment":0}
{"run":7,"commit":"5960b06","metric":1.2671,"metrics":{"win_rate":48.3,"net_pnl":68660.87,"total_trades":437,"tp_exits":20,"sl_exits":153,"eod_exits":264,"stocks_with_trades":23},"status":"discard","description":"CD=30 SL=0.8 TP=2.5: PF 1.2671, TP too far","timestamp":1781455485,"segment":0}
{"run":8,"commit":"5960b06","metric":1.6052,"metrics":{"win_rate":52.5,"net_pnl":145252.34,"total_trades":432,"tp_exits":42,"sl_exits":110,"eod_exits":280,"stocks_with_trades":23},"status":"keep","description":"CD=30 SL=1.0 TP=2.0: PF 1.6052, new best","timestamp":1781455485,"segment":0}
{"run":9,"commit":"5960b06","metric":1.4323,"metrics":{"win_rate":51.8,"net_pnl":109596.01,"total_trades":427,"tp_exits":23,"sl_exits":112,"eod_exits":292,"stocks_with_trades":23},"status":"discard","description":"CD=30 SL=1.0 TP=2.5: PF 1.4323","timestamp":1781455485,"segment":0}
{"run":10,"commit":"5960b06","metric":1.6447,"metrics":{"win_rate":55.1,"net_pnl":148768.73,"total_trades":434,"tp_exits":73,"sl_exits":83,"eod_exits":278,"stocks_with_trades":23},"status":"keep","description":"CD=30 SL=1.2 TP=1.5: PF 1.6447, very high WR","timestamp":1781455485,"segment":0}
{"run":11,"commit":"5960b06","metric":1.6624,"metrics":{"win_rate":54.1,"net_pnl":152841.42,"total_trades":425,"tp_exits":42,"sl_exits":83,"eod_exits":300,"stocks_with_trades":23},"status":"keep","description":"CD=30 SL=1.2 TP=2.0: PF 1.6624, best so far","timestamp":1781455485,"segment":0}
{"run":12,"commit":"5960b06","metric":1.4635,"metrics":{"win_rate":53.3,"net_pnl":114466.19,"total_trades":420,"tp_exits":23,"sl_exits":85,"eod_exits":312,"stocks_with_trades":23},"status":"discard","description":"CD=30 SL=1.2 TP=2.5: PF 1.4635","timestamp":1781455485,"segment":0}
{"run":13,"commit":"fda380b","metric":1.6758,"metrics":{"win_rate":53.6,"net_pnl":158013.81,"total_trades":431,"tp_exits":42,"sl_exits":86,"eod_exits":303,"stocks_with_trades":23},"status":"keep","description":"CD=20 SL=1.2 TP=2.0: PF 1.6758, slight improvement","timestamp":1781455520,"segment":0}
{"run":14,"commit":"fda380b","metric":1.6867,"metrics":{"win_rate":54.2,"net_pnl":159030.94,"total_trades":428,"tp_exits":43,"sl_exits":83,"eod_exits":302,"stocks_with_trades":23},"status":"keep","description":"CD=25 SL=1.2 TP=2.0: PF 1.6867","timestamp":1781455520,"segment":0}
{"run":15,"commit":"fda380b","metric":1.6908,"metrics":{"win_rate":53.4,"net_pnl":156119.28,"total_trades":414,"tp_exits":42,"sl_exits":80,"eod_exits":292,"stocks_with_trades":23},"status":"keep","description":"CD=40 SL=1.2 TP=2.0: PF 1.6908, best so far","timestamp":1781455520,"segment":0}
{"run":16,"commit":"fda380b","metric":1.6912,"metrics":{"win_rate":53.7,"net_pnl":155896.28,"total_trades":406,"tp_exits":42,"sl_exits":80,"eod_exits":284,"stocks_with_trades":23},"status":"keep","description":"CD=50 SL=1.2 TP=2.0: PF 1.6912, plateau","timestamp":1781455520,"segment":0}
{"run":17,"commit":"8df11cd","metric":1.6102,"metrics":{"win_rate":55.0,"net_pnl":148642.02,"total_trades":433,"tp_exits":50,"sl_exits":88,"eod_exits":295,"stocks_with_trades":23},"status":"discard","description":"EOD=15:15 CD=40 SL=1.2 TP=2.0: PF drops to 1.61","timestamp":1781455557,"segment":0}
{"run":18,"commit":"8df11cd","metric":1.1318,"metrics":{"win_rate":38.2,"net_pnl":26803.46,"total_trades":152,"tp_exits":58,"sl_exits":94,"eod_exits":0,"stocks_with_trades":23},"status":"discard","description":"EOD=15:30 CD=40 SL=1.2 TP=2.0: PF 1.13, no EOD exits left","timestamp":1781455557,"segment":0}
{"run":19,"commit":"8df11cd","metric":1.7428,"metrics":{"win_rate":53.7,"net_pnl":194457.07,"total_trades":501,"tp_exits":51,"sl_exits":88,"eod_exits":362,"stocks_with_trades":23},"status":"keep","description":"Buffer=0.1% CD=40 SL=1.2 TP=2.0: PF 1.74, big jump from 0.3%","timestamp":1781455557,"segment":0}
{"run":20,"commit":"8df11cd","metric":1.6682,"metrics":{"win_rate":51.4,"net_pnl":164646.10,"total_trades":453,"tp_exits":46,"sl_exits":84,"eod_exits":323,"stocks_with_trades":23},"status":"discard","description":"Buffer=0.2% CD=40 SL=1.2 TP=2.0: PF 1.67","timestamp":1781455557,"segment":0}
{"run":21,"commit":"8df11cd","metric":1.7721,"metrics":{"win_rate":56.6,"net_pnl":129707.48,"total_trades":332,"tp_exits":33,"sl_exits":63,"eod_exits":236,"stocks_with_trades":23},"status":"keep","description":"Buffer=0.5% CD=40 SL=1.2 TP=2.0: PF 1.77, BEST SO FAR","timestamp":1781455557,"segment":0}
{"run":22,"commit":"8df11cd","metric":1.7004,"metrics":{"win_rate":54.2,"net_pnl":157933.58,"total_trades":417,"tp_exits":42,"sl_exits":81,"eod_exits":294,"stocks_with_trades":23},"status":"keep","description":"CD=35 SL=1.2 TP=2.0: PF 1.70, slight improvement over CD=40","timestamp":1781455557,"segment":0}
{"run":23,"commit":"8d9d8ff","metric":1.7762,"metrics":{"win_rate":56.9,"net_pnl":130118.78,"total_trades":334,"tp_exits":33,"sl_exits":64,"eod_exits":237,"stocks_with_trades":23},"status":"keep","description":"CD=35 buf=0.5 SL=1.2 TP=2.0: PF 1.7762","timestamp":1781455593,"segment":0}
{"run":24,"commit":"8d9d8ff","metric":1.4106,"metrics":{"win_rate":53.6,"net_pnl":95066.10,"total_trades":375,"tp_exits":36,"sl_exits":75,"eod_exits":264,"stocks_with_trades":23},"status":"discard","description":"buf=0.4 CD=40: PF 1.41, 0.5% is the sweet spot low","timestamp":1781455593,"segment":0}
{"run":25,"commit":"8d9d8ff","metric":1.8782,"metrics":{"win_rate":55.9,"net_pnl":128188.08,"total_trades":304,"tp_exits":32,"sl_exits":55,"eod_exits":217,"stocks_with_trades":23},"status":"keep","description":"buf=0.6 CD=40: PF 1.8782, BEST SO FAR","timestamp":1781455593,"segment":0}
{"run":26,"commit":"8d9d8ff","metric":1.4630,"metrics":{"win_rate":55.4,"net_pnl":68679.60,"total_trades":267,"tp_exits":26,"sl_exits":53,"eod_exits":188,"stocks_with_trades":23},"status":"discard","description":"buf=0.7 CD=40: PF 1.46, too restrictive","timestamp":1781455593,"segment":0}
{"run":27,"commit":"8d9d8ff","metric":1.7701,"metrics":{"win_rate":56.8,"net_pnl":129534.48,"total_trades":331,"tp_exits":33,"sl_exits":63,"eod_exits":235,"stocks_with_trades":23},"status":"keep","description":"CD=45 buf=0.5: PF 1.7701, similar to CD=40","timestamp":1781455593,"segment":0}
{"run":28,"commit":"8d9d8ff","metric":1.7772,"metrics":{"win_rate":56.9,"net_pnl":130891.18,"total_trades":341,"tp_exits":33,"sl_exits":65,"eod_exits":243,"stocks_with_trades":23},"status":"keep","description":"CD=30 buf=0.5: PF 1.7772","timestamp":1781455593,"segment":0}
{"run":29,"commit":"2e99a87","metric":1.6187,"metrics":{"win_rate":54.6,"net_pnl":91903.22,"total_trades":302,"tp_exits":46,"sl_exits":78,"eod_exits":178,"stocks_with_trades":23},"status":"discard","description":"CD=50 buf=0.6 SL=1.0 TP=1.5: PF 1.62, worse","timestamp":1781455704,"segment":0}
{"run":30,"commit":"2e99a87","metric":1.7084,"metrics":{"win_rate":54.3,"net_pnl":105478.34,"total_trades":300,"tp_exits":31,"sl_exits":78,"eod_exits":191,"stocks_with_trades":23},"status":"discard","description":"CD=50 buf=0.6 SL=1.0 TP=2.0: PF 1.71","timestamp":1781455704,"segment":0}
{"run":31,"commit":"2e99a87","metric":1.6667,"metrics":{"win_rate":57.2,"net_pnl":101895.51,"total_trades":299,"tp_exits":14,"sl_exits":34,"eod_exits":251,"stocks_with_trades":23},"status":"discard","description":"CD=50 buf=0.6 SL=1.5 TP=2.5: PF 1.67","timestamp":1781455704,"segment":0}
{"run":32,"commit":"2e99a87","metric":1.8922,"metrics":{"win_rate":56.5,"net_pnl":129237.08,"total_trades":299,"tp_exits":32,"sl_exits":55,"eod_exits":212,"stocks_with_trades":23},"status":"keep","description":"max_trades=1 CD=50 buf=0.6: PF 1.8922 (same as unlimited)","timestamp":1781455704,"segment":0}
{"run":33,"commit":"2e99a87","metric":1.8922,"metrics":{"win_rate":56.5,"net_pnl":129237.08,"total_trades":299,"tp_exits":32,"sl_exits":55,"eod_exits":212,"stocks_with_trades":23},"status":"keep","description":"max_trades=2 CD=50 buf=0.6: PF 1.8922","timestamp":1781455704,"segment":0}
{"run":34,"commit":"2e99a87","metric":1.2562,"metrics":{"win_rate":48.7,"net_pnl":107763.92,"total_trades":657,"tp_exits":64,"sl_exits":149,"eod_exits":444,"stocks_with_trades":23},"status":"discard","description":"shorts enabled CD=50 buf=0.6: PF 1.26, worse","timestamp":1781455704,"segment":0}
{"run":35,"commit":"2e99a87","metric":1.8922,"metrics":{"win_rate":56.5,"net_pnl":129237.08,"total_trades":299,"tp_exits":32,"sl_exits":55,"eod_exits":212,"stocks_with_trades":23},"status":"keep","description":"buf=0.60 CD=50 (rerun): PF 1.8922 confirmed","timestamp":1781455704,"segment":0}
{"run":36,"commit":"2e99a87","metric":1.9031,"metrics":{"win_rate":55.7,"net_pnl":125431.91,"total_trades":291,"tp_exits":31,"sl_exits":54,"eod_exits":206,"stocks_with_trades":23},"status":"keep","description":"buf=0.62 CD=50 (rerun): PF 1.9031 confirmed","timestamp":1781455704,"segment":0}
{"run":37,"commit":"2e99a87","metric":1.8734,"metrics":{"win_rate":55.7,"net_pnl":119175.12,"total_trades":280,"tp_exits":30,"sl_exits":51,"eod_exits":199,"stocks_with_trades":23},"status":"discard","description":"buf=0.64 CD=50: PF 1.87","timestamp":1781455704,"segment":0}
{"run":38,"commit":"2e99a87","metric":1.8608,"metrics":{"win_rate":56.0,"net_pnl":115527.63,"total_trades":275,"tp_exits":30,"sl_exits":53,"eod_exits":192,"stocks_with_trades":23},"status":"discard","description":"buf=0.66 CD=50: PF 1.86","timestamp":1781455704,"segment":0}
{"run":39,"commit":"2e99a87","metric":1.5058,"metrics":{"win_rate":56.0,"net_pnl":74800.45,"total_trades":268,"tp_exits":28,"sl_exits":52,"eod_exits":188,"stocks_with_trades":23},"status":"discard","description":"buf=0.68 CD=50: PF 1.51, sharp drop","timestamp":1781455704,"segment":0}
{"run":40,"commit":"8fdecb1","metric":1.9031,"metrics":{"win_rate":55.7,"net_pnl":125431.91,"total_trades":291,"tp_exits":31,"sl_exits":54,"eod_exits":206,"stocks_with_trades":23},"status":"keep","description":"CD=55 buf=0.62: PF 1.9031, same as CD=50","timestamp":1781455734,"segment":0}
{"run":41,"commit":"8fdecb1","metric":1.9019,"metrics":{"win_rate":55.8,"net_pnl":125394.91,"total_trades":294,"tp_exits":31,"sl_exits":54,"eod_exits":209,"stocks_with_trades":23},"status":"keep","description":"CD=45 buf=0.62: PF 1.9019","timestamp":1781455734,"segment":0}
{"run":42,"commit":"8fdecb1","metric":1.7401,"metrics":{"win_rate":55.0,"net_pnl":107986.34,"total_trades":291,"tp_exits":36,"sl_exits":66,"eod_exits":189,"stocks_with_trades":23},"status":"discard","description":"SL=1.1 TP=1.8 buf=0.62: PF 1.74, worse","timestamp":1781455734,"segment":0}
{"type": "config", "name": "EMA Cross Trending", "metricName": "profit_factor", "metricUnit": "", "bestDirection": "higher"}
{"run": 43, "commit": "5b59ef9", "metric": 1.0585, "metrics": {"win_rate": 49.3, "net_pnl": 53299.04, "total_trades": 3057, "tp_exits": 318, "sl_exits": 656, "eod_exits": 2083, "stocks_with_trades": 34}, "status": "keep", "description": "baseline: FAST=9 SLOW=21 SL=1.0 TP=1.5 CD=3 shorts=off EOD=14:45", "timestamp": 1782471786, "segment": 1}
{"run": 44, "commit": "be9125e", "metric": 1.1063, "metrics": {"win_rate": 44.4, "net_pnl": 87373.01, "total_trades": 3613, "tp_exits": 636, "sl_exits": 1522, "eod_exits": 1455, "stocks_with_trades": 34}, "status": "keep", "description": "SL=0.5 TP=1.0 FAST=9/21 CD=3: PF improves to 1.1063, more TP hits (636 vs 318 baseline)", "timestamp": 1782471837, "segment": 1}
{"run": 45, "commit": "be9125e", "metric": 1.1214, "metrics": {"win_rate": 42.7, "net_pnl": 101396.58, "total_trades": 3554, "tp_exits": 300, "sl_exits": 1549, "eod_exits": 1705, "stocks_with_trades": 34}, "status": "keep", "description": "SL=0.5 TP=1.5 FAST=9/21 CD=3: PF improves to 1.1214", "timestamp": 1782473498, "segment": 1}
{"run": 46, "commit": "be9125e", "metric": 1.1731, "metrics": {"win_rate": 42.5, "net_pnl": 144394.5, "total_trades": 3531, "tp_exits": 168, "sl_exits": 1548, "eod_exits": 1815, "stocks_with_trades": 34}, "status": "keep", "description": "SL=0.5 TP=2.0 FAST=9/21 CD=3: PF=1.1731 best of SL/TP grid", "timestamp": 1782473498, "segment": 1}
{"run": 47, "commit": "be9125e", "metric": 1.1702, "metrics": {"win_rate": 42.2, "net_pnl": 142232.54, "total_trades": 3516, "tp_exits": 44, "sl_exits": 1551, "eod_exits": 1921, "stocks_with_trades": 34}, "status": "discard", "description": "SL=0.5 TP=3.0 FAST=9/21 CD=3: PF=1.1702, discard", "timestamp": 1782473498, "segment": 1}
{"run": 48, "commit": "be9125e", "metric": 1.057, "metrics": {"win_rate": 47.0, "net_pnl": 24384.53, "total_trades": 3367, "tp_exits": 562, "sl_exits": 1257, "eod_exits": 1548, "stocks_with_trades": 34}, "status": "discard", "description": "SL=0.8 TP=1.0 FAST=9/21 CD=3: PF=1.057", "timestamp": 1782473498, "segment": 1}
{"run": 49, "commit": "be9125e", "metric": 1.0691, "metrics": {"win_rate": 46.2, "net_pnl": 29101.24, "total_trades": 3321, "tp_exits": 278, "sl_exits": 1230, "eod_exits": 1813, "stocks_with_trades": 34}, "status": "discard", "description": "SL=0.8 TP=1.5 FAST=9/21 CD=3: PF=1.069", "timestamp": 1782473498, "segment": 1}
{"run": 50, "commit": "be9125e", "metric": 1.117, "metrics": {"wr": 42.2, "np": 58423.52, "tt": 3282, "tp": 167, "sl": 1230, "eod": 1885, "st": 34}, "status": "keep", "description": "SL=0.8 TP=2.0 FAST=9/21 CD=3: PF=1.117", "timestamp": 1782473534, "segment": 1}
{"run": 51, "commit": "be9125e", "metric": 1.0396, "metrics": {"wr": 44.4, "np": 15036.8, "tt": 3121, "tp": 541, "sl": 1066, "eod": 1514, "st": 34}, "status": "discard", "description": "SL=1.2 TP=1.5 FAST=9/21 CD=3: PF=1.04", "timestamp": 1782473534, "segment": 1}
{"run": 52, "commit": "be9125e", "metric": 1.0841, "metrics": {"wr": 43.8, "np": 30927.93, "tt": 3093, "tp": 270, "sl": 1050, "eod": 1773, "st": 34}, "status": "discard", "description": "SL=1.2 TP=2.0 FAST=9/21 CD=3: PF=1.084", "timestamp": 1782473534, "segment": 1}
{"run": 53, "commit": "be9125e", "metric": 1.088, "metrics": {"wr": 43.2, "np": 31576.48, "tt": 3065, "tp": 90, "sl": 1045, "eod": 1930, "st": 34}, "status": "discard", "description": "SL=1.2 TP=3.0 FAST=9/21 CD=3: PF=1.088", "timestamp": 1782473534, "segment": 1}
{"run": 54, "commit": "be9125e", "metric": 1.0872, "metrics": {"wr": 46.0, "np": 42280.0, "tt": 3305, "tp": 220, "sl": 1441, "eod": 1644, "st": 34}, "status": "discard", "description": "FAST=5 SLOW=15: PF=1.087", "timestamp": 1782473534, "segment": 1}
{"run": 55, "commit": "be9125e", "metric": 1.0845, "metrics": {"wr": 45.3, "np": 33076.0, "tt": 2813, "tp": 176, "sl": 1170, "eod": 1467, "st": 34}, "status": "discard", "description": "FAST=5 SLOW=20: PF=1.085", "timestamp": 1782473534, "segment": 1}
{"run": 56, "commit": "be9125e", "metric": 1.1416, "metrics": {"wr": 46.7, "np": 57491.0, "tt": 2347, "tp": 136, "sl": 842, "eod": 1369, "st": 34}, "status": "discard", "description": "FAST=5 SLOW=30: PF=1.142", "timestamp": 1782473534, "segment": 1}
{"run": 57, "commit": "be9125e", "metric": 1.1647, "metrics": {"wr": 47.5, "np": 66099.0, "tt": 2390, "tp": 124, "sl": 832, "eod": 1434, "st": 34}, "status": "discard", "description": "FAST=10 SLOW=30: PF=1.165", "timestamp": 1782473534, "segment": 1}
{"run": 58, "commit": "be9125e", "metric": 1.19, "metrics": {"wr": 47.8, "np": 73944.0, "tt": 2456, "tp": 122, "sl": 850, "eod": 1484, "st": 34}, "status": "keep", "description": "FAST=12 SLOW=26: PF=1.190 \u2014 NEW BEST", "timestamp": 1782473534, "segment": 1}
{"run": 59, "commit": "be9125e", "metric": 1.0941, "metrics": {"wr": 45.8, "np": 35371.0, "tt": 1996, "tp": 94, "sl": 711, "eod": 1191, "st": 34}, "status": "discard", "description": "FAST=15 SLOW=30: PF=1.094", "timestamp": 1782473534, "segment": 1}
{"run": 60, "commit": "be9125e", "metric": 1.1701, "metrics": {"wr": 47.7, "np": 67972.0, "tt": 2374, "tp": 121, "sl": 826, "eod": 1427, "st": 34}, "status": "discard", "description": "FAST=10 SLOW=26: PF=1.170", "timestamp": 1782473534, "segment": 1}
{"run": 61, "commit": "be9125e", "metric": 1.1718, "metrics": {"wr": 47.3, "np": 69575.0, "tt": 2557, "tp": 130, "sl": 901, "eod": 1526, "st": 34}, "status": "discard", "description": "FAST=12 SLOW=20: PF=1.172", "timestamp": 1782473534, "segment": 1}
{"run": 62, "commit": "be9125e", "metric": 1.164, "metrics": {"wr": 46.7, "np": 64953.0, "tt": 2734, "tp": 149, "sl": 1004, "eod": 1581, "st": 34}, "status": "discard", "description": "FAST=8 SLOW=21: PF=1.164", "timestamp": 1782473534, "segment": 1}
{"run": 63, "commit": "be9125e", "metric": 1.1691, "metrics": {"wr": 47.2, "np": 68053.0, "tt": 2564, "tp": 137, "sl": 943, "eod": 1484, "st": 34}, "status": "discard", "description": "FAST=10 SLOW=21: PF=1.169", "timestamp": 1782473534, "segment": 1}
{"run": 64, "commit": "be9125e", "metric": 1.1325, "metrics": {"wr": 45.9, "np": 53888.0, "tt": 2281, "tp": 156, "sl": 914, "eod": 1211, "st": 34}, "status": "discard", "description": "SL=1.0 TP=2.0 FAST=12/26: PF=1.133", "timestamp": 1782473534, "segment": 1}
{"run": 65, "commit": "be9125e", "metric": 1.1635, "metrics": {"wr": 47.0, "np": 64969.0, "tt": 2518, "tp": 179, "sl": 938, "eod": 1401, "st": 34}, "status": "discard", "description": "SL=0.5 TP=1.5 FAST=12/26: PF=1.164", "timestamp": 1782473534, "segment": 1}
{"run": 66, "commit": "be9125e", "metric": 1.1887, "metrics": {"wr": 46.9, "np": 74958.0, "tt": 2443, "tp": 74, "sl": 860, "eod": 1509, "st": 34}, "status": "discard", "description": "SL=0.5 TP=3.0 FAST=12/26: PF=1.189", "timestamp": 1782473534, "segment": 1}
{"run": 67, "commit": "be9125e", "metric": 1.199, "metrics": {"wr": 43.2, "np": 77718.0, "tt": 2922, "tp": 165, "sl": 1201, "eod": 1556, "st": 34}, "status": "keep", "description": "CD=5 FAST=12/26 SL=0.5 TP=2.0: PF=1.199", "timestamp": 1782473534, "segment": 1}
{"run": 68, "commit": "be9125e", "metric": 1.2055, "metrics": {"wr": 43.3, "np": 78002.0, "tt": 2765, "tp": 155, "sl": 1124, "eod": 1486, "st": 34}, "status": "keep", "description": "CD=10 FAST=12/26 SL=0.5 TP=2.0: PF=1.206", "timestamp": 1782473534, "segment": 1}
{"run": 69, "commit": "be9125e", "metric": 1.2326, "metrics": {"wr": 44.0, "np": 83468.0, "tt": 2597, "tp": 144, "sl": 1045, "eod": 1408, "st": 34}, "status": "keep", "description": "CD=15 FAST=12/26 SL=0.5 TP=2.0: PF=1.233", "timestamp": 1782473534, "segment": 1}
{"run": 70, "commit": "be9125e", "metric": 1.276, "metrics": {"wr": 44.6, "np": 89789.0, "tt": 2471, "tp": 139, "sl": 991, "eod": 1341, "st": 34}, "status": "keep", "description": "CD=20 FAST=12/26 SL=0.5 TP=2.0: PF=1.276", "timestamp": 1782473534, "segment": 1}
{"run": 71, "commit": "be9125e", "metric": 1.3214, "metrics": {"wr": 46.0, "np": 97867.0, "tt": 2275, "tp": 130, "sl": 877, "eod": 1268, "st": 34}, "status": "keep", "description": "CD=30 FAST=12/26 SL=0.5 TP=2.0: PF=1.321", "timestamp": 1782473534, "segment": 1}
{"run": 72, "commit": "be9125e", "metric": 1.2906, "metrics": {"wr": 45.4, "np": 91353.0, "tt": 1928, "tp": 106, "sl": 724, "eod": 1098, "st": 34}, "status": "keep", "description": "CD=50 FAST=12/26 SL=0.5 TP=2.0: PF=1.291", "timestamp": 1782473534, "segment": 1}
{"run": 73, "commit": "be9125e", "metric": 1.2841, "metrics": {"wr": 45.0, "np": 91815.0, "tt": 2362, "tp": 132, "sl": 937, "eod": 1293, "st": 34}, "status": "discard", "description": "CD=25 FAST=12/26: PF=1.284", "timestamp": 1782473534, "segment": 1}
{"run": 74, "commit": "be9125e", "metric": 1.343, "metrics": {"wr": 46.3, "np": 100314.0, "tt": 2187, "tp": 125, "sl": 828, "eod": 1234, "st": 34}, "status": "keep", "description": "CD=35 FAST=12/26: PF=1.343 \u2014 NEW BEST", "timestamp": 1782473534, "segment": 1}
{"run": 75, "commit": "be9125e", "metric": 1.3298, "metrics": {"wr": 46.2, "np": 98001.0, "tt": 2097, "tp": 118, "sl": 790, "eod": 1189, "st": 34}, "status": "discard", "description": "CD=40 FAST=12/26: PF=1.330", "timestamp": 1782473534, "segment": 1}
{"run": 76, "commit": "be9125e", "metric": 1.3304, "metrics": {"wr": 46.3, "np": 98999.0, "tt": 2244, "tp": 125, "sl": 849, "eod": 1270, "st": 34}, "status": "discard", "description": "CD=32: PF=1.330", "timestamp": 1782473534, "segment": 1}
