{"run": 455, "commit": "b63ee0a", "metric": 2.0615, "metrics": {"win_rate": 65.7, "net_pnl": 16444.38, "total_trades": 67, "tp_exits": 29, "sl_exits": 4, "eod_exits": 34}, "status": "discard", "description": "tf=5|fast=12|slow=26|sl=1.8|tp=1.0|cd=3|shorts=1|eod=855|fine sl 1.8", "timestamp": 1785880860, "segment": 0, "session": "newgen-ema"}
{"run": 456, "commit": "b63ee0a", "metric": 2.0098, "metrics": {"win_rate": 65.7, "net_pnl": 16045.2, "total_trades": 67, "tp_exits": 29, "sl_exits": 4, "eod_exits": 34}, "status": "discard", "description": "tf=5|fast=12|slow=26|sl=1.9|tp=1.0|cd=3|shorts=1|eod=855|fine sl 1.9", "timestamp": 1785880861, "segment": 0, "session": "newgen-ema"}
{"run": 457, "commit": "b63ee0a", "metric": 2.0884, "metrics": {"win_rate": 65.7, "net_pnl": 16643.98, "total_trades": 67, "tp_exits": 29, "sl_exits": 4, "eod_exits": 34}, "status": "keep", "description": "tf=5|fast=12|slow=26|sl=1.75|tp=1.0|cd=0|shorts=1|eod=855|cd 0", "timestamp": 1785880862, "segment": 0, "session": "newgen-ema"}
{"run": 458, "commit": "b63ee0a", "metric": 2.0884, "metrics": {"win_rate": 65.7, "net_pnl": 16643.98, "total_trades": 67, "tp_exits": 29, "sl_exits": 4, "eod_exits": 34}, "status": "keep", "description": "tf=5|fast=12|slow=26|sl=1.75|tp=1.0|cd=1|shorts=1|eod=855|cd 1", "timestamp": 1785880863, "segment": 0, "session": "newgen-ema"}
{"run": 459, "commit": "b63ee0a", "metric": 1.4935, "metrics": {"win_rate": 64.4, "net_pnl": 10635.13, "total_trades": 73, "tp_exits": 29, "sl_exits": 7, "eod_exits": 37}, "status": "discard", "description": "tf=5|fast=11|slow=24|sl=1.75|tp=1.0|cd=3|shorts=1|eod=855|perturb pair", "timestamp": 1785880878, "segment": 0, "session": "newgen-ema"}
{"run": 460, "commit": "b63ee0a", "metric": 1.9004, "metrics": {"win_rate": 63.1, "net_pnl": 13728.63, "total_trades": 65, "tp_exits": 27, "sl_exits": 4, "eod_exits": 34}, "status": "discard", "description": "tf=5|fast=13|slow=28|sl=1.75|tp=1.0|cd=3|shorts=1|eod=855|perturb pair", "timestamp": 1785880879, "segment": 0, "session": "newgen-ema"}
{"run": 461, "commit": "b63ee0a", "metric": 2.1097, "metrics": {"win_rate": 67.6, "net_pnl": 16597.17, "total_trades": 68, "tp_exits": 31, "sl_exits": 4, "eod_exits": 33}, "status": "keep", "description": "tf=5|fast=12|slow=26|sl=1.75|tp=0.95|cd=3|shorts=1|eod=855|perturb tp", "timestamp": 1785880880, "segment": 0, "session": "newgen-ema"}
{"run": 462, "commit": "b63ee0a", "metric": 1.6277, "metrics": {"win_rate": 62.1, "net_pnl": 11894.93, "total_trades": 66, "tp_exits": 27, "sl_exits": 6, "eod_exits": 33}, "status": "discard", "description": "tf=5|fast=12|slow=26|sl=1.75|tp=1.05|cd=3|shorts=1|eod=855|perturb tp", "timestamp": 1785880881, "segment": 0, "session": "newgen-ema"}
{"run": 463, "commit": "b63ee0a", "metric": 2.1622, "metrics": {"win_rate": 70.1, "net_pnl": 16946.78, "total_trades": 67, "tp_exits": 29, "sl_exits": 4, "eod_exits": 34}, "status": "keep", "description": "tf=5|fast=12|slow=26|sl=1.75|tp=1.0|cd=3|shorts=1|eod=850|perturb eod", "timestamp": 1785880883, "segment": 0, "session": "newgen-ema"}
{"run": 464, "commit": "b63ee0a", "metric": 1.9005, "metrics": {"win_rate": 64.2, "net_pnl": 15039.59, "total_trades": 67, "tp_exits": 29, "sl_exits": 4, "eod_exits": 34}, "status": "discard", "description": "tf=5|fast=12|slow=26|sl=1.75|tp=1.0|cd=3|shorts=1|eod=860|perturb eod", "timestamp": 1785880884, "segment": 0, "session": "newgen-ema"}
{"run": 465, "commit": "b63ee0a", "metric": 2.0884, "metrics": {"win_rate": 65.7, "net_pnl": 16643.98, "total_trades": 67, "tp_exits": 29, "sl_exits": 4, "eod_exits": 34}, "status": "discard", "description": "tf=5|fast=12|slow=26|sl=1.75|tp=1.0|cd=5|shorts=1|eod=855|perturb cd", "timestamp": 1785880885, "segment": 0, "session": "newgen-ema"}
{"run": 466, "commit": "b63ee0a", "metric": 1.7746, "metrics": {"win_rate": 68.2, "net_pnl": 13439.72, "total_trades": 66, "tp_exits": 29, "sl_exits": 4, "eod_exits": 33}, "status": "discard", "description": "tf=5|fast=12|slow=26|sl=1.75|tp=1.0|cd=3|shorts=1|eod=845|eod 845", "timestamp": 1785880896, "segment": 0, "session": "newgen-ema"}
{"run": 467, "commit": "b63ee0a", "metric": 1.8281, "metrics": {"win_rate": 68.8, "net_pnl": 13849.34, "total_trades": 64, "tp_exits": 28, "sl_exits": 3, "eod_exits": 33}, "status": "discard", "description": "tf=5|fast=12|slow=26|sl=1.75|tp=1.0|cd=3|shorts=1|eod=840|eod 840", "timestamp": 1785880897, "segment": 0, "session": "newgen-ema"}
{"run": 468, "commit": "b63ee0a", "metric": 1.9255, "metrics": {"win_rate": 71.4, "net_pnl": 13859.69, "total_trades": 63, "tp_exits": 27, "sl_exits": 3, "eod_exits": 33}, "status": "discard", "description": "tf=5|fast=12|slow=26|sl=1.75|tp=1.0|cd=3|shorts=1|eod=830|eod 830", "timestamp": 1785880898, "segment": 0, "session": "newgen-ema"}
{"run": 469, "commit": "b63ee0a", "metric": 2.1607, "metrics": {"win_rate": 71.6, "net_pnl": 16644.39, "total_trades": 67, "tp_exits": 31, "sl_exits": 4, "eod_exits": 32}, "status": "discard", "description": "tf=5|fast=12|slow=26|sl=1.75|tp=0.95|cd=3|shorts=1|eod=850|tp 0.95 eod850", "timestamp": 1785880900, "segment": 0, "session": "newgen-ema"}
{"run": 470, "commit": "b63ee0a", "metric": 1.7571, "metrics": {"win_rate": 69.7, "net_pnl": 13016.83, "total_trades": 66, "tp_exits": 30, "sl_exits": 4, "eod_exits": 32}, "status": "discard", "description": "tf=5|fast=12|slow=26|sl=1.75|tp=0.95|cd=3|shorts=1|eod=845|tp 0.95 eod845", "timestamp": 1785880901, "segment": 0, "session": "newgen-ema"}
{"run": 471, "commit": "b63ee0a", "metric": 2.1622, "metrics": {"win_rate": 70.1, "net_pnl": 16946.78, "total_trades": 67, "tp_exits": 29, "sl_exits": 4, "eod_exits": 34}, "status": "keep", "description": "tf=5|fast=12|slow=26|sl=1.75|tp=1.0|cd=3|shorts=1|eod=850|recheck eod850", "timestamp": 1785880902, "segment": 0, "session": "newgen-ema"}
{"run": 472, "commit": "b63ee0a", "metric": 1.6958, "metrics": {"win_rate": 68.6, "net_pnl": 13316.73, "total_trades": 70, "tp_exits": 30, "sl_exits": 7, "eod_exits": 33}, "status": "discard", "description": "tf=5|fast=12|slow=24|sl=1.75|tp=1.0|cd=3|shorts=1|eod=850|robust pair", "timestamp": 1785880916, "segment": 0, "session": "newgen-ema"}
{"run": 473, "commit": "b63ee0a", "metric": 1.6707, "metrics": {"win_rate": 68.1, "net_pnl": 12795.92, "total_trades": 69, "tp_exits": 29, "sl_exits": 7, "eod_exits": 33}, "status": "discard", "description": "tf=5|fast=11|slow=26|sl=1.75|tp=1.0|cd=3|shorts=1|eod=850|robust pair", "timestamp": 1785880917, "segment": 0, "session": "newgen-ema"}
{"run": 474, "commit": "b63ee0a", "metric": 1.7076, "metrics": {"win_rate": 60.3, "net_pnl": 11148.24, "total_trades": 63, "tp_exits": 26, "sl_exits": 5, "eod_exits": 32}, "status": "discard", "description": "tf=5|fast=14|slow=30|sl=1.75|tp=1.0|cd=3|shorts=1|eod=850|robust pair", "timestamp": 1785880918, "segment": 0, "session": "newgen-ema"}
{"run": 475, "commit": "b63ee0a", "metric": 1.9769, "metrics": {"win_rate": 70.0, "net_pnl": 15793.7, "total_trades": 70, "tp_exits": 29, "sl_exits": 8, "eod_exits": 33}, "status": "discard", "description": "tf=5|fast=12|slow=26|sl=1.5|tp=1.0|cd=3|shorts=1|eod=850|robust sl", "timestamp": 1785880919, "segment": 0, "session": "newgen-ema"}
{"run": 476, "commit": "b63ee0a", "metric": 2.0237, "metrics": {"win_rate": 70.1, "net_pnl": 15948.82, "total_trades": 67, "tp_exits": 29, "sl_exits": 4, "eod_exits": 34}, "status": "discard", "description": "tf=5|fast=12|slow=26|sl=2.0|tp=1.0|cd=3|shorts=1|eod=850|robust sl", "timestamp": 1785880921, "segment": 0, "session": "newgen-ema"}
{"run": 477, "commit": "b63ee0a", "metric": 1.7907, "metrics": {"win_rate": 61.0, "net_pnl": 8418.66, "total_trades": 41, "tp_exits": 19, "sl_exits": 1, "eod_exits": 21}, "status": "discard", "description": "tf=5|fast=12|slow=26|sl=1.75|tp=1.0|cd=3|shorts=0|eod=850|robust shorts off", "timestamp": 1785880922, "segment": 0, "session": "newgen-ema"}
{"run": 478, "commit": "b63ee0a", "metric": 0.0, "metrics": {"win_rate": 0.0, "net_pnl": 0.0, "total_trades": 0, "tp_exits": 0, "sl_exits": 0, "eod_exits": 0}, "status": "discard", "description": "baseline tf=15 ATR=10 MULT=3.0 SL=0 TP=0 EOD=885 shorts=0", "timestamp": 1785880747.6651764, "segment": 0, "session": "newgen-supertrend"}
{"run": 479, "commit": "b63ee0a", "metric": 0.0, "metrics": {"win_rate": 0.0, "net_pnl": 0.0, "total_trades": 0, "tp_exits": 0, "sl_exits": 0, "eod_exits": 0}, "status": "discard", "description": "tf=15 ATR=10 MULT=2.0 SL=0 TP=0 EOD=885 shorts=0", "timestamp": 1785880772.8863895, "segment": 0, "session": "newgen-supertrend"}
{"run": 480, "commit": "b63ee0a", "metric": 0.0, "metrics": {"win_rate": 0.0, "net_pnl": 0.0, "total_trades": 0, "tp_exits": 0, "sl_exits": 0, "eod_exits": 0}, "status": "discard", "description": "tf=15 ATR=10 MULT=2.5 SL=0 TP=0 EOD=885 shorts=0", "timestamp": 1785880774.1051514, "segment": 0, "session": "newgen-supertrend"}
{"run": 481, "commit": "b63ee0a", "metric": 0.0, "metrics": {"win_rate": 0.0, "net_pnl": 0.0, "total_trades": 0, "tp_exits": 0, "sl_exits": 0, "eod_exits": 0}, "status": "discard", "description": "tf=15 ATR=10 MULT=3.5 SL=0 TP=0 EOD=885 shorts=0", "timestamp": 1785880775.2767313, "segment": 0, "session": "newgen-supertrend"}
{"run": 482, "commit": "b63ee0a", "metric": 0.0, "metrics": {"win_rate": 0.0, "net_pnl": 0.0, "total_trades": 0, "tp_exits": 0, "sl_exits": 0, "eod_exits": 0}, "status": "discard", "description": "tf=15 ATR=10 MULT=4.0 SL=0 TP=0 EOD=885 shorts=0", "timestamp": 1785880776.4087734, "segment": 0, "session": "newgen-supertrend"}
{"run": 483, "commit": "b63ee0a", "metric": 2.4798, "metrics": {"win_rate": 33.3, "net_pnl": 3382.38, "total_trades": 3, "tp_exits": 0, "sl_exits": 0, "eod_exits": 3}, "status": "keep", "description": "tf=15 ATR=10 MULT=1.5 SL=0 TP=0 EOD=885 shorts=0", "timestamp": 1785880783.2874813, "segment": 0, "session": "newgen-supertrend"}
{"run": 484, "commit": "b63ee0a", "metric": 0.0, "metrics": {"win_rate": 0.0, "net_pnl": -3483.02, "total_trades": 3, "tp_exits": 0, "sl_exits": 0, "eod_exits": 3}, "status": "discard", "description": "tf=15 ATR=14 MULT=1.5 SL=0 TP=0 EOD=885 shorts=0", "timestamp": 1785880784.1801128, "segment": 0, "session": "newgen-supertrend"}
{"run": 485, "commit": "b63ee0a", "metric": 0.0, "metrics": {"win_rate": 0.0, "net_pnl": -3483.02, "total_trades": 3, "tp_exits": 0, "sl_exits": 0, "eod_exits": 3}, "status": "discard", "description": "tf=15 ATR=20 MULT=1.5 SL=0 TP=0 EOD=885 shorts=0", "timestamp": 1785880785.2930155, "segment": 0, "session": "newgen-supertrend"}
{"run": 486, "commit": "b63ee0a", "metric": 4.9025, "metrics": {"win_rate": 50.0, "net_pnl": 4511.93, "total_trades": 2, "tp_exits": 0, "sl_exits": 0, "eod_exits": 2}, "status": "keep", "description": "tf=15 ATR=7 MULT=1.5 SL=0 TP=0 EOD=885 shorts=0", "timestamp": 1785880786.3708591, "segment": 0, "session": "newgen-supertrend"}
{"run": 487, "commit": "b63ee0a", "metric": 0.2379, "metrics": {"win_rate": 37.5, "net_pnl": -4058.69, "total_trades": 8, "tp_exits": 0, "sl_exits": 0, "eod_exits": 8}, "status": "keep", "description": "tf=15 ATR=10 MULT=1.0 SL=0 TP=0 EOD=885 shorts=0", "timestamp": 1785880787.4877627, "segment": 0, "session": "newgen-supertrend"}
{"run": 488, "commit": "b63ee0a", "metric": 0.0711, "metrics": {"win_rate": 22.2, "net_pnl": -6203.39, "total_trades": 9, "tp_exits": 0, "sl_exits": 0, "eod_exits": 8}, "status": "keep", "description": "tf=15 ATR=14 MULT=1.0 SL=0 TP=0 EOD=885 shorts=0", "timestamp": 1785880788.8215384, "segment": 0, "session": "newgen-supertrend"}
{"run": 489, "commit": "b63ee0a", "metric": 0.3346, "metrics": {"win_rate": 36.4, "net_pnl": -4595.78, "total_trades": 11, "tp_exits": 0, "sl_exits": 0, "eod_exits": 11}, "status": "keep", "description": "tf=15 ATR=20 MULT=1.0 SL=0 TP=0 EOD=885 shorts=0", "timestamp": 1785880790.0133765, "segment": 0, "session": "newgen-supertrend"}
{"run": 490, "commit": "b63ee0a", "metric": 0.7442, "metrics": {"win_rate": 33.3, "net_pnl": -1211.69, "total_trades": 6, "tp_exits": 0, "sl_exits": 0, "eod_exits": 6}, "status": "keep", "description": "tf=15 ATR=7 MULT=1.0 SL=0 TP=0 EOD=885 shorts=0", "timestamp": 1785880791.298232, "segment": 0, "session": "newgen-supertrend"}
{"run": 491, "commit": "b63ee0a", "metric": 0.7713, "metrics": {"win_rate": 33.3, "net_pnl": -255.34, "total_trades": 3, "tp_exits": 1, "sl_exits": 2, "eod_exits": 0}, "status": "keep", "description": "tf=15 ATR=10 MULT=1.5 SL=1.0 TP=2.0 EOD=885 shorts=0", "timestamp": 1785880800.650465, "segment": 0, "session": "newgen-supertrend"}
{"run": 492, "commit": "b63ee0a", "metric": 1.1786, "metrics": {"win_rate": 33.3, "net_pnl": 199.37, "total_trades": 3, "tp_exits": 1, "sl_exits": 2, "eod_exits": 0}, "status": "keep", "description": "tf=15 ATR=10 MULT=1.5 SL=1.0 TP=3.0 EOD=885 shorts=0", "timestamp": 1785880801.9140072, "segment": 0, "session": "newgen-supertrend"}
{"run": 493, "commit": "b63ee0a", "metric": 0.8117, "metrics": {"win_rate": 33.3, "net_pnl": -305.34, "total_trades": 3, "tp_exits": 1, "sl_exits": 2, "eod_exits": 0}, "status": "keep", "description": "tf=15 ATR=10 MULT=1.5 SL=1.5 TP=3.0 EOD=885 shorts=0", "timestamp": 1785880802.9303048, "segment": 0, "session": "newgen-supertrend"}
{"run": 494, "commit": "b63ee0a", "metric": 0.8329, "metrics": {"win_rate": 33.3, "net_pnl": -355.34, "total_trades": 3, "tp_exits": 1, "sl_exits": 2, "eod_exits": 0}, "status": "keep", "description": "tf=15 ATR=10 MULT=1.5 SL=2.0 TP=4.0 EOD=885 shorts=0", "timestamp": 1785880804.000694, "segment": 0, "session": "newgen-supertrend"}
{"run": 495, "commit": "b63ee0a", "metric": 1.4528, "metrics": {"win_rate": 50.0, "net_pnl": 268.4, "total_trades": 2, "tp_exits": 1, "sl_exits": 1, "eod_exits": 0}, "status": "keep", "description": "tf=15 ATR=7 MULT=1.5 SL=1.0 TP=2.0 EOD=885 shorts=0", "timestamp": 1785880804.9977295, "segment": 0, "session": "newgen-supertrend"}
{"run": 496, "commit": "b63ee0a", "metric": 2.2199, "metrics": {"win_rate": 50.0, "net_pnl": 723.11, "total_trades": 2, "tp_exits": 1, "sl_exits": 1, "eod_exits": 0}, "status": "keep", "description": "tf=15 ATR=7 MULT=1.5 SL=1.0 TP=3.0 EOD=885 shorts=0", "timestamp": 1785880805.897388, "segment": 0, "session": "newgen-supertrend"}
{"run": 497, "commit": "b63ee0a", "metric": 1.5288, "metrics": {"win_rate": 50.0, "net_pnl": 455.15, "total_trades": 2, "tp_exits": 1, "sl_exits": 1, "eod_exits": 0}, "status": "keep", "description": "tf=15 ATR=7 MULT=1.5 SL=1.5 TP=3.0 EOD=885 shorts=0", "timestamp": 1785880806.7607627, "segment": 0, "session": "newgen-supertrend"}
{"run": 498, "commit": "b63ee0a", "metric": 1.5687, "metrics": {"win_rate": 50.0, "net_pnl": 641.9, "total_trades": 2, "tp_exits": 1, "sl_exits": 1, "eod_exits": 0}, "status": "keep", "description": "tf=15 ATR=7 MULT=1.5 SL=2.0 TP=4.0 EOD=885 shorts=0", "timestamp": 1785880807.5806336, "segment": 0, "session": "newgen-supertrend"}
{"run": 499, "commit": "b63ee0a", "metric": 44.9489, "metrics": {"win_rate": 50.0, "net_pnl": 6797.14, "total_trades": 2, "tp_exits": 0, "sl_exits": 0, "eod_exits": 2}, "status": "keep", "description": "tf=60 ATR=10 MULT=1.0 SL=0 TP=0 EOD=885 shorts=0", "timestamp": 1785880818.805637, "segment": 0, "session": "newgen-supertrend"}
{"run": 500, "commit": "b63ee0a", "metric": 99.9999, "metrics": {"win_rate": 100.0, "net_pnl": 6971.55, "total_trades": 2, "tp_exits": 0, "sl_exits": 0, "eod_exits": 2}, "status": "keep", "description": "tf=60 ATR=14 MULT=1.0 SL=0 TP=0 EOD=885 shorts=0", "timestamp": 1785880819.468697, "segment": 0, "session": "newgen-supertrend"}
{"run": 501, "commit": "b63ee0a", "metric": 99.9999, "metrics": {"win_rate": 100.0, "net_pnl": 6971.55, "total_trades": 2, "tp_exits": 0, "sl_exits": 0, "eod_exits": 2}, "status": "keep", "description": "tf=60 ATR=20 MULT=1.0 SL=0 TP=0 EOD=885 shorts=0", "timestamp": 1785880820.2137277, "segment": 0, "session": "newgen-supertrend"}
{"run": 502, "commit": "b63ee0a", "metric": 0.0, "metrics": {"win_rate": 0.0, "net_pnl": 0.0, "total_trades": 0, "tp_exits": 0, "sl_exits": 0, "eod_exits": 0}, "status": "discard", "description": "tf=60 ATR=10 MULT=1.5 SL=0 TP=0 EOD=885 shorts=0", "timestamp": 1785880821.070203, "segment": 0, "session": "newgen-supertrend"}
{"run": 503, "commit": "b63ee0a", "metric": 0.0, "metrics": {"win_rate": 0.0, "net_pnl": 0.0, "total_trades": 0, "tp_exits": 0, "sl_exits": 0, "eod_exits": 0}, "status": "discard", "description": "tf=60 ATR=14 MULT=1.5 SL=0 TP=0 EOD=885 shorts=0", "timestamp": 1785880821.8607705, "segment": 0, "session": "newgen-supertrend"}
{"run": 504, "commit": "b63ee0a", "metric": 0.0, "metrics": {"win_rate": 0.0, "net_pnl": 0.0, "total_trades": 0, "tp_exits": 0, "sl_exits": 0, "eod_exits": 0}, "status": "discard", "description": "tf=60 ATR=20 MULT=1.5 SL=0 TP=0 EOD=885 shorts=0", "timestamp": 1785880822.837759, "segment": 0, "session": "newgen-supertrend"}
{"run": 505, "commit": "b63ee0a", "metric": 0.0, "metrics": {"win_rate": 0.0, "net_pnl": 0.0, "total_trades": 0, "tp_exits": 0, "sl_exits": 0, "eod_exits": 0}, "status": "discard", "description": "tf=60 ATR=7 MULT=1.5 SL=0 TP=0 EOD=885 shorts=0", "timestamp": 1785880823.5384958, "segment": 0, "session": "newgen-supertrend"}
{"run": 506, "commit": "b63ee0a", "metric": 99.9999, "metrics": {"win_rate": 100.0, "net_pnl": 1846.11, "total_trades": 2, "tp_exits": 2, "sl_exits": 0, "eod_exits": 0}, "status": "keep", "description": "tf=60 ATR=10 MULT=1.0 SL=1.0 TP=2.0 EOD=885 shorts=0", "timestamp": 1785880824.2138433, "segment": 0, "session": "newgen-supertrend"}
{"run": 507, "commit": "b63ee0a", "metric": 2.007, "metrics": {"win_rate": 54.5, "net_pnl": 2685.14, "total_trades": 11, "tp_exits": 5, "sl_exits": 5, "eod_exits": 1}, "status": "keep", "description": "tf=15 ATR=20 MULT=1.0 SL=1.0 TP=2.0 EOD=885 shorts=0", "timestamp": 1785880839.0465558, "segment": 0, "session": "newgen-supertrend"}
{"run": 508, "commit": "b63ee0a", "metric": 0.4504, "metrics": {"win_rate": 36.4, "net_pnl": -2818.9, "total_trades": 11, "tp_exits": 0, "sl_exits": 6, "eod_exits": 5}, "status": "keep", "description": "tf=15 ATR=20 MULT=1.0 SL=1.5 TP=3.0 EOD=885 shorts=0", "timestamp": 1785880839.7232594, "segment": 0, "session": "newgen-supertrend"}
{"run": 509, "commit": "b63ee0a", "metric": 0.6291, "metrics": {"win_rate": 36.4, "net_pnl": -1362.51, "total_trades": 11, "tp_exits": 0, "sl_exits": 6, "eod_exits": 5}, "status": "keep", "description": "tf=15 ATR=20 MULT=1.0 SL=1.0 TP=3.0 EOD=885 shorts=0", "timestamp": 1785880840.603219, "segment": 0, "session": "newgen-supertrend"}
{"run": 510, "commit": "b63ee0a", "metric": 0.3867, "metrics": {"win_rate": 36.4, "net_pnl": -3664.09, "total_trades": 11, "tp_exits": 0, "sl_exits": 4, "eod_exits": 7}, "status": "keep", "description": "tf=15 ATR=20 MULT=1.0 SL=2.0 TP=4.0 EOD=885 shorts=0", "timestamp": 1785880841.577554, "segment": 0, "session": "newgen-supertrend"}
{"run": 511, "commit": "b63ee0a", "metric": 0.3369, "metrics": {"win_rate": 36.4, "net_pnl": -4665.74, "total_trades": 11, "tp_exits": 0, "sl_exits": 0, "eod_exits": 11}, "status": "keep", "description": "tf=15 ATR=20 MULT=1.0 SL=0 TP=0 EOD=870 shorts=0", "timestamp": 1785880842.427263, "segment": 0, "session": "newgen-supertrend"}
{"run": 512, "commit": "b63ee0a", "metric": 0.1149, "metrics": {"win_rate": 27.3, "net_pnl": -7558.87, "total_trades": 11, "tp_exits": 0, "sl_exits": 0, "eod_exits": 10}, "status": "keep", "description": "tf=15 ATR=20 MULT=1.0 SL=0 TP=0 EOD=900 shorts=0", "timestamp": 1785880843.2350807, "segment": 0, "session": "newgen-supertrend"}
{"run": 513, "commit": "b63ee0a", "metric": 2.022, "metrics": {"win_rate": 54.5, "net_pnl": 2725.12, "total_trades": 11, "tp_exits": 5, "sl_exits": 5, "eod_exits": 1}, "status": "keep", "description": "tf=15 ATR=20 MULT=1.0 SL=1.0 TP=2.0 EOD=870 shorts=0", "timestamp": 1785880844.1034398, "segment": 0, "session": "newgen-supertrend"}
{"run": 514, "commit": "b63ee0a", "metric": 1.9507, "metrics": {"win_rate": 54.5, "net_pnl": 2535.24, "total_trades": 11, "tp_exits": 5, "sl_exits": 5, "eod_exits": 1}, "status": "keep", "description": "tf=15 ATR=20 MULT=1.0 SL=1.0 TP=2.0 EOD=900 shorts=0", "timestamp": 1785880845.090149, "segment": 0, "session": "newgen-supertrend"}
{"run": 515, "commit": "b63ee0a", "metric": 2.0766, "metrics": {"win_rate": 59.1, "net_pnl": 4641.37, "total_trades": 22, "tp_exits": 6, "sl_exits": 7, "eod_exits": 9}, "status": "keep", "description": "tf=15 ATR=20 MULT=1.0 SL=1.0 TP=2.0 EOD=885 shorts=1", "timestamp": 1785880861.6224334, "segment": 0, "session": "newgen-supertrend"}
{"run": 516, "commit": "b63ee0a", "metric": 0.8583, "metrics": {"win_rate": 54.5, "net_pnl": -1294.43, "total_trades": 22, "tp_exits": 0, "sl_exits": 0, "eod_exits": 22}, "status": "keep", "description": "tf=15 ATR=20 MULT=1.0 SL=0 TP=0 EOD=885 shorts=1", "timestamp": 1785880862.3797305, "segment": 0, "session": "newgen-supertrend"}
{"run": 517, "commit": "b63ee0a", "metric": 99.9999, "metrics": {"win_rate": 100.0, "net_pnl": 889.24, "total_trades": 2, "tp_exits": 1, "sl_exits": 0, "eod_exits": 1}, "status": "keep", "description": "tf=60 ATR=20 MULT=1.0 SL=1.0 TP=2.0 EOD=885 shorts=0", "timestamp": 1785880863.1591368, "segment": 0, "session": "newgen-supertrend"}
{"run": 518, "commit": "b63ee0a", "metric": 99.9999, "metrics": {"win_rate": 100.0, "net_pnl": 889.24, "total_trades": 2, "tp_exits": 1, "sl_exits": 0, "eod_exits": 1}, "status": "keep", "description": "tf=60 ATR=14 MULT=1.0 SL=1.0 TP=2.0 EOD=885 shorts=0", "timestamp": 1785880863.9251742, "segment": 0, "session": "newgen-supertrend"}
{"run": 519, "commit": "b63ee0a", "metric": 0.7482, "metrics": {"win_rate": 33.3, "net_pnl": -727.71, "total_trades": 9, "tp_exits": 2, "sl_exits": 5, "eod_exits": 1}, "status": "keep", "description": "tf=15 ATR=14 MULT=1.0 SL=1.0 TP=2.0 EOD=885 shorts=0", "timestamp": 1785880864.9405644, "segment": 0, "session": "newgen-supertrend"}
