{"run": 77, "commit": "be9125e", "metric": 1.3358, "metrics": {"wr": 46.3, "np": 99904.0, "tt": 2136, "tp": 122, "sl": 807, "eod": 1207, "st": 34}, "status": "discard", "description": "CD=38: PF=1.336", "timestamp": 1782473534, "segment": 1}
{"run": 78, "commit": "be9125e", "metric": 1.3368, "metrics": {"wr": 46.1, "np": 99952.0, "tt": 2022, "tp": 114, "sl": 748, "eod": 1160, "st": 34}, "status": "discard", "description": "CD=45: PF=1.337", "timestamp": 1782473534, "segment": 1}
{"run": 79, "commit": "be9125e", "metric": 1.3764, "metrics": {"wr": 46.5, "np": 105352.0, "tt": 2259, "tp": 127, "sl": 836, "eod": 1296, "st": 34}, "status": "keep", "description": "EOD=15:00 CD=35: PF=1.376 \u2014 NEW BEST", "timestamp": 1782473534, "segment": 1}
{"run": 80, "commit": "be9125e", "metric": 1.3138, "metrics": {"wr": 45.0, "np": 98288.0, "tt": 2136, "tp": 126, "sl": 757, "eod": 1253, "st": 34}, "status": "discard", "description": "EOD=14:30 CD=35: PF=1.314", "timestamp": 1782473534, "segment": 1}
{"run": 81, "commit": "be9125e", "metric": 1.3739, "metrics": {"wr": 45.4, "np": 104116.0, "tt": 2298, "tp": 125, "sl": 875, "eod": 1298, "st": 34}, "status": "discard", "description": "EOD=15:15 CD=35: PF=1.374", "timestamp": 1782473534, "segment": 1}
{"run": 82, "commit": "be9125e", "metric": 1.2674, "metrics": {"wr": 44.9, "np": 90933.0, "tt": 2012, "tp": 115, "sl": 696, "eod": 1201, "st": 34}, "status": "discard", "description": "EOD=15:30 CD=35: PF=1.267", "timestamp": 1782473534, "segment": 1}
{"run": 83, "commit": "be9125e", "metric": 1.2702, "metrics": {"wr": 48.0, "np": 93925.0, "tt": 2725, "tp": 117, "sl": 573, "eod": 2035, "st": 34}, "status": "discard", "description": "shorts on CD=35 EOD=15:00: PF=1.270", "timestamp": 1782473534, "segment": 1}
{"run": 84, "commit": "be9125e", "metric": 1.3083, "metrics": {"wr": 41.6, "np": 95817.0, "tt": 2329, "tp": 124, "sl": 888, "eod": 1317, "st": 34}, "status": "discard", "description": "SL=0.4 TP=2.0 CD=35 EOD=15:00: PF=1.308", "timestamp": 1782473534, "segment": 1}
{"run": 85, "commit": "be9125e", "metric": 1.3252, "metrics": {"wr": 48.9, "np": 97559.0, "tt": 2222, "tp": 130, "sl": 778, "eod": 1314, "st": 34}, "status": "discard", "description": "SL=0.6 TP=2.0 CD=35 EOD=15:00: PF=1.325", "timestamp": 1782473534, "segment": 1}
{"run": 86, "commit": "be9125e", "metric": 1.3851, "metrics": {"wr": 46.6, "np": 106447.0, "tt": 2251, "tp": 77, "sl": 828, "eod": 1346, "st": 34}, "status": "keep", "description": "SL=0.5 TP=2.5 CD=35 EOD=15:00: PF=1.385", "timestamp": 1782473534, "segment": 1}
{"run": 87, "commit": "be9125e", "metric": 1.393, "metrics": {"wr": 46.5, "np": 107411.0, "tt": 2248, "tp": 51, "sl": 828, "eod": 1369, "st": 34}, "status": "keep", "description": "SL=0.5 TP=3.0 CD=35 EOD=15:00: PF=1.393", "timestamp": 1782473534, "segment": 1}
{"run": 88, "commit": "be9125e", "metric": 1.3955, "metrics": {"wr": 46.6, "np": 107760.0, "tt": 2256, "tp": 62, "sl": 830, "eod": 1364, "st": 34}, "status": "keep", "description": "SL=0.5 TP=2.2 CD=35 EOD=15:00: PF=1.396", "timestamp": 1782473534, "segment": 1}
{"run": 89, "commit": "be9125e", "metric": 1.3804, "metrics": {"wr": 46.4, "np": 106496.0, "tt": 2256, "tp": 69, "sl": 838, "eod": 1349, "st": 34}, "status": "discard", "description": "SL=0.5 TP=2.1 CD=35 EOD=15:00: PF=1.380", "timestamp": 1782473534, "segment": 1}
{"run": 90, "commit": "be9125e", "metric": 1.3948, "metrics": {"wr": 46.5, "np": 107513.0, "tt": 2255, "tp": 57, "sl": 828, "eod": 1370, "st": 34}, "status": "discard", "description": "SL=0.5 TP=2.3 CD=35 EOD=15:00: PF=1.395", "timestamp": 1782473534, "segment": 1}
{"run": 91, "commit": "be9125e", "metric": 1.4023, "metrics": {"wr": 46.6, "np": 108208.0, "tt": 2253, "tp": 49, "sl": 828, "eod": 1376, "st": 34}, "status": "keep", "description": "SL=0.5 TP=2.4 CD=35 EOD=15:00: PF=1.402 \u2014 NEW BEST", "timestamp": 1782473534, "segment": 1}
{"run": 92, "commit": "be9125e", "metric": 1.3887, "metrics": {"wr": 46.4, "np": 107047.0, "tt": 2250, "tp": 44, "sl": 825, "eod": 1381, "st": 34}, "status": "discard", "description": "SL=0.5 TP=2.6 CD=35 EOD=15:00: PF=1.389", "timestamp": 1782473534, "segment": 1}
{"run": 93, "commit": "be9125e", "metric": 1.3742, "metrics": {"wr": 46.1, "np": 106138.0, "tt": 2346, "tp": 52, "sl": 872, "eod": 1422, "st": 34}, "status": "discard", "description": "CD=30 TP=2.4: PF=1.374", "timestamp": 1782473534, "segment": 1}
{"run": 94, "commit": "be9125e", "metric": 1.4017, "metrics": {"wr": 46.5, "np": 108006.0, "tt": 2194, "tp": 48, "sl": 802, "eod": 1344, "st": 34}, "status": "discard", "description": "CD=38 TP=2.4: PF=1.402", "timestamp": 1782473534, "segment": 1}
{"run": 95, "commit": "be9125e", "metric": 1.4013, "metrics": {"wr": 46.5, "np": 107986.0, "tt": 2147, "tp": 47, "sl": 785, "eod": 1315, "st": 34}, "status": "discard", "description": "CD=40 TP=2.4: PF=1.401", "timestamp": 1782473534, "segment": 1}
{"run": 96, "commit": "be9125e", "metric": 1.3482, "metrics": {"wr": 45.5, "np": 103318.0, "tt": 2527, "tp": 56, "sl": 962, "eod": 1509, "st": 34}, "status": "discard", "description": "FAST=10 SLOW=20 TP=2.4 CD=35 EOD=15:00: PF=1.348", "timestamp": 1782473534, "segment": 1}
{"run": 97, "commit": "be9125e", "metric": 1.2769, "metrics": {"wr": 44.3, "np": 94147.0, "tt": 2072, "tp": 42, "sl": 768, "eod": 1262, "st": 34}, "status": "discard", "description": "FAST=15 SLOW=30 TP=2.4 CD=35 EOD=15:00: PF=1.277", "timestamp": 1782473534, "segment": 1}
{"run": 98, "commit": "be9125e", "metric": 1.3645, "metrics": {"wr": 45.6, "np": 104875.0, "tt": 2601, "tp": 59, "sl": 990, "eod": 1552, "st": 34}, "status": "discard", "description": "FAST=8 SLOW=21 TP=2.4 CD=35 EOD=15:00: PF=1.365", "timestamp": 1782473534, "segment": 1}
{"run": 99, "commit": "be9125e", "metric": 1.4561, "metrics": {"wr": 48.0, "np": 112009.0, "tt": 2242, "tp": 48, "sl": 827, "eod": 1367, "st": 34}, "status": "keep", "description": "EOD=14:53 SL=0.5 TP=2.4 CD=35 FAST=12/26: PF=1.456 \u2014 NEW BEST!", "timestamp": 1782473534, "segment": 1}
{"run": 100, "commit": "be9125e", "metric": 1.416, "metrics": {"wr": 47.1, "np": 108711.0, "tt": 2206, "tp": 49, "sl": 812, "eod": 1345, "st": 34}, "status": "discard", "description": "EOD=14:50: PF=1.416", "timestamp": 1782473534, "segment": 1}
{"run": 101, "commit": "be9125e", "metric": 1.4023, "metrics": {"wr": 46.6, "np": 108033.0, "tt": 2253, "tp": 49, "sl": 828, "eod": 1376, "st": 34}, "status": "discard", "description": "EOD=14:57: PF=1.402", "timestamp": 1782473534, "segment": 1}
{"run": 102, "commit": "be9125e", "metric": 1.4413, "metrics": {"wr": 47.9, "np": 110884.0, "tt": 2240, "tp": 44, "sl": 825, "eod": 1371, "st": 34}, "status": "discard", "description": "EOD=14:53 TP=2.5: PF=1.441", "timestamp": 1782473534, "segment": 1}
{"run": 103, "commit": "be9125e", "metric": 1.404, "metrics": {"wr": 45.6, "np": 107772.0, "tt": 2275, "tp": 49, "sl": 847, "eod": 1379, "st": 34}, "status": "discard", "description": "SL=0.45 TP=2.4 CD=35 EOD=14:53: PF=1.404", "timestamp": 1782473534, "segment": 1}
{"run": 104, "commit": "be9125e", "metric": 1.4509, "metrics": {"wr": 49.4, "np": 111379.0, "tt": 2222, "tp": 48, "sl": 778, "eod": 1396, "st": 34}, "status": "discard", "description": "SL=0.55 TP=2.4 CD=35 EOD=14:53: PF=1.451", "timestamp": 1782473534, "segment": 1}
{"run": 105, "commit": "be9125e", "metric": 1.4426, "metrics": {"wr": 48.0, "np": 111018.0, "tt": 2279, "tp": 49, "sl": 847, "eod": 1383, "st": 34}, "status": "discard", "description": "CD=33 EOD=14:53: PF=1.443", "timestamp": 1782473534, "segment": 1}
{"run": 106, "commit": "be9125e", "metric": 1.4518, "metrics": {"wr": 47.8, "np": 111571.0, "tt": 2259, "tp": 49, "sl": 836, "eod": 1374, "st": 34}, "status": "discard", "description": "CD=34 EOD=14:53: PF=1.452", "timestamp": 1782473534, "segment": 1}
{"run": 107, "commit": "be9125e", "metric": 1.4543, "metrics": {"wr": 48.0, "np": 111808.0, "tt": 2222, "tp": 48, "sl": 815, "eod": 1359, "st": 34}, "status": "discard", "description": "CD=36 EOD=14:53: PF=1.454", "timestamp": 1782473534, "segment": 1}
{"run": 108, "commit": "be9125e", "metric": 1.4561, "metrics": {"wr": 48.0, "np": 112009.0, "tt": 2242, "tp": 48, "sl": 827, "eod": 1367, "st": 34}, "status": "keep", "description": "EOD=14:54 SL=0.5 TP=2.4 CD=35 FAST=12/26: PF=1.456 (confirmed)", "timestamp": 1782473534, "segment": 1}
{"run": 109, "commit": "be9125e", "metric": 1.4417, "metrics": {"wr": 49.2, "np": 110725.0, "tt": 2241, "tp": 48, "sl": 777, "eod": 1416, "st": 34}, "status": "discard", "description": "SL=0.55 TP=2.4 CD=34: PF=1.442", "timestamp": 1782473534, "segment": 1}
{"run": 110, "commit": "be9125e", "metric": 1.3788, "metrics": {"wr": 46.3, "np": 105864.0, "tt": 2230, "tp": 46, "sl": 818, "eod": 1366, "st": 34}, "status": "discard", "description": "FAST=10 SLOW=30 best params: PF=1.379", "timestamp": 1782473534, "segment": 1}
{"run": 111, "commit": "be9125e", "metric": 1.3192, "metrics": {"wr": 41.6, "np": 100426.0, "tt": 2324, "tp": 49, "sl": 891, "eod": 1384, "st": 34}, "status": "discard", "description": "SL=0.4 TP=2.4 best params: PF=1.319", "timestamp": 1782473534, "segment": 1}
{"run": 112, "commit": "be9125e", "metric": 1.3591, "metrics": {"wr": 49.0, "np": 104489.0, "tt": 2218, "tp": 47, "sl": 780, "eod": 1391, "st": 34}, "status": "discard", "description": "SL=0.6 TP=2.4 best params: PF=1.359", "timestamp": 1782473534, "segment": 1}
{"run": 113, "commit": "be9125e", "metric": 1.3799, "metrics": {"wr": 47.2, "np": 106134.0, "tt": 2324, "tp": 49, "sl": 857, "eod": 1418, "st": 34}, "status": "discard", "description": "FAST=11 SLOW=25 best params: PF=1.380", "timestamp": 1782473534, "segment": 1}
{"run": 114, "commit": "be9125e", "metric": 1.3478, "metrics": {"wr": 46.3, "np": 103350.0, "tt": 2191, "tp": 46, "sl": 806, "eod": 1339, "st": 34}, "status": "discard", "description": "FAST=13 SLOW=27 best params: PF=1.348", "timestamp": 1782473534, "segment": 1}
{"run": 115, "commit": "be9125e", "metric": 1.4227, "metrics": {"wr": 47.0, "np": 109299.0, "tt": 2268, "tp": 48, "sl": 842, "eod": 1378, "st": 34}, "status": "discard", "description": "EOD=15:05 best params: PF=1.423", "timestamp": 1782473534, "segment": 1}
