{"run": 130, "commit": "b63ee0a", "metric": 1.0859, "metrics": {"win_rate": 45.3, "net_pnl": 1444.86, "total_trades": 53.0, "tp_exits": 17.0, "sl_exits": 22.0, "eod_exits": 14.0}, "status": "discard", "description": "buffer sweep 0.0 @OR5/SL1.25/TP2 [or_min=5 sl=1.25 tp=2.0 buffer=0.0 cooldown=1 shorts=False eod=900 min_or_range=0.3 max_or_range=5.0]", "timestamp": 1785880674, "segment": 0, "session": "newgen-orb-10m"}
{"run": 131, "commit": "b63ee0a", "metric": 1.4231, "metrics": {"win_rate": 51.2, "net_pnl": 5006.74, "total_trades": 41.0, "tp_exits": 16.0, "sl_exits": 15.0, "eod_exits": 10.0}, "status": "keep", "description": "buffer sweep 0.5 @OR5/SL1.25/TP2 [or_min=5 sl=1.25 tp=2.0 buffer=0.5 cooldown=1 shorts=False eod=900 min_or_range=0.3 max_or_range=5.0]", "timestamp": 1785880676, "segment": 0, "session": "newgen-orb-10m"}
{"run": 132, "commit": "b63ee0a", "metric": 1.4677, "metrics": {"win_rate": 53.1, "net_pnl": 4560.59, "total_trades": 32.0, "tp_exits": 13.0, "sl_exits": 12.0, "eod_exits": 7.0}, "status": "keep", "description": "buffer sweep 1.0 @OR5/SL1.25/TP2 [or_min=5 sl=1.25 tp=2.0 buffer=1.0 cooldown=1 shorts=False eod=900 min_or_range=0.3 max_or_range=5.0]", "timestamp": 1785880676, "segment": 0, "session": "newgen-orb-10m"}
{"run": 133, "commit": "b63ee0a", "metric": 1.2273, "metrics": {"win_rate": 48.0, "net_pnl": 1927.74, "total_trades": 25.0, "tp_exits": 10.0, "sl_exits": 11.0, "eod_exits": 4.0}, "status": "discard", "description": "buffer probe 1.5 @OR5/SL1.25/TP2 [or_min=5 sl=1.25 tp=2.0 buffer=1.5 cooldown=1 shorts=False eod=900 min_or_range=0.3 max_or_range=5.0]", "timestamp": 1785880682, "segment": 0, "session": "newgen-orb-10m"}
{"run": 134, "commit": "b63ee0a", "metric": 1.093, "metrics": {"win_rate": 47.8, "net_pnl": 798.85, "total_trades": 23.0, "tp_exits": 9.0, "sl_exits": 11.0, "eod_exits": 3.0}, "status": "discard", "description": "buffer probe 2.0 @OR5/SL1.25/TP2 [or_min=5 sl=1.25 tp=2.0 buffer=2.0 cooldown=1 shorts=False eod=900 min_or_range=0.3 max_or_range=5.0]", "timestamp": 1785880683, "segment": 0, "session": "newgen-orb-10m"}
{"run": 135, "commit": "b63ee0a", "metric": 1.4677, "metrics": {"win_rate": 53.1, "net_pnl": 4560.59, "total_trades": 32.0, "tp_exits": 13.0, "sl_exits": 12.0, "eod_exits": 7.0}, "status": "discard", "description": "cooldown 0 @OR5/SL1.25/TP2/buf1 [or_min=5 sl=1.25 tp=2.0 buffer=1.0 cooldown=0 shorts=False eod=900 min_or_range=0.3 max_or_range=5.0]", "timestamp": 1785880689, "segment": 0, "session": "newgen-orb-10m"}
{"run": 136, "commit": "b63ee0a", "metric": 1.2729, "metrics": {"win_rate": 50.0, "net_pnl": 2639.5, "total_trades": 30.0, "tp_exits": 12.0, "sl_exits": 12.0, "eod_exits": 6.0}, "status": "discard", "description": "cooldown 2 @OR5/SL1.25/TP2/buf1 [or_min=5 sl=1.25 tp=2.0 buffer=1.0 cooldown=2 shorts=False eod=900 min_or_range=0.3 max_or_range=5.0]", "timestamp": 1785880690, "segment": 0, "session": "newgen-orb-10m"}
{"run": 137, "commit": "b63ee0a", "metric": 1.2896, "metrics": {"win_rate": 46.2, "net_pnl": 2425.93, "total_trades": 26.0, "tp_exits": 10.0, "sl_exits": 10.0, "eod_exits": 6.0}, "status": "discard", "description": "cooldown 3 @OR5/SL1.25/TP2/buf1 [or_min=5 sl=1.25 tp=2.0 buffer=1.0 cooldown=3 shorts=False eod=900 min_or_range=0.3 max_or_range=5.0]", "timestamp": 1785880692, "segment": 0, "session": "newgen-orb-10m"}
{"run": 138, "commit": "b63ee0a", "metric": 1.2049, "metrics": {"win_rate": 46.0, "net_pnl": 2857.42, "total_trades": 50.0, "tp_exits": 15.0, "sl_exits": 16.0, "eod_exits": 19.0}, "status": "discard", "description": "shorts ON @OR5/SL1.25/TP2/buf1/cool1 [or_min=5 sl=1.25 tp=2.0 buffer=1.0 cooldown=1 shorts=True eod=900 min_or_range=0.3 max_or_range=5.0]", "timestamp": 1785880698, "segment": 0, "session": "newgen-orb-10m"}
{"run": 139, "commit": "b63ee0a", "metric": 1.4922, "metrics": {"win_rate": 50.0, "net_pnl": 4138.55, "total_trades": 28.0, "tp_exits": 12.0, "sl_exits": 11.0, "eod_exits": 5.0}, "status": "keep", "description": "EOD 870 @OR5/SL1.25/TP2/buf1/cool1 [or_min=5 sl=1.25 tp=2.0 buffer=1.0 cooldown=1 shorts=False eod=870 min_or_range=0.3 max_or_range=5.0]", "timestamp": 1785880699, "segment": 0, "session": "newgen-orb-10m"}
{"run": 140, "commit": "b63ee0a", "metric": 1.5687, "metrics": {"win_rate": 55.2, "net_pnl": 4892.8, "total_trades": 29.0, "tp_exits": 13.0, "sl_exits": 11.0, "eod_exits": 5.0}, "status": "keep", "description": "EOD 885 @OR5/SL1.25/TP2/buf1/cool1 [or_min=5 sl=1.25 tp=2.0 buffer=1.0 cooldown=1 shorts=False eod=885 min_or_range=0.3 max_or_range=5.0]", "timestamp": 1785880700, "segment": 0, "session": "newgen-orb-10m"}
{"run": 141, "commit": "b63ee0a", "metric": 1.6833, "metrics": {"win_rate": 51.9, "net_pnl": 4993.55, "total_trades": 27.0, "tp_exits": 12.0, "sl_exits": 8.0, "eod_exits": 7.0}, "status": "keep", "description": "EOD 855 @OR5/SL1.25/TP2/buf1/cool1 [or_min=5 sl=1.25 tp=2.0 buffer=1.0 cooldown=1 shorts=False eod=855 min_or_range=0.3 max_or_range=5.0]", "timestamp": 1785880707, "segment": 0, "session": "newgen-orb-10m"}
{"run": 142, "commit": "b63ee0a", "metric": 1.6739, "metrics": {"win_rate": 48.1, "net_pnl": 4908.61, "total_trades": 27.0, "tp_exits": 12.0, "sl_exits": 8.0, "eod_exits": 7.0}, "status": "discard", "description": "EOD 840 @OR5/SL1.25/TP2/buf1/cool1 [or_min=5 sl=1.25 tp=2.0 buffer=1.0 cooldown=1 shorts=False eod=840 min_or_range=0.3 max_or_range=5.0]", "timestamp": 1785880708, "segment": 0, "session": "newgen-orb-10m"}
{"run": 143, "commit": "b63ee0a", "metric": 1.6833, "metrics": {"win_rate": 51.9, "net_pnl": 4993.55, "total_trades": 27.0, "tp_exits": 12.0, "sl_exits": 8.0, "eod_exits": 7.0}, "status": "discard", "description": "minOR 0.2 @best [or_min=5 sl=1.25 tp=2.0 buffer=1.0 cooldown=1 shorts=False eod=855 min_or_range=0.2 max_or_range=5.0]", "timestamp": 1785880715, "segment": 0, "session": "newgen-orb-10m"}
{"run": 144, "commit": "b63ee0a", "metric": 1.6833, "metrics": {"win_rate": 51.9, "net_pnl": 4993.55, "total_trades": 27.0, "tp_exits": 12.0, "sl_exits": 8.0, "eod_exits": 7.0}, "status": "discard", "description": "minOR 0.5 @best [or_min=5 sl=1.25 tp=2.0 buffer=1.0 cooldown=1 shorts=False eod=855 min_or_range=0.5 max_or_range=5.0]", "timestamp": 1785880717, "segment": 0, "session": "newgen-orb-10m"}
{"run": 145, "commit": "b63ee0a", "metric": 1.8344, "metrics": {"win_rate": 53.8, "net_pnl": 5595.62, "total_trades": 26.0, "tp_exits": 12.0, "sl_exits": 7.0, "eod_exits": 7.0}, "status": "keep", "description": "minOR 0.8 @best [or_min=5 sl=1.25 tp=2.0 buffer=1.0 cooldown=1 shorts=False eod=855 min_or_range=0.8 max_or_range=5.0]", "timestamp": 1785880718, "segment": 0, "session": "newgen-orb-10m"}
{"run": 146, "commit": "b63ee0a", "metric": 1.8344, "metrics": {"win_rate": 53.8, "net_pnl": 5595.62, "total_trades": 26.0, "tp_exits": 12.0, "sl_exits": 7.0, "eod_exits": 7.0}, "status": "discard", "description": "minOR 1.0 @best [or_min=5 sl=1.25 tp=2.0 buffer=1.0 cooldown=1 shorts=False eod=855 min_or_range=1.0 max_or_range=5.0]", "timestamp": 1785880726, "segment": 0, "session": "newgen-orb-10m"}
{"run": 147, "commit": "b63ee0a", "metric": 2.1336, "metrics": {"win_rate": 57.1, "net_pnl": 5997.83, "total_trades": 21.0, "tp_exits": 11.0, "sl_exits": 6.0, "eod_exits": 4.0}, "status": "keep", "description": "minOR 1.5 @best [or_min=5 sl=1.25 tp=2.0 buffer=1.0 cooldown=1 shorts=False eod=855 min_or_range=1.5 max_or_range=5.0]", "timestamp": 1785880727, "segment": 0, "session": "newgen-orb-10m"}
{"run": 148, "commit": "b63ee0a", "metric": 2.1336, "metrics": {"win_rate": 57.1, "net_pnl": 5997.83, "total_trades": 21.0, "tp_exits": 11.0, "sl_exits": 6.0, "eod_exits": 4.0}, "status": "discard", "description": "minOR 2.0 @best [or_min=5 sl=1.25 tp=2.0 buffer=1.0 cooldown=1 shorts=False eod=855 min_or_range=2.0 max_or_range=5.0]", "timestamp": 1785880728, "segment": 0, "session": "newgen-orb-10m"}
{"run": 149, "commit": "b63ee0a", "metric": 2.7359, "metrics": {"win_rate": 60.0, "net_pnl": 5702.12, "total_trades": 15.0, "tp_exits": 9.0, "sl_exits": 4.0, "eod_exits": 2.0}, "status": "keep", "description": "minOR 2.5 @best [or_min=5 sl=1.25 tp=2.0 buffer=1.0 cooldown=1 shorts=False eod=855 min_or_range=2.5 max_or_range=5.0]", "timestamp": 1785880738, "segment": 0, "session": "newgen-orb-10m"}
{"run": 150, "commit": "b63ee0a", "metric": 2.7359, "metrics": {"win_rate": 60.0, "net_pnl": 5702.12, "total_trades": 15.0, "tp_exits": 9.0, "sl_exits": 4.0, "eod_exits": 2.0}, "status": "discard", "description": "minOR 3.0 @best [or_min=5 sl=1.25 tp=2.0 buffer=1.0 cooldown=1 shorts=False eod=855 min_or_range=3.0 max_or_range=5.0]", "timestamp": 1785880739, "segment": 0, "session": "newgen-orb-10m"}
{"run": 151, "commit": "b63ee0a", "metric": 1.4615, "metrics": {"win_rate": 50.0, "net_pnl": 1159.58, "total_trades": 8.0, "tp_exits": 4.0, "sl_exits": 3.0, "eod_exits": 1.0}, "status": "discard", "description": "minOR 4.0 @best [or_min=5 sl=1.25 tp=2.0 buffer=1.0 cooldown=1 shorts=False eod=855 min_or_range=4.0 max_or_range=5.0]", "timestamp": 1785880740, "segment": 0, "session": "newgen-orb-10m"}
{"run": 152, "commit": "b63ee0a", "metric": 2.0353, "metrics": {"win_rate": 50.0, "net_pnl": 4087.53, "total_trades": 16.0, "tp_exits": 8.0, "sl_exits": 7.0, "eod_exits": 1.0}, "status": "discard", "description": "SL 1.0 @minOR2.5 [or_min=5 sl=1.0 tp=2.0 buffer=1.0 cooldown=1 shorts=False eod=855 min_or_range=2.5 max_or_range=5.0]", "timestamp": 1785880751, "segment": 0, "session": "newgen-orb-10m"}
{"run": 153, "commit": "b63ee0a", "metric": 3.9471, "metrics": {"win_rate": 69.2, "net_pnl": 6714.0, "total_trades": 13.0, "tp_exits": 9.0, "sl_exits": 2.0, "eod_exits": 2.0}, "status": "keep", "description": "SL 1.5 @minOR2.5 [or_min=5 sl=1.5 tp=2.0 buffer=1.0 cooldown=1 shorts=False eod=855 min_or_range=2.5 max_or_range=5.0]", "timestamp": 1785880752, "segment": 0, "session": "newgen-orb-10m"}
{"run": 154, "commit": "b63ee0a", "metric": 2.3444, "metrics": {"win_rate": 57.1, "net_pnl": 5303.44, "total_trades": 14.0, "tp_exits": 7.0, "sl_exits": 5.0, "eod_exits": 2.0}, "status": "discard", "description": "TP 2.5 @minOR2.5 [or_min=5 sl=1.25 tp=2.5 buffer=1.0 cooldown=1 shorts=False eod=855 min_or_range=2.5 max_or_range=5.0]", "timestamp": 1785880753, "segment": 0, "session": "newgen-orb-10m"}
{"run": 155, "commit": "b63ee0a", "metric": 2.8087, "metrics": {"win_rate": 66.7, "net_pnl": 4756.89, "total_trades": 15.0, "tp_exits": 10.0, "sl_exits": 3.0, "eod_exits": 2.0}, "status": "discard", "description": "TP 1.5 @minOR2.5 [or_min=5 sl=1.25 tp=1.5 buffer=1.0 cooldown=1 shorts=False eod=855 min_or_range=2.5 max_or_range=5.0]", "timestamp": 1785880754, "segment": 0, "session": "newgen-orb-10m"}
{"run": 156, "commit": "b63ee0a", "metric": 3.5224, "metrics": {"win_rate": 69.2, "net_pnl": 6439.36, "total_trades": 13.0, "tp_exits": 9.0, "sl_exits": 2.0, "eod_exits": 2.0}, "status": "discard", "description": "SL 1.75 @minOR2.5/TP2 [or_min=5 sl=1.75 tp=2.0 buffer=1.0 cooldown=1 shorts=False eod=855 min_or_range=2.5 max_or_range=5.0]", "timestamp": 1785880762, "segment": 0, "session": "newgen-orb-10m"}
{"run": 157, "commit": "b63ee0a", "metric": 5.4509, "metrics": {"win_rate": 75.0, "net_pnl": 7349.31, "total_trades": 12.0, "tp_exits": 9.0, "sl_exits": 1.0, "eod_exits": 2.0}, "status": "keep", "description": "SL 2.0 @minOR2.5/TP2 [or_min=5 sl=2.0 tp=2.0 buffer=1.0 cooldown=1 shorts=False eod=855 min_or_range=2.5 max_or_range=5.0]", "timestamp": 1785880763, "segment": 0, "session": "newgen-orb-10m"}
{"run": 158, "commit": "b63ee0a", "metric": 3.5767, "metrics": {"win_rate": 72.7, "net_pnl": 6667.27, "total_trades": 11.0, "tp_exits": 7.0, "sl_exits": 3.0, "eod_exits": 1.0}, "status": "discard", "description": "SL 1.5 TP2.5 @minOR2.5 [or_min=5 sl=1.5 tp=2.5 buffer=1.0 cooldown=1 shorts=False eod=855 min_or_range=2.5 max_or_range=5.0]", "timestamp": 1785880764, "segment": 0, "session": "newgen-orb-10m"}
{"run": 159, "commit": "b63ee0a", "metric": 7.1057, "metrics": {"win_rate": 80.0, "net_pnl": 8341.03, "total_trades": 10.0, "tp_exits": 6.0, "sl_exits": 1.0, "eod_exits": 3.0}, "status": "keep", "description": "SL 1.5 TP3 @minOR2.5 [or_min=5 sl=1.5 tp=3.0 buffer=1.0 cooldown=1 shorts=False eod=855 min_or_range=2.5 max_or_range=5.0]", "timestamp": 1785880765, "segment": 0, "session": "newgen-orb-10m"}
{"run": 160, "commit": "b63ee0a", "metric": 5.933, "metrics": {"win_rate": 80.0, "net_pnl": 8071.01, "total_trades": 10.0, "tp_exits": 6.0, "sl_exits": 1.0, "eod_exits": 3.0}, "status": "discard", "description": "SL2.0 TP3 @minOR2.5 [or_min=5 sl=2.0 tp=3.0 buffer=1.0 cooldown=1 shorts=False eod=855 min_or_range=2.5 max_or_range=5.0]", "timestamp": 1785880773, "segment": 0, "session": "newgen-orb-10m"}
{"run": 161, "commit": "b63ee0a", "metric": 4.6361, "metrics": {"win_rate": 80.0, "net_pnl": 7258.6, "total_trades": 10.0, "tp_exits": 7.0, "sl_exits": 1.0, "eod_exits": 2.0}, "status": "discard", "description": "SL2.0 TP2.5 @minOR2.5 [or_min=5 sl=2.0 tp=2.5 buffer=1.0 cooldown=1 shorts=False eod=855 min_or_range=2.5 max_or_range=5.0]", "timestamp": 1785880774, "segment": 0, "session": "newgen-orb-10m"}
{"run": 162, "commit": "b63ee0a", "metric": 6.4666, "metrics": {"win_rate": 80.0, "net_pnl": 8206.02, "total_trades": 10.0, "tp_exits": 6.0, "sl_exits": 1.0, "eod_exits": 3.0}, "status": "discard", "description": "SL1.75 TP3 @minOR2.5 [or_min=5 sl=1.75 tp=3.0 buffer=1.0 cooldown=1 shorts=False eod=855 min_or_range=2.5 max_or_range=5.0]", "timestamp": 1785880776, "segment": 0, "session": "newgen-orb-10m"}
{"run": 163, "commit": "b63ee0a", "metric": 4.6847, "metrics": {"win_rate": 75.0, "net_pnl": 7079.28, "total_trades": 12.0, "tp_exits": 9.0, "sl_exits": 1.0, "eod_exits": 2.0}, "status": "discard", "description": "SL2.5 TP2 @minOR2.5 [or_min=5 sl=2.5 tp=2.0 buffer=1.0 cooldown=1 shorts=False eod=855 min_or_range=2.5 max_or_range=5.0]", "timestamp": 1785880777, "segment": 0, "session": "newgen-orb-10m"}
{"run": 164, "commit": "b63ee0a", "metric": 8.237, "metrics": {"win_rate": 80.0, "net_pnl": 9886.5, "total_trades": 10.0, "tp_exits": 6.0, "sl_exits": 1.0, "eod_exits": 3.0}, "status": "keep", "description": "SL1.5 TP3.5 @minOR2.5 [or_min=5 sl=1.5 tp=3.5 buffer=1.0 cooldown=1 shorts=False eod=855 min_or_range=2.5 max_or_range=5.0]", "timestamp": 1785880785, "segment": 0, "session": "newgen-orb-10m"}
{"run": 165, "commit": "b63ee0a", "metric": 6.4324, "metrics": {"win_rate": 77.8, "net_pnl": 9183.31, "total_trades": 9.0, "tp_exits": 5.0, "sl_exits": 2.0, "eod_exits": 2.0}, "status": "discard", "description": "SL1.5 TP4 @minOR2.5 [or_min=5 sl=1.5 tp=4.0 buffer=1.0 cooldown=1 shorts=False eod=855 min_or_range=2.5 max_or_range=5.0]", "timestamp": 1785880786, "segment": 0, "session": "newgen-orb-10m"}
{"run": 166, "commit": "b63ee0a", "metric": 4.2862, "metrics": {"win_rate": 72.7, "net_pnl": 7437.08, "total_trades": 11.0, "tp_exits": 6.0, "sl_exits": 2.0, "eod_exits": 3.0}, "status": "discard", "description": "SL1.5 TP3 buf0.5 @minOR2.5 [or_min=5 sl=1.5 tp=3.0 buffer=0.5 cooldown=1 shorts=False eod=855 min_or_range=2.5 max_or_range=5.0]", "timestamp": 1785880788, "segment": 0, "session": "newgen-orb-10m"}
{"run": 167, "commit": "b63ee0a", "metric": 18.7624, "metrics": {"win_rate": 88.9, "net_pnl": 8858.27, "total_trades": 9.0, "tp_exits": 6.0, "sl_exits": 0.0, "eod_exits": 3.0}, "status": "keep", "description": "SL1.5 TP3 buf1.5 @minOR2.5 [or_min=5 sl=1.5 tp=3.0 buffer=1.5 cooldown=1 shorts=False eod=855 min_or_range=2.5 max_or_range=5.0]", "timestamp": 1785880789, "segment": 0, "session": "newgen-orb-10m"}
{"run": 168, "commit": "b63ee0a", "metric": 21.8613, "metrics": {"win_rate": 88.9, "net_pnl": 10403.74, "total_trades": 9.0, "tp_exits": 6.0, "sl_exits": 0.0, "eod_exits": 3.0}, "status": "keep", "description": "SL1.5 TP3.5 buf1.5 @minOR2.5 [or_min=5 sl=1.5 tp=3.5 buffer=1.5 cooldown=1 shorts=False eod=855 min_or_range=2.5 max_or_range=5.0]", "timestamp": 1785880800, "segment": 0, "session": "newgen-orb-10m"}
{"run": 169, "commit": "b63ee0a", "metric": 6.8494, "metrics": {"win_rate": 80.0, "net_pnl": 7990.88, "total_trades": 10.0, "tp_exits": 6.0, "sl_exits": 1.0, "eod_exits": 3.0}, "status": "discard", "description": "SL1.5 TP3 buf1.2 @minOR2.5 [or_min=5 sl=1.5 tp=3.0 buffer=1.2 cooldown=1 shorts=False eod=855 min_or_range=2.5 max_or_range=5.0]", "timestamp": 1785880801, "segment": 0, "session": "newgen-orb-10m"}
{"run": 170, "commit": "b63ee0a", "metric": 7.9807, "metrics": {"win_rate": 80.0, "net_pnl": 9536.35, "total_trades": 10.0, "tp_exits": 6.0, "sl_exits": 1.0, "eod_exits": 3.0}, "status": "discard", "description": "SL1.5 TP3.5 buf1.2 @minOR2.5 [or_min=5 sl=1.5 tp=3.5 buffer=1.2 cooldown=1 shorts=False eod=855 min_or_range=2.5 max_or_range=5.0]", "timestamp": 1785880803, "segment": 0, "session": "newgen-orb-10m"}
{"run": 171, "commit": "b63ee0a", "metric": 5.2568, "metrics": {"win_rate": 71.4, "net_pnl": 10829.5, "total_trades": 14.0, "tp_exits": 7.0, "sl_exits": 2.0, "eod_exits": 5.0}, "status": "discard", "description": "SL1.5 TP3.5 buf1 minOR2.0 [or_min=5 sl=1.5 tp=3.5 buffer=1.0 cooldown=1 shorts=False eod=855 min_or_range=2.0 max_or_range=5.0]", "timestamp": 1785880820, "segment": 0, "session": "newgen-orb-10m"}
{"run": 172, "commit": "b63ee0a", "metric": 8.237, "metrics": {"win_rate": 80.0, "net_pnl": 9886.5, "total_trades": 10.0, "tp_exits": 6.0, "sl_exits": 1.0, "eod_exits": 3.0}, "status": "discard", "description": "SL1.5 TP3.5 buf1 minOR3.0 [or_min=5 sl=1.5 tp=3.5 buffer=1.0 cooldown=1 shorts=False eod=855 min_or_range=3.0 max_or_range=5.0]", "timestamp": 1785880821, "segment": 0, "session": "newgen-orb-10m"}
{"run": 173, "commit": "b63ee0a", "metric": 5.2959, "metrics": {"win_rate": 71.4, "net_pnl": 11079.35, "total_trades": 14.0, "tp_exits": 7.0, "sl_exits": 2.0, "eod_exits": 5.0}, "status": "discard", "description": "SL1.5 TP3.5 buf1 minOR1.5 EOD840 [or_min=5 sl=1.5 tp=3.5 buffer=1.0 cooldown=1 shorts=False eod=840 min_or_range=1.5 max_or_range=5.0]", "timestamp": 1785880823, "segment": 0, "session": "newgen-orb-10m"}
{"run": 174, "commit": "b63ee0a", "metric": 8.1329, "metrics": {"win_rate": 80.0, "net_pnl": 10136.34, "total_trades": 10.0, "tp_exits": 6.0, "sl_exits": 1.0, "eod_exits": 3.0}, "status": "discard", "description": "SL1.5 TP3.5 buf1 minOR2.5 EOD840 [or_min=5 sl=1.5 tp=3.5 buffer=1.0 cooldown=1 shorts=False eod=840 min_or_range=2.5 max_or_range=5.0]", "timestamp": 1785880834, "segment": 0, "session": "newgen-orb-10m"}
{"run": 175, "commit": "b63ee0a", "metric": 4.2994, "metrics": {"win_rate": 70.0, "net_pnl": 8687.27, "total_trades": 10.0, "tp_exits": 6.0, "sl_exits": 3.0, "eod_exits": 1.0}, "status": "discard", "description": "SL1.5 TP3.5 buf1 minOR2.5 EOD870 [or_min=5 sl=1.5 tp=3.5 buffer=1.0 cooldown=1 shorts=False eod=870 min_or_range=2.5 max_or_range=5.0]", "timestamp": 1785880835, "segment": 0, "session": "newgen-orb-10m"}
{"run": 176, "commit": "b63ee0a", "metric": 4.1798, "metrics": {"win_rate": 70.0, "net_pnl": 8372.47, "total_trades": 10.0, "tp_exits": 6.0, "sl_exits": 3.0, "eod_exits": 1.0}, "status": "discard", "description": "SL1.5 TP3.5 buf1 minOR2.5 EOD885 [or_min=5 sl=1.5 tp=3.5 buffer=1.0 cooldown=1 shorts=False eod=885 min_or_range=2.5 max_or_range=5.0]", "timestamp": 1785880836, "segment": 0, "session": "newgen-orb-10m"}
{"run": 177, "commit": "b63ee0a", "metric": 8.237, "metrics": {"win_rate": 80.0, "net_pnl": 9886.5, "total_trades": 10.0, "tp_exits": 6.0, "sl_exits": 1.0, "eod_exits": 3.0}, "status": "discard", "description": "SL1.5 TP3.5 buf1 minOR2.5 EOD850 [or_min=5 sl=1.5 tp=3.5 buffer=1.0 cooldown=1 shorts=False eod=850 min_or_range=2.5 max_or_range=5.0]", "timestamp": 1785880850, "segment": 0, "session": "newgen-orb-10m"}
{"run": 178, "commit": "b63ee0a", "metric": 7.4349, "metrics": {"win_rate": 70.0, "net_pnl": 9386.81, "total_trades": 10.0, "tp_exits": 6.0, "sl_exits": 1.0, "eod_exits": 3.0}, "status": "discard", "description": "SL1.5 TP3.5 buf1 minOR2.5 EOD860 [or_min=5 sl=1.5 tp=3.5 buffer=1.0 cooldown=1 shorts=False eod=860 min_or_range=2.5 max_or_range=5.0]", "timestamp": 1785880851, "segment": 0, "session": "newgen-orb-10m"}
{"run": 179, "commit": "b63ee0a", "metric": 6.1983, "metrics": {"win_rate": 70.0, "net_pnl": 9145.34, "total_trades": 10.0, "tp_exits": 6.0, "sl_exits": 1.0, "eod_exits": 3.0}, "status": "discard", "description": "robustness cooldown2 [or_min=5 sl=1.5 tp=3.5 buffer=1.0 cooldown=2 shorts=False eod=855 min_or_range=2.5 max_or_range=5.0]", "timestamp": 1785880867, "segment": 0, "session": "newgen-orb-10m"}
{"run": 180, "commit": "b63ee0a", "metric": 3.0202, "metrics": {"win_rate": 53.3, "net_pnl": 7526.84, "total_trades": 15.0, "tp_exits": 6.0, "sl_exits": 3.0, "eod_exits": 6.0}, "status": "discard", "description": "robustness shorts ON [or_min=5 sl=1.5 tp=3.5 buffer=1.0 cooldown=1 shorts=True eod=855 min_or_range=2.5 max_or_range=5.0]", "timestamp": 1785880869, "segment": 0, "session": "newgen-orb-10m"}
{"run": 181, "commit": "b63ee0a", "metric": 4.964, "metrics": {"win_rate": 72.7, "net_pnl": 8970.84, "total_trades": 11.0, "tp_exits": 6.0, "sl_exits": 2.0, "eod_exits": 3.0}, "status": "discard", "description": "robustness buf0.8 [or_min=5 sl=1.5 tp=3.5 buffer=0.8 cooldown=1 shorts=False eod=855 min_or_range=2.5 max_or_range=5.0]", "timestamp": 1785880870, "segment": 0, "session": "newgen-orb-10m"}
{"run": 182, "commit": "b63ee0a", "metric": 7.9807, "metrics": {"win_rate": 80.0, "net_pnl": 9536.35, "total_trades": 10.0, "tp_exits": 6.0, "sl_exits": 1.0, "eod_exits": 3.0}, "status": "discard", "description": "robustness buf1.25 [or_min=5 sl=1.5 tp=3.5 buffer=1.25 cooldown=1 shorts=False eod=855 min_or_range=2.5 max_or_range=5.0]", "timestamp": 1785880871, "segment": 0, "session": "newgen-orb-10m"}
