{"run": 520, "commit": "b63ee0a", "metric": 1.3822, "metrics": {"win_rate": 54.5, "net_pnl": 1479.77, "total_trades": 11, "tp_exits": 5, "sl_exits": 5, "eod_exits": 1}, "status": "keep", "description": "tf=15 ATR=20 MULT=1.0 SL=1.5 TP=2.0 EOD=885 shorts=0", "timestamp": 1785880865.823318, "segment": 0, "session": "newgen-supertrend"}
{"run": 521, "commit": "b63ee0a", "metric": 1.0772, "metrics": {"win_rate": 45.5, "net_pnl": 248.58, "total_trades": 11, "tp_exits": 1, "sl_exits": 6, "eod_exits": 4}, "status": "keep", "description": "tf=15 ATR=20 MULT=1.0 SL=1.0 TP=2.5 EOD=885 shorts=0", "timestamp": 1785880866.8222172, "segment": 0, "session": "newgen-supertrend"}
{"run": 522, "commit": "b63ee0a", "metric": 1.9076, "metrics": {"win_rate": 59.1, "net_pnl": 3912.56, "total_trades": 22, "tp_exits": 5, "sl_exits": 7, "eod_exits": 10}, "status": "keep", "description": "perturb tf=15 ATR=18 MULT=1.0 SL=1.0 TP=2.0 EOD=885 shorts=1", "timestamp": 1785880875.1693656, "segment": 0, "session": "newgen-supertrend"}
{"run": 523, "commit": "b63ee0a", "metric": 1.9565, "metrics": {"win_rate": 57.1, "net_pnl": 4123.36, "total_trades": 21, "tp_exits": 6, "sl_exits": 7, "eod_exits": 8}, "status": "keep", "description": "perturb tf=15 ATR=22 MULT=1.0 SL=1.0 TP=2.0 EOD=885 shorts=1", "timestamp": 1785880876.0271068, "segment": 0, "session": "newgen-supertrend"}
{"run": 524, "commit": "b63ee0a", "metric": 1.3253, "metrics": {"win_rate": 50.0, "net_pnl": 2071.38, "total_trades": 26, "tp_exits": 6, "sl_exits": 10, "eod_exits": 10}, "status": "keep", "description": "perturb tf=15 ATR=20 MULT=0.9 SL=1.0 TP=2.0 EOD=885 shorts=1", "timestamp": 1785880876.8883815, "segment": 0, "session": "newgen-supertrend"}
{"run": 525, "commit": "b63ee0a", "metric": 1.5877, "metrics": {"win_rate": 57.9, "net_pnl": 2472.93, "total_trades": 19, "tp_exits": 4, "sl_exits": 7, "eod_exits": 8}, "status": "keep", "description": "perturb tf=15 ATR=20 MULT=1.1 SL=1.0 TP=2.0 EOD=885 shorts=1", "timestamp": 1785880877.789755, "segment": 0, "session": "newgen-supertrend"}
{"run": 526, "commit": "b63ee0a", "metric": 2.0475, "metrics": {"win_rate": 54.5, "net_pnl": 4334.41, "total_trades": 22, "tp_exits": 6, "sl_exits": 9, "eod_exits": 7}, "status": "keep", "description": "perturb tf=15 ATR=20 MULT=1.0 SL=0.8 TP=2.0 EOD=885 shorts=1", "timestamp": 1785880878.6342745, "segment": 0, "session": "newgen-supertrend"}
{"run": 527, "commit": "b63ee0a", "metric": 2.0428, "metrics": {"win_rate": 59.1, "net_pnl": 4495.4, "total_trades": 22, "tp_exits": 8, "sl_exits": 7, "eod_exits": 7}, "status": "keep", "description": "perturb tf=15 ATR=20 MULT=1.0 SL=1.0 TP=1.8 EOD=885 shorts=1", "timestamp": 1785880879.6627462, "segment": 0, "session": "newgen-supertrend"}
{"run": 528, "commit": "b63ee0a", "metric": 0.7845, "metrics": {"win_rate": 41.3, "net_pnl": -5362.73, "total_trades": 109, "tp_exits": 19, "sl_exits": 34, "eod_exits": 56, "strategy": "bb"}, "status": "keep", "description": "bb:bounce tf=5 p=20 std=2.0 SL=1.0 TP=1.5 EOD=885 [baseline]", "timestamp": 1785880892, "segment": 0, "session": "newgen-bb-short-vol"}
{"run": 529, "commit": "b63ee0a", "metric": 0.4792, "metrics": {"win_rate": 55.2, "net_pnl": -3324.85, "total_trades": 29, "tp_exits": 11, "sl_exits": 5, "eod_exits": 13, "strategy": "short"}, "status": "keep", "description": "short:s1_breakdown tf=5 SL=1.5 TP=2.0 buf=0.3 piv=classic EOD=915 [baseline]", "timestamp": 1785880893, "segment": 0, "session": "newgen-bb-short-vol"}
{"run": 530, "commit": "b63ee0a", "metric": 0.762, "metrics": {"win_rate": 39.3, "net_pnl": -7521.39, "total_trades": 122, "tp_exits": 30, "sl_exits": 50, "eod_exits": 42, "strategy": "vol"}, "status": "keep", "description": "vol tf=5 mult=2.0 avg=20 SL=1.0 TP=1.5 EOD=885 [baseline]", "timestamp": 1785880893, "segment": 0, "session": "newgen-bb-short-vol"}
{"run": 531, "commit": "b63ee0a", "metric": 0.8378, "metrics": {"win_rate": 41.3, "net_pnl": -3837.35, "total_trades": 109, "tp_exits": 17, "sl_exits": 34, "eod_exits": 58, "strategy": "bb"}, "status": "discard", "description": "bb:bounce tf=5 p=15 std=2.0 SL=1.0 TP=1.5", "timestamp": 1785880913, "segment": 0, "session": "newgen-bb-short-vol"}
{"run": 532, "commit": "b63ee0a", "metric": 0.9751, "metrics": {"win_rate": 45.1, "net_pnl": -437.44, "total_trades": 71, "tp_exits": 11, "sl_exits": 15, "eod_exits": 45, "strategy": "bb"}, "status": "keep", "description": "bb:bounce tf=5 p=20 std=2.5 SL=1.5 TP=2.0", "timestamp": 1785880913, "segment": 0, "session": "newgen-bb-short-vol"}
{"run": 533, "commit": "b63ee0a", "metric": 0.887, "metrics": {"win_rate": 44.5, "net_pnl": -3114.17, "total_trades": 119, "tp_exits": 25, "sl_exits": 38, "eod_exits": 56, "strategy": "bb"}, "status": "discard", "description": "bb:breakout tf=5 p=20 std=2.0 SL=1.0 TP=1.5", "timestamp": 1785880914, "segment": 0, "session": "newgen-bb-short-vol"}
{"run": 534, "commit": "b63ee0a", "metric": 0.9658, "metrics": {"win_rate": 40.0, "net_pnl": -155.58, "total_trades": 40, "tp_exits": 3, "sl_exits": 3, "eod_exits": 34, "strategy": "bb"}, "status": "keep", "description": "bb:squeeze tf=5 p=20 std=2.0 SL=1.0 TP=1.5", "timestamp": 1785880915, "segment": 0, "session": "newgen-bb-short-vol"}
{"run": 535, "commit": "b63ee0a", "metric": 1.1892, "metrics": {"win_rate": 50.0, "net_pnl": 2147.29, "total_trades": 54, "tp_exits": 10, "sl_exits": 10, "eod_exits": 34, "strategy": "bb"}, "status": "keep", "description": "bb:bounce tf=15 p=20 std=2.0 SL=1.5 TP=2.0", "timestamp": 1785880925, "segment": 0, "session": "newgen-bb-short-vol"}
{"run": 536, "commit": "b63ee0a", "metric": 1.0913, "metrics": {"win_rate": 48.5, "net_pnl": 1518.65, "total_trades": 66, "tp_exits": 5, "sl_exits": 14, "eod_exits": 47, "strategy": "bb"}, "status": "keep", "description": "bb:bounce tf=5 p=20 std=2.5 SL=1.5 TP=3.0", "timestamp": 1785880926, "segment": 0, "session": "newgen-bb-short-vol"}
{"run": 537, "commit": "b63ee0a", "metric": 1.0495, "metrics": {"win_rate": 50.8, "net_pnl": 866.93, "total_trades": 65, "tp_exits": 5, "sl_exits": 9, "eod_exits": 51, "strategy": "bb"}, "status": "keep", "description": "bb:bounce tf=5 p=20 std=2.5 SL=2.0 TP=3.0", "timestamp": 1785880927, "segment": 0, "session": "newgen-bb-short-vol"}
{"run": 538, "commit": "b63ee0a", "metric": 0.909, "metrics": {"win_rate": 44.2, "net_pnl": -1903.92, "total_trades": 77, "tp_exits": 13, "sl_exits": 14, "eod_exits": 50, "strategy": "bb"}, "status": "discard", "description": "bb:breakout tf=5 p=20 std=2.5 SL=1.5 TP=2.0", "timestamp": 1785880928, "segment": 0, "session": "newgen-bb-short-vol"}
{"run": 539, "commit": "b63ee0a", "metric": 1.2986, "metrics": {"win_rate": 43.6, "net_pnl": 1302.45, "total_trades": 39, "tp_exits": 3, "sl_exits": 2, "eod_exits": 34, "strategy": "bb"}, "status": "keep", "description": "bb:squeeze tf=5 p=20 std=2.5 SL=1.5 TP=2.0", "timestamp": 1785880929, "segment": 0, "session": "newgen-bb-short-vol"}
{"run": 540, "commit": "b63ee0a", "metric": 1.322, "metrics": {"win_rate": 58.1, "net_pnl": 2534.76, "total_trades": 31, "tp_exits": 8, "sl_exits": 8, "eod_exits": 15, "strategy": "bb"}, "status": "keep", "description": "bb:bounce tf=15 p=20 std=2.5 SL=1.5 TP=2.0", "timestamp": 1785880942, "segment": 0, "session": "newgen-bb-short-vol"}
{"run": 541, "commit": "b63ee0a", "metric": 0.8676, "metrics": {"win_rate": 46.8, "net_pnl": -1515.26, "total_trades": 47, "tp_exits": 6, "sl_exits": 11, "eod_exits": 30, "strategy": "bb"}, "status": "discard", "description": "bb:bounce tf=15 p=15 std=2.0 SL=1.5 TP=2.0", "timestamp": 1785880943, "segment": 0, "session": "newgen-bb-short-vol"}
{"run": 542, "commit": "b63ee0a", "metric": 0.4622, "metrics": {"win_rate": 33.3, "net_pnl": -3646.24, "total_trades": 18, "tp_exits": 2, "sl_exits": 6, "eod_exits": 10, "strategy": "bb"}, "status": "discard", "description": "bb:squeeze tf=15 p=20 std=2.0 SL=1.5 TP=2.0", "timestamp": 1785880943, "segment": 0, "session": "newgen-bb-short-vol"}
{"run": 543, "commit": "b63ee0a", "metric": 0.9658, "metrics": {"win_rate": 40.0, "net_pnl": -155.58, "total_trades": 40, "tp_exits": 3, "sl_exits": 3, "eod_exits": 34, "strategy": "bb"}, "status": "discard", "description": "bb:squeeze tf=5 p=20 std=2.5 SL=1.0 TP=1.5", "timestamp": 1785880944, "segment": 0, "session": "newgen-bb-short-vol"}
{"run": 544, "commit": "b63ee0a", "metric": 1.8919, "metrics": {"win_rate": 66.7, "net_pnl": 1490.92, "total_trades": 6, "tp_exits": 3, "sl_exits": 2, "eod_exits": 1, "strategy": "short"}, "status": "keep", "description": "short:rsi_overbought tf=5 SL=1.5 TP=2.0", "timestamp": 1785880961, "segment": 0, "session": "newgen-bb-short-vol"}
{"run": 545, "commit": "b63ee0a", "metric": 1.1252, "metrics": {"win_rate": 52.4, "net_pnl": 512.29, "total_trades": 21, "tp_exits": 1, "sl_exits": 3, "eod_exits": 17, "strategy": "short"}, "status": "keep", "description": "short:breakout_fail tf=5 SL=1.5 TP=2.0 buf=0.3", "timestamp": 1785880962, "segment": 0, "session": "newgen-bb-short-vol"}
{"run": 546, "commit": "b63ee0a", "metric": 0.4218, "metrics": {"win_rate": 25.0, "net_pnl": -2999.48, "total_trades": 8, "tp_exits": 2, "sl_exits": 6, "eod_exits": 0, "strategy": "short"}, "status": "discard", "description": "short:ema_extended tf=5 SL=1.5 TP=2.0", "timestamp": 1785880963, "segment": 0, "session": "newgen-bb-short-vol"}
{"run": 547, "commit": "b63ee0a", "metric": 0.5421, "metrics": {"win_rate": 53.3, "net_pnl": -3204.04, "total_trades": 30, "tp_exits": 11, "sl_exits": 6, "eod_exits": 13, "strategy": "short"}, "status": "discard", "description": "short:s1_breakdown tf=5 SL=1.5 TP=2.0 buf=0.1", "timestamp": 1785880964, "segment": 0, "session": "newgen-bb-short-vol"}
{"run": 548, "commit": "b63ee0a", "metric": 0.6205, "metrics": {"win_rate": 55.3, "net_pnl": -3591.84, "total_trades": 38, "tp_exits": 12, "sl_exits": 9, "eod_exits": 17, "strategy": "short"}, "status": "keep", "description": "short:s1_breakdown tf=5 SL=1.5 TP=2.0 buf=0.3 piv=fib", "timestamp": 1785880965, "segment": 0, "session": "newgen-bb-short-vol"}
{"run": 549, "commit": "b63ee0a", "metric": 1.9525, "metrics": {"win_rate": 57.9, "net_pnl": 2521.48, "total_trades": 19, "tp_exits": 1, "sl_exits": 1, "eod_exits": 17, "strategy": "short"}, "status": "keep", "description": "short:breakout_fail tf=5 SL=2.0 TP=3.0", "timestamp": 1785880974, "segment": 0, "session": "newgen-bb-short-vol"}
{"run": 550, "commit": "b63ee0a", "metric": 1.2651, "metrics": {"win_rate": 52.4, "net_pnl": 1085.19, "total_trades": 21, "tp_exits": 1, "sl_exits": 3, "eod_exits": 17, "strategy": "short"}, "status": "keep", "description": "short:breakout_fail tf=5 SL=1.5 TP=3.0", "timestamp": 1785880975, "segment": 0, "session": "newgen-bb-short-vol"}
{"run": 551, "commit": "b63ee0a", "metric": 1.4045, "metrics": {"win_rate": 70.0, "net_pnl": 1290.12, "total_trades": 20, "tp_exits": 2, "sl_exits": 3, "eod_exits": 15, "strategy": "short"}, "status": "keep", "description": "short:breakout_fail tf=15 SL=1.5 TP=2.0", "timestamp": 1785880976, "segment": 0, "session": "newgen-bb-short-vol"}
{"run": 552, "commit": "b63ee0a", "metric": 0.3942, "metrics": {"win_rate": 55.2, "net_pnl": -4527.27, "total_trades": 29, "tp_exits": 10, "sl_exits": 4, "eod_exits": 15, "strategy": "short"}, "status": "discard", "description": "short:s1_breakdown tf=5 SL=2.0 TP=3.0", "timestamp": 1785880978, "segment": 0, "session": "newgen-bb-short-vol"}
{"run": 553, "commit": "b63ee0a", "metric": 0.8091, "metrics": {"win_rate": 40.6, "net_pnl": -6856.27, "total_trades": 138, "tp_exits": 36, "sl_exits": 56, "eod_exits": 46, "strategy": "vol"}, "status": "keep", "description": "vol tf=5 mult=1.5 avg=20 SL=1.0 TP=1.5", "timestamp": 1785880987, "segment": 0, "session": "newgen-bb-short-vol"}
{"run": 554, "commit": "b63ee0a", "metric": 0.6954, "metrics": {"win_rate": 36.1, "net_pnl": -7628.57, "total_trades": 72, "tp_exits": 8, "sl_exits": 21, "eod_exits": 43, "strategy": "vol"}, "status": "discard", "description": "vol tf=5 mult=3.0 avg=20 SL=1.5 TP=3.0", "timestamp": 1785880988, "segment": 0, "session": "newgen-bb-short-vol"}
{"run": 555, "commit": "b63ee0a", "metric": 0.7983, "metrics": {"win_rate": 39.2, "net_pnl": -6144.13, "total_trades": 120, "tp_exits": 30, "sl_exits": 45, "eod_exits": 45, "strategy": "vol"}, "status": "discard", "description": "vol tf=5 mult=2.0 avg=10 SL=1.0 TP=1.5", "timestamp": 1785880989, "segment": 0, "session": "newgen-bb-short-vol"}
{"run": 556, "commit": "b63ee0a", "metric": 0.6409, "metrics": {"win_rate": 32.8, "net_pnl": -8248.8, "total_trades": 58, "tp_exits": 14, "sl_exits": 23, "eod_exits": 21, "strategy": "vol"}, "status": "discard", "description": "vol tf=15 mult=2.0 avg=20 SL=1.5 TP=2.0", "timestamp": 1785880990, "segment": 0, "session": "newgen-bb-short-vol"}
{"run": 557, "commit": "b63ee0a", "metric": 0.7117, "metrics": {"win_rate": 36.7, "net_pnl": -9057.4, "total_trades": 90, "tp_exits": 11, "sl_exits": 28, "eod_exits": 51, "strategy": "vol"}, "status": "discard", "description": "vol tf=5 mult=2.0 avg=20 SL=1.5 TP=3.0", "timestamp": 1785880991, "segment": 0, "session": "newgen-bb-short-vol"}
{"run": 558, "commit": "b63ee0a", "metric": 0.8255, "metrics": {"win_rate": 36.2, "net_pnl": -5567.72, "total_trades": 116, "tp_exits": 24, "sl_exits": 50, "eod_exits": 42, "strategy": "vol"}, "status": "discard", "description": "vol tf=5 mult=2.0 avg=20 SL=1.0 TP=2.0", "timestamp": 1785881000, "segment": 0, "session": "newgen-bb-short-vol"}
{"run": 559, "commit": "b63ee0a", "metric": 0.7295, "metrics": {"win_rate": 35.3, "net_pnl": -6242.52, "total_trades": 85, "tp_exits": 15, "sl_exits": 35, "eod_exits": 35, "strategy": "vol"}, "status": "discard", "description": "vol tf=5 mult=3.0 avg=10 SL=1.0 TP=2.0", "timestamp": 1785881001, "segment": 0, "session": "newgen-bb-short-vol"}
{"run": 560, "commit": "b63ee0a", "metric": 0.8532, "metrics": {"win_rate": 38.6, "net_pnl": -2673.07, "total_trades": 70, "tp_exits": 20, "sl_exits": 28, "eod_exits": 22, "strategy": "vol"}, "status": "keep", "description": "vol tf=15 mult=2.0 avg=10 SL=1.0 TP=1.5", "timestamp": 1785881002, "segment": 0, "session": "newgen-bb-short-vol"}
{"run": 561, "commit": "b63ee0a", "metric": 1.0364, "metrics": {"win_rate": 40.6, "net_pnl": 1202.91, "total_trades": 133, "tp_exits": 30, "sl_exits": 48, "eod_exits": 55, "strategy": "vol"}, "status": "keep", "description": "vol tf=5 mult=1.5 avg=10 SL=1.0 TP=2.0", "timestamp": 1785881003, "segment": 0, "session": "newgen-bb-short-vol"}
{"run": 562, "commit": "b63ee0a", "metric": 0.8047, "metrics": {"win_rate": 36.0, "net_pnl": -6174.48, "total_trades": 114, "tp_exits": 11, "sl_exits": 47, "eod_exits": 56, "strategy": "vol"}, "status": "discard", "description": "vol tf=5 mult=1.5 avg=10 SL=1.0 TP=3.0", "timestamp": 1785881009, "segment": 0, "session": "newgen-bb-short-vol"}
{"run": 563, "commit": "b63ee0a", "metric": 1.1459, "metrics": {"win_rate": 45.0, "net_pnl": 4309.09, "total_trades": 111, "tp_exits": 30, "sl_exits": 23, "eod_exits": 58, "strategy": "vol"}, "status": "keep", "description": "vol tf=5 mult=1.5 avg=10 SL=1.5 TP=2.0", "timestamp": 1785881010, "segment": 0, "session": "newgen-bb-short-vol"}
{"run": 564, "commit": "b63ee0a", "metric": 0.6566, "metrics": {"win_rate": 27.2, "net_pnl": -7693.57, "total_trades": 81, "tp_exits": 13, "sl_exits": 33, "eod_exits": 35, "strategy": "vol"}, "status": "discard", "description": "vol tf=15 mult=1.5 avg=10 SL=1.0 TP=2.0", "timestamp": 1785881010, "segment": 0, "session": "newgen-bb-short-vol"}
{"run": 565, "commit": "b63ee0a", "metric": 1.1194, "metrics": {"win_rate": 54.8, "net_pnl": 921.78, "total_trades": 31, "tp_exits": 0, "sl_exits": 3, "eod_exits": 28, "strategy": "bb"}, "status": "keep", "description": "bb:bounce tf=15 p=20 std=2.5 SL=2.0 TP=3.0 [perturb of run13]", "timestamp": 1785881023, "segment": 0, "session": "newgen-bb-short-vol"}
{"run": 566, "commit": "b63ee0a", "metric": 2.2752, "metrics": {"win_rate": 57.9, "net_pnl": 3375.86, "total_trades": 19, "tp_exits": 1, "sl_exits": 1, "eod_exits": 17, "strategy": "short"}, "status": "keep", "description": "short:breakout_fail tf=5 SL=2.0 TP=4.5 [perturb of run22]", "timestamp": 1785881024, "segment": 0, "session": "newgen-bb-short-vol"}
{"run": 567, "commit": "b63ee0a", "metric": 1.9525, "metrics": {"win_rate": 57.9, "net_pnl": 2521.48, "total_trades": 19, "tp_exits": 1, "sl_exits": 1, "eod_exits": 17, "strategy": "short"}, "status": "keep", "description": "short:breakout_fail tf=5 SL=2.0 TP=3.0 buf=0.5 [perturb of run22]", "timestamp": 1785881025, "segment": 0, "session": "newgen-bb-short-vol"}
{"run": 568, "commit": "b63ee0a", "metric": 0.9683, "metrics": {"win_rate": 40.2, "net_pnl": -870.52, "total_trades": 97, "tp_exits": 23, "sl_exits": 22, "eod_exits": 52, "strategy": "vol"}, "status": "keep", "description": "vol tf=5 mult=2.0 avg=10 SL=1.5 TP=2.0 [perturb of run36]", "timestamp": 1785881025, "segment": 0, "session": "newgen-bb-short-vol"}
{"run": 569, "commit": "b63ee0a", "metric": 1.2408, "metrics": {"win_rate": 65.0, "net_pnl": 1098.44, "total_trades": 20, "tp_exits": 1, "sl_exits": 3, "eod_exits": 16, "strategy": "short"}, "status": "keep", "description": "short:breakout_fail tf=5 SL=2.0 TP=4.5 piv=fib [perturb of run39]", "timestamp": 1785881039, "segment": 0, "session": "newgen-bb-short-vol"}
{"run": 570, "commit": "b63ee0a", "metric": 0.8725, "metrics": {"win_rate": 41.0, "net_pnl": -4644.81, "total_trades": 144, "tp_exits": 41, "sl_exits": 54, "eod_exits": 49, "strategy": "vol"}, "status": "discard", "description": "vol tf=5 mult=1.5 avg=10 SL=1.0 TP=1.5 [family check]", "timestamp": 1785881040, "segment": 0, "session": "newgen-bb-short-vol"}
