{"run": 253, "commit": "b63ee0a", "metric": 5.0968, "metrics": {"win_rate": 30.8, "net_pnl": 8652.73, "total_trades": 13, "tp_exits": 2, "sl_exits": 2, "eod_exits": 9}, "status": "keep", "description": "EOD sweep: EOD=795 (13:15)", "timestamp": 1785880867, "segment": 0, "session": "newgen-orb-15m"}
{"run": 254, "commit": "b63ee0a", "metric": 5.9452, "metrics": {"win_rate": 41.7, "net_pnl": 9452.86, "total_trades": 12, "tp_exits": 2, "sl_exits": 2, "eod_exits": 8}, "status": "keep", "description": "EOD sweep: EOD=780 (13:00)", "timestamp": 1785880868, "segment": 0, "session": "newgen-orb-15m"}
{"run": 255, "commit": "b63ee0a", "metric": 5.7014, "metrics": {"win_rate": 35.7, "net_pnl": 9910.73, "total_trades": 14, "tp_exits": 2, "sl_exits": 2, "eod_exits": 10}, "status": "discard", "description": "EOD sweep: EOD=810 PF5.701<5.945", "timestamp": 1785880880, "segment": 0, "session": "newgen-orb-15m"}
{"run": 256, "commit": "b63ee0a", "metric": 5.1778, "metrics": {"win_rate": 41.7, "net_pnl": 7516.14, "total_trades": 12, "tp_exits": 1, "sl_exits": 2, "eod_exits": 9}, "status": "keep", "description": "EOD sweep: EOD=765 (12:45)", "timestamp": 1785880881, "segment": 0, "session": "newgen-orb-15m"}
{"run": 257, "commit": "b63ee0a", "metric": 4.7343, "metrics": {"win_rate": 36.4, "net_pnl": 6452.9, "total_trades": 11, "tp_exits": 1, "sl_exits": 1, "eod_exits": 9}, "status": "keep", "description": "EOD sweep: EOD=750 (12:30)", "timestamp": 1785880882, "segment": 0, "session": "newgen-orb-15m"}
{"run": 258, "commit": "b63ee0a", "metric": 5.0968, "metrics": {"win_rate": 30.8, "net_pnl": 8652.73, "total_trades": 13, "tp_exits": 2, "sl_exits": 2, "eod_exits": 9}, "status": "discard", "description": "EOD sweep: EOD=795 PF5.097<5.945", "timestamp": 1785880883, "segment": 0, "session": "newgen-orb-15m"}
{"run": 259, "commit": "b63ee0a", "metric": 5.1778, "metrics": {"win_rate": 41.7, "net_pnl": 7516.14, "total_trades": 12, "tp_exits": 1, "sl_exits": 2, "eod_exits": 9}, "status": "discard", "description": "EOD sweep: EOD=765 PF5.178<5.945", "timestamp": 1785880896, "segment": 0, "session": "newgen-orb-15m"}
{"run": 260, "commit": "b63ee0a", "metric": 3.0071, "metrics": {"win_rate": 47.1, "net_pnl": 6384.1, "total_trades": 17, "tp_exits": 6, "sl_exits": 4, "eod_exits": 7}, "status": "keep", "description": "TP sens @EOD780: TP=3.0", "timestamp": 1785880898, "segment": 0, "session": "newgen-orb-15m"}
{"run": 261, "commit": "b63ee0a", "metric": 5.2625, "metrics": {"win_rate": 36.4, "net_pnl": 8147.88, "total_trades": 11, "tp_exits": 0, "sl_exits": 2, "eod_exits": 9}, "status": "keep", "description": "TP sens @EOD780: TP=99 (pure EOD exit)", "timestamp": 1785880899, "segment": 0, "session": "newgen-orb-15m"}
{"run": 262, "commit": "b63ee0a", "metric": 4.7343, "metrics": {"win_rate": 36.4, "net_pnl": 6452.9, "total_trades": 11, "tp_exits": 1, "sl_exits": 1, "eod_exits": 9}, "status": "discard", "description": "EOD sweep: EOD=750 PF4.734<5.945", "timestamp": 1785880900, "segment": 0, "session": "newgen-orb-15m"}
{"run": 263, "commit": "b63ee0a", "metric": 3.0071, "metrics": {"win_rate": 47.1, "net_pnl": 6384.1, "total_trades": 17, "tp_exits": 6, "sl_exits": 4, "eod_exits": 7}, "status": "discard", "description": "TP sens@EOD780: TP=3.0 PF3.007<5.945", "timestamp": 1785880909, "segment": 0, "session": "newgen-orb-15m"}
{"run": 264, "commit": "b63ee0a", "metric": 5.9452, "metrics": {"win_rate": 41.7, "net_pnl": 9452.86, "total_trades": 12, "tp_exits": 2, "sl_exits": 2, "eod_exits": 8}, "status": "keep", "description": "minOR sweep: 0.2", "timestamp": 1785880910, "segment": 0, "session": "newgen-orb-15m"}
{"run": 265, "commit": "b63ee0a", "metric": 5.9452, "metrics": {"win_rate": 41.7, "net_pnl": 9452.86, "total_trades": 12, "tp_exits": 2, "sl_exits": 2, "eod_exits": 8}, "status": "keep", "description": "minOR sweep: 0.5", "timestamp": 1785880911, "segment": 0, "session": "newgen-orb-15m"}
{"run": 266, "commit": "b63ee0a", "metric": 8.9671, "metrics": {"win_rate": 50.0, "net_pnl": 10097.05, "total_trades": 10, "tp_exits": 2, "sl_exits": 1, "eod_exits": 7}, "status": "keep", "description": "minOR sweep: 0.8", "timestamp": 1785880912, "segment": 0, "session": "newgen-orb-15m"}
{"run": 267, "commit": "b63ee0a", "metric": 5.9452, "metrics": {"win_rate": 41.7, "net_pnl": 9452.86, "total_trades": 12, "tp_exits": 2, "sl_exits": 2, "eod_exits": 8}, "status": "discard", "description": "minOR sweep: 0.2/0.5 same as 0.3", "timestamp": 1785880921, "segment": 0, "session": "newgen-orb-15m"}
{"run": 268, "commit": "b63ee0a", "metric": 5.9452, "metrics": {"win_rate": 41.7, "net_pnl": 9452.86, "total_trades": 12, "tp_exits": 2, "sl_exits": 2, "eod_exits": 8}, "status": "keep", "description": "minOR sweep: 0.6", "timestamp": 1785880922, "segment": 0, "session": "newgen-orb-15m"}
{"run": 269, "commit": "b63ee0a", "metric": 8.9671, "metrics": {"win_rate": 50.0, "net_pnl": 10097.05, "total_trades": 10, "tp_exits": 2, "sl_exits": 1, "eod_exits": 7}, "status": "keep", "description": "minOR sweep: 0.7", "timestamp": 1785880924, "segment": 0, "session": "newgen-orb-15m"}
{"run": 270, "commit": "b63ee0a", "metric": 8.9671, "metrics": {"win_rate": 50.0, "net_pnl": 10097.05, "total_trades": 10, "tp_exits": 2, "sl_exits": 1, "eod_exits": 7}, "status": "keep", "description": "minOR sweep: 1.0", "timestamp": 1785880925, "segment": 0, "session": "newgen-orb-15m"}
{"run": 271, "commit": "b63ee0a", "metric": 5.9452, "metrics": {"win_rate": 41.7, "net_pnl": 9452.86, "total_trades": 12, "tp_exits": 2, "sl_exits": 2, "eod_exits": 8}, "status": "discard", "description": "minOR sweep: 0.6 same as 0.3", "timestamp": 1785880936, "segment": 0, "session": "newgen-orb-15m"}
{"run": 272, "commit": "b63ee0a", "metric": 8.9671, "metrics": {"win_rate": 50.0, "net_pnl": 10097.05, "total_trades": 10, "tp_exits": 2, "sl_exits": 1, "eod_exits": 7}, "status": "keep", "description": "minOR sweep: 1.2", "timestamp": 1785880937, "segment": 0, "session": "newgen-orb-15m"}
{"run": 273, "commit": "b63ee0a", "metric": 24.2554, "metrics": {"win_rate": 83.3, "net_pnl": 10895.87, "total_trades": 6, "tp_exits": 2, "sl_exits": 0, "eod_exits": 4}, "status": "keep", "description": "minOR sweep: 1.5", "timestamp": 1785880938, "segment": 0, "session": "newgen-orb-15m"}
{"run": 274, "commit": "b63ee0a", "metric": 8.9671, "metrics": {"win_rate": 50.0, "net_pnl": 10097.05, "total_trades": 10, "tp_exits": 2, "sl_exits": 1, "eod_exits": 7}, "status": "discard", "description": "minOR sweep: 1.0 dup of 0.7-0.8", "timestamp": 1785880938, "segment": 0, "session": "newgen-orb-15m"}
{"run": 275, "commit": "b63ee0a", "metric": 24.2554, "metrics": {"win_rate": 83.3, "net_pnl": 10895.87, "total_trades": 6, "tp_exits": 2, "sl_exits": 0, "eod_exits": 4}, "status": "discard", "description": "minOR=1.5 PF24.3 but only 6 trades UNRELIABLE", "timestamp": 1785880948, "segment": 0, "session": "newgen-orb-15m"}
{"run": 276, "commit": "b63ee0a", "metric": 2.5127, "metrics": {"win_rate": 46.2, "net_pnl": 7341.68, "total_trades": 26, "tp_exits": 2, "sl_exits": 7, "eod_exits": 17}, "status": "keep", "description": "shorts ON @best minOR0.8", "timestamp": 1785880949, "segment": 0, "session": "newgen-orb-15m"}
{"run": 277, "commit": "b63ee0a", "metric": 2.2182, "metrics": {"win_rate": 42.9, "net_pnl": 6697.49, "total_trades": 28, "tp_exits": 2, "sl_exits": 8, "eod_exits": 18}, "status": "keep", "description": "shorts ON @minOR0.3 (more trades)", "timestamp": 1785880950, "segment": 0, "session": "newgen-orb-15m"}
{"run": 278, "commit": "b63ee0a", "metric": 8.9671, "metrics": {"win_rate": 50.0, "net_pnl": 10097.05, "total_trades": 10, "tp_exits": 2, "sl_exits": 1, "eod_exits": 7}, "status": "discard", "description": "minOR=1.2 dup of 0.8", "timestamp": 1785880951, "segment": 0, "session": "newgen-orb-15m"}
{"run": 279, "commit": "b63ee0a", "metric": 2.5127, "metrics": {"win_rate": 46.2, "net_pnl": 7341.68, "total_trades": 26, "tp_exits": 2, "sl_exits": 7, "eod_exits": 17}, "status": "discard", "description": "shorts@0.8 PF2.51 worse, shorts hurt", "timestamp": 1785880965, "segment": 0, "session": "newgen-orb-15m"}
{"run": 280, "commit": "b63ee0a", "metric": 4.3107, "metrics": {"win_rate": 38.5, "net_pnl": 8824.1, "total_trades": 13, "tp_exits": 2, "sl_exits": 4, "eod_exits": 7}, "status": "keep", "description": "robust: SL=0.75", "timestamp": 1785880966, "segment": 0, "session": "newgen-orb-15m"}
{"run": 281, "commit": "b63ee0a", "metric": 9.9137, "metrics": {"win_rate": 50.0, "net_pnl": 10218.07, "total_trades": 10, "tp_exits": 2, "sl_exits": 0, "eod_exits": 8}, "status": "keep", "description": "robust: SL=1.25", "timestamp": 1785880967, "segment": 0, "session": "newgen-orb-15m"}
{"run": 282, "commit": "b63ee0a", "metric": 2.2182, "metrics": {"win_rate": 42.9, "net_pnl": 6697.49, "total_trades": 28, "tp_exits": 2, "sl_exits": 8, "eod_exits": 18}, "status": "discard", "description": "shorts@0.3 PF2.22 worse", "timestamp": 1785880968, "segment": 0, "session": "newgen-orb-15m"}
{"run": 283, "commit": "b63ee0a", "metric": 4.3107, "metrics": {"win_rate": 38.5, "net_pnl": 8824.1, "total_trades": 13, "tp_exits": 2, "sl_exits": 4, "eod_exits": 7}, "status": "discard", "description": "robust SL=0.75 PF4.31 worse", "timestamp": 1785880975, "segment": 0, "session": "newgen-orb-15m"}
{"run": 284, "commit": "b63ee0a", "metric": 9.9137, "metrics": {"win_rate": 50.0, "net_pnl": 10218.07, "total_trades": 10, "tp_exits": 2, "sl_exits": 0, "eod_exits": 8}, "status": "keep", "description": "robust: SL=1.5", "timestamp": 1785880977, "segment": 0, "session": "newgen-orb-15m"}
{"run": 285, "commit": "b63ee0a", "metric": 9.9137, "metrics": {"win_rate": 50.0, "net_pnl": 10218.07, "total_trades": 10, "tp_exits": 2, "sl_exits": 0, "eod_exits": 8}, "status": "keep", "description": "robust: SL=2.0", "timestamp": 1785880978, "segment": 0, "session": "newgen-orb-15m"}
{"run": 286, "commit": "b63ee0a", "metric": 9.9137, "metrics": {"win_rate": 50.0, "net_pnl": 10218.07, "total_trades": 10, "tp_exits": 2, "sl_exits": 0, "eod_exits": 8}, "status": "discard", "description": "robust SL=1.5 dup of 1.25", "timestamp": 1785880990, "segment": 0, "session": "newgen-orb-15m"}
{"run": 287, "commit": "b63ee0a", "metric": 5.9385, "metrics": {"win_rate": 45.5, "net_pnl": 9450.73, "total_trades": 11, "tp_exits": 2, "sl_exits": 1, "eod_exits": 8}, "status": "keep", "description": "robust: BUF=0.5 SL=1.25", "timestamp": 1785880991, "segment": 0, "session": "newgen-orb-15m"}
{"run": 288, "commit": "b63ee0a", "metric": 9.2568, "metrics": {"win_rate": 50.0, "net_pnl": 9465.01, "total_trades": 10, "tp_exits": 1, "sl_exits": 0, "eod_exits": 9}, "status": "keep", "description": "robust: BUF=0.7 SL=1.25", "timestamp": 1785880992, "segment": 0, "session": "newgen-orb-15m"}
{"run": 289, "commit": "b63ee0a", "metric": 9.9137, "metrics": {"win_rate": 50.0, "net_pnl": 10218.07, "total_trades": 10, "tp_exits": 2, "sl_exits": 0, "eod_exits": 8}, "status": "discard", "description": "robust SL=2.0 dup of 1.25", "timestamp": 1785880994, "segment": 0, "session": "newgen-orb-15m"}
{"run": 290, "commit": "b63ee0a", "metric": 5.9385, "metrics": {"win_rate": 45.5, "net_pnl": 9450.73, "total_trades": 11, "tp_exits": 2, "sl_exits": 1, "eod_exits": 8}, "status": "discard", "description": "robust BUF=0.5 PF5.94 worse", "timestamp": 1785881002, "segment": 0, "session": "newgen-orb-15m"}
{"run": 291, "commit": "b63ee0a", "metric": 9.9137, "metrics": {"win_rate": 50.0, "net_pnl": 10218.07, "total_trades": 10, "tp_exits": 2, "sl_exits": 0, "eod_exits": 8}, "status": "keep", "description": "robust: EOD=770", "timestamp": 1785881003, "segment": 0, "session": "newgen-orb-15m"}
{"run": 292, "commit": "b63ee0a", "metric": 8.4681, "metrics": {"win_rate": 40.0, "net_pnl": 9493.56, "total_trades": 10, "tp_exits": 2, "sl_exits": 0, "eod_exits": 8}, "status": "keep", "description": "robust: EOD=790", "timestamp": 1785881004, "segment": 0, "session": "newgen-orb-15m"}
{"run": 293, "commit": "b63ee0a", "metric": 9.2568, "metrics": {"win_rate": 50.0, "net_pnl": 9465.01, "total_trades": 10, "tp_exits": 1, "sl_exits": 0, "eod_exits": 9}, "status": "discard", "description": "robust BUF=0.7 PF9.26<9.91", "timestamp": 1785881005, "segment": 0, "session": "newgen-orb-15m"}
{"run": 294, "commit": "b63ee0a", "metric": 9.9137, "metrics": {"win_rate": 50.0, "net_pnl": 10218.07, "total_trades": 10, "tp_exits": 2, "sl_exits": 0, "eod_exits": 8}, "status": "discard", "description": "robust EOD=770 same as 780", "timestamp": 1785881011, "segment": 0, "session": "newgen-orb-15m"}
{"run": 295, "commit": "b63ee0a", "metric": 9.4828, "metrics": {"win_rate": 50.0, "net_pnl": 9724.12, "total_trades": 10, "tp_exits": 2, "sl_exits": 0, "eod_exits": 8}, "status": "keep", "description": "robust: TP=8.0 SL=1.25", "timestamp": 1785881012, "segment": 0, "session": "newgen-orb-15m"}
{"run": 296, "commit": "b63ee0a", "metric": 9.7456, "metrics": {"win_rate": 50.0, "net_pnl": 10025.29, "total_trades": 10, "tp_exits": 1, "sl_exits": 0, "eod_exits": 9}, "status": "keep", "description": "robust: TP=9.0 SL=1.25", "timestamp": 1785881013, "segment": 0, "session": "newgen-orb-15m"}
{"run": 297, "commit": "b63ee0a", "metric": 8.4681, "metrics": {"win_rate": 40.0, "net_pnl": 9493.56, "total_trades": 10, "tp_exits": 2, "sl_exits": 0, "eod_exits": 8}, "status": "discard", "description": "robust EOD=790 PF8.47<9.91", "timestamp": 1785881014, "segment": 0, "session": "newgen-orb-15m"}
{"run": 298, "commit": "b63ee0a", "metric": 9.4828, "metrics": {"win_rate": 50.0, "net_pnl": 9724.12, "total_trades": 10, "tp_exits": 2, "sl_exits": 0, "eod_exits": 8}, "status": "discard", "description": "robust TP=8.0 PF9.48<9.91", "timestamp": 1785881025, "segment": 0, "session": "newgen-orb-15m"}
{"run": 299, "commit": "b63ee0a", "metric": 9.7456, "metrics": {"win_rate": 50.0, "net_pnl": 10025.29, "total_trades": 10, "tp_exits": 1, "sl_exits": 0, "eod_exits": 9}, "status": "discard", "description": "robust TP=9.0 PF9.75<9.91", "timestamp": 1785881026, "segment": 0, "session": "newgen-orb-15m"}
{"run": 300, "commit": "b63ee0a", "metric": 0.0, "metrics": {"win_rate": 0.0, "net_pnl": -1134.31, "total_trades": 3, "tp_exits": 0, "sl_exits": 0, "eod_exits": 3}, "status": "keep", "description": "OR60 with best params (rescue attempt)", "timestamp": 1785881026, "segment": 0, "session": "newgen-orb-15m"}
{"run": 301, "commit": "b63ee0a", "metric": 0.2796, "metrics": {"win_rate": 16.7, "net_pnl": -1722.59, "total_trades": 6.0, "tp_exits": 1.0, "sl_exits": 4.0, "eod_exits": 1.0}, "status": "keep", "description": "baseline OR=15 SL=1.0 TP=1.5 buf=0.3 cd=1 no-shorts EOD=885", "timestamp": 1785880649, "segment": 0, "session": "newgen-orb-1h"}
{"run": 302, "commit": "b63ee0a", "metric": 0.2796, "metrics": {"win_rate": 16.7, "net_pnl": -1722.59, "total_trades": 6.0, "tp_exits": 1.0, "sl_exits": 4.0, "eod_exits": 1.0}, "status": "discard", "description": "OR sweep: OR=5", "timestamp": 1785880655, "segment": 0, "session": "newgen-orb-1h"}
{"run": 303, "commit": "b63ee0a", "metric": 0.2796, "metrics": {"win_rate": 16.7, "net_pnl": -1722.59, "total_trades": 6.0, "tp_exits": 1.0, "sl_exits": 4.0, "eod_exits": 1.0}, "status": "discard", "description": "OR sweep: OR=10", "timestamp": 1785880656, "segment": 0, "session": "newgen-orb-1h"}
{"run": 304, "commit": "b63ee0a", "metric": 0.2796, "metrics": {"win_rate": 16.7, "net_pnl": -1722.59, "total_trades": 6.0, "tp_exits": 1.0, "sl_exits": 4.0, "eod_exits": 1.0}, "status": "discard", "description": "OR sweep: OR=60", "timestamp": 1785880657, "segment": 0, "session": "newgen-orb-1h"}
{"run": 305, "commit": "b63ee0a", "metric": 0.3793, "metrics": {"win_rate": 14.3, "net_pnl": -1094.02, "total_trades": 7.0, "tp_exits": 1.0, "sl_exits": 6.0, "eod_exits": 0.0}, "status": "keep", "description": "SL sweep: SL=0.5", "timestamp": 1785880662, "segment": 0, "session": "newgen-orb-1h"}
{"run": 306, "commit": "b63ee0a", "metric": 0.2945, "metrics": {"win_rate": 14.3, "net_pnl": -1601.49, "total_trades": 7.0, "tp_exits": 1.0, "sl_exits": 5.0, "eod_exits": 1.0}, "status": "discard", "description": "SL sweep: SL=0.75", "timestamp": 1785880663, "segment": 0, "session": "newgen-orb-1h"}
{"run": 307, "commit": "b63ee0a", "metric": 0.2567, "metrics": {"win_rate": 20.0, "net_pnl": -1936.18, "total_trades": 5.0, "tp_exits": 1.0, "sl_exits": 3.0, "eod_exits": 1.0}, "status": "discard", "description": "SL sweep: SL=1.5", "timestamp": 1785880664, "segment": 0, "session": "newgen-orb-1h"}
{"run": 308, "commit": "b63ee0a", "metric": 0.214, "metrics": {"win_rate": 20.0, "net_pnl": -2455.51, "total_trades": 5.0, "tp_exits": 1.0, "sl_exits": 2.0, "eod_exits": 2.0}, "status": "discard", "description": "SL sweep: SL=2.0", "timestamp": 1785880665, "segment": 0, "session": "newgen-orb-1h"}
{"run": 309, "commit": "b63ee0a", "metric": 0.5661, "metrics": {"win_rate": 14.3, "net_pnl": -512.39, "total_trades": 7.0, "tp_exits": 1.0, "sl_exits": 6.0, "eod_exits": 0.0}, "status": "keep", "description": "SL refine: SL=0.3", "timestamp": 1785880673, "segment": 0, "session": "newgen-orb-1h"}
{"run": 310, "commit": "b63ee0a", "metric": 0.4543, "metrics": {"win_rate": 14.3, "net_pnl": -803.2, "total_trades": 7.0, "tp_exits": 1.0, "sl_exits": 6.0, "eod_exits": 0.0}, "status": "discard", "description": "SL refine: SL=0.4", "timestamp": 1785880674, "segment": 0, "session": "newgen-orb-1h"}
{"run": 311, "commit": "b63ee0a", "metric": 0.3256, "metrics": {"win_rate": 14.3, "net_pnl": -1384.83, "total_trades": 7.0, "tp_exits": 1.0, "sl_exits": 6.0, "eod_exits": 0.0}, "status": "discard", "description": "SL refine: SL=0.6", "timestamp": 1785880674, "segment": 0, "session": "newgen-orb-1h"}
{"run": 312, "commit": "b63ee0a", "metric": 0.7511, "metrics": {"win_rate": 14.3, "net_pnl": -221.58, "total_trades": 7.0, "tp_exits": 1.0, "sl_exits": 6.0, "eod_exits": 0.0}, "status": "keep", "description": "SL refine: SL=0.2", "timestamp": 1785880680, "segment": 0, "session": "newgen-orb-1h"}
{"run": 313, "commit": "b63ee0a", "metric": 0.6456, "metrics": {"win_rate": 14.3, "net_pnl": -366.99, "total_trades": 7.0, "tp_exits": 1.0, "sl_exits": 6.0, "eod_exits": 0.0}, "status": "discard", "description": "SL refine: SL=0.25", "timestamp": 1785880681, "segment": 0, "session": "newgen-orb-1h"}
{"run": 314, "commit": "b63ee0a", "metric": 0.8977, "metrics": {"win_rate": 14.3, "net_pnl": -76.17, "total_trades": 7.0, "tp_exits": 1.0, "sl_exits": 6.0, "eod_exits": 0.0}, "status": "keep", "description": "SL refine: SL=0.15", "timestamp": 1785880690, "segment": 0, "session": "newgen-orb-1h"}
{"run": 315, "commit": "b63ee0a", "metric": 1.1155, "metrics": {"win_rate": 14.3, "net_pnl": 69.24, "total_trades": 7.0, "tp_exits": 1.0, "sl_exits": 6.0, "eod_exits": 0.0}, "status": "keep", "description": "SL refine: SL=0.1", "timestamp": 1785880691, "segment": 0, "session": "newgen-orb-1h"}
{"run": 316, "commit": "b63ee0a", "metric": 1.2695, "metrics": {"win_rate": 14.3, "net_pnl": 141.95, "total_trades": 7.0, "tp_exits": 1.0, "sl_exits": 6.0, "eod_exits": 0.0}, "status": "keep", "description": "SL refine: SL=0.075", "timestamp": 1785880696, "segment": 0, "session": "newgen-orb-1h"}
{"run": 317, "commit": "b63ee0a", "metric": 1.4728, "metrics": {"win_rate": 14.3, "net_pnl": 214.64, "total_trades": 7.0, "tp_exits": 1.0, "sl_exits": 6.0, "eod_exits": 0.0}, "status": "keep", "description": "SL refine: SL=0.05", "timestamp": 1785880697, "segment": 0, "session": "newgen-orb-1h"}
{"run": 318, "commit": "b63ee0a", "metric": 0.9445, "metrics": {"win_rate": 14.3, "net_pnl": -25.21, "total_trades": 7.0, "tp_exits": 1.0, "sl_exits": 6.0, "eod_exits": 0.0}, "status": "discard", "description": "TP sweep @SL=0.05: TP=1.0", "timestamp": 1785880716, "segment": 0, "session": "newgen-orb-1h"}
{"run": 319, "commit": "b63ee0a", "metric": 0.0, "metrics": {"win_rate": 0.0, "net_pnl": -528.89, "total_trades": 7.0, "tp_exits": 0.0, "sl_exits": 7.0, "eod_exits": 0.0}, "status": "discard", "description": "TP sweep @SL=0.05: TP=2.0", "timestamp": 1785880717, "segment": 0, "session": "newgen-orb-1h"}
{"run": 320, "commit": "b63ee0a", "metric": 0.0, "metrics": {"win_rate": 0.0, "net_pnl": -528.89, "total_trades": 7.0, "tp_exits": 0.0, "sl_exits": 7.0, "eod_exits": 0.0}, "status": "discard", "description": "TP sweep @SL=0.05: TP=3.0", "timestamp": 1785880718, "segment": 0, "session": "newgen-orb-1h"}
{"run": 321, "commit": "b63ee0a", "metric": 0.0, "metrics": {"win_rate": 0.0, "net_pnl": -528.89, "total_trades": 7.0, "tp_exits": 0.0, "sl_exits": 7.0, "eod_exits": 0.0}, "status": "discard", "description": "TP sweep @SL=0.05: TP=4.0", "timestamp": 1785880719, "segment": 0, "session": "newgen-orb-1h"}
{"run": 322, "commit": "b63ee0a", "metric": 0.0, "metrics": {"win_rate": 0.0, "net_pnl": -383.88, "total_trades": 7.0, "tp_exits": 6.0, "sl_exits": 1.0, "eod_exits": 0.0}, "status": "discard", "description": "TP sweep @SL=0.05: TP=0 (no TP)", "timestamp": 1785880720, "segment": 0, "session": "newgen-orb-1h"}
{"run": 323, "commit": "b63ee0a", "metric": 0.7906, "metrics": {"win_rate": 8.3, "net_pnl": -177.14, "total_trades": 12.0, "tp_exits": 1.0, "sl_exits": 11.0, "eod_exits": 0.0}, "status": "discard", "description": "buffer sweep @SL=0.05/TP=1.5: buf=0.0", "timestamp": 1785880730, "segment": 0, "session": "newgen-orb-1h"}
{"run": 324, "commit": "b63ee0a", "metric": 1.7697, "metrics": {"win_rate": 16.7, "net_pnl": 290.81, "total_trades": 6.0, "tp_exits": 1.0, "sl_exits": 5.0, "eod_exits": 0.0}, "status": "keep", "description": "buffer sweep @SL=0.05/TP=1.5: buf=0.5", "timestamp": 1785880731, "segment": 0, "session": "newgen-orb-1h"}
{"run": 325, "commit": "b63ee0a", "metric": 1.4728, "metrics": {"win_rate": 14.3, "net_pnl": 214.64, "total_trades": 7.0, "tp_exits": 1.0, "sl_exits": 6.0, "eod_exits": 0.0}, "status": "discard", "description": "cooldown sweep @best: cd=0", "timestamp": 1785880732, "segment": 0, "session": "newgen-orb-1h"}
