{"run": 183, "commit": "b63ee0a", "metric": 8.237, "metrics": {"win_rate": 80.0, "net_pnl": 9886.5, "total_trades": 10.0, "tp_exits": 6.0, "sl_exits": 1.0, "eod_exits": 3.0}, "status": "discard", "description": "tuned params OR10 [or_min=10 sl=1.5 tp=3.5 buffer=1.0 cooldown=1 shorts=False eod=855 min_or_range=2.5 max_or_range=5.0]", "timestamp": 1785880881, "segment": 0, "session": "newgen-orb-10m"}
{"run": 184, "commit": "b63ee0a", "metric": 1.571, "metrics": {"win_rate": 44.4, "net_pnl": 2161.23, "total_trades": 9.0, "tp_exits": 3.0, "sl_exits": 4.0, "eod_exits": 2.0}, "status": "discard", "description": "tuned params OR15 [or_min=15 sl=1.5 tp=3.5 buffer=1.0 cooldown=1 shorts=False eod=855 min_or_range=2.5 max_or_range=5.0]", "timestamp": 1785880883, "segment": 0, "session": "newgen-orb-10m"}
{"run": 185, "commit": "b63ee0a", "metric": 0.0, "metrics": {"win_rate": 0.0, "net_pnl": -919.71, "total_trades": 1.0, "tp_exits": 0.0, "sl_exits": 1.0, "eod_exits": 0.0}, "status": "discard", "description": "tuned params OR60 [or_min=60 sl=1.5 tp=3.5 buffer=1.0 cooldown=1 shorts=False eod=855 min_or_range=2.5 max_or_range=5.0]", "timestamp": 1785880884, "segment": 0, "session": "newgen-orb-10m"}
{"run": 186, "commit": "b63ee0a", "metric": 0.9763, "metrics": {"win_rate": 44.4, "net_pnl": -155.99, "total_trades": 18.0, "tp_exits": 6.0, "sl_exits": 8.0, "eod_exits": 4.0}, "status": "discard", "description": "OR15 SL1.25 TP2 buf1 minOR0.3 [or_min=15 sl=1.25 tp=2.0 buffer=1.0 cooldown=1 shorts=False eod=855 min_or_range=0.3 max_or_range=5.0]", "timestamp": 1785880898, "segment": 0, "session": "newgen-orb-10m"}
{"run": 187, "commit": "b63ee0a", "metric": 0.0, "metrics": {"win_rate": 0.0, "net_pnl": -2315.47, "total_trades": 4.0, "tp_exits": 0.0, "sl_exits": 3.0, "eod_exits": 1.0}, "status": "discard", "description": "OR60 SL1.25 TP2 buf1 minOR0.3 [or_min=60 sl=1.25 tp=2.0 buffer=1.0 cooldown=1 shorts=False eod=855 min_or_range=0.3 max_or_range=5.0]", "timestamp": 1785880899, "segment": 0, "session": "newgen-orb-10m"}
{"run": 188, "commit": "b63ee0a", "metric": 8.237, "metrics": {"win_rate": 80.0, "net_pnl": 9886.5, "total_trades": 10.0, "tp_exits": 6.0, "sl_exits": 1.0, "eod_exits": 3.0}, "status": "discard", "description": "OR5 best config TP3.5 minOR2.5 cooldown0 [or_min=5 sl=1.5 tp=3.5 buffer=1.0 cooldown=0 shorts=False eod=855 min_or_range=2.5 max_or_range=5.0]", "timestamp": 1785880900, "segment": 0, "session": "newgen-orb-10m"}
{"run": 189, "commit": "b63ee0a", "metric": 8.237, "metrics": {"win_rate": 80.0, "net_pnl": 9886.5, "total_trades": 10.0, "tp_exits": 6.0, "sl_exits": 1.0, "eod_exits": 3.0}, "status": "discard", "description": "final best verification run [or_min=5 sl=1.5 tp=3.5 buffer=1.0 cooldown=1 shorts=False eod=855 min_or_range=2.5 max_or_range=5.0]", "timestamp": 1785880931, "segment": 0, "session": "newgen-orb-10m"}
{"run": 190, "commit": "b63ee0a", "metric": 1.1168, "metrics": {"win_rate": 43.2, "net_pnl": 1337.23, "total_trades": 44, "tp_exits": 17, "sl_exits": 18, "eod_exits": 9}, "status": "keep", "description": "baseline OR=15 SL=1.0 TP=1.5 BUF=0.3 COOLDOWN=1 SHORTS=0 EOD=900 MINOR=0.3", "timestamp": 1785880642, "segment": 0, "session": "newgen-orb-15m"}
{"run": 191, "commit": "b63ee0a", "metric": 1.1168, "metrics": {"win_rate": 43.2, "net_pnl": 1337.23, "total_trades": 44, "tp_exits": 17, "sl_exits": 18, "eod_exits": 9}, "status": "keep", "description": "OR sweep: OR=5", "timestamp": 1785880654, "segment": 0, "session": "newgen-orb-15m"}
{"run": 192, "commit": "b63ee0a", "metric": 1.1168, "metrics": {"win_rate": 43.2, "net_pnl": 1337.23, "total_trades": 44, "tp_exits": 17, "sl_exits": 18, "eod_exits": 9}, "status": "discard", "description": "OR sweep: OR=10 (aliases to 1 candle on 15m)", "timestamp": 1785880664, "segment": 0, "session": "newgen-orb-15m"}
{"run": 193, "commit": "b63ee0a", "metric": 0.3023, "metrics": {"win_rate": 15.4, "net_pnl": -3386.43, "total_trades": 13, "tp_exits": 2, "sl_exits": 8, "eod_exits": 3}, "status": "keep", "description": "OR sweep: OR=60 (4 candles)", "timestamp": 1785880665, "segment": 0, "session": "newgen-orb-15m"}
{"run": 194, "commit": "b63ee0a", "metric": 0.1476, "metrics": {"win_rate": 9.1, "net_pnl": -8447.61, "total_trades": 22, "tp_exits": 2, "sl_exits": 16, "eod_exits": 4}, "status": "keep", "description": "OR sweep: OR=30 (2 candles)", "timestamp": 1785880671, "segment": 0, "session": "newgen-orb-15m"}
{"run": 195, "commit": "b63ee0a", "metric": 0.2703, "metrics": {"win_rate": 14.3, "net_pnl": -3962.07, "total_trades": 14, "tp_exits": 2, "sl_exits": 9, "eod_exits": 3}, "status": "discard", "description": "OR sweep: OR=45 (3 candles)", "timestamp": 1785880672, "segment": 0, "session": "newgen-orb-15m"}
{"run": 196, "commit": "b63ee0a", "metric": 0.9569, "metrics": {"win_rate": 26.8, "net_pnl": -502.84, "total_trades": 56, "tp_exits": 15, "sl_exits": 36, "eod_exits": 5}, "status": "keep", "description": "SL sweep: SL=0.5", "timestamp": 1785880681, "segment": 0, "session": "newgen-orb-15m"}
{"run": 197, "commit": "b63ee0a", "metric": 1.029, "metrics": {"win_rate": 35.4, "net_pnl": 355.11, "total_trades": 48, "tp_exits": 17, "sl_exits": 25, "eod_exits": 6}, "status": "keep", "description": "SL sweep: SL=0.75", "timestamp": 1785880683, "segment": 0, "session": "newgen-orb-15m"}
{"run": 198, "commit": "b63ee0a", "metric": 0.9569, "metrics": {"win_rate": 26.8, "net_pnl": -502.84, "total_trades": 56, "tp_exits": 15, "sl_exits": 36, "eod_exits": 5}, "status": "discard", "description": "SL sweep: SL=0.5 PF0.957<1.117", "timestamp": 1785880688, "segment": 0, "session": "newgen-orb-15m"}
{"run": 199, "commit": "b63ee0a", "metric": 1.029, "metrics": {"win_rate": 35.4, "net_pnl": 355.11, "total_trades": 48, "tp_exits": 17, "sl_exits": 25, "eod_exits": 6}, "status": "discard", "description": "SL sweep: SL=0.75 PF1.029<1.117", "timestamp": 1785880690, "segment": 0, "session": "newgen-orb-15m"}
{"run": 200, "commit": "b63ee0a", "metric": 1.0638, "metrics": {"win_rate": 46.2, "net_pnl": 724.27, "total_trades": 39, "tp_exits": 16, "sl_exits": 14, "eod_exits": 9}, "status": "keep", "description": "SL sweep: SL=1.25", "timestamp": 1785880691, "segment": 0, "session": "newgen-orb-15m"}
{"run": 201, "commit": "b63ee0a", "metric": 1.0965, "metrics": {"win_rate": 48.6, "net_pnl": 994.65, "total_trades": 35, "tp_exits": 15, "sl_exits": 10, "eod_exits": 10}, "status": "keep", "description": "SL sweep: SL=1.5", "timestamp": 1785880692, "segment": 0, "session": "newgen-orb-15m"}
{"run": 202, "commit": "b63ee0a", "metric": 1.0638, "metrics": {"win_rate": 46.2, "net_pnl": 724.27, "total_trades": 39, "tp_exits": 16, "sl_exits": 14, "eod_exits": 9}, "status": "discard", "description": "SL sweep: SL=1.25 PF1.064<1.117", "timestamp": 1785880700, "segment": 0, "session": "newgen-orb-15m"}
{"run": 203, "commit": "b63ee0a", "metric": 1.0965, "metrics": {"win_rate": 48.6, "net_pnl": 994.65, "total_trades": 35, "tp_exits": 15, "sl_exits": 10, "eod_exits": 10}, "status": "discard", "description": "SL sweep: SL=1.5 PF1.096<1.117", "timestamp": 1785880701, "segment": 0, "session": "newgen-orb-15m"}
{"run": 204, "commit": "b63ee0a", "metric": 1.1287, "metrics": {"win_rate": 53.1, "net_pnl": 1356.04, "total_trades": 49, "tp_exits": 25, "sl_exits": 16, "eod_exits": 8}, "status": "keep", "description": "TP sweep: TP=1.0", "timestamp": 1785880702, "segment": 0, "session": "newgen-orb-15m"}
{"run": 205, "commit": "b63ee0a", "metric": 1.038, "metrics": {"win_rate": 35.0, "net_pnl": 448.51, "total_trades": 40, "tp_exits": 12, "sl_exits": 19, "eod_exits": 9}, "status": "keep", "description": "TP sweep: TP=2.0", "timestamp": 1785880703, "segment": 0, "session": "newgen-orb-15m"}
{"run": 206, "commit": "b63ee0a", "metric": 1.038, "metrics": {"win_rate": 35.0, "net_pnl": 448.51, "total_trades": 40, "tp_exits": 12, "sl_exits": 19, "eod_exits": 9}, "status": "discard", "description": "TP sweep: TP=2.0 PF1.038<1.129", "timestamp": 1785880709, "segment": 0, "session": "newgen-orb-15m"}
{"run": 207, "commit": "b63ee0a", "metric": 1.3777, "metrics": {"win_rate": 34.4, "net_pnl": 3503.52, "total_trades": 32, "tp_exits": 7, "sl_exits": 15, "eod_exits": 10}, "status": "keep", "description": "TP sweep: TP=3.0", "timestamp": 1785880710, "segment": 0, "session": "newgen-orb-15m"}
{"run": 208, "commit": "b63ee0a", "metric": 0.0, "metrics": {"win_rate": 0.0, "net_pnl": -6570.13, "total_trades": 102, "tp_exits": 100, "sl_exits": 2, "eod_exits": 0}, "status": "keep", "description": "TP sweep: TP=0 (no TP)", "timestamp": 1785880711, "segment": 0, "session": "newgen-orb-15m"}
{"run": 209, "commit": "b63ee0a", "metric": 0.0, "metrics": {"win_rate": 0.0, "net_pnl": -6570.13, "total_trades": 102, "tp_exits": 100, "sl_exits": 2, "eod_exits": 0}, "status": "discard", "description": "TP sweep: TP=3.0 PF1.378>1.129 keep; TP=0 degenerate instant-exit", "timestamp": 1785880718, "segment": 0, "session": "newgen-orb-15m"}
{"run": 210, "commit": "b63ee0a", "metric": 1.1667, "metrics": {"win_rate": 34.3, "net_pnl": 1732.33, "total_trades": 35, "tp_exits": 8, "sl_exits": 17, "eod_exits": 10}, "status": "keep", "description": "TP sweep: TP=2.5", "timestamp": 1785880719, "segment": 0, "session": "newgen-orb-15m"}
{"run": 211, "commit": "b63ee0a", "metric": 1.5632, "metrics": {"win_rate": 32.3, "net_pnl": 5224.41, "total_trades": 31, "tp_exits": 6, "sl_exits": 15, "eod_exits": 10}, "status": "keep", "description": "TP sweep: TP=4.0", "timestamp": 1785880720, "segment": 0, "session": "newgen-orb-15m"}
{"run": 212, "commit": "b63ee0a", "metric": 1.1667, "metrics": {"win_rate": 34.3, "net_pnl": 1732.33, "total_trades": 35, "tp_exits": 8, "sl_exits": 17, "eod_exits": 10}, "status": "discard", "description": "TP sweep: TP=2.5 PF1.167<1.563", "timestamp": 1785880728, "segment": 0, "session": "newgen-orb-15m"}
{"run": 213, "commit": "b63ee0a", "metric": 1.5731, "metrics": {"win_rate": 34.4, "net_pnl": 5315.79, "total_trades": 32, "tp_exits": 7, "sl_exits": 15, "eod_exits": 10}, "status": "keep", "description": "TP sweep: TP=3.5", "timestamp": 1785880729, "segment": 0, "session": "newgen-orb-15m"}
{"run": 214, "commit": "b63ee0a", "metric": 1.5238, "metrics": {"win_rate": 30.0, "net_pnl": 4897.92, "total_trades": 30, "tp_exits": 5, "sl_exits": 15, "eod_exits": 10}, "status": "keep", "description": "TP sweep: TP=5.0", "timestamp": 1785880730, "segment": 0, "session": "newgen-orb-15m"}
{"run": 215, "commit": "b63ee0a", "metric": 1.9259, "metrics": {"win_rate": 29.2, "net_pnl": 6471.54, "total_trades": 24, "tp_exits": 4, "sl_exits": 11, "eod_exits": 9}, "status": "keep", "description": "TP sweep: TP=6.0", "timestamp": 1785880731, "segment": 0, "session": "newgen-orb-15m"}
{"run": 216, "commit": "b63ee0a", "metric": 1.5238, "metrics": {"win_rate": 30.0, "net_pnl": 4897.92, "total_trades": 30, "tp_exits": 5, "sl_exits": 15, "eod_exits": 10}, "status": "discard", "description": "TP sweep: TP=5.0 PF1.524<1.926", "timestamp": 1785880740, "segment": 0, "session": "newgen-orb-15m"}
{"run": 217, "commit": "b63ee0a", "metric": 2.012, "metrics": {"win_rate": 27.3, "net_pnl": 6414.05, "total_trades": 22, "tp_exits": 2, "sl_exits": 10, "eod_exits": 10}, "status": "keep", "description": "TP sweep: TP=7.0", "timestamp": 1785880742, "segment": 0, "session": "newgen-orb-15m"}
{"run": 218, "commit": "b63ee0a", "metric": 2.2215, "metrics": {"win_rate": 27.3, "net_pnl": 7742.1, "total_trades": 22, "tp_exits": 2, "sl_exits": 10, "eod_exits": 10}, "status": "keep", "description": "TP sweep: TP=8.0", "timestamp": 1785880743, "segment": 0, "session": "newgen-orb-15m"}
{"run": 219, "commit": "b63ee0a", "metric": 1.398, "metrics": {"win_rate": 24.0, "net_pnl": 3228.21, "total_trades": 25, "tp_exits": 2, "sl_exits": 13, "eod_exits": 10}, "status": "keep", "description": "TP sweep: TP=10.0", "timestamp": 1785880744, "segment": 0, "session": "newgen-orb-15m"}
{"run": 220, "commit": "b63ee0a", "metric": 2.012, "metrics": {"win_rate": 27.3, "net_pnl": 6414.05, "total_trades": 22, "tp_exits": 2, "sl_exits": 10, "eod_exits": 10}, "status": "discard", "description": "TP sweep: TP=7.0 PF2.012<2.222", "timestamp": 1785880753, "segment": 0, "session": "newgen-orb-15m"}
{"run": 221, "commit": "b63ee0a", "metric": 2.2995, "metrics": {"win_rate": 27.3, "net_pnl": 8236.06, "total_trades": 22, "tp_exits": 2, "sl_exits": 10, "eod_exits": 10}, "status": "keep", "description": "TP sweep: TP=8.5", "timestamp": 1785880754, "segment": 0, "session": "newgen-orb-15m"}
{"run": 222, "commit": "b63ee0a", "metric": 1.7937, "metrics": {"win_rate": 26.1, "net_pnl": 5547.6, "total_trades": 23, "tp_exits": 2, "sl_exits": 11, "eod_exits": 10}, "status": "keep", "description": "TP sweep: TP=9.0", "timestamp": 1785880755, "segment": 0, "session": "newgen-orb-15m"}
{"run": 223, "commit": "b63ee0a", "metric": 1.398, "metrics": {"win_rate": 24.0, "net_pnl": 3228.21, "total_trades": 25, "tp_exits": 2, "sl_exits": 13, "eod_exits": 10}, "status": "discard", "description": "TP sweep: TP=10.0 PF1.398<2.222", "timestamp": 1785880757, "segment": 0, "session": "newgen-orb-15m"}
{"run": 224, "commit": "b63ee0a", "metric": 1.7937, "metrics": {"win_rate": 26.1, "net_pnl": 5547.6, "total_trades": 23, "tp_exits": 2, "sl_exits": 11, "eod_exits": 10}, "status": "discard", "description": "TP sweep: TP=9.0 PF1.794<2.300", "timestamp": 1785880763, "segment": 0, "session": "newgen-orb-15m"}
{"run": 225, "commit": "b63ee0a", "metric": 1.2012, "metrics": {"win_rate": 47.1, "net_pnl": 2449.12, "total_trades": 51, "tp_exits": 19, "sl_exits": 17, "eod_exits": 15}, "status": "keep", "description": "buffer sweep: BUF=0.0", "timestamp": 1785880764, "segment": 0, "session": "newgen-orb-15m"}
{"run": 226, "commit": "b63ee0a", "metric": 1.3616, "metrics": {"win_rate": 48.7, "net_pnl": 3395.61, "total_trades": 39, "tp_exits": 17, "sl_exits": 14, "eod_exits": 8}, "status": "keep", "description": "buffer sweep: BUF=0.5", "timestamp": 1785880765, "segment": 0, "session": "newgen-orb-15m"}
{"run": 227, "commit": "b63ee0a", "metric": 1.0388, "metrics": {"win_rate": 46.9, "net_pnl": 363.05, "total_trades": 32, "tp_exits": 13, "sl_exits": 15, "eod_exits": 4}, "status": "keep", "description": "buffer sweep: BUF=1.0", "timestamp": 1785880766, "segment": 0, "session": "newgen-orb-15m"}
{"run": 228, "commit": "b63ee0a", "metric": 2.5156, "metrics": {"win_rate": 42.3, "net_pnl": 9302.2, "total_trades": 26, "tp_exits": 2, "sl_exits": 8, "eod_exits": 16}, "status": "keep", "description": "buffer sweep@TP8.5: BUF=0.0", "timestamp": 1785880775, "segment": 0, "session": "newgen-orb-15m"}
{"run": 229, "commit": "b63ee0a", "metric": 3.0215, "metrics": {"win_rate": 33.3, "net_pnl": 9750.67, "total_trades": 18, "tp_exits": 2, "sl_exits": 7, "eod_exits": 9}, "status": "keep", "description": "buffer sweep@TP8.5: BUF=0.5", "timestamp": 1785880776, "segment": 0, "session": "newgen-orb-15m"}
{"run": 230, "commit": "b63ee0a", "metric": 1.1967, "metrics": {"win_rate": 27.8, "net_pnl": 1422.64, "total_trades": 18, "tp_exits": 2, "sl_exits": 12, "eod_exits": 4}, "status": "keep", "description": "buffer sweep@TP8.5: BUF=1.0", "timestamp": 1785880777, "segment": 0, "session": "newgen-orb-15m"}
{"run": 231, "commit": "b63ee0a", "metric": 2.5156, "metrics": {"win_rate": 42.3, "net_pnl": 9302.2, "total_trades": 26, "tp_exits": 2, "sl_exits": 8, "eod_exits": 16}, "status": "discard", "description": "buffer@TP8.5: BUF=0.0 PF2.516<3.022", "timestamp": 1785880784, "segment": 0, "session": "newgen-orb-15m"}
{"run": 232, "commit": "b63ee0a", "metric": 2.5682, "metrics": {"win_rate": 30.0, "net_pnl": 8899.25, "total_trades": 20, "tp_exits": 2, "sl_exits": 9, "eod_exits": 9}, "status": "keep", "description": "buffer@TP8.5: BUF=0.4", "timestamp": 1785880785, "segment": 0, "session": "newgen-orb-15m"}
{"run": 233, "commit": "b63ee0a", "metric": 3.1319, "metrics": {"win_rate": 31.2, "net_pnl": 9055.46, "total_trades": 16, "tp_exits": 2, "sl_exits": 6, "eod_exits": 8}, "status": "keep", "description": "buffer@TP8.5: BUF=0.6", "timestamp": 1785880787, "segment": 0, "session": "newgen-orb-15m"}
{"run": 234, "commit": "b63ee0a", "metric": 2.0625, "metrics": {"win_rate": 31.2, "net_pnl": 5666.69, "total_trades": 16, "tp_exits": 2, "sl_exits": 8, "eod_exits": 6}, "status": "keep", "description": "buffer@TP8.5: BUF=0.75", "timestamp": 1785880788, "segment": 0, "session": "newgen-orb-15m"}
{"run": 235, "commit": "b63ee0a", "metric": 2.5682, "metrics": {"win_rate": 30.0, "net_pnl": 8899.25, "total_trades": 20, "tp_exits": 2, "sl_exits": 9, "eod_exits": 9}, "status": "discard", "description": "buffer@TP8.5: BUF=0.4 PF2.568<3.132", "timestamp": 1785880797, "segment": 0, "session": "newgen-orb-15m"}
{"run": 236, "commit": "b63ee0a", "metric": 2.758, "metrics": {"win_rate": 29.4, "net_pnl": 8479.6, "total_trades": 17, "tp_exits": 2, "sl_exits": 7, "eod_exits": 8}, "status": "keep", "description": "buffer@TP8.5: BUF=0.55", "timestamp": 1785880798, "segment": 0, "session": "newgen-orb-15m"}
{"run": 237, "commit": "b63ee0a", "metric": 3.1063, "metrics": {"win_rate": 31.2, "net_pnl": 9020.44, "total_trades": 16, "tp_exits": 2, "sl_exits": 6, "eod_exits": 8}, "status": "keep", "description": "buffer@TP8.5: BUF=0.65", "timestamp": 1785880799, "segment": 0, "session": "newgen-orb-15m"}
{"run": 238, "commit": "b63ee0a", "metric": 2.0625, "metrics": {"win_rate": 31.2, "net_pnl": 5666.69, "total_trades": 16, "tp_exits": 2, "sl_exits": 8, "eod_exits": 6}, "status": "discard", "description": "buffer@TP8.5: BUF=0.75 PF2.062<3.132", "timestamp": 1785880800, "segment": 0, "session": "newgen-orb-15m"}
{"run": 239, "commit": "b63ee0a", "metric": 2.758, "metrics": {"win_rate": 29.4, "net_pnl": 8479.6, "total_trades": 17, "tp_exits": 2, "sl_exits": 7, "eod_exits": 8}, "status": "discard", "description": "buffer@TP8.5: BUF=0.55 PF2.758<3.132", "timestamp": 1785880816, "segment": 0, "session": "newgen-orb-15m"}
{"run": 240, "commit": "b63ee0a", "metric": 3.1319, "metrics": {"win_rate": 31.2, "net_pnl": 9055.46, "total_trades": 16, "tp_exits": 2, "sl_exits": 6, "eod_exits": 8}, "status": "keep", "description": "cooldown sweep: CD=0", "timestamp": 1785880817, "segment": 0, "session": "newgen-orb-15m"}
{"run": 241, "commit": "b63ee0a", "metric": 2.7148, "metrics": {"win_rate": 31.2, "net_pnl": 7344.35, "total_trades": 16, "tp_exits": 2, "sl_exits": 6, "eod_exits": 8}, "status": "keep", "description": "cooldown sweep: CD=2", "timestamp": 1785880818, "segment": 0, "session": "newgen-orb-15m"}
{"run": 242, "commit": "b63ee0a", "metric": 2.1519, "metrics": {"win_rate": 26.7, "net_pnl": 5339.33, "total_trades": 15, "tp_exits": 2, "sl_exits": 6, "eod_exits": 7}, "status": "keep", "description": "cooldown sweep: CD=3", "timestamp": 1785880819, "segment": 0, "session": "newgen-orb-15m"}
{"run": 243, "commit": "b63ee0a", "metric": 3.1319, "metrics": {"win_rate": 31.2, "net_pnl": 9055.46, "total_trades": 16, "tp_exits": 2, "sl_exits": 6, "eod_exits": 8}, "status": "discard", "description": "cooldown sweep: CD=0 same as CD=1", "timestamp": 1785880831, "segment": 0, "session": "newgen-orb-15m"}
{"run": 244, "commit": "b63ee0a", "metric": 4.1378, "metrics": {"win_rate": 46.7, "net_pnl": 8882.5, "total_trades": 15, "tp_exits": 2, "sl_exits": 5, "eod_exits": 8}, "status": "keep", "description": "EOD sweep: EOD=870 (14:30)", "timestamp": 1785880831, "segment": 0, "session": "newgen-orb-15m"}
{"run": 245, "commit": "b63ee0a", "metric": 4.4648, "metrics": {"win_rate": 53.3, "net_pnl": 10551.45, "total_trades": 15, "tp_exits": 2, "sl_exits": 5, "eod_exits": 8}, "status": "keep", "description": "EOD sweep: EOD=885 (14:45)", "timestamp": 1785880833, "segment": 0, "session": "newgen-orb-15m"}
{"run": 246, "commit": "b63ee0a", "metric": 2.7148, "metrics": {"win_rate": 31.2, "net_pnl": 7344.35, "total_trades": 16, "tp_exits": 2, "sl_exits": 6, "eod_exits": 8}, "status": "discard", "description": "cooldown sweep: CD=2 PF2.715<3.132", "timestamp": 1785880833, "segment": 0, "session": "newgen-orb-15m"}
{"run": 247, "commit": "b63ee0a", "metric": 4.1378, "metrics": {"win_rate": 46.7, "net_pnl": 8882.5, "total_trades": 15, "tp_exits": 2, "sl_exits": 5, "eod_exits": 8}, "status": "discard", "description": "EOD sweep: EOD=870 PF4.138<4.465", "timestamp": 1785880851, "segment": 0, "session": "newgen-orb-15m"}
{"run": 248, "commit": "b63ee0a", "metric": 4.3208, "metrics": {"win_rate": 46.7, "net_pnl": 9739.97, "total_trades": 15, "tp_exits": 2, "sl_exits": 4, "eod_exits": 9}, "status": "keep", "description": "EOD sweep: EOD=855 (14:15)", "timestamp": 1785880852, "segment": 0, "session": "newgen-orb-15m"}
{"run": 249, "commit": "b63ee0a", "metric": 5.3861, "metrics": {"win_rate": 50.0, "net_pnl": 10751.19, "total_trades": 14, "tp_exits": 2, "sl_exits": 2, "eod_exits": 10}, "status": "keep", "description": "EOD sweep: EOD=840 (14:00)", "timestamp": 1785880853, "segment": 0, "session": "newgen-orb-15m"}
{"run": 250, "commit": "b63ee0a", "metric": 5.5075, "metrics": {"win_rate": 42.9, "net_pnl": 10556.31, "total_trades": 14, "tp_exits": 2, "sl_exits": 2, "eod_exits": 10}, "status": "keep", "description": "EOD sweep: EOD=825 (13:45)", "timestamp": 1785880854, "segment": 0, "session": "newgen-orb-15m"}
{"run": 251, "commit": "b63ee0a", "metric": 4.3208, "metrics": {"win_rate": 46.7, "net_pnl": 9739.97, "total_trades": 15, "tp_exits": 2, "sl_exits": 4, "eod_exits": 9}, "status": "discard", "description": "EOD sweep: EOD=855 PF4.321<5.386", "timestamp": 1785880864, "segment": 0, "session": "newgen-orb-15m"}
{"run": 252, "commit": "b63ee0a", "metric": 5.7014, "metrics": {"win_rate": 35.7, "net_pnl": 9910.73, "total_trades": 14, "tp_exits": 2, "sl_exits": 2, "eod_exits": 10}, "status": "keep", "description": "EOD sweep: EOD=810 (13:30)", "timestamp": 1785880865, "segment": 0, "session": "newgen-orb-15m"}
