{"type": "config", "name": "newgen-sr", "metricName": "profit_factor", "metricUnit": "ratio", "bestDirection": "higher"}
{"run": 1, "commit": "b63ee0a", "metric": 0.473, "metrics": {"win_rate": 40.0, "net_pnl": -4536.38, "total_trades": 15, "tp_exits": 7, "sl_exits": 8, "eod_exits": 0}, "status": "keep", "description": "baseline tf=5 classic SL=2.0 TP=3.0 buffer=0.1 max_dist=5.0 min_entry=10:00 cd=30 shorts=0", "timestamp": 1785880695, "segment": 0}
{"run": 2, "commit": "b63ee0a", "metric": 0.4024, "metrics": {"win_rate": 41.7, "net_pnl": -4466.59, "total_trades": 12, "tp_exits": 5, "sl_exits": 7, "eod_exits": 0}, "status": "discard", "description": "tf=15 classic SL=2.0 TP=3.0 buffer=0.1 max_dist=5.0 min_entry=10:00 cd=30 shorts=0", "timestamp": 1785880706, "segment": 0}
{"run": 3, "commit": "b63ee0a", "metric": 0.7627, "metrics": {"win_rate": 40.0, "net_pnl": -729.54, "total_trades": 5, "tp_exits": 2, "sl_exits": 3, "eod_exits": 0}, "status": "discard", "description": "tf=60 classic SL=2.0 TP=3.0 buffer=0.1 max_dist=5.0 min_entry=10:00 cd=30 shorts=0 (only 5 trades, unreliable)", "timestamp": 1785880706, "segment": 0}
{"run": 4, "commit": "b63ee0a", "metric": 0.3454, "metrics": {"win_rate": 21.9, "net_pnl": -8662.91, "total_trades": 32, "tp_exits": 8, "sl_exits": 24, "eod_exits": 0}, "status": "discard", "description": "tf=5 SL=1.0 TP=3.0 buffer=0.1 max_dist=5.0 min_entry=10:00 cd=30", "timestamp": 1785880745, "segment": 0}
{"run": 5, "commit": "b63ee0a", "metric": 0.4604, "metrics": {"win_rate": 35.0, "net_pnl": -5422.14, "total_trades": 20, "tp_exits": 8, "sl_exits": 12, "eod_exits": 0}, "status": "discard", "description": "tf=5 SL=1.5 TP=3.0 buffer=0.1 max_dist=5.0 min_entry=10:00 cd=30", "timestamp": 1785880745, "segment": 0}
{"run": 6, "commit": "b63ee0a", "metric": 0.6039, "metrics": {"win_rate": 50.0, "net_pnl": -2669.7, "total_trades": 12, "tp_exits": 7, "sl_exits": 5, "eod_exits": 0}, "status": "discard", "description": "tf=5 SL=2.5 TP=3.0 buffer=0.1 max_dist=5.0 min_entry=10:00 cd=30", "timestamp": 1785880745, "segment": 0}
{"run": 7, "commit": "b63ee0a", "metric": 0.6235, "metrics": {"win_rate": 54.5, "net_pnl": -2458.06, "total_trades": 11, "tp_exits": 7, "sl_exits": 4, "eod_exits": 0}, "status": "discard", "description": "tf=5 SL=3.0 TP=3.0 buffer=0.1 max_dist=5.0 min_entry=10:00 cd=30", "timestamp": 1785880745, "segment": 0}
{"run": 8, "commit": "b63ee0a", "metric": 0.865, "metrics": {"win_rate": 66.7, "net_pnl": -635.2, "total_trades": 9, "tp_exits": 7, "sl_exits": 2, "eod_exits": 0}, "status": "discard", "description": "tf=5 SL=4.0 TP=3.0 buffer=0.1 max_dist=5.0 min_entry=10:00 cd=30 (9 trades, unreliable)", "timestamp": 1785880745, "segment": 0}
{"run": 9, "commit": "b63ee0a", "metric": 1.3795, "metrics": {"win_rate": 75.0, "net_pnl": 1119.87, "total_trades": 8, "tp_exits": 7, "sl_exits": 1, "eod_exits": 0}, "status": "keep", "description": "tf=5 SL=5.0 TP=3.0 buffer=0.1 max_dist=5.0 min_entry=10:00 cd=30 (8 trades, unreliable but best so far)", "timestamp": 1785880745, "segment": 0}
{"run": 10, "commit": "b63ee0a", "metric": 1.38, "metrics": {"win_rate": 75.0, "net_pnl": 1120.89, "total_trades": 8, "tp_exits": 7, "sl_exits": 1, "eod_exits": 0}, "status": "discard", "description": "tf=5 SL=5.0 TP=3.0 buffer=0.0 max_dist=5.0 min_entry=10:00 cd=30 (8 trades, unreliable)", "timestamp": 1785880784, "segment": 0}
{"run": 11, "commit": "b63ee0a", "metric": 480.6166, "metrics": {"win_rate": 85.7, "net_pnl": 3448.44, "total_trades": 7, "tp_exits": 7, "sl_exits": 0, "eod_exits": 0}, "status": "keep", "description": "tf=5 SL=5.0 TP=3.0 buffer=0.3 max_dist=5.0 min_entry=10:00 cd=30 (7 trades, unreliable but huge PF)", "timestamp": 1785880784, "segment": 0}
{"run": 12, "commit": "b63ee0a", "metric": 455.5721, "metrics": {"win_rate": 85.7, "net_pnl": 3268.37, "total_trades": 7, "tp_exits": 7, "sl_exits": 0, "eod_exits": 0}, "status": "discard", "description": "tf=5 SL=5.0 TP=3.0 buffer=0.5 max_dist=5.0 min_entry=10:00 cd=30 (7 trades, unreliable)", "timestamp": 1785880784, "segment": 0}
{"run": 13, "commit": "b63ee0a", "metric": 1.8626, "metrics": {"win_rate": 81.8, "net_pnl": 2562.86, "total_trades": 11, "tp_exits": 10, "sl_exits": 1, "eod_exits": 0}, "status": "keep", "description": "tf=5 SL=5.0 TP=3.0 buffer=0.1 max_dist=5.0 min_entry=10:00 cd=0 (11 trades, trustworthy)", "timestamp": 1785880784, "segment": 0}
{"run": 14, "commit": "b63ee0a", "metric": 1.8835, "metrics": {"win_rate": 88.9, "net_pnl": 2600.87, "total_trades": 9, "tp_exits": 8, "sl_exits": 1, "eod_exits": 0}, "status": "discard", "description": "tf=5 SL=5.0 TP=3.0 buffer=0.1 max_dist=5.0 min_entry=10:00 cd=15 (9 trades, unreliable)", "timestamp": 1785880784, "segment": 0}
{"run": 15, "commit": "b63ee0a", "metric": 180.832, "metrics": {"win_rate": 90.0, "net_pnl": 4891.43, "total_trades": 10, "tp_exits": 10, "sl_exits": 0, "eod_exits": 0}, "status": "keep", "description": "tf=5 SL=5.0 TP=3.0 buffer=0.3 max_dist=5.0 min_entry=10:00 cd=0 (10 trades, trustworthy, BEST)", "timestamp": 1785880791, "segment": 0}
{"run": 16, "commit": "b63ee0a", "metric": 174.2118, "metrics": {"win_rate": 90.0, "net_pnl": 4711.36, "total_trades": 10, "tp_exits": 10, "sl_exits": 0, "eod_exits": 0}, "status": "keep", "description": "tf=5 SL=5.0 TP=3.0 buffer=0.5 max_dist=5.0 min_entry=10:00 cd=0 (10 trades)", "timestamp": 1785880791, "segment": 0}
{"run": 17, "commit": "b63ee0a", "metric": 99.9999, "metrics": {"win_rate": 100.0, "net_pnl": 4929.44, "total_trades": 8, "tp_exits": 8, "sl_exits": 0, "eod_exits": 0}, "status": "discard", "description": "tf=5 SL=5.0 TP=3.0 buffer=0.3 max_dist=5.0 min_entry=10:00 cd=15 (8 trades, 100% WR, unreliable)", "timestamp": 1785880791, "segment": 0}
{"run": 18, "commit": "b63ee0a", "metric": 1.8633, "metrics": {"win_rate": 81.8, "net_pnl": 2563.88, "total_trades": 11, "tp_exits": 10, "sl_exits": 1, "eod_exits": 0}, "status": "discard", "description": "tf=5 SL=5.0 TP=3.0 buffer=0.0 max_dist=5.0 min_entry=10:00 cd=0 (11 trades, PF similar to run13)", "timestamp": 1785880791, "segment": 0}
{"run": 19, "commit": "b63ee0a", "metric": 155.1831, "metrics": {"win_rate": 90.0, "net_pnl": 4193.78, "total_trades": 10, "tp_exits": 10, "sl_exits": 0, "eod_exits": 0}, "status": "discard", "description": "TP sweep: SL=5.0 TP=1.5 buffer=0.3 cd=0 (worse than TP=3.0)", "timestamp": 1785880878, "segment": 0}
{"run": 20, "commit": "b63ee0a", "metric": 163.7327, "metrics": {"win_rate": 90.0, "net_pnl": 4426.33, "total_trades": 10, "tp_exits": 10, "sl_exits": 0, "eod_exits": 0}, "status": "discard", "description": "TP sweep: SL=5.0 TP=2.0 buffer=0.3 cd=0", "timestamp": 1785880878, "segment": 0}
{"run": 21, "commit": "b63ee0a", "metric": 197.9313, "metrics": {"win_rate": 90.0, "net_pnl": 5356.53, "total_trades": 10, "tp_exits": 10, "sl_exits": 0, "eod_exits": 0}, "status": "discard", "description": "TP sweep: SL=5.0 TP=4.0 buffer=0.3 cd=0", "timestamp": 1785880878, "segment": 0}
{"run": 22, "commit": "b63ee0a", "metric": 215.0309, "metrics": {"win_rate": 90.0, "net_pnl": 5821.64, "total_trades": 10, "tp_exits": 10, "sl_exits": 0, "eod_exits": 0}, "status": "discard", "description": "TP sweep: SL=5.0 TP=5.0 buffer=0.3 cd=0", "timestamp": 1785880878, "segment": 0}
{"run": 23, "commit": "b63ee0a", "metric": 300.5276, "metrics": {"win_rate": 90.0, "net_pnl": 8147.15, "total_trades": 10, "tp_exits": 10, "sl_exits": 0, "eod_exits": 0}, "status": "keep", "description": "TP sweep: SL=5.0 TP=10.0 buffer=0.3 cd=0 (monotone TP; R2 caps most, one +10% run)", "timestamp": 1785880879, "segment": 0}
{"run": 24, "commit": "b63ee0a", "metric": 153.5931, "metrics": {"win_rate": 90.0, "net_pnl": 4150.53, "total_trades": 10, "tp_exits": 10, "sl_exits": 0, "eod_exits": 0}, "status": "discard", "description": "max_dist sweep: SL=5.0 TP=3.0 buffer=0.3 cd=0 max_dist=2.0", "timestamp": 1785880885, "segment": 0}
{"run": 25, "commit": "b63ee0a", "metric": 400.079, "metrics": {"win_rate": 92.9, "net_pnl": 10854.95, "total_trades": 14, "tp_exits": 14, "sl_exits": 0, "eod_exits": 0}, "status": "keep", "description": "max_dist sweep: SL=5.0 TP=3.0 buffer=0.3 cd=0 max_dist=8.0 (14 trades, BEST)", "timestamp": 1785880885, "segment": 0}
{"run": 26, "commit": "b63ee0a", "metric": 401.1529, "metrics": {"win_rate": 92.9, "net_pnl": 10884.16, "total_trades": 14, "tp_exits": 14, "sl_exits": 0, "eod_exits": 0}, "status": "keep", "description": "max_dist sweep: max_dist=10.0-20.0 plateau (14 trades, PF~401)", "timestamp": 1785880885, "segment": 0}
{"run": 27, "commit": "b63ee0a", "metric": 201.99, "metrics": {"win_rate": 90.9, "net_pnl": 5466.93, "total_trades": 11, "tp_exits": 11, "sl_exits": 0, "eod_exits": 0}, "status": "discard", "description": "min_entry sweep: min_entry=9:45 (11 trades, PF lower than 10:00)", "timestamp": 1785880885, "segment": 0}
{"run": 28, "commit": "b63ee0a", "metric": 154.8833, "metrics": {"win_rate": 83.3, "net_pnl": 4185.63, "total_trades": 6, "tp_exits": 6, "sl_exits": 0, "eod_exits": 0}, "status": "discard", "description": "min_entry sweep: min_entry=10:30 (6 trades, fewer)", "timestamp": 1785880885, "segment": 0}
{"run": 29, "commit": "b63ee0a", "metric": 3.3491, "metrics": {"win_rate": 83.3, "net_pnl": 6922.48, "total_trades": 12, "tp_exits": 11, "sl_exits": 1, "eod_exits": 0}, "status": "discard", "description": "pivot sweep: fibonacci tf5 SL=5.0 TP=3.0 buffer=0.3 cd=0 max_dist=10 (PF much lower than classic)", "timestamp": 1785880925, "segment": 0}
{"run": 30, "commit": "b63ee0a", "metric": 99.9999, "metrics": {"win_rate": 100.0, "net_pnl": 8752.77, "total_trades": 11, "tp_exits": 11, "sl_exits": 0, "eod_exits": 0}, "status": "keep", "description": "tf sweep: classic tf15 SL=5.0 TP=3.0 buffer=0.3 cd=0 max_dist=10 (11 trades, 100% WR)", "timestamp": 1785880925, "segment": 0}
{"run": 31, "commit": "b63ee0a", "metric": 99.9999, "metrics": {"win_rate": 100.0, "net_pnl": 5243.64, "total_trades": 4, "tp_exits": 4, "sl_exits": 0, "eod_exits": 0}, "status": "discard", "description": "tf sweep: classic tf60 SL=5.0 TP=3.0 buffer=0.3 cd=0 max_dist=10 (4 trades, unreliable)", "timestamp": 1785880925, "segment": 0}
{"run": 32, "commit": "b63ee0a", "metric": 181.3166, "metrics": {"win_rate": 88.0, "net_pnl": 12331.25, "total_trades": 25, "tp_exits": 25, "sl_exits": 0, "eod_exits": 0}, "status": "keep", "description": "shorts=1 tf5 SL=5.0 TP=3.0 buffer=0.3 cd=0 max_dist=10 (25 trades, highest net)", "timestamp": 1785880925, "segment": 0}
{"run": 33, "commit": "b63ee0a", "metric": 92.4515, "metrics": {"win_rate": 83.3, "net_pnl": 10192.27, "total_trades": 24, "tp_exits": 24, "sl_exits": 0, "eod_exits": 0}, "status": "keep", "description": "shorts=1 tf15 SL=5.0 TP=3.0 buffer=0.3 cd=0 max_dist=10 (24 trades)", "timestamp": 1785880934, "segment": 0}
{"run": 34, "commit": "b63ee0a", "metric": 175.3225, "metrics": {"win_rate": 88.0, "net_pnl": 11921.33, "total_trades": 25, "tp_exits": 25, "sl_exits": 0, "eod_exits": 0}, "status": "keep", "description": "shorts=1 tf5 SL=5.0 TP=3.0 buffer=0.5 cd=0 max_dist=10 (robust to buffer 0.5)", "timestamp": 1785880934, "segment": 0}
{"run": 35, "commit": "b63ee0a", "metric": 4.5198, "metrics": {"win_rate": 84.6, "net_pnl": 10602.29, "total_trades": 26, "tp_exits": 25, "sl_exits": 1, "eod_exits": 0}, "status": "discard", "description": "shorts=1 tf5 SL=5.0 TP=3.0 buffer=0.1 cd=0 max_dist=10 (buffer=0.1 breaks PF -> buffer>=0.3 critical)", "timestamp": 1785880934, "segment": 0}
{"run": 36, "commit": "b63ee0a", "metric": 2.956, "metrics": {"win_rate": 84.6, "net_pnl": 5791.75, "total_trades": 13, "tp_exits": 11, "sl_exits": 2, "eod_exits": 0}, "status": "discard", "description": "tf15 SL=3.0 TP=3.0 buffer=0.3 cd=0 max_dist=10 (wide SL matters at tf15 too)", "timestamp": 1785880934, "segment": 0}
{"run": 37, "commit": "b63ee0a", "metric": 400.5471, "metrics": {"win_rate": 92.9, "net_pnl": 10867.68, "total_trades": 14, "tp_exits": 14, "sl_exits": 0, "eod_exits": 0}, "status": "keep", "description": "ROBUST: SL=4.5 buffer=0.3 cd=0 max_dist=10 (same 14 trades as best)", "timestamp": 1785880958, "segment": 0}
{"run": 38, "commit": "b63ee0a", "metric": 400.5471, "metrics": {"win_rate": 92.9, "net_pnl": 10867.68, "total_trades": 14, "tp_exits": 14, "sl_exits": 0, "eod_exits": 0}, "status": "keep", "description": "ROBUST: SL=5.5 buffer=0.3 cd=0 max_dist=10 (same as best)", "timestamp": 1785880958, "segment": 0}
{"run": 39, "commit": "b63ee0a", "metric": 400.5471, "metrics": {"win_rate": 92.9, "net_pnl": 10867.68, "total_trades": 14, "tp_exits": 14, "sl_exits": 0, "eod_exits": 0}, "status": "keep", "description": "ROBUST: buffer=0.2 SL=5.0 cd=0 max_dist=10 (same as best)", "timestamp": 1785880958, "segment": 0}
{"run": 40, "commit": "b63ee0a", "metric": 393.9268, "metrics": {"win_rate": 92.9, "net_pnl": 10687.61, "total_trades": 14, "tp_exits": 14, "sl_exits": 0, "eod_exits": 0}, "status": "keep", "description": "ROBUST: buffer=0.4 SL=5.0 cd=0 max_dist=10 (PF 394)", "timestamp": 1785880958, "segment": 0}
{"run": 41, "commit": "b63ee0a", "metric": 401.1529, "metrics": {"win_rate": 92.9, "net_pnl": 10884.16, "total_trades": 14, "tp_exits": 14, "sl_exits": 0, "eod_exits": 0}, "status": "keep", "description": "ROBUST: max_dist=12 SL=5.0 buffer=0.3 cd=0 (PF 401)", "timestamp": 1785880958, "segment": 0}
{"run": 42, "commit": "b63ee0a", "metric": 330.9447, "metrics": {"win_rate": 84.6, "net_pnl": 10515.34, "total_trades": 13, "tp_exits": 13, "sl_exits": 0, "eod_exits": 0}, "status": "keep", "description": "ROBUST: min_entry=615 SL=5.0 buffer=0.3 cd=0 max_dist=10 (PF 331, 13 trades)", "timestamp": 1785880958, "segment": 0}
