{"type":"config","name":"newgen-orb-10m","metricName":"profit_factor","metricUnit":"ratio","bestDirection":"higher"}
{"run": 1, "commit": "b63ee0a", "metric": 0.954, "metrics": {"win_rate": 38.9, "net_pnl": -486.24, "total_trades": 36.0, "tp_exits": 13.0, "sl_exits": 16.0, "eod_exits": 7.0}, "status": "keep", "description": "baseline OR15 SL1.0 TP1.5 buf0.3 cool1 shorts0 EOD900 minOR0.3 [or_min=15 sl=1.0 tp=1.5 buffer=0.3 cooldown=1 shorts=False eod=900 min_or_range=0.3 max_or_range=5.0]", "timestamp": 1785880636, "segment": 0}
{"run": 2, "commit": "b63ee0a", "metric": 1.1336, "metrics": {"win_rate": 44.4, "net_pnl": 2006.05, "total_trades": 54.0, "tp_exits": 23.0, "sl_exits": 24.0, "eod_exits": 7.0}, "status": "keep", "description": "OR sweep 5m [or_min=5 sl=1.0 tp=1.5 buffer=0.3 cooldown=1 shorts=False eod=900 min_or_range=0.3 max_or_range=5.0]", "timestamp": 1785880641, "segment": 0}
{"run": 3, "commit": "b63ee0a", "metric": 1.1336, "metrics": {"win_rate": 44.4, "net_pnl": 2006.05, "total_trades": 54.0, "tp_exits": 23.0, "sl_exits": 24.0, "eod_exits": 7.0}, "status": "discard", "description": "OR sweep 10m [or_min=10 sl=1.0 tp=1.5 buffer=0.3 cooldown=1 shorts=False eod=900 min_or_range=0.3 max_or_range=5.0]", "timestamp": 1785880642, "segment": 0}
{"run": 4, "commit": "b63ee0a", "metric": 0.4679, "metrics": {"win_rate": 27.3, "net_pnl": -1702.02, "total_trades": 11.0, "tp_exits": 2.0, "sl_exits": 5.0, "eod_exits": 4.0}, "status": "discard", "description": "OR sweep 60m [or_min=60 sl=1.0 tp=1.5 buffer=0.3 cooldown=1 shorts=False eod=900 min_or_range=0.3 max_or_range=5.0]", "timestamp": 1785880643, "segment": 0}
{"run": 5, "commit": "b63ee0a", "metric": 1.0449, "metrics": {"win_rate": 30.3, "net_pnl": 700.86, "total_trades": 76.0, "tp_exits": 22.0, "sl_exits": 48.0, "eod_exits": 6.0}, "status": "discard", "description": "SL sweep 0.5 @OR5 [or_min=5 sl=0.5 tp=1.5 buffer=0.3 cooldown=1 shorts=False eod=900 min_or_range=0.3 max_or_range=5.0]", "timestamp": 1785880654, "segment": 0}
{"run": 6, "commit": "b63ee0a", "metric": 1.0517, "metrics": {"win_rate": 38.5, "net_pnl": 838.49, "total_trades": 65.0, "tp_exits": 23.0, "sl_exits": 35.0, "eod_exits": 7.0}, "status": "discard", "description": "SL sweep 0.75 @OR5 [or_min=5 sl=0.75 tp=1.5 buffer=0.3 cooldown=1 shorts=False eod=900 min_or_range=0.3 max_or_range=5.0]", "timestamp": 1785880655, "segment": 0}
{"run": 7, "commit": "b63ee0a", "metric": 1.1823, "metrics": {"win_rate": 50.0, "net_pnl": 2524.45, "total_trades": 48.0, "tp_exits": 22.0, "sl_exits": 17.0, "eod_exits": 9.0}, "status": "keep", "description": "SL sweep 1.25 @OR5 [or_min=5 sl=1.25 tp=1.5 buffer=0.3 cooldown=1 shorts=False eod=900 min_or_range=0.3 max_or_range=5.0]", "timestamp": 1785880656, "segment": 0}
{"run": 8, "commit": "b63ee0a", "metric": 1.0995, "metrics": {"win_rate": 51.1, "net_pnl": 1412.42, "total_trades": 45.0, "tp_exits": 21.0, "sl_exits": 14.0, "eod_exits": 10.0}, "status": "discard", "description": "SL sweep 1.5 @OR5 [or_min=5 sl=1.5 tp=1.5 buffer=0.3 cooldown=1 shorts=False eod=900 min_or_range=0.3 max_or_range=5.0]", "timestamp": 1785880657, "segment": 0}
{"run": 9, "commit": "b63ee0a", "metric": 0.795, "metrics": {"win_rate": 51.8, "net_pnl": -3306.56, "total_trades": 56.0, "tp_exits": 27.0, "sl_exits": 20.0, "eod_exits": 9.0}, "status": "discard", "description": "TP sweep 1.0 @OR5/SL1.25 [or_min=5 sl=1.25 tp=1.0 buffer=0.3 cooldown=1 shorts=False eod=900 min_or_range=0.3 max_or_range=5.0]", "timestamp": 1785880663, "segment": 0}
{"run": 10, "commit": "b63ee0a", "metric": 1.2318, "metrics": {"win_rate": 47.7, "net_pnl": 3168.44, "total_trades": 44.0, "tp_exits": 16.0, "sl_exits": 18.0, "eod_exits": 10.0}, "status": "keep", "description": "TP sweep 2.0 @OR5/SL1.25 [or_min=5 sl=1.25 tp=2.0 buffer=0.3 cooldown=1 shorts=False eod=900 min_or_range=0.3 max_or_range=5.0]", "timestamp": 1785880664, "segment": 0}
{"run": 11, "commit": "b63ee0a", "metric": 1.0608, "metrics": {"win_rate": 41.2, "net_pnl": 715.46, "total_trades": 34.0, "tp_exits": 7.0, "sl_exits": 16.0, "eod_exits": 11.0}, "status": "discard", "description": "TP sweep 3.0 @OR5/SL1.25 [or_min=5 sl=1.25 tp=3.0 buffer=0.3 cooldown=1 shorts=False eod=900 min_or_range=0.3 max_or_range=5.0]", "timestamp": 1785880665, "segment": 0}
{"run": 12, "commit": "b63ee0a", "metric": 0.0, "metrics": {"win_rate": 0.0, "net_pnl": -9699.35, "total_trades": 163.0, "tp_exits": 161.0, "sl_exits": 1.0, "eod_exits": 1.0}, "status": "discard", "description": "TP sweep 0 (no TP) @OR5/SL1.25 [or_min=5 sl=1.25 tp=0.0 buffer=0.3 cooldown=1 shorts=False eod=900 min_or_range=0.3 max_or_range=5.0]", "timestamp": 1785880666, "segment": 0}
{"run": 13, "commit": "b63ee0a", "metric": 1.0859, "metrics": {"win_rate": 45.3, "net_pnl": 1444.86, "total_trades": 53.0, "tp_exits": 17.0, "sl_exits": 22.0, "eod_exits": 14.0}, "status": "discard", "description": "buffer sweep 0.0 @OR5/SL1.25/TP2 [or_min=5 sl=1.25 tp=2.0 buffer=0.0 cooldown=1 shorts=False eod=900 min_or_range=0.3 max_or_range=5.0]", "timestamp": 1785880674, "segment": 0}
{"run": 14, "commit": "b63ee0a", "metric": 1.4231, "metrics": {"win_rate": 51.2, "net_pnl": 5006.74, "total_trades": 41.0, "tp_exits": 16.0, "sl_exits": 15.0, "eod_exits": 10.0}, "status": "keep", "description": "buffer sweep 0.5 @OR5/SL1.25/TP2 [or_min=5 sl=1.25 tp=2.0 buffer=0.5 cooldown=1 shorts=False eod=900 min_or_range=0.3 max_or_range=5.0]", "timestamp": 1785880676, "segment": 0}
{"run": 15, "commit": "b63ee0a", "metric": 1.4677, "metrics": {"win_rate": 53.1, "net_pnl": 4560.59, "total_trades": 32.0, "tp_exits": 13.0, "sl_exits": 12.0, "eod_exits": 7.0}, "status": "keep", "description": "buffer sweep 1.0 @OR5/SL1.25/TP2 [or_min=5 sl=1.25 tp=2.0 buffer=1.0 cooldown=1 shorts=False eod=900 min_or_range=0.3 max_or_range=5.0]", "timestamp": 1785880676, "segment": 0}
{"run": 16, "commit": "b63ee0a", "metric": 1.2273, "metrics": {"win_rate": 48.0, "net_pnl": 1927.74, "total_trades": 25.0, "tp_exits": 10.0, "sl_exits": 11.0, "eod_exits": 4.0}, "status": "discard", "description": "buffer probe 1.5 @OR5/SL1.25/TP2 [or_min=5 sl=1.25 tp=2.0 buffer=1.5 cooldown=1 shorts=False eod=900 min_or_range=0.3 max_or_range=5.0]", "timestamp": 1785880682, "segment": 0}
{"run": 17, "commit": "b63ee0a", "metric": 1.093, "metrics": {"win_rate": 47.8, "net_pnl": 798.85, "total_trades": 23.0, "tp_exits": 9.0, "sl_exits": 11.0, "eod_exits": 3.0}, "status": "discard", "description": "buffer probe 2.0 @OR5/SL1.25/TP2 [or_min=5 sl=1.25 tp=2.0 buffer=2.0 cooldown=1 shorts=False eod=900 min_or_range=0.3 max_or_range=5.0]", "timestamp": 1785880683, "segment": 0}
{"run": 18, "commit": "b63ee0a", "metric": 1.4677, "metrics": {"win_rate": 53.1, "net_pnl": 4560.59, "total_trades": 32.0, "tp_exits": 13.0, "sl_exits": 12.0, "eod_exits": 7.0}, "status": "discard", "description": "cooldown 0 @OR5/SL1.25/TP2/buf1 [or_min=5 sl=1.25 tp=2.0 buffer=1.0 cooldown=0 shorts=False eod=900 min_or_range=0.3 max_or_range=5.0]", "timestamp": 1785880689, "segment": 0}
{"run": 19, "commit": "b63ee0a", "metric": 1.2729, "metrics": {"win_rate": 50.0, "net_pnl": 2639.5, "total_trades": 30.0, "tp_exits": 12.0, "sl_exits": 12.0, "eod_exits": 6.0}, "status": "discard", "description": "cooldown 2 @OR5/SL1.25/TP2/buf1 [or_min=5 sl=1.25 tp=2.0 buffer=1.0 cooldown=2 shorts=False eod=900 min_or_range=0.3 max_or_range=5.0]", "timestamp": 1785880690, "segment": 0}
{"run": 20, "commit": "b63ee0a", "metric": 1.2896, "metrics": {"win_rate": 46.2, "net_pnl": 2425.93, "total_trades": 26.0, "tp_exits": 10.0, "sl_exits": 10.0, "eod_exits": 6.0}, "status": "discard", "description": "cooldown 3 @OR5/SL1.25/TP2/buf1 [or_min=5 sl=1.25 tp=2.0 buffer=1.0 cooldown=3 shorts=False eod=900 min_or_range=0.3 max_or_range=5.0]", "timestamp": 1785880692, "segment": 0}
{"run": 21, "commit": "b63ee0a", "metric": 1.2049, "metrics": {"win_rate": 46.0, "net_pnl": 2857.42, "total_trades": 50.0, "tp_exits": 15.0, "sl_exits": 16.0, "eod_exits": 19.0}, "status": "discard", "description": "shorts ON @OR5/SL1.25/TP2/buf1/cool1 [or_min=5 sl=1.25 tp=2.0 buffer=1.0 cooldown=1 shorts=True eod=900 min_or_range=0.3 max_or_range=5.0]", "timestamp": 1785880698, "segment": 0}
{"run": 22, "commit": "b63ee0a", "metric": 1.4922, "metrics": {"win_rate": 50.0, "net_pnl": 4138.55, "total_trades": 28.0, "tp_exits": 12.0, "sl_exits": 11.0, "eod_exits": 5.0}, "status": "keep", "description": "EOD 870 @OR5/SL1.25/TP2/buf1/cool1 [or_min=5 sl=1.25 tp=2.0 buffer=1.0 cooldown=1 shorts=False eod=870 min_or_range=0.3 max_or_range=5.0]", "timestamp": 1785880699, "segment": 0}
{"run": 23, "commit": "b63ee0a", "metric": 1.5687, "metrics": {"win_rate": 55.2, "net_pnl": 4892.8, "total_trades": 29.0, "tp_exits": 13.0, "sl_exits": 11.0, "eod_exits": 5.0}, "status": "keep", "description": "EOD 885 @OR5/SL1.25/TP2/buf1/cool1 [or_min=5 sl=1.25 tp=2.0 buffer=1.0 cooldown=1 shorts=False eod=885 min_or_range=0.3 max_or_range=5.0]", "timestamp": 1785880700, "segment": 0}
{"run": 24, "commit": "b63ee0a", "metric": 1.6833, "metrics": {"win_rate": 51.9, "net_pnl": 4993.55, "total_trades": 27.0, "tp_exits": 12.0, "sl_exits": 8.0, "eod_exits": 7.0}, "status": "keep", "description": "EOD 855 @OR5/SL1.25/TP2/buf1/cool1 [or_min=5 sl=1.25 tp=2.0 buffer=1.0 cooldown=1 shorts=False eod=855 min_or_range=0.3 max_or_range=5.0]", "timestamp": 1785880707, "segment": 0}
{"run": 25, "commit": "b63ee0a", "metric": 1.6739, "metrics": {"win_rate": 48.1, "net_pnl": 4908.61, "total_trades": 27.0, "tp_exits": 12.0, "sl_exits": 8.0, "eod_exits": 7.0}, "status": "discard", "description": "EOD 840 @OR5/SL1.25/TP2/buf1/cool1 [or_min=5 sl=1.25 tp=2.0 buffer=1.0 cooldown=1 shorts=False eod=840 min_or_range=0.3 max_or_range=5.0]", "timestamp": 1785880708, "segment": 0}
{"run": 26, "commit": "b63ee0a", "metric": 1.6833, "metrics": {"win_rate": 51.9, "net_pnl": 4993.55, "total_trades": 27.0, "tp_exits": 12.0, "sl_exits": 8.0, "eod_exits": 7.0}, "status": "discard", "description": "minOR 0.2 @best [or_min=5 sl=1.25 tp=2.0 buffer=1.0 cooldown=1 shorts=False eod=855 min_or_range=0.2 max_or_range=5.0]", "timestamp": 1785880715, "segment": 0}
{"run": 27, "commit": "b63ee0a", "metric": 1.6833, "metrics": {"win_rate": 51.9, "net_pnl": 4993.55, "total_trades": 27.0, "tp_exits": 12.0, "sl_exits": 8.0, "eod_exits": 7.0}, "status": "discard", "description": "minOR 0.5 @best [or_min=5 sl=1.25 tp=2.0 buffer=1.0 cooldown=1 shorts=False eod=855 min_or_range=0.5 max_or_range=5.0]", "timestamp": 1785880717, "segment": 0}
{"run": 28, "commit": "b63ee0a", "metric": 1.8344, "metrics": {"win_rate": 53.8, "net_pnl": 5595.62, "total_trades": 26.0, "tp_exits": 12.0, "sl_exits": 7.0, "eod_exits": 7.0}, "status": "keep", "description": "minOR 0.8 @best [or_min=5 sl=1.25 tp=2.0 buffer=1.0 cooldown=1 shorts=False eod=855 min_or_range=0.8 max_or_range=5.0]", "timestamp": 1785880718, "segment": 0}
{"run": 29, "commit": "b63ee0a", "metric": 1.8344, "metrics": {"win_rate": 53.8, "net_pnl": 5595.62, "total_trades": 26.0, "tp_exits": 12.0, "sl_exits": 7.0, "eod_exits": 7.0}, "status": "discard", "description": "minOR 1.0 @best [or_min=5 sl=1.25 tp=2.0 buffer=1.0 cooldown=1 shorts=False eod=855 min_or_range=1.0 max_or_range=5.0]", "timestamp": 1785880726, "segment": 0}
{"run": 30, "commit": "b63ee0a", "metric": 2.1336, "metrics": {"win_rate": 57.1, "net_pnl": 5997.83, "total_trades": 21.0, "tp_exits": 11.0, "sl_exits": 6.0, "eod_exits": 4.0}, "status": "keep", "description": "minOR 1.5 @best [or_min=5 sl=1.25 tp=2.0 buffer=1.0 cooldown=1 shorts=False eod=855 min_or_range=1.5 max_or_range=5.0]", "timestamp": 1785880727, "segment": 0}
{"run": 31, "commit": "b63ee0a", "metric": 2.1336, "metrics": {"win_rate": 57.1, "net_pnl": 5997.83, "total_trades": 21.0, "tp_exits": 11.0, "sl_exits": 6.0, "eod_exits": 4.0}, "status": "discard", "description": "minOR 2.0 @best [or_min=5 sl=1.25 tp=2.0 buffer=1.0 cooldown=1 shorts=False eod=855 min_or_range=2.0 max_or_range=5.0]", "timestamp": 1785880728, "segment": 0}
{"run": 32, "commit": "b63ee0a", "metric": 2.7359, "metrics": {"win_rate": 60.0, "net_pnl": 5702.12, "total_trades": 15.0, "tp_exits": 9.0, "sl_exits": 4.0, "eod_exits": 2.0}, "status": "keep", "description": "minOR 2.5 @best [or_min=5 sl=1.25 tp=2.0 buffer=1.0 cooldown=1 shorts=False eod=855 min_or_range=2.5 max_or_range=5.0]", "timestamp": 1785880738, "segment": 0}
{"run": 33, "commit": "b63ee0a", "metric": 2.7359, "metrics": {"win_rate": 60.0, "net_pnl": 5702.12, "total_trades": 15.0, "tp_exits": 9.0, "sl_exits": 4.0, "eod_exits": 2.0}, "status": "discard", "description": "minOR 3.0 @best [or_min=5 sl=1.25 tp=2.0 buffer=1.0 cooldown=1 shorts=False eod=855 min_or_range=3.0 max_or_range=5.0]", "timestamp": 1785880739, "segment": 0}
{"run": 34, "commit": "b63ee0a", "metric": 1.4615, "metrics": {"win_rate": 50.0, "net_pnl": 1159.58, "total_trades": 8.0, "tp_exits": 4.0, "sl_exits": 3.0, "eod_exits": 1.0}, "status": "discard", "description": "minOR 4.0 @best [or_min=5 sl=1.25 tp=2.0 buffer=1.0 cooldown=1 shorts=False eod=855 min_or_range=4.0 max_or_range=5.0]", "timestamp": 1785880740, "segment": 0}
{"run": 35, "commit": "b63ee0a", "metric": 2.0353, "metrics": {"win_rate": 50.0, "net_pnl": 4087.53, "total_trades": 16.0, "tp_exits": 8.0, "sl_exits": 7.0, "eod_exits": 1.0}, "status": "discard", "description": "SL 1.0 @minOR2.5 [or_min=5 sl=1.0 tp=2.0 buffer=1.0 cooldown=1 shorts=False eod=855 min_or_range=2.5 max_or_range=5.0]", "timestamp": 1785880751, "segment": 0}
{"run": 36, "commit": "b63ee0a", "metric": 3.9471, "metrics": {"win_rate": 69.2, "net_pnl": 6714.0, "total_trades": 13.0, "tp_exits": 9.0, "sl_exits": 2.0, "eod_exits": 2.0}, "status": "keep", "description": "SL 1.5 @minOR2.5 [or_min=5 sl=1.5 tp=2.0 buffer=1.0 cooldown=1 shorts=False eod=855 min_or_range=2.5 max_or_range=5.0]", "timestamp": 1785880752, "segment": 0}
{"run": 37, "commit": "b63ee0a", "metric": 2.3444, "metrics": {"win_rate": 57.1, "net_pnl": 5303.44, "total_trades": 14.0, "tp_exits": 7.0, "sl_exits": 5.0, "eod_exits": 2.0}, "status": "discard", "description": "TP 2.5 @minOR2.5 [or_min=5 sl=1.25 tp=2.5 buffer=1.0 cooldown=1 shorts=False eod=855 min_or_range=2.5 max_or_range=5.0]", "timestamp": 1785880753, "segment": 0}
{"run": 38, "commit": "b63ee0a", "metric": 2.8087, "metrics": {"win_rate": 66.7, "net_pnl": 4756.89, "total_trades": 15.0, "tp_exits": 10.0, "sl_exits": 3.0, "eod_exits": 2.0}, "status": "discard", "description": "TP 1.5 @minOR2.5 [or_min=5 sl=1.25 tp=1.5 buffer=1.0 cooldown=1 shorts=False eod=855 min_or_range=2.5 max_or_range=5.0]", "timestamp": 1785880754, "segment": 0}
{"run": 39, "commit": "b63ee0a", "metric": 3.5224, "metrics": {"win_rate": 69.2, "net_pnl": 6439.36, "total_trades": 13.0, "tp_exits": 9.0, "sl_exits": 2.0, "eod_exits": 2.0}, "status": "discard", "description": "SL 1.75 @minOR2.5/TP2 [or_min=5 sl=1.75 tp=2.0 buffer=1.0 cooldown=1 shorts=False eod=855 min_or_range=2.5 max_or_range=5.0]", "timestamp": 1785880762, "segment": 0}
{"run": 40, "commit": "b63ee0a", "metric": 5.4509, "metrics": {"win_rate": 75.0, "net_pnl": 7349.31, "total_trades": 12.0, "tp_exits": 9.0, "sl_exits": 1.0, "eod_exits": 2.0}, "status": "keep", "description": "SL 2.0 @minOR2.5/TP2 [or_min=5 sl=2.0 tp=2.0 buffer=1.0 cooldown=1 shorts=False eod=855 min_or_range=2.5 max_or_range=5.0]", "timestamp": 1785880763, "segment": 0}
{"run": 41, "commit": "b63ee0a", "metric": 3.5767, "metrics": {"win_rate": 72.7, "net_pnl": 6667.27, "total_trades": 11.0, "tp_exits": 7.0, "sl_exits": 3.0, "eod_exits": 1.0}, "status": "discard", "description": "SL 1.5 TP2.5 @minOR2.5 [or_min=5 sl=1.5 tp=2.5 buffer=1.0 cooldown=1 shorts=False eod=855 min_or_range=2.5 max_or_range=5.0]", "timestamp": 1785880764, "segment": 0}
{"run": 42, "commit": "b63ee0a", "metric": 7.1057, "metrics": {"win_rate": 80.0, "net_pnl": 8341.03, "total_trades": 10.0, "tp_exits": 6.0, "sl_exits": 1.0, "eod_exits": 3.0}, "status": "keep", "description": "SL 1.5 TP3 @minOR2.5 [or_min=5 sl=1.5 tp=3.0 buffer=1.0 cooldown=1 shorts=False eod=855 min_or_range=2.5 max_or_range=5.0]", "timestamp": 1785880765, "segment": 0}
{"run": 43, "commit": "b63ee0a", "metric": 5.933, "metrics": {"win_rate": 80.0, "net_pnl": 8071.01, "total_trades": 10.0, "tp_exits": 6.0, "sl_exits": 1.0, "eod_exits": 3.0}, "status": "discard", "description": "SL2.0 TP3 @minOR2.5 [or_min=5 sl=2.0 tp=3.0 buffer=1.0 cooldown=1 shorts=False eod=855 min_or_range=2.5 max_or_range=5.0]", "timestamp": 1785880773, "segment": 0}
{"run": 44, "commit": "b63ee0a", "metric": 4.6361, "metrics": {"win_rate": 80.0, "net_pnl": 7258.6, "total_trades": 10.0, "tp_exits": 7.0, "sl_exits": 1.0, "eod_exits": 2.0}, "status": "discard", "description": "SL2.0 TP2.5 @minOR2.5 [or_min=5 sl=2.0 tp=2.5 buffer=1.0 cooldown=1 shorts=False eod=855 min_or_range=2.5 max_or_range=5.0]", "timestamp": 1785880774, "segment": 0}
{"run": 45, "commit": "b63ee0a", "metric": 6.4666, "metrics": {"win_rate": 80.0, "net_pnl": 8206.02, "total_trades": 10.0, "tp_exits": 6.0, "sl_exits": 1.0, "eod_exits": 3.0}, "status": "discard", "description": "SL1.75 TP3 @minOR2.5 [or_min=5 sl=1.75 tp=3.0 buffer=1.0 cooldown=1 shorts=False eod=855 min_or_range=2.5 max_or_range=5.0]", "timestamp": 1785880776, "segment": 0}
{"run": 46, "commit": "b63ee0a", "metric": 4.6847, "metrics": {"win_rate": 75.0, "net_pnl": 7079.28, "total_trades": 12.0, "tp_exits": 9.0, "sl_exits": 1.0, "eod_exits": 2.0}, "status": "discard", "description": "SL2.5 TP2 @minOR2.5 [or_min=5 sl=2.5 tp=2.0 buffer=1.0 cooldown=1 shorts=False eod=855 min_or_range=2.5 max_or_range=5.0]", "timestamp": 1785880777, "segment": 0}
{"run": 47, "commit": "b63ee0a", "metric": 8.237, "metrics": {"win_rate": 80.0, "net_pnl": 9886.5, "total_trades": 10.0, "tp_exits": 6.0, "sl_exits": 1.0, "eod_exits": 3.0}, "status": "keep", "description": "SL1.5 TP3.5 @minOR2.5 [or_min=5 sl=1.5 tp=3.5 buffer=1.0 cooldown=1 shorts=False eod=855 min_or_range=2.5 max_or_range=5.0]", "timestamp": 1785880785, "segment": 0}
{"run": 48, "commit": "b63ee0a", "metric": 6.4324, "metrics": {"win_rate": 77.8, "net_pnl": 9183.31, "total_trades": 9.0, "tp_exits": 5.0, "sl_exits": 2.0, "eod_exits": 2.0}, "status": "discard", "description": "SL1.5 TP4 @minOR2.5 [or_min=5 sl=1.5 tp=4.0 buffer=1.0 cooldown=1 shorts=False eod=855 min_or_range=2.5 max_or_range=5.0]", "timestamp": 1785880786, "segment": 0}
{"run": 49, "commit": "b63ee0a", "metric": 4.2862, "metrics": {"win_rate": 72.7, "net_pnl": 7437.08, "total_trades": 11.0, "tp_exits": 6.0, "sl_exits": 2.0, "eod_exits": 3.0}, "status": "discard", "description": "SL1.5 TP3 buf0.5 @minOR2.5 [or_min=5 sl=1.5 tp=3.0 buffer=0.5 cooldown=1 shorts=False eod=855 min_or_range=2.5 max_or_range=5.0]", "timestamp": 1785880788, "segment": 0}
{"run": 50, "commit": "b63ee0a", "metric": 18.7624, "metrics": {"win_rate": 88.9, "net_pnl": 8858.27, "total_trades": 9.0, "tp_exits": 6.0, "sl_exits": 0.0, "eod_exits": 3.0}, "status": "keep", "description": "SL1.5 TP3 buf1.5 @minOR2.5 [or_min=5 sl=1.5 tp=3.0 buffer=1.5 cooldown=1 shorts=False eod=855 min_or_range=2.5 max_or_range=5.0]", "timestamp": 1785880789, "segment": 0}
{"run": 51, "commit": "b63ee0a", "metric": 21.8613, "metrics": {"win_rate": 88.9, "net_pnl": 10403.74, "total_trades": 9.0, "tp_exits": 6.0, "sl_exits": 0.0, "eod_exits": 3.0}, "status": "keep", "description": "SL1.5 TP3.5 buf1.5 @minOR2.5 [or_min=5 sl=1.5 tp=3.5 buffer=1.5 cooldown=1 shorts=False eod=855 min_or_range=2.5 max_or_range=5.0]", "timestamp": 1785880800, "segment": 0}
{"run": 52, "commit": "b63ee0a", "metric": 6.8494, "metrics": {"win_rate": 80.0, "net_pnl": 7990.88, "total_trades": 10.0, "tp_exits": 6.0, "sl_exits": 1.0, "eod_exits": 3.0}, "status": "discard", "description": "SL1.5 TP3 buf1.2 @minOR2.5 [or_min=5 sl=1.5 tp=3.0 buffer=1.2 cooldown=1 shorts=False eod=855 min_or_range=2.5 max_or_range=5.0]", "timestamp": 1785880801, "segment": 0}
{"run": 53, "commit": "b63ee0a", "metric": 7.9807, "metrics": {"win_rate": 80.0, "net_pnl": 9536.35, "total_trades": 10.0, "tp_exits": 6.0, "sl_exits": 1.0, "eod_exits": 3.0}, "status": "discard", "description": "SL1.5 TP3.5 buf1.2 @minOR2.5 [or_min=5 sl=1.5 tp=3.5 buffer=1.2 cooldown=1 shorts=False eod=855 min_or_range=2.5 max_or_range=5.0]", "timestamp": 1785880803, "segment": 0}
{"run": 54, "commit": "b63ee0a", "metric": 5.2568, "metrics": {"win_rate": 71.4, "net_pnl": 10829.5, "total_trades": 14.0, "tp_exits": 7.0, "sl_exits": 2.0, "eod_exits": 5.0}, "status": "discard", "description": "SL1.5 TP3.5 buf1 minOR2.0 [or_min=5 sl=1.5 tp=3.5 buffer=1.0 cooldown=1 shorts=False eod=855 min_or_range=2.0 max_or_range=5.0]", "timestamp": 1785880820, "segment": 0}
{"run": 55, "commit": "b63ee0a", "metric": 8.237, "metrics": {"win_rate": 80.0, "net_pnl": 9886.5, "total_trades": 10.0, "tp_exits": 6.0, "sl_exits": 1.0, "eod_exits": 3.0}, "status": "discard", "description": "SL1.5 TP3.5 buf1 minOR3.0 [or_min=5 sl=1.5 tp=3.5 buffer=1.0 cooldown=1 shorts=False eod=855 min_or_range=3.0 max_or_range=5.0]", "timestamp": 1785880821, "segment": 0}
{"run": 56, "commit": "b63ee0a", "metric": 5.2959, "metrics": {"win_rate": 71.4, "net_pnl": 11079.35, "total_trades": 14.0, "tp_exits": 7.0, "sl_exits": 2.0, "eod_exits": 5.0}, "status": "discard", "description": "SL1.5 TP3.5 buf1 minOR1.5 EOD840 [or_min=5 sl=1.5 tp=3.5 buffer=1.0 cooldown=1 shorts=False eod=840 min_or_range=1.5 max_or_range=5.0]", "timestamp": 1785880823, "segment": 0}
{"run": 57, "commit": "b63ee0a", "metric": 8.1329, "metrics": {"win_rate": 80.0, "net_pnl": 10136.34, "total_trades": 10.0, "tp_exits": 6.0, "sl_exits": 1.0, "eod_exits": 3.0}, "status": "discard", "description": "SL1.5 TP3.5 buf1 minOR2.5 EOD840 [or_min=5 sl=1.5 tp=3.5 buffer=1.0 cooldown=1 shorts=False eod=840 min_or_range=2.5 max_or_range=5.0]", "timestamp": 1785880834, "segment": 0}
