{"run": 58, "commit": "b63ee0a", "metric": 4.2994, "metrics": {"win_rate": 70.0, "net_pnl": 8687.27, "total_trades": 10.0, "tp_exits": 6.0, "sl_exits": 3.0, "eod_exits": 1.0}, "status": "discard", "description": "SL1.5 TP3.5 buf1 minOR2.5 EOD870 [or_min=5 sl=1.5 tp=3.5 buffer=1.0 cooldown=1 shorts=False eod=870 min_or_range=2.5 max_or_range=5.0]", "timestamp": 1785880835, "segment": 0}
{"run": 59, "commit": "b63ee0a", "metric": 4.1798, "metrics": {"win_rate": 70.0, "net_pnl": 8372.47, "total_trades": 10.0, "tp_exits": 6.0, "sl_exits": 3.0, "eod_exits": 1.0}, "status": "discard", "description": "SL1.5 TP3.5 buf1 minOR2.5 EOD885 [or_min=5 sl=1.5 tp=3.5 buffer=1.0 cooldown=1 shorts=False eod=885 min_or_range=2.5 max_or_range=5.0]", "timestamp": 1785880836, "segment": 0}
{"run": 60, "commit": "b63ee0a", "metric": 8.237, "metrics": {"win_rate": 80.0, "net_pnl": 9886.5, "total_trades": 10.0, "tp_exits": 6.0, "sl_exits": 1.0, "eod_exits": 3.0}, "status": "discard", "description": "SL1.5 TP3.5 buf1 minOR2.5 EOD850 [or_min=5 sl=1.5 tp=3.5 buffer=1.0 cooldown=1 shorts=False eod=850 min_or_range=2.5 max_or_range=5.0]", "timestamp": 1785880850, "segment": 0}
{"run": 61, "commit": "b63ee0a", "metric": 7.4349, "metrics": {"win_rate": 70.0, "net_pnl": 9386.81, "total_trades": 10.0, "tp_exits": 6.0, "sl_exits": 1.0, "eod_exits": 3.0}, "status": "discard", "description": "SL1.5 TP3.5 buf1 minOR2.5 EOD860 [or_min=5 sl=1.5 tp=3.5 buffer=1.0 cooldown=1 shorts=False eod=860 min_or_range=2.5 max_or_range=5.0]", "timestamp": 1785880851, "segment": 0}
{"run": 62, "commit": "b63ee0a", "metric": 6.1983, "metrics": {"win_rate": 70.0, "net_pnl": 9145.34, "total_trades": 10.0, "tp_exits": 6.0, "sl_exits": 1.0, "eod_exits": 3.0}, "status": "discard", "description": "robustness cooldown2 [or_min=5 sl=1.5 tp=3.5 buffer=1.0 cooldown=2 shorts=False eod=855 min_or_range=2.5 max_or_range=5.0]", "timestamp": 1785880867, "segment": 0}
{"run": 63, "commit": "b63ee0a", "metric": 3.0202, "metrics": {"win_rate": 53.3, "net_pnl": 7526.84, "total_trades": 15.0, "tp_exits": 6.0, "sl_exits": 3.0, "eod_exits": 6.0}, "status": "discard", "description": "robustness shorts ON [or_min=5 sl=1.5 tp=3.5 buffer=1.0 cooldown=1 shorts=True eod=855 min_or_range=2.5 max_or_range=5.0]", "timestamp": 1785880869, "segment": 0}
{"run": 64, "commit": "b63ee0a", "metric": 4.964, "metrics": {"win_rate": 72.7, "net_pnl": 8970.84, "total_trades": 11.0, "tp_exits": 6.0, "sl_exits": 2.0, "eod_exits": 3.0}, "status": "discard", "description": "robustness buf0.8 [or_min=5 sl=1.5 tp=3.5 buffer=0.8 cooldown=1 shorts=False eod=855 min_or_range=2.5 max_or_range=5.0]", "timestamp": 1785880870, "segment": 0}
{"run": 65, "commit": "b63ee0a", "metric": 7.9807, "metrics": {"win_rate": 80.0, "net_pnl": 9536.35, "total_trades": 10.0, "tp_exits": 6.0, "sl_exits": 1.0, "eod_exits": 3.0}, "status": "discard", "description": "robustness buf1.25 [or_min=5 sl=1.5 tp=3.5 buffer=1.25 cooldown=1 shorts=False eod=855 min_or_range=2.5 max_or_range=5.0]", "timestamp": 1785880871, "segment": 0}
{"run": 66, "commit": "b63ee0a", "metric": 8.237, "metrics": {"win_rate": 80.0, "net_pnl": 9886.5, "total_trades": 10.0, "tp_exits": 6.0, "sl_exits": 1.0, "eod_exits": 3.0}, "status": "discard", "description": "tuned params OR10 [or_min=10 sl=1.5 tp=3.5 buffer=1.0 cooldown=1 shorts=False eod=855 min_or_range=2.5 max_or_range=5.0]", "timestamp": 1785880881, "segment": 0}
{"run": 67, "commit": "b63ee0a", "metric": 1.571, "metrics": {"win_rate": 44.4, "net_pnl": 2161.23, "total_trades": 9.0, "tp_exits": 3.0, "sl_exits": 4.0, "eod_exits": 2.0}, "status": "discard", "description": "tuned params OR15 [or_min=15 sl=1.5 tp=3.5 buffer=1.0 cooldown=1 shorts=False eod=855 min_or_range=2.5 max_or_range=5.0]", "timestamp": 1785880883, "segment": 0}
{"run": 68, "commit": "b63ee0a", "metric": 0.0, "metrics": {"win_rate": 0.0, "net_pnl": -919.71, "total_trades": 1.0, "tp_exits": 0.0, "sl_exits": 1.0, "eod_exits": 0.0}, "status": "discard", "description": "tuned params OR60 [or_min=60 sl=1.5 tp=3.5 buffer=1.0 cooldown=1 shorts=False eod=855 min_or_range=2.5 max_or_range=5.0]", "timestamp": 1785880884, "segment": 0}
{"run": 69, "commit": "b63ee0a", "metric": 0.9763, "metrics": {"win_rate": 44.4, "net_pnl": -155.99, "total_trades": 18.0, "tp_exits": 6.0, "sl_exits": 8.0, "eod_exits": 4.0}, "status": "discard", "description": "OR15 SL1.25 TP2 buf1 minOR0.3 [or_min=15 sl=1.25 tp=2.0 buffer=1.0 cooldown=1 shorts=False eod=855 min_or_range=0.3 max_or_range=5.0]", "timestamp": 1785880898, "segment": 0}
{"run": 70, "commit": "b63ee0a", "metric": 0.0, "metrics": {"win_rate": 0.0, "net_pnl": -2315.47, "total_trades": 4.0, "tp_exits": 0.0, "sl_exits": 3.0, "eod_exits": 1.0}, "status": "discard", "description": "OR60 SL1.25 TP2 buf1 minOR0.3 [or_min=60 sl=1.25 tp=2.0 buffer=1.0 cooldown=1 shorts=False eod=855 min_or_range=0.3 max_or_range=5.0]", "timestamp": 1785880899, "segment": 0}
{"run": 71, "commit": "b63ee0a", "metric": 8.237, "metrics": {"win_rate": 80.0, "net_pnl": 9886.5, "total_trades": 10.0, "tp_exits": 6.0, "sl_exits": 1.0, "eod_exits": 3.0}, "status": "discard", "description": "OR5 best config TP3.5 minOR2.5 cooldown0 [or_min=5 sl=1.5 tp=3.5 buffer=1.0 cooldown=0 shorts=False eod=855 min_or_range=2.5 max_or_range=5.0]", "timestamp": 1785880900, "segment": 0}
{"run": 72, "commit": "b63ee0a", "metric": 8.237, "metrics": {"win_rate": 80.0, "net_pnl": 9886.5, "total_trades": 10.0, "tp_exits": 6.0, "sl_exits": 1.0, "eod_exits": 3.0}, "status": "discard", "description": "final best verification run [or_min=5 sl=1.5 tp=3.5 buffer=1.0 cooldown=1 shorts=False eod=855 min_or_range=2.5 max_or_range=5.0]", "timestamp": 1785880931, "segment": 0}
