{"type":"config","name":"btst-param-optimization","metricName":"profit_factor","metricUnit":"ratio","bestDirection":"higher"}
{"run":1,"commit":"8deac38","metric":0.8188,"metrics":{"win_rate":39.3,"net_pnl":-712109,"total_trades":3689,"stocks_with_trades":79,"sl_exits":1632,"tp_exits":1009},"status":"keep","description":"baseline: SL=2% TP=3% entry>0.5% mode=up_day mcap>=1000 price>=50","timestamp":1783606519,"segment":0}
{"run":2,"commit":"4119185","metric":0.9144,"metrics":{"win_rate":37.6,"net_pnl":-339235,"total_trades":3689,"stocks_with_trades":79,"sl_exits":1632,"tp_exits":469},"status":"keep","description":"wider TP=5% SL=2% entry>0.5% up_day","timestamp":1783606598,"segment":0}
{"run":3,"commit":"8deac38","metric":0.9858,"metrics":{"win_rate":27.8,"net_pnl":-41279,"total_trades":3689,"stocks_with_trades":79,"sl_exits":2443,"tp_exits":382},"status":"keep","description":"SL=1% TP=5% entry>0.5% up_day","timestamp":1782540000,"segment":0}
{"run":4,"commit":"8deac38","metric":1.0628,"metrics":{"win_rate":27.8,"net_pnl":182383,"total_trades":3689,"stocks_with_trades":79,"sl_exits":2443,"tp_exits":79},"status":"keep","description":"SL=1% TP=10% entry>0.5% up_day","timestamp":1782540100,"segment":0}
{"run":5,"commit":"8deac38","metric":1.0783,"metrics":{"win_rate":27.8,"net_pnl":227509,"total_trades":3689,"stocks_with_trades":79,"sl_exits":2443,"tp_exits":0},"status":"keep","description":"SL=1% no TP entry>0.5% up_day","timestamp":1782540200,"segment":0}
{"run":6,"commit":"8deac38","metric":1.1637,"metrics":{"win_rate":29.4,"net_pnl":1170710,"total_trades":9465,"stocks_with_trades":79,"sl_exits":5967,"tp_exits":0},"status":"keep","description":"SL=1% no TP any_day mode","timestamp":1782540300,"segment":0}
{"run":7,"commit":"8deac38","metric":1.4747,"metrics":{"win_rate":22.1,"net_pnl":2250061,"total_trades":9465,"stocks_with_trades":79,"sl_exits":7009,"tp_exits":0},"status":"keep","description":"SL=0.5% no TP any_day","timestamp":1782540400,"segment":0}
{"run":8,"commit":"8deac38","metric":1.8377,"metrics":{"win_rate":18.9,"net_pnl":2935755,"total_trades":9465,"stocks_with_trades":79,"sl_exits":7381,"tp_exits":0},"status":"keep","description":"SL=0.3% no TP any_day","timestamp":1782540500,"segment":0}
{"run":9,"commit":"8deac38","metric":2.1697,"metrics":{"win_rate":17.4,"net_pnl":3301078,"total_trades":9465,"stocks_with_trades":79,"sl_exits":7528,"tp_exits":0},"status":"keep","description":"SL=0.2% no TP any_day","timestamp":1782540600,"segment":0}
{"run":10,"commit":"8deac38","metric":2.7364,"metrics":{"win_rate":15.8,"net_pnl":3671888,"total_trades":9465,"stocks_with_trades":79,"sl_exits":7689,"tp_exits":0},"status":"keep","description":"SL=0.1% no TP any_day","timestamp":1782540700,"segment":0}
{"run":11,"commit":"8deac38","metric":1.0483,"metrics":{"win_rate":44.2,"net_pnl":510767,"total_trades":9465,"stocks_with_trades":79,"sl_exits":0,"tp_exits":0},"status":"discard","description":"no SL no TP any_day (0% SL worse)","timestamp":1782540800,"segment":0}
{"run":12,"commit":"8deac38","metric":3.267,"metrics":{"win_rate":15.2,"net_pnl":3950179,"total_trades":9465,"stocks_with_trades":79,"sl_exits":7739,"tp_exits":0},"status":"keep","description":"SL=0.05% no TP any_day","timestamp":1782540900,"segment":0}
{"run":13,"commit":"8deac38","metric":3.8503,"metrics":{"win_rate":14.7,"net_pnl":4113324,"total_trades":9465,"stocks_with_trades":79,"sl_exits":7791,"tp_exits":0},"status":"keep","description":"SL=0.01% no TP any_day","timestamp":1782541000,"segment":0}
{"run":14,"commit":"8deac38","metric":4.0376,"metrics":{"win_rate":14.6,"net_pnl":4174013,"total_trades":9465,"stocks_with_trades":79,"sl_exits":7796,"tp_exits":0},"status":"keep","description":"SL=0.001% no TP any_day","timestamp":1782541100,"segment":0}
{"run":15,"commit":"8deac38","metric":4.1612,"metrics":{"win_rate":15.5,"net_pnl":2303769,"total_trades":5072,"stocks_with_trades":42,"sl_exits":4129,"tp_exits":0},"status":"keep","description":"SL=0.001% no TP any_day mcap>=5000","timestamp":1782541200,"segment":0}
{"run":16,"commit":"8deac38","metric":4.1781,"metrics":{"win_rate":16.0,"net_pnl":1271674,"total_trades":2802,"stocks_with_trades":23,"sl_exits":2267,"tp_exits":0},"status":"keep","description":"SL=0.001% no TP any_day mcap>=10000","timestamp":1782541300,"segment":0}
{"run":17,"commit":"8deac38","metric":4.101,"metrics":{"win_rate":14.8,"net_pnl":3693299,"total_trades":8223,"stocks_with_trades":68,"sl_exits":6757,"tp_exits":0},"status":"discard","description":"SL=0.001% no TP any_day price>=200","timestamp":1782541400,"segment":0}
{"run":18,"commit":"e891da3","metric":4.196,"metrics":{"win_rate":13.6,"net_pnl":520728,"total_trades":1109,"stocks_with_trades":79,"sl_exits":937,"tp_exits":0},"status":"keep","description":"volume_surge SL=0.001% no TP mcap>=1000 H1-2026","timestamp":1783607409,"segment":0}
{"run":19,"commit":"e891da3","metric":3.9044,"metrics":{"win_rate":13.8,"net_pnl":258677,"total_trades":608,"stocks_with_trades":42,"sl_exits":511,"tp_exits":0},"status":"discard","description":"volume_surge SL=0.001% no TP mcap>=5000 H1-2026","timestamp":1783607409,"segment":0}
{"run":20,"commit":"e891da3","metric":1.626,"metrics":{"win_rate":9.4,"net_pnl":815484,"total_trades":8027,"stocks_with_trades":74,"sl_exits":7271,"tp_exits":0},"status":"discard","description":"any_day SL=0.01% no TP H2-2025 (regime test)","timestamp":1783607409,"segment":0}
{"run":21,"commit":"e891da3","metric":2.7212,"metrics":{"win_rate":12.1,"net_pnl":5002754,"total_trades":18486,"stocks_with_trades":79,"sl_exits":15960,"tp_exits":0},"status":"keep","description":"any_day SL=0.01% no TP FY Jul25-Jun26","timestamp":1783607409,"segment":0}
{"run":22,"commit":"e891da3","metric":2.3268,"metrics":{"win_rate":12.8,"net_pnl":4665003,"total_trades":18486,"stocks_with_trades":79,"sl_exits":15837,"tp_exits":0},"status":"discard","description":"any_day SL=0.05% no TP FY Jul25-Jun26","timestamp":1783607409,"segment":0}
{"run":23,"commit":"e891da3","metric":2.8503,"metrics":{"win_rate":12.0,"net_pnl":5118249,"total_trades":18486,"stocks_with_trades":79,"sl_exits":15976,"tp_exits":0},"status":"keep","description":"any_day SL=0.001% no TP FY Jul25-Jun26","timestamp":1783607409,"segment":0}
{"run":24,"commit":"e891da3","metric":3.8791,"metrics":{"win_rate":13.7,"net_pnl":839342,"total_trades":1985,"stocks_with_trades":79,"sl_exits":1691,"tp_exits":0},"status":"keep","description":"volume_surge SL=0.001% no TP FY Jul25-Jun26","timestamp":1783607409,"segment":0}
{"run":25,"commit":"e891da3","metric":3.3525,"metrics":{"win_rate":12.3,"net_pnl":369884,"total_trades":1055,"stocks_with_trades":42,"sl_exits":911,"tp_exits":0},"status":"discard","description":"volume_surge SL=0.001% no TP mcap>=5000 FY","timestamp":1783607409,"segment":0}
{"run":26,"commit":"fc29b82","metric":3.6874,"metrics":{"win_rate":13.7,"net_pnl":824182,"total_trades":1985,"stocks_with_trades":79,"sl_exits":1691,"tp_exits":0},"status":"discard","description":"vol_surge SL=0.01% no TP FY (vs 0.001% better)","timestamp":1783619125,"segment":0}
{"run":27,"commit":"fc29b82","metric":3.1219,"metrics":{"win_rate":14.2,"net_pnl":788640,"total_trades":1985,"stocks_with_trades":79,"sl_exits":1680,"tp_exits":0},"status":"discard","description":"vol_surge SL=0.05% no TP FY","timestamp":1783619125,"segment":0}
{"run":28,"commit":"fc29b82","metric":2.6159,"metrics":{"win_rate":14.7,"net_pnl":731857,"total_trades":1985,"stocks_with_trades":79,"sl_exits":1671,"tp_exits":0},"status":"discard","description":"vol_surge SL=0.1% no TP FY","timestamp":1783619125,"segment":0}
{"run":29,"commit":"fc29b82","metric":1.4161,"metrics":{"win_rate":21.5,"net_pnl":425097,"total_trades":1985,"stocks_with_trades":79,"sl_exits":1523,"tp_exits":0},"status":"discard","description":"vol_surge SL=0.5% no TP FY","timestamp":1783619125,"segment":0}
{"run":30,"commit":"fc29b82","metric":2.7411,"metrics":{"win_rate":11.4,"net_pnl":1853886,"total_trades":6720,"stocks_with_trades":79,"sl_exits":5863,"tp_exits":0},"status":"discard","description":"up_day SL=0.01% no TP FY (vol_surge better)","timestamp":1783619125,"segment":0}
{"run":31,"commit":"fc29b82","metric":2.876,"metrics":{"win_rate":11.4,"net_pnl":1900179,"total_trades":6720,"stocks_with_trades":79,"sl_exits":5867,"tp_exits":0},"status":"keep","description":"up_day SL=0.001% no TP FY","timestamp":1783619125,"segment":0}
{"run":32,"commit":"fc29b82","metric":2.8358,"metrics":{"win_rate":12.2,"net_pnl":9023565,"total_trades":32905,"stocks_with_trades":140,"sl_exits":28388,"tp_exits":0},"status":"keep","description":"any_day SL=0.001% no TP 200stocks FY","timestamp":1783619125,"segment":0}
{"run":33,"commit":"fc29b82","metric":3.8614,"metrics":{"win_rate":13.7,"net_pnl":1467453,"total_trades":3493,"stocks_with_trades":140,"sl_exits":2972,"tp_exits":0},"status":"keep","description":"vol_surge SL=0.001% no TP 200stocks FY","timestamp":1783619125,"segment":0}
{"run":34,"commit":"fc29b82","metric":2.7548,"metrics":{"win_rate":12.3,"net_pnl":12034827,"total_trades":45977,"stocks_with_trades":195,"sl_exits":39607,"tp_exits":0},"status":"keep","description":"any_day SL=0.001% no TP 300stocks FY","timestamp":1783619125,"segment":0}
{"run":35,"commit":"fc29b82","metric":3.7574,"metrics":{"win_rate":13.6,"net_pnl":1974558,"total_trades":4875,"stocks_with_trades":195,"sl_exits":4144,"tp_exits":0},"status":"keep","description":"vol_surge SL=0.001% no TP 300stocks FY","timestamp":1783619125,"segment":0}
{"run":36,"commit":"4ac628b","metric":0.8164,"metrics":{"win_rate":20.5,"net_pnl":-4022966,"total_trades":32905,"stocks_with_trades":140,"sl_exits":24843,"tp_exits":0},"status":"discard","description":"any_day SL=0.5% no TP 200st 0.1%slip FY","timestamp":1783623691,"segment":0}
{"run":37,"commit":"4ac628b","metric":0.9861,"metrics":{"win_rate":20.4,"net_pnl":-32571,"total_trades":3493,"stocks_with_trades":140,"sl_exits":2680,"tp_exits":0},"status":"discard","description":"vol_surge SL=0.5% no TP 200st 0.1%slip FY","timestamp":1783623691,"segment":0}
{"run":38,"commit":"4ac628b","metric":0.8935,"metrics":{"win_rate":16.9,"net_pnl":-1910369,"total_trades":32905,"stocks_with_trades":140,"sl_exits":26517,"tp_exits":0},"status":"discard","description":"any_day SL=0.3% no TP 200st 0.1%slip FY","timestamp":1783623691,"segment":0}
{"run":39,"commit":"4ac628b","metric":1.118,"metrics":{"win_rate":17.4,"net_pnl":223878,"total_trades":3493,"stocks_with_trades":140,"sl_exits":2812,"tp_exits":0},"status":"keep","description":"vol_surge SL=0.3% no TP 200st 0.1%slip FY","timestamp":1783623691,"segment":0}
{"run":40,"commit":"4ac628b","metric":1.3696,"metrics":{"win_rate":21.4,"net_pnl":665139,"total_trades":3493,"stocks_with_trades":140,"sl_exits":2680,"tp_exits":0},"status":"keep","description":"vol_surge SL=0.5% no TP 200st 0%slip FY","timestamp":1783623691,"segment":0}
{"run":41,"commit":"4ac628b","metric":0.8547,"metrics":{"win_rate":20.1,"net_pnl":-381426,"total_trades":3493,"stocks_with_trades":140,"sl_exits":2680,"tp_exits":0},"status":"discard","description":"vol_surge SL=0.5% no TP 200st 0.15%slip FY","timestamp":1783623691,"segment":0}
{"run":42,"commit":"4ac628b","metric":0.9427,"metrics":{"win_rate":17.2,"net_pnl":-125105,"total_trades":3493,"stocks_with_trades":140,"sl_exits":2812,"tp_exits":0},"status":"discard","description":"vol_surge SL=0.3% no TP 200st 0.15%slip FY","timestamp":1783623691,"segment":0}
{"run":43,"commit":"4ac628b","metric":0.869,"metrics":{"win_rate":27.0,"net_pnl":-425681,"total_trades":3493,"stocks_with_trades":140,"sl_exits":2310,"tp_exits":0},"status":"discard","description":"vol_surge SL=1.0% no TP 200st 0.1%slip FY","timestamp":1783623691,"segment":0}
{"run":44,"commit":"4ac628b","metric":0.8485,"metrics":{"win_rate":41.1,"net_pnl":-695050,"total_trades":3493,"stocks_with_trades":140,"sl_exits":0,"tp_exits":0},"status":"discard","description":"vol_surge no SL no TP 200st 0.1%slip FY","timestamp":1783623691,"segment":0}
{"run":45,"commit":"4ac628b","metric":0.8201,"metrics":{"win_rate":35.4,"net_pnl":-751546,"total_trades":3493,"stocks_with_trades":140,"sl_exits":1514,"tp_exits":0},"status":"discard","description":"vol_surge SL=2% no TP 200st 0.1%slip FY","timestamp":1783623691,"segment":0}
{"run":46,"commit":"4ac628b","metric":0.7585,"metrics":{"win_rate":39.2,"net_pnl":-9050506,"total_trades":32905,"stocks_with_trades":140,"sl_exits":0,"tp_exits":0},"status":"discard","description":"any_day no SL no TP 200st 0.1%slip FY","timestamp":1783623691,"segment":0}
{"run":47,"commit":"4ac628b","metric":0.72,"metrics":{"win_rate":35.2,"net_pnl":-10085836,"total_trades":32905,"stocks_with_trades":140,"sl_exits":12035,"tp_exits":0},"status":"discard","description":"any_day SL=2% no TP 200st 0.1%slip FY","timestamp":1783623691,"segment":0}
{"run":48,"commit":"4ac628b","metric":1.3856,"metrics":{"win_rate":17.6,"net_pnl":353236,"total_trades":1985,"stocks_with_trades":79,"sl_exits":1601,"tp_exits":0},"status":"keep","description":"vol_surge SL=0.3% no TP 100st 0.05%slip FY BEST REALISTIC","timestamp":1783623691,"segment":0}
{"run":49,"commit":"4ac628b","metric":1.1928,"metrics":{"win_rate":21.1,"net_pnl":226847,"total_trades":1985,"stocks_with_trades":79,"sl_exits":1523,"tp_exits":0},"status":"keep","description":"vol_surge SL=0.5% no TP 100st 0.05%slip FY","timestamp":1783623691,"segment":0}
{"run":50,"commit":"4ac628b","metric":1.0695,"metrics":{"win_rate":21.3,"net_pnl":76895,"total_trades":1879,"stocks_with_trades":76,"sl_exits":1431,"tp_exits":0},"status":"discard","description":"vol_surge SL=0.5% mcap>=5000 0.05%slip FY","timestamp":1783623691,"segment":0}
{"run":51,"commit":"630c135","metric":1.6064,"metrics":{"net_pnl":1149157,"total_trades":4218,"win_rate":22.1},"status":"keep","description":"SR+BTST SL=0.5% no_slip 117 stocks","timestamp":1783627593,"segment":0}
{"run":52,"commit":"630c135","metric":2.077,"metrics":{"net_pnl":1409497,"total_trades":4218,"win_rate":18.5},"status":"keep","description":"SR+BTST SL=0.3% no_slip best","timestamp":1783627593,"segment":0}
{"run":53,"commit":"630c135","metric":1.2533,"metrics":{"net_pnl":771468,"total_trades":4218,"win_rate":30.3},"status":"discard","description":"SR+BTST SL=1.0% no_slip","timestamp":1783627593,"segment":0}
{"run":54,"commit":"630c135","metric":1.1039,"metrics":{"net_pnl":396416,"total_trades":4218,"win_rate":36.1},"status":"discard","description":"SR+BTST SL=1.5% no_slip","timestamp":1783627593,"segment":0}
{"run":55,"commit":"630c135","metric":1.5983,"metrics":{"net_pnl":987504,"total_trades":4218,"win_rate":18.3},"status":"keep","description":"SR+BTST SL=0.3% 0.05%slip","timestamp":1783627593,"segment":0}
{"run":56,"commit":"630c135","metric":1.284,"metrics":{"net_pnl":565927,"total_trades":4218,"win_rate":18.2},"status":"keep","description":"SR+BTST SL=0.3% 0.1%slip","timestamp":1783627593,"segment":0}
{"run":57,"commit":"630c135","metric":1.3275,"metrics":{"net_pnl":727493,"total_trades":4218,"win_rate":21.8},"status":"keep","description":"SR+BTST SL=0.5% 0.05%slip","timestamp":1783627593,"segment":0}
{"run":58,"commit":"630c135","metric":1.1201,"metrics":{"net_pnl":306139,"total_trades":4218,"win_rate":21.5},"status":"keep","description":"SR+BTST SL=0.5% 0.1%slip","timestamp":1783627593,"segment":0}
{"run":59,"commit":"90576e9","metric":1.753,"metrics":{"net_pnl":1083253,"total_trades":3862,"win_rate":18.6},"status":"keep","description":"ADX(21)>35 adx_only SL=0.3% no_slip BEST","timestamp":1783628029,"segment":0}
{"run":60,"commit":"90576e9","metric":1.674,"metrics":{"net_pnl":660477,"total_trades":2603,"win_rate":17.2},"status":"keep","description":"ADX(21)>35 adx_trend_up SL=0.3% no_slip","timestamp":1783628029,"segment":0}
{"run":61,"commit":"90576e9","metric":1.665,"metrics":{"net_pnl":1458313,"total_trades":5845,"win_rate":18.3},"status":"keep","description":"ADX(21)>30 adx_only SL=0.3% no_slip","timestamp":1783628029,"segment":0}
{"run":62,"commit":"90576e9","metric":1.594,"metrics":{"net_pnl":1531499,"total_trades":6839,"win_rate":18.0},"status":"keep","description":"ADX(14)>35 adx_only SL=0.3% no_slip","timestamp":1783628029,"segment":0}
{"run":63,"commit":"90576e9","metric":1.398,"metrics":{"net_pnl":697212,"total_trades":3862,"win_rate":18.4},"status":"keep","description":"ADX(21)>35 adx_only SL=0.3% slip=0.05%","timestamp":1783628029,"segment":0}
{"run":64,"commit":"90576e9","metric":1.151,"metrics":{"net_pnl":311219,"total_trades":3862,"win_rate":18.1},"status":"keep","description":"ADX(21)>35 adx_only SL=0.3% slip=0.1%","timestamp":1783628029,"segment":0}
{"type":"config","name":"orb-winrate-80","metricName":"win_rate","metricUnit":"%","bestDirection":"higher"}
{"run":65,"commit":"8b1b09b","metric":59.26,"metrics":{"profit_factor":1.5327,"net_pnl":0.0262,"total_trades":27},"status":"keep","description":"baseline OR15 TF3 eff0.50 HL3 TP1.2 retest0 (NETWEB 5mo)","timestamp":1787697563,"segment":1}
{"run":66,"commit":"8b1b09b","metric":84.62,"metrics":{"profit_factor":4.61,"net_pnl":0.076,"total_trades":13},"status":"keep","description":"OR15 TF5 HL2 eff0.50 no-retest TP1.2 win84.6% PF4.61 (NETWEB Jan-Apr, 13tr)","timestamp":1787697975,"segment":1}
