{"run": 81, "commit": "b63ee0a", "metric": 8.9671, "metrics": {"win_rate": 50.0, "net_pnl": 10097.05, "total_trades": 10, "tp_exits": 2, "sl_exits": 1, "eod_exits": 7}, "status": "keep", "description": "minOR sweep: 1.0", "timestamp": 1785880925, "segment": 0}
{"run": 82, "commit": "b63ee0a", "metric": 5.9452, "metrics": {"win_rate": 41.7, "net_pnl": 9452.86, "total_trades": 12, "tp_exits": 2, "sl_exits": 2, "eod_exits": 8}, "status": "discard", "description": "minOR sweep: 0.6 same as 0.3", "timestamp": 1785880936, "segment": 0}
{"run": 83, "commit": "b63ee0a", "metric": 8.9671, "metrics": {"win_rate": 50.0, "net_pnl": 10097.05, "total_trades": 10, "tp_exits": 2, "sl_exits": 1, "eod_exits": 7}, "status": "keep", "description": "minOR sweep: 1.2", "timestamp": 1785880937, "segment": 0}
{"run": 84, "commit": "b63ee0a", "metric": 24.2554, "metrics": {"win_rate": 83.3, "net_pnl": 10895.87, "total_trades": 6, "tp_exits": 2, "sl_exits": 0, "eod_exits": 4}, "status": "keep", "description": "minOR sweep: 1.5", "timestamp": 1785880938, "segment": 0}
{"run": 85, "commit": "b63ee0a", "metric": 8.9671, "metrics": {"win_rate": 50.0, "net_pnl": 10097.05, "total_trades": 10, "tp_exits": 2, "sl_exits": 1, "eod_exits": 7}, "status": "discard", "description": "minOR sweep: 1.0 dup of 0.7-0.8", "timestamp": 1785880938, "segment": 0}
{"run": 86, "commit": "b63ee0a", "metric": 24.2554, "metrics": {"win_rate": 83.3, "net_pnl": 10895.87, "total_trades": 6, "tp_exits": 2, "sl_exits": 0, "eod_exits": 4}, "status": "discard", "description": "minOR=1.5 PF24.3 but only 6 trades UNRELIABLE", "timestamp": 1785880948, "segment": 0}
{"run": 87, "commit": "b63ee0a", "metric": 2.5127, "metrics": {"win_rate": 46.2, "net_pnl": 7341.68, "total_trades": 26, "tp_exits": 2, "sl_exits": 7, "eod_exits": 17}, "status": "keep", "description": "shorts ON @best minOR0.8", "timestamp": 1785880949, "segment": 0}
{"run": 88, "commit": "b63ee0a", "metric": 2.2182, "metrics": {"win_rate": 42.9, "net_pnl": 6697.49, "total_trades": 28, "tp_exits": 2, "sl_exits": 8, "eod_exits": 18}, "status": "keep", "description": "shorts ON @minOR0.3 (more trades)", "timestamp": 1785880950, "segment": 0}
{"run": 89, "commit": "b63ee0a", "metric": 8.9671, "metrics": {"win_rate": 50.0, "net_pnl": 10097.05, "total_trades": 10, "tp_exits": 2, "sl_exits": 1, "eod_exits": 7}, "status": "discard", "description": "minOR=1.2 dup of 0.8", "timestamp": 1785880951, "segment": 0}
{"run": 90, "commit": "b63ee0a", "metric": 2.5127, "metrics": {"win_rate": 46.2, "net_pnl": 7341.68, "total_trades": 26, "tp_exits": 2, "sl_exits": 7, "eod_exits": 17}, "status": "discard", "description": "shorts@0.8 PF2.51 worse, shorts hurt", "timestamp": 1785880965, "segment": 0}
{"run": 91, "commit": "b63ee0a", "metric": 4.3107, "metrics": {"win_rate": 38.5, "net_pnl": 8824.1, "total_trades": 13, "tp_exits": 2, "sl_exits": 4, "eod_exits": 7}, "status": "keep", "description": "robust: SL=0.75", "timestamp": 1785880966, "segment": 0}
{"run": 92, "commit": "b63ee0a", "metric": 9.9137, "metrics": {"win_rate": 50.0, "net_pnl": 10218.07, "total_trades": 10, "tp_exits": 2, "sl_exits": 0, "eod_exits": 8}, "status": "keep", "description": "robust: SL=1.25", "timestamp": 1785880967, "segment": 0}
{"run": 93, "commit": "b63ee0a", "metric": 2.2182, "metrics": {"win_rate": 42.9, "net_pnl": 6697.49, "total_trades": 28, "tp_exits": 2, "sl_exits": 8, "eod_exits": 18}, "status": "discard", "description": "shorts@0.3 PF2.22 worse", "timestamp": 1785880968, "segment": 0}
{"run": 94, "commit": "b63ee0a", "metric": 4.3107, "metrics": {"win_rate": 38.5, "net_pnl": 8824.1, "total_trades": 13, "tp_exits": 2, "sl_exits": 4, "eod_exits": 7}, "status": "discard", "description": "robust SL=0.75 PF4.31 worse", "timestamp": 1785880975, "segment": 0}
{"run": 95, "commit": "b63ee0a", "metric": 9.9137, "metrics": {"win_rate": 50.0, "net_pnl": 10218.07, "total_trades": 10, "tp_exits": 2, "sl_exits": 0, "eod_exits": 8}, "status": "keep", "description": "robust: SL=1.5", "timestamp": 1785880977, "segment": 0}
{"run": 96, "commit": "b63ee0a", "metric": 9.9137, "metrics": {"win_rate": 50.0, "net_pnl": 10218.07, "total_trades": 10, "tp_exits": 2, "sl_exits": 0, "eod_exits": 8}, "status": "keep", "description": "robust: SL=2.0", "timestamp": 1785880978, "segment": 0}
{"run": 97, "commit": "b63ee0a", "metric": 9.9137, "metrics": {"win_rate": 50.0, "net_pnl": 10218.07, "total_trades": 10, "tp_exits": 2, "sl_exits": 0, "eod_exits": 8}, "status": "discard", "description": "robust SL=1.5 dup of 1.25", "timestamp": 1785880990, "segment": 0}
{"run": 98, "commit": "b63ee0a", "metric": 5.9385, "metrics": {"win_rate": 45.5, "net_pnl": 9450.73, "total_trades": 11, "tp_exits": 2, "sl_exits": 1, "eod_exits": 8}, "status": "keep", "description": "robust: BUF=0.5 SL=1.25", "timestamp": 1785880991, "segment": 0}
{"run": 99, "commit": "b63ee0a", "metric": 9.2568, "metrics": {"win_rate": 50.0, "net_pnl": 9465.01, "total_trades": 10, "tp_exits": 1, "sl_exits": 0, "eod_exits": 9}, "status": "keep", "description": "robust: BUF=0.7 SL=1.25", "timestamp": 1785880992, "segment": 0}
{"run": 100, "commit": "b63ee0a", "metric": 9.9137, "metrics": {"win_rate": 50.0, "net_pnl": 10218.07, "total_trades": 10, "tp_exits": 2, "sl_exits": 0, "eod_exits": 8}, "status": "discard", "description": "robust SL=2.0 dup of 1.25", "timestamp": 1785880994, "segment": 0}
{"run": 101, "commit": "b63ee0a", "metric": 5.9385, "metrics": {"win_rate": 45.5, "net_pnl": 9450.73, "total_trades": 11, "tp_exits": 2, "sl_exits": 1, "eod_exits": 8}, "status": "discard", "description": "robust BUF=0.5 PF5.94 worse", "timestamp": 1785881002, "segment": 0}
{"run": 102, "commit": "b63ee0a", "metric": 9.9137, "metrics": {"win_rate": 50.0, "net_pnl": 10218.07, "total_trades": 10, "tp_exits": 2, "sl_exits": 0, "eod_exits": 8}, "status": "keep", "description": "robust: EOD=770", "timestamp": 1785881003, "segment": 0}
{"run": 103, "commit": "b63ee0a", "metric": 8.4681, "metrics": {"win_rate": 40.0, "net_pnl": 9493.56, "total_trades": 10, "tp_exits": 2, "sl_exits": 0, "eod_exits": 8}, "status": "keep", "description": "robust: EOD=790", "timestamp": 1785881004, "segment": 0}
{"run": 104, "commit": "b63ee0a", "metric": 9.2568, "metrics": {"win_rate": 50.0, "net_pnl": 9465.01, "total_trades": 10, "tp_exits": 1, "sl_exits": 0, "eod_exits": 9}, "status": "discard", "description": "robust BUF=0.7 PF9.26<9.91", "timestamp": 1785881005, "segment": 0}
{"run": 105, "commit": "b63ee0a", "metric": 9.9137, "metrics": {"win_rate": 50.0, "net_pnl": 10218.07, "total_trades": 10, "tp_exits": 2, "sl_exits": 0, "eod_exits": 8}, "status": "discard", "description": "robust EOD=770 same as 780", "timestamp": 1785881011, "segment": 0}
{"run": 106, "commit": "b63ee0a", "metric": 9.4828, "metrics": {"win_rate": 50.0, "net_pnl": 9724.12, "total_trades": 10, "tp_exits": 2, "sl_exits": 0, "eod_exits": 8}, "status": "keep", "description": "robust: TP=8.0 SL=1.25", "timestamp": 1785881012, "segment": 0}
{"run": 107, "commit": "b63ee0a", "metric": 9.7456, "metrics": {"win_rate": 50.0, "net_pnl": 10025.29, "total_trades": 10, "tp_exits": 1, "sl_exits": 0, "eod_exits": 9}, "status": "keep", "description": "robust: TP=9.0 SL=1.25", "timestamp": 1785881013, "segment": 0}
{"run": 108, "commit": "b63ee0a", "metric": 8.4681, "metrics": {"win_rate": 40.0, "net_pnl": 9493.56, "total_trades": 10, "tp_exits": 2, "sl_exits": 0, "eod_exits": 8}, "status": "discard", "description": "robust EOD=790 PF8.47<9.91", "timestamp": 1785881014, "segment": 0}
{"run": 109, "commit": "b63ee0a", "metric": 9.4828, "metrics": {"win_rate": 50.0, "net_pnl": 9724.12, "total_trades": 10, "tp_exits": 2, "sl_exits": 0, "eod_exits": 8}, "status": "discard", "description": "robust TP=8.0 PF9.48<9.91", "timestamp": 1785881025, "segment": 0}
{"run": 110, "commit": "b63ee0a", "metric": 9.7456, "metrics": {"win_rate": 50.0, "net_pnl": 10025.29, "total_trades": 10, "tp_exits": 1, "sl_exits": 0, "eod_exits": 9}, "status": "discard", "description": "robust TP=9.0 PF9.75<9.91", "timestamp": 1785881026, "segment": 0}
{"run": 111, "commit": "b63ee0a", "metric": 0.0, "metrics": {"win_rate": 0.0, "net_pnl": -1134.31, "total_trades": 3, "tp_exits": 0, "sl_exits": 0, "eod_exits": 3}, "status": "keep", "description": "OR60 with best params (rescue attempt)", "timestamp": 1785881026, "segment": 0}
