{"type": "config", "name": "newgen-orb-1h", "metricName": "profit_factor", "metricUnit": "ratio", "bestDirection": "higher"}
{"run": 1, "commit": "b63ee0a", "metric": 0.2796, "metrics": {"win_rate": 16.7, "net_pnl": -1722.59, "total_trades": 6.0, "tp_exits": 1.0, "sl_exits": 4.0, "eod_exits": 1.0}, "status": "keep", "description": "baseline OR=15 SL=1.0 TP=1.5 buf=0.3 cd=1 no-shorts EOD=885", "timestamp": 1785880649, "segment": 0}
{"run": 2, "commit": "b63ee0a", "metric": 0.2796, "metrics": {"win_rate": 16.7, "net_pnl": -1722.59, "total_trades": 6.0, "tp_exits": 1.0, "sl_exits": 4.0, "eod_exits": 1.0}, "status": "discard", "description": "OR sweep: OR=5", "timestamp": 1785880655, "segment": 0}
{"run": 3, "commit": "b63ee0a", "metric": 0.2796, "metrics": {"win_rate": 16.7, "net_pnl": -1722.59, "total_trades": 6.0, "tp_exits": 1.0, "sl_exits": 4.0, "eod_exits": 1.0}, "status": "discard", "description": "OR sweep: OR=10", "timestamp": 1785880656, "segment": 0}
{"run": 4, "commit": "b63ee0a", "metric": 0.2796, "metrics": {"win_rate": 16.7, "net_pnl": -1722.59, "total_trades": 6.0, "tp_exits": 1.0, "sl_exits": 4.0, "eod_exits": 1.0}, "status": "discard", "description": "OR sweep: OR=60", "timestamp": 1785880657, "segment": 0}
{"run": 5, "commit": "b63ee0a", "metric": 0.3793, "metrics": {"win_rate": 14.3, "net_pnl": -1094.02, "total_trades": 7.0, "tp_exits": 1.0, "sl_exits": 6.0, "eod_exits": 0.0}, "status": "keep", "description": "SL sweep: SL=0.5", "timestamp": 1785880662, "segment": 0}
{"run": 6, "commit": "b63ee0a", "metric": 0.2945, "metrics": {"win_rate": 14.3, "net_pnl": -1601.49, "total_trades": 7.0, "tp_exits": 1.0, "sl_exits": 5.0, "eod_exits": 1.0}, "status": "discard", "description": "SL sweep: SL=0.75", "timestamp": 1785880663, "segment": 0}
{"run": 7, "commit": "b63ee0a", "metric": 0.2567, "metrics": {"win_rate": 20.0, "net_pnl": -1936.18, "total_trades": 5.0, "tp_exits": 1.0, "sl_exits": 3.0, "eod_exits": 1.0}, "status": "discard", "description": "SL sweep: SL=1.5", "timestamp": 1785880664, "segment": 0}
{"run": 8, "commit": "b63ee0a", "metric": 0.214, "metrics": {"win_rate": 20.0, "net_pnl": -2455.51, "total_trades": 5.0, "tp_exits": 1.0, "sl_exits": 2.0, "eod_exits": 2.0}, "status": "discard", "description": "SL sweep: SL=2.0", "timestamp": 1785880665, "segment": 0}
{"run": 9, "commit": "b63ee0a", "metric": 0.5661, "metrics": {"win_rate": 14.3, "net_pnl": -512.39, "total_trades": 7.0, "tp_exits": 1.0, "sl_exits": 6.0, "eod_exits": 0.0}, "status": "keep", "description": "SL refine: SL=0.3", "timestamp": 1785880673, "segment": 0}
{"run": 10, "commit": "b63ee0a", "metric": 0.4543, "metrics": {"win_rate": 14.3, "net_pnl": -803.2, "total_trades": 7.0, "tp_exits": 1.0, "sl_exits": 6.0, "eod_exits": 0.0}, "status": "discard", "description": "SL refine: SL=0.4", "timestamp": 1785880674, "segment": 0}
{"run": 11, "commit": "b63ee0a", "metric": 0.3256, "metrics": {"win_rate": 14.3, "net_pnl": -1384.83, "total_trades": 7.0, "tp_exits": 1.0, "sl_exits": 6.0, "eod_exits": 0.0}, "status": "discard", "description": "SL refine: SL=0.6", "timestamp": 1785880674, "segment": 0}
{"run": 12, "commit": "b63ee0a", "metric": 0.7511, "metrics": {"win_rate": 14.3, "net_pnl": -221.58, "total_trades": 7.0, "tp_exits": 1.0, "sl_exits": 6.0, "eod_exits": 0.0}, "status": "keep", "description": "SL refine: SL=0.2", "timestamp": 1785880680, "segment": 0}
{"run": 13, "commit": "b63ee0a", "metric": 0.6456, "metrics": {"win_rate": 14.3, "net_pnl": -366.99, "total_trades": 7.0, "tp_exits": 1.0, "sl_exits": 6.0, "eod_exits": 0.0}, "status": "discard", "description": "SL refine: SL=0.25", "timestamp": 1785880681, "segment": 0}
{"run": 14, "commit": "b63ee0a", "metric": 0.8977, "metrics": {"win_rate": 14.3, "net_pnl": -76.17, "total_trades": 7.0, "tp_exits": 1.0, "sl_exits": 6.0, "eod_exits": 0.0}, "status": "keep", "description": "SL refine: SL=0.15", "timestamp": 1785880690, "segment": 0}
{"run": 15, "commit": "b63ee0a", "metric": 1.1155, "metrics": {"win_rate": 14.3, "net_pnl": 69.24, "total_trades": 7.0, "tp_exits": 1.0, "sl_exits": 6.0, "eod_exits": 0.0}, "status": "keep", "description": "SL refine: SL=0.1", "timestamp": 1785880691, "segment": 0}
{"run": 16, "commit": "b63ee0a", "metric": 1.2695, "metrics": {"win_rate": 14.3, "net_pnl": 141.95, "total_trades": 7.0, "tp_exits": 1.0, "sl_exits": 6.0, "eod_exits": 0.0}, "status": "keep", "description": "SL refine: SL=0.075", "timestamp": 1785880696, "segment": 0}
{"run": 17, "commit": "b63ee0a", "metric": 1.4728, "metrics": {"win_rate": 14.3, "net_pnl": 214.64, "total_trades": 7.0, "tp_exits": 1.0, "sl_exits": 6.0, "eod_exits": 0.0}, "status": "keep", "description": "SL refine: SL=0.05", "timestamp": 1785880697, "segment": 0}
{"run": 18, "commit": "b63ee0a", "metric": 0.9445, "metrics": {"win_rate": 14.3, "net_pnl": -25.21, "total_trades": 7.0, "tp_exits": 1.0, "sl_exits": 6.0, "eod_exits": 0.0}, "status": "discard", "description": "TP sweep @SL=0.05: TP=1.0", "timestamp": 1785880716, "segment": 0}
{"run": 19, "commit": "b63ee0a", "metric": 0.0, "metrics": {"win_rate": 0.0, "net_pnl": -528.89, "total_trades": 7.0, "tp_exits": 0.0, "sl_exits": 7.0, "eod_exits": 0.0}, "status": "discard", "description": "TP sweep @SL=0.05: TP=2.0", "timestamp": 1785880717, "segment": 0}
{"run": 20, "commit": "b63ee0a", "metric": 0.0, "metrics": {"win_rate": 0.0, "net_pnl": -528.89, "total_trades": 7.0, "tp_exits": 0.0, "sl_exits": 7.0, "eod_exits": 0.0}, "status": "discard", "description": "TP sweep @SL=0.05: TP=3.0", "timestamp": 1785880718, "segment": 0}
{"run": 21, "commit": "b63ee0a", "metric": 0.0, "metrics": {"win_rate": 0.0, "net_pnl": -528.89, "total_trades": 7.0, "tp_exits": 0.0, "sl_exits": 7.0, "eod_exits": 0.0}, "status": "discard", "description": "TP sweep @SL=0.05: TP=4.0", "timestamp": 1785880719, "segment": 0}
{"run": 22, "commit": "b63ee0a", "metric": 0.0, "metrics": {"win_rate": 0.0, "net_pnl": -383.88, "total_trades": 7.0, "tp_exits": 6.0, "sl_exits": 1.0, "eod_exits": 0.0}, "status": "discard", "description": "TP sweep @SL=0.05: TP=0 (no TP)", "timestamp": 1785880720, "segment": 0}
{"run": 23, "commit": "b63ee0a", "metric": 0.7906, "metrics": {"win_rate": 8.3, "net_pnl": -177.14, "total_trades": 12.0, "tp_exits": 1.0, "sl_exits": 11.0, "eod_exits": 0.0}, "status": "discard", "description": "buffer sweep @SL=0.05/TP=1.5: buf=0.0", "timestamp": 1785880730, "segment": 0}
{"run": 24, "commit": "b63ee0a", "metric": 1.7697, "metrics": {"win_rate": 16.7, "net_pnl": 290.81, "total_trades": 6.0, "tp_exits": 1.0, "sl_exits": 5.0, "eod_exits": 0.0}, "status": "keep", "description": "buffer sweep @SL=0.05/TP=1.5: buf=0.5", "timestamp": 1785880731, "segment": 0}
{"run": 25, "commit": "b63ee0a", "metric": 1.4728, "metrics": {"win_rate": 14.3, "net_pnl": 214.64, "total_trades": 7.0, "tp_exits": 1.0, "sl_exits": 6.0, "eod_exits": 0.0}, "status": "discard", "description": "cooldown sweep @best: cd=0", "timestamp": 1785880732, "segment": 0}
{"run": 26, "commit": "b63ee0a", "metric": 1.7712, "metrics": {"win_rate": 16.7, "net_pnl": 291.14, "total_trades": 6.0, "tp_exits": 1.0, "sl_exits": 5.0, "eod_exits": 0.0}, "status": "keep", "description": "cooldown sweep @best: cd=2", "timestamp": 1785880732, "segment": 0}
{"run": 27, "commit": "b63ee0a", "metric": 0.6277, "metrics": {"win_rate": 6.7, "net_pnl": -786.9, "total_trades": 30.0, "tp_exits": 2.0, "sl_exits": 28.0, "eod_exits": 0.0}, "status": "discard", "description": "shorts ON @SL=0.05/TP=1.5/buf=0.3", "timestamp": 1785880748, "segment": 0}
{"run": 28, "commit": "b63ee0a", "metric": 1.7712, "metrics": {"win_rate": 16.7, "net_pnl": 291.14, "total_trades": 6.0, "tp_exits": 1.0, "sl_exits": 5.0, "eod_exits": 0.0}, "status": "discard", "description": "EOD sweep @best: EOD=870", "timestamp": 1785880749, "segment": 0}
{"run": 29, "commit": "b63ee0a", "metric": 1.7712, "metrics": {"win_rate": 16.7, "net_pnl": 291.14, "total_trades": 6.0, "tp_exits": 1.0, "sl_exits": 5.0, "eod_exits": 0.0}, "status": "discard", "description": "EOD sweep @best: EOD=900", "timestamp": 1785880749, "segment": 0}
{"run": 30, "commit": "b63ee0a", "metric": 2.164, "metrics": {"win_rate": 20.0, "net_pnl": 359.66, "total_trades": 5.0, "tp_exits": 1.0, "sl_exits": 4.0, "eod_exits": 0.0}, "status": "keep", "description": "buf=0.5 + cd=2 combo @SL=0.05/TP=1.5", "timestamp": 1785880750, "segment": 0}
{"run": 31, "commit": "b63ee0a", "metric": 1.7712, "metrics": {"win_rate": 16.7, "net_pnl": 291.14, "total_trades": 6.0, "tp_exits": 1.0, "sl_exits": 5.0, "eod_exits": 0.0}, "status": "discard", "description": "perturb buf=0.4 @best", "timestamp": 1785880761, "segment": 0}
{"run": 32, "commit": "b63ee0a", "metric": 0.0, "metrics": {"win_rate": 0.0, "net_pnl": -308.98, "total_trades": 4.0, "tp_exits": 0.0, "sl_exits": 4.0, "eod_exits": 0.0}, "status": "discard", "description": "perturb buf=0.6 @best", "timestamp": 1785880762, "segment": 0}
{"run": 33, "commit": "b63ee0a", "metric": 0.0, "metrics": {"win_rate": 0.0, "net_pnl": -235.2, "total_trades": 3.0, "tp_exits": 0.0, "sl_exits": 3.0, "eod_exits": 0.0}, "status": "discard", "description": "perturb buf=0.7 @best", "timestamp": 1785880763, "segment": 0}
{"run": 34, "commit": "b63ee0a", "metric": 2.482, "metrics": {"win_rate": 20.0, "net_pnl": 399.25, "total_trades": 5.0, "tp_exits": 1.0, "sl_exits": 4.0, "eod_exits": 0.0}, "status": "keep", "description": "perturb SL=0.03 @best", "timestamp": 1785880763, "segment": 0}
{"run": 35, "commit": "b63ee0a", "metric": 2.6787, "metrics": {"win_rate": 20.0, "net_pnl": 419.03, "total_trades": 5.0, "tp_exits": 1.0, "sl_exits": 4.0, "eod_exits": 0.0}, "status": "keep", "description": "perturb SL=0.02 @best", "timestamp": 1785880772, "segment": 0}
{"run": 36, "commit": "b63ee0a", "metric": 2.9095, "metrics": {"win_rate": 20.0, "net_pnl": 438.83, "total_trades": 5.0, "tp_exits": 1.0, "sl_exits": 4.0, "eod_exits": 0.0}, "status": "keep", "description": "perturb SL=0.01 @best", "timestamp": 1785880773, "segment": 0}
{"run": 37, "commit": "b63ee0a", "metric": 2.6787, "metrics": {"win_rate": 20.0, "net_pnl": 419.03, "total_trades": 5.0, "tp_exits": 1.0, "sl_exits": 4.0, "eod_exits": 0.0}, "status": "discard", "description": "min_entry=60min @SL=0.02/buf=0.5/cd=2", "timestamp": 1785880789, "segment": 0}
{"run": 38, "commit": "b63ee0a", "metric": 2.6887, "metrics": {"win_rate": 20.0, "net_pnl": 419.96, "total_trades": 5.0, "tp_exits": 1.0, "sl_exits": 4.0, "eod_exits": 0.0}, "status": "discard", "description": "min_entry=120min @SL=0.02/buf=0.5/cd=2", "timestamp": 1785880790, "segment": 0}
{"run": 39, "commit": "b63ee0a", "metric": 0.3396, "metrics": {"win_rate": 14.3, "net_pnl": -1163.98, "total_trades": 7.0, "tp_exits": 0.0, "sl_exits": 6.0, "eod_exits": 1.0}, "status": "discard", "description": "realistic regime SL=0.5/TP=2.0/buf=0.3/cd=1", "timestamp": 1785880791, "segment": 0}
{"run": 40, "commit": "b63ee0a", "metric": 0.3233, "metrics": {"win_rate": 20.0, "net_pnl": -1252.84, "total_trades": 5.0, "tp_exits": 0.0, "sl_exits": 3.0, "eod_exits": 2.0}, "status": "discard", "description": "wide regime SL=1.0/TP=3.0/buf=0.5/cd=0", "timestamp": 1785880792, "segment": 0}
{"run": 41, "commit": "b63ee0a", "metric": 2.7007, "metrics": {"win_rate": 20.0, "net_pnl": 390.86, "total_trades": 5.0, "tp_exits": 1.0, "sl_exits": 4.0, "eod_exits": 0.0}, "status": "discard", "description": "TP perturb 1.4 @best", "timestamp": 1785880800, "segment": 0}
{"run": 42, "commit": "b63ee0a", "metric": 3.1182, "metrics": {"win_rate": 20.0, "net_pnl": 486.8, "total_trades": 5.0, "tp_exits": 1.0, "sl_exits": 4.0, "eod_exits": 0.0}, "status": "keep", "description": "TP perturb 1.6 @best", "timestamp": 1785880802, "segment": 0}
{"run": 43, "commit": "b63ee0a", "metric": 3.4313, "metrics": {"win_rate": 20.0, "net_pnl": 558.75, "total_trades": 5.0, "tp_exits": 1.0, "sl_exits": 4.0, "eod_exits": 0.0}, "status": "keep", "description": "TP=1.75 @best (near ceiling)", "timestamp": 1785880844, "segment": 0}
{"run": 44, "commit": "b63ee0a", "metric": 3.5148, "metrics": {"win_rate": 20.0, "net_pnl": 577.94, "total_trades": 5.0, "tp_exits": 1.0, "sl_exits": 4.0, "eod_exits": 0.0}, "status": "keep", "description": "TP=1.79 @best (exact ceiling)", "timestamp": 1785880845, "segment": 0}
{"run": 45, "commit": "b63ee0a", "metric": 0.0, "metrics": {"win_rate": 0.0, "net_pnl": -285.51, "total_trades": 5.0, "tp_exits": 0.0, "sl_exits": 5.0, "eod_exits": 0.0}, "status": "discard", "description": "TP=1.80 @best (just past ceiling)", "timestamp": 1785880845, "segment": 0}
