{"run": 73, "commit": "b63ee0a", "metric": 4.2328, "metrics": {"win_rate": 50.0, "net_pnl": 10027.07, "total_trades": 14, "tp_exits": 0, "sl_exits": 5, "eod_exits": 9}, "status": "discard", "description": "OR=15 SL=1.0 TP=100 buffer=0.5 cooldown=3 EOD=845 min_or_range=0.8", "timestamp": 1785881024, "segment": 0}
{"run": 74, "commit": "b63ee0a", "metric": 4.5015, "metrics": {"win_rate": 50.0, "net_pnl": 10212.25, "total_trades": 14, "tp_exits": 0, "sl_exits": 5, "eod_exits": 9}, "status": "keep", "description": "OR=15 SL=1.0 TP=100 buffer=0.45 cooldown=3 EOD=845 mor=0.8 min_entry=15", "timestamp": 1785881035, "segment": 0}
{"run": 75, "commit": "b63ee0a", "metric": 3.463, "metrics": {"win_rate": 42.9, "net_pnl": 9108.71, "total_trades": 14, "tp_exits": 0, "sl_exits": 6, "eod_exits": 8}, "status": "discard", "description": "OR=15 SL=1.0 TP=100 buffer=0.45 cooldown=3 EOD=845 mor=0.8 min_entry=30", "timestamp": 1785881036, "segment": 0}
{"run": 76, "commit": "b63ee0a", "metric": 2.8754, "metrics": {"win_rate": 41.7, "net_pnl": 5469.7, "total_trades": 12, "tp_exits": 0, "sl_exits": 5, "eod_exits": 7}, "status": "discard", "description": "OR=15 SL=1.0 TP=100 buffer=0.45 cooldown=3 EOD=845 mor=0.8 max_per_day=1", "timestamp": 1785881037, "segment": 0}
{"run": 77, "commit": "b63ee0a", "metric": 3.5928, "metrics": {"win_rate": 43.8, "net_pnl": 9492.63, "total_trades": 16, "tp_exits": 0, "sl_exits": 7, "eod_exits": 9}, "status": "discard", "description": "robustness: OR=15 SL=0.9 TP=100 buffer=0.45 cd=3 EOD=845 mor=0.8", "timestamp": 1785881050, "segment": 0}
{"run": 78, "commit": "b63ee0a", "metric": 4.1497, "metrics": {"win_rate": 50.0, "net_pnl": 9964.96, "total_trades": 14, "tp_exits": 0, "sl_exits": 5, "eod_exits": 9}, "status": "discard", "description": "robustness: OR=15 SL=1.1 TP=100 buffer=0.45 cd=3 EOD=845 mor=0.8", "timestamp": 1785881051, "segment": 0}
{"run": 79, "commit": "b63ee0a", "metric": 3.8001, "metrics": {"win_rate": 46.7, "net_pnl": 9673.92, "total_trades": 15, "tp_exits": 0, "sl_exits": 6, "eod_exits": 9}, "status": "discard", "description": "robustness: OR=15 SL=1.0 TP=100 buffer=0.43 cd=3 EOD=845 mor=0.8", "timestamp": 1785881052, "segment": 0}
{"run": 80, "commit": "b63ee0a", "metric": 4.2329, "metrics": {"win_rate": 50.0, "net_pnl": 10027.18, "total_trades": 14, "tp_exits": 0, "sl_exits": 5, "eod_exits": 9}, "status": "discard", "description": "robustness: OR=15 SL=1.0 TP=100 buffer=0.47 cd=3 EOD=845 mor=0.8", "timestamp": 1785881053, "segment": 0}
{"run": 81, "commit": "b63ee0a", "metric": 4.4295, "metrics": {"win_rate": 50.0, "net_pnl": 10002.17, "total_trades": 14, "tp_exits": 0, "sl_exits": 5, "eod_exits": 9}, "status": "discard", "description": "robustness: OR=15 SL=1.0 TP=100 buffer=0.45 cd=2 EOD=845 mor=0.8", "timestamp": 1785881064, "segment": 0}
{"run": 82, "commit": "b63ee0a", "metric": 4.3643, "metrics": {"win_rate": 50.0, "net_pnl": 9812.09, "total_trades": 14, "tp_exits": 0, "sl_exits": 5, "eod_exits": 9}, "status": "discard", "description": "robustness: OR=15 SL=1.0 TP=100 buffer=0.45 cd=4 EOD=845 mor=0.8", "timestamp": 1785881065, "segment": 0}
{"run": 83, "commit": "b63ee0a", "metric": 0.3852, "metrics": {"win_rate": 40.0, "net_pnl": -1479.0, "total_trades": 10, "tp_exits": 0, "sl_exits": 4, "eod_exits": 6}, "status": "discard", "description": "OR=15 SL=1.0 TP=100 buffer=0.45 cd=3 EOD=845 mor=0.8 max_or_range=3.0", "timestamp": 1785881066, "segment": 0}
{"run": 84, "commit": "b63ee0a", "metric": 3.4673, "metrics": {"win_rate": 45.5, "net_pnl": 5935.14, "total_trades": 11, "tp_exits": 0, "sl_exits": 4, "eod_exits": 7}, "status": "discard", "description": "OR=15 SL=1.0 TP=100 buffer=0.45 cd=3 EOD=845 mor=0.8 max_or_range=4.0", "timestamp": 1785881067, "segment": 0}
{"run": 85, "commit": "b63ee0a", "metric": 4.5015, "metrics": {"win_rate": 50.0, "net_pnl": 10212.25, "total_trades": 14, "tp_exits": 0, "sl_exits": 5, "eod_exits": 9}, "status": "keep", "description": "OR=15 SL=1.0 TP=100 buffer=0.45 cd=3 EOD=843 mor=0.8", "timestamp": 1785881083, "segment": 0}
{"run": 86, "commit": "b63ee0a", "metric": 3.856, "metrics": {"win_rate": 40.0, "net_pnl": 9072.68, "total_trades": 15, "tp_exits": 0, "sl_exits": 5, "eod_exits": 10}, "status": "discard", "description": "OR=15 SL=1.0 TP=100 buffer=0.45 cd=3 EOD=847 mor=0.8", "timestamp": 1785881084, "segment": 0}
{"run": 87, "commit": "b63ee0a", "metric": 5.2801, "metrics": {"win_rate": 57.1, "net_pnl": 10975.65, "total_trades": 14, "tp_exits": 0, "sl_exits": 5, "eod_exits": 9}, "status": "keep", "description": "OR=15 SL=1.0 TP=100 buffer=0.45 cd=3 EOD=845 mor=0.8 COSTS=0 (PF inflated, for reference)", "timestamp": 1785881086, "segment": 0}
{"run": 88, "commit": "b63ee0a", "metric": 2.834, "metrics": {"win_rate": 40.9, "net_pnl": 10553.95, "total_trades": 22, "tp_exits": 0, "sl_exits": 9, "eod_exits": 13}, "status": "discard", "description": "tuned at OR=5 SL=1.0 TP=100 buffer=0.45 cd=3 EOD=845 mor=0.8", "timestamp": 1785881096, "segment": 0}
{"run": 89, "commit": "b63ee0a", "metric": 3.1494, "metrics": {"win_rate": 44.4, "net_pnl": 9373.02, "total_trades": 18, "tp_exits": 0, "sl_exits": 7, "eod_exits": 11}, "status": "discard", "description": "tuned at OR=10 SL=1.0 TP=100 buffer=0.45 cd=3 EOD=845 mor=0.8", "timestamp": 1785881097, "segment": 0}
{"run": 90, "commit": "b63ee0a", "metric": 0.0356, "metrics": {"win_rate": 20.0, "net_pnl": -1758.27, "total_trades": 5, "tp_exits": 0, "sl_exits": 2, "eod_exits": 3}, "status": "discard", "description": "tuned at OR=60 SL=1.0 TP=100 buffer=0.45 cd=3 EOD=845 mor=0.8", "timestamp": 1785881098, "segment": 0}
{"run": 91, "commit": "b63ee0a", "metric": 4.0294, "metrics": {"win_rate": 46.7, "net_pnl": 9870.52, "total_trades": 15, "tp_exits": 0, "sl_exits": 5, "eod_exits": 10}, "status": "discard", "description": "robustness: OR=15 SL=1.0 TP=100 buffer=0.45 cd=3 EOD=845 mor=0.6", "timestamp": 1785881117, "segment": 0}
{"run": 92, "commit": "b63ee0a", "metric": 4.5015, "metrics": {"win_rate": 50.0, "net_pnl": 10212.25, "total_trades": 14, "tp_exits": 0, "sl_exits": 5, "eod_exits": 9}, "status": "discard", "description": "robustness: OR=15 SL=1.0 TP=100 buffer=0.45 cd=3 EOD=845 mor=0.7", "timestamp": 1785881118, "segment": 0}
{"run": 93, "commit": "b63ee0a", "metric": 4.5015, "metrics": {"win_rate": 50.0, "net_pnl": 10212.25, "total_trades": 14, "tp_exits": 0, "sl_exits": 5, "eod_exits": 9}, "status": "discard", "description": "robustness: OR=15 SL=1.0 TP=100 buffer=0.45 cd=3 EOD=845 mor=0.9", "timestamp": 1785881119, "segment": 0}
{"run": 94, "commit": "b63ee0a", "metric": 3.856, "metrics": {"win_rate": 40.0, "net_pnl": 9072.68, "total_trades": 15, "tp_exits": 0, "sl_exits": 5, "eod_exits": 10}, "status": "discard", "description": "robustness: OR=15 SL=1.0 TP=100 buffer=0.45 cd=3 EOD=846 mor=0.8", "timestamp": 1785881120, "segment": 0}
{"run": 95, "commit": "b63ee0a", "metric": 4.5015, "metrics": {"win_rate": 50.0, "net_pnl": 10212.25, "total_trades": 14, "tp_exits": 0, "sl_exits": 5, "eod_exits": 9}, "status": "discard", "description": "OR=15 SL=1.0 TP=100 buffer=0.45 cd=3 EOD=845 mor=1.1", "timestamp": 1785881141, "segment": 0}
{"run": 96, "commit": "b63ee0a", "metric": 5.8596, "metrics": {"win_rate": 54.5, "net_pnl": 10872.16, "total_trades": 11, "tp_exits": 0, "sl_exits": 4, "eod_exits": 7}, "status": "keep", "description": "OR=15 SL=1.0 TP=100 buffer=0.45 cd=3 EOD=845 mor=1.3 [NEW BEST reliable]", "timestamp": 1785881142, "segment": 0}
{"run": 97, "commit": "b63ee0a", "metric": 8.0206, "metrics": {"win_rate": 62.5, "net_pnl": 11072.41, "total_trades": 8, "tp_exits": 0, "sl_exits": 3, "eod_exits": 5}, "status": "discard", "description": "OR=15 SL=1.0 TP=100 buffer=0.45 cd=3 EOD=845 mor=1.4 [<10 trades unreliable]", "timestamp": 1785881142, "segment": 0}
{"run": 98, "commit": "b63ee0a", "metric": 5.4917, "metrics": {"win_rate": 50.0, "net_pnl": 10722.26, "total_trades": 12, "tp_exits": 0, "sl_exits": 4, "eod_exits": 8}, "status": "discard", "description": "OR=15 SL=1.0 TP=100 buffer=0.45 cd=3 EOD=845 mor=1.25", "timestamp": 1785881143, "segment": 0}
{"run": 99, "commit": "b63ee0a", "metric": 7.8637, "metrics": {"win_rate": 55.6, "net_pnl": 11040.94, "total_trades": 9, "tp_exits": 0, "sl_exits": 3, "eod_exits": 6}, "status": "discard", "description": "OR=15 SL=1.0 TP=100 buffer=0.45 cd=3 EOD=845 mor=1.35 [<10 trades unreliable]", "timestamp": 1785881144, "segment": 0}
{"run": 100, "commit": "b63ee0a", "metric": 5.1407, "metrics": {"win_rate": 50.0, "net_pnl": 10559.28, "total_trades": 12, "tp_exits": 0, "sl_exits": 5, "eod_exits": 7}, "status": "discard", "description": "robust@mor1.3: SL=0.9", "timestamp": 1785881164, "segment": 0}
{"run": 101, "commit": "b63ee0a", "metric": 5.3801, "metrics": {"win_rate": 54.5, "net_pnl": 10672.73, "total_trades": 11, "tp_exits": 0, "sl_exits": 4, "eod_exits": 7}, "status": "discard", "description": "robust@mor1.3: SL=1.1", "timestamp": 1785881166, "segment": 0}
{"run": 102, "commit": "b63ee0a", "metric": 4.7843, "metrics": {"win_rate": 53.8, "net_pnl": 10503.64, "total_trades": 13, "tp_exits": 0, "sl_exits": 5, "eod_exits": 8}, "status": "discard", "description": "robust@mor1.3: buffer=0.4", "timestamp": 1785881167, "segment": 0}
{"run": 103, "commit": "b63ee0a", "metric": 5.4117, "metrics": {"win_rate": 54.5, "net_pnl": 10686.98, "total_trades": 11, "tp_exits": 0, "sl_exits": 4, "eod_exits": 7}, "status": "discard", "description": "robust@mor1.3: buffer=0.5", "timestamp": 1785881169, "segment": 0}
{"run": 104, "commit": "b63ee0a", "metric": 5.5122, "metrics": {"win_rate": 63.6, "net_pnl": 9952.77, "total_trades": 11, "tp_exits": 0, "sl_exits": 4, "eod_exits": 7}, "status": "discard", "description": "robust@mor1.3: EOD=840", "timestamp": 1785881170, "segment": 0}
{"run": 105, "commit": "b63ee0a", "metric": 4.8901, "metrics": {"win_rate": 41.7, "net_pnl": 9637.64, "total_trades": 12, "tp_exits": 0, "sl_exits": 4, "eod_exits": 8}, "status": "discard", "description": "robust@mor1.3: EOD=850", "timestamp": 1785881172, "segment": 0}
{"run": 106, "commit": "b63ee0a", "metric": 5.7657, "metrics": {"win_rate": 54.5, "net_pnl": 10662.08, "total_trades": 11, "tp_exits": 0, "sl_exits": 4, "eod_exits": 7}, "status": "discard", "description": "robust@mor1.3: cooldown=2", "timestamp": 1785881173, "segment": 0}
{"run": 107, "commit": "b63ee0a", "metric": 5.6808, "metrics": {"win_rate": 54.5, "net_pnl": 10472.0, "total_trades": 11, "tp_exits": 0, "sl_exits": 4, "eod_exits": 7}, "status": "discard", "description": "robust@mor1.3: cooldown=4", "timestamp": 1785881175, "segment": 0}
{"run": 108, "commit": "b63ee0a", "metric": 5.8596, "metrics": {"win_rate": 54.5, "net_pnl": 10872.16, "total_trades": 11, "tp_exits": 0, "sl_exits": 4, "eod_exits": 7}, "status": "keep", "description": "robust@mor1.3: mor=1.28 (same as 1.3)", "timestamp": 1785881211, "segment": 0}
{"run": 109, "commit": "b63ee0a", "metric": 5.8596, "metrics": {"win_rate": 54.5, "net_pnl": 10872.16, "total_trades": 11, "tp_exits": 0, "sl_exits": 4, "eod_exits": 7}, "status": "keep", "description": "robust@mor1.3: mor=1.32 (same as 1.3)", "timestamp": 1785881213, "segment": 0}
{"run": 110, "commit": "b63ee0a", "metric": 5.8596, "metrics": {"win_rate": 54.5, "net_pnl": 10872.16, "total_trades": 11, "tp_exits": 0, "sl_exits": 4, "eod_exits": 7}, "status": "keep", "description": "robust@mor1.3: EOD=843 (same as 845)", "timestamp": 1785881215, "segment": 0}
{"run": 111, "commit": "b63ee0a", "metric": 4.6722, "metrics": {"win_rate": 50.0, "net_pnl": 10303.54, "total_trades": 12, "tp_exits": 0, "sl_exits": 5, "eod_exits": 7}, "status": "discard", "description": "robust@mor1.3: max_or_range=6.0", "timestamp": 1785881217, "segment": 0}
{"run": 112, "commit": "b63ee0a", "metric": 4.858, "metrics": {"win_rate": 55.6, "net_pnl": 6659.95, "total_trades": 9, "tp_exits": 0, "sl_exits": 3, "eod_exits": 6}, "status": "discard", "description": "robust@mor1.3: max_or_range=4.5 [9 trades]", "timestamp": 1785881219, "segment": 0}
{"run": 113, "commit": "b63ee0a", "metric": 5.8596, "metrics": {"win_rate": 54.5, "net_pnl": 10872.16, "total_trades": 11, "tp_exits": 0, "sl_exits": 4, "eod_exits": 7}, "status": "keep", "description": "FINAL confirmation: OR=15 SL=1.0 TP=100(no cap) buffer=0.45 cd=3 EOD=845 mor=1.3", "timestamp": 1785881220, "segment": 0}
{"run": 114, "commit": "b63ee0a", "metric": 3.7516, "metrics": {"win_rate": 43.8, "net_pnl": 11727.25, "total_trades": 16, "tp_exits": 0, "sl_exits": 7, "eod_exits": 9}, "status": "discard", "description": "per-OR: OR=5 SL=1.0 TP=100 buf=0.45 cd=3 EOD=845 mor=1.3 [best OR=5]", "timestamp": 1785881248, "segment": 0}
{"run": 115, "commit": "b63ee0a", "metric": 3.7253, "metrics": {"win_rate": 46.7, "net_pnl": 10032.93, "total_trades": 15, "tp_exits": 0, "sl_exits": 6, "eod_exits": 9}, "status": "discard", "description": "per-OR: OR=10 SL=1.0 TP=100 buf=0.45 cd=3 EOD=845 mor=1.3 [best OR=10]", "timestamp": 1785881250, "segment": 0}
{"run": 116, "commit": "b63ee0a", "metric": 2.7611, "metrics": {"win_rate": 53.8, "net_pnl": 8591.06, "total_trades": 13, "tp_exits": 0, "sl_exits": 4, "eod_exits": 9}, "status": "discard", "description": "per-OR: OR=10 SL=2.0 TP=100 buf=0.45 cd=3 EOD=845 mor=1.3", "timestamp": 1785881251, "segment": 0}
{"run": 117, "commit": "b63ee0a", "metric": 2.9364, "metrics": {"win_rate": 46.7, "net_pnl": 10544.1, "total_trades": 15, "tp_exits": 0, "sl_exits": 6, "eod_exits": 9}, "status": "discard", "description": "per-OR: OR=5 SL=1.5 TP=100 buf=0.45 cd=3 EOD=845 mor=1.3", "timestamp": 1785881253, "segment": 0}
