{"type":"config","name":"newgen-orb-5m","metricName":"profit_factor","metricUnit":"ratio","bestDirection":"higher"}
{"run": 1, "commit": "b63ee0a", "metric": 0.9548, "metrics": {"win_rate": 45.9, "net_pnl": -777.7, "total_trades": 61, "tp_exits": 22, "sl_exits": 29, "eod_exits": 10}, "status": "keep", "description": "baseline OR=15 SL=1.0 TP=1.5 buffer=0.3 cooldown=1 shorts=0 EOD=900 min_or_range=0.3", "timestamp": 1785880625, "segment": 0}
{"run": 2, "commit": "b63ee0a", "metric": 0.9277, "metrics": {"win_rate": 43.9, "net_pnl": -1718.72, "total_trades": 82, "tp_exits": 30, "sl_exits": 38, "eod_exits": 14}, "status": "discard", "description": "OR sweep: OR=5 SL=1.0 TP=1.5 buffer=0.3 cooldown=1 EOD=900", "timestamp": 1785880637, "segment": 0}
{"run": 3, "commit": "b63ee0a", "metric": 0.9823, "metrics": {"win_rate": 46.3, "net_pnl": -331.46, "total_trades": 67, "tp_exits": 25, "sl_exits": 31, "eod_exits": 11}, "status": "keep", "description": "OR sweep: OR=10 SL=1.0 TP=1.5 buffer=0.3 cooldown=1 EOD=900", "timestamp": 1785880639, "segment": 0}
{"run": 4, "commit": "b63ee0a", "metric": 0.6136, "metrics": {"win_rate": 30.8, "net_pnl": -1356.52, "total_trades": 13, "tp_exits": 3, "sl_exits": 6, "eod_exits": 4}, "status": "discard", "description": "OR sweep: OR=60 SL=1.0 TP=1.5 buffer=0.3 cooldown=1 EOD=900", "timestamp": 1785880639, "segment": 0}
{"run": 5, "commit": "b63ee0a", "metric": 1.0346, "metrics": {"win_rate": 34.7, "net_pnl": 656.8, "total_trades": 95, "tp_exits": 26, "sl_exits": 60, "eod_exits": 9}, "status": "keep", "description": "OR=10 SL=0.5 TP=1.5 buffer=0.3 cooldown=1 EOD=900", "timestamp": 1785880653, "segment": 0}
{"run": 6, "commit": "b63ee0a", "metric": 1.0372, "metrics": {"win_rate": 41.6, "net_pnl": 695.85, "total_trades": 77, "tp_exits": 26, "sl_exits": 40, "eod_exits": 11}, "status": "keep", "description": "OR=10 SL=0.75 TP=1.5 buffer=0.3 cooldown=1 EOD=900", "timestamp": 1785880654, "segment": 0}
{"run": 7, "commit": "b63ee0a", "metric": 1.1409, "metrics": {"win_rate": 51.7, "net_pnl": 2354.69, "total_trades": 58, "tp_exits": 26, "sl_exits": 21, "eod_exits": 11}, "status": "keep", "description": "OR=10 SL=1.25 TP=1.5 buffer=0.3 cooldown=1 EOD=900", "timestamp": 1785880656, "segment": 0}
{"run": 8, "commit": "b63ee0a", "metric": 1.1235, "metrics": {"win_rate": 53.6, "net_pnl": 2108.6, "total_trades": 56, "tp_exits": 26, "sl_exits": 17, "eod_exits": 13}, "status": "discard", "description": "OR=10 SL=1.5 TP=1.5 buffer=0.3 cooldown=1 EOD=900", "timestamp": 1785880657, "segment": 0}
{"run": 9, "commit": "b63ee0a", "metric": 1.092, "metrics": {"win_rate": 58.3, "net_pnl": 1456.19, "total_trades": 48, "tp_exits": 23, "sl_exits": 12, "eod_exits": 13}, "status": "discard", "description": "OR=10 SL=2.0 TP=1.5 buffer=0.3 cooldown=1 EOD=900", "timestamp": 1785880673, "segment": 0}
{"run": 10, "commit": "b63ee0a", "metric": 1.4542, "metrics": {"win_rate": 62.8, "net_pnl": 5335.64, "total_trades": 43, "tp_exits": 23, "sl_exits": 5, "eod_exits": 15}, "status": "keep", "description": "OR=10 SL=2.5 TP=1.5 buffer=0.3 cooldown=1 EOD=900", "timestamp": 1785880674, "segment": 0}
{"run": 11, "commit": "b63ee0a", "metric": 1.4499, "metrics": {"win_rate": 63.4, "net_pnl": 5052.77, "total_trades": 41, "tp_exits": 22, "sl_exits": 2, "eod_exits": 17}, "status": "discard", "description": "OR=10 SL=3.0 TP=1.5 buffer=0.3 cooldown=1 EOD=900", "timestamp": 1785880683, "segment": 0}
{"run": 12, "commit": "b63ee0a", "metric": 1.3931, "metrics": {"win_rate": 62.5, "net_pnl": 4588.99, "total_trades": 40, "tp_exits": 22, "sl_exits": 1, "eod_exits": 17}, "status": "discard", "description": "OR=10 SL=4.0 TP=1.5 buffer=0.3 cooldown=1 EOD=900", "timestamp": 1785880684, "segment": 0}
{"run": 13, "commit": "b63ee0a", "metric": 1.3321, "metrics": {"win_rate": 69.1, "net_pnl": 4117.7, "total_trades": 55, "tp_exits": 35, "sl_exits": 5, "eod_exits": 15}, "status": "discard", "description": "OR=10 SL=2.5 TP=1.0 buffer=0.3 cooldown=1 EOD=900", "timestamp": 1785880702, "segment": 0}
{"run": 14, "commit": "b63ee0a", "metric": 1.3105, "metrics": {"win_rate": 58.3, "net_pnl": 3852.57, "total_trades": 36, "tp_exits": 15, "sl_exits": 6, "eod_exits": 15}, "status": "discard", "description": "OR=10 SL=2.5 TP=2.0 buffer=0.3 cooldown=1 EOD=900", "timestamp": 1785880703, "segment": 0}
{"run": 15, "commit": "b63ee0a", "metric": 1.5006, "metrics": {"win_rate": 51.7, "net_pnl": 5232.12, "total_trades": 29, "tp_exits": 9, "sl_exits": 4, "eod_exits": 16}, "status": "keep", "description": "OR=10 SL=2.5 TP=3.0 buffer=0.3 cooldown=1 EOD=900", "timestamp": 1785880704, "segment": 0}
{"run": 16, "commit": "b63ee0a", "metric": 0.0, "metrics": {"win_rate": 0.0, "net_pnl": -17904.01, "total_trades": 280, "tp_exits": 276, "sl_exits": 1, "eod_exits": 3}, "status": "discard", "description": "OR=10 SL=2.5 TP=0(degenerate=immediate TP) buffer=0.3 cooldown=1 EOD=900", "timestamp": 1785880705, "segment": 0}
{"run": 17, "commit": "b63ee0a", "metric": 2.0577, "metrics": {"win_rate": 44.4, "net_pnl": 7081.02, "total_trades": 18, "tp_exits": 0, "sl_exits": 2, "eod_exits": 16}, "status": "keep", "description": "OR=10 SL=2.5 TP=100(no cap) buffer=0.3 cooldown=1 EOD=900", "timestamp": 1785880717, "segment": 0}
{"run": 18, "commit": "b63ee0a", "metric": 1.7074, "metrics": {"win_rate": 50.0, "net_pnl": 6019.08, "total_trades": 24, "tp_exits": 5, "sl_exits": 3, "eod_exits": 16}, "status": "discard", "description": "OR=10 SL=2.5 TP=5.0 buffer=0.3 cooldown=1 EOD=900", "timestamp": 1785880718, "segment": 0}
{"run": 19, "commit": "b63ee0a", "metric": 2.2842, "metrics": {"win_rate": 45.5, "net_pnl": 7600.26, "total_trades": 22, "tp_exits": 0, "sl_exits": 10, "eod_exits": 12}, "status": "keep", "description": "OR=10 SL=1.0 TP=100(no cap) buffer=0.3 cooldown=1 EOD=900", "timestamp": 1785880743, "segment": 0}
{"run": 20, "commit": "b63ee0a", "metric": 2.0524, "metrics": {"win_rate": 42.1, "net_pnl": 6876.35, "total_trades": 19, "tp_exits": 0, "sl_exits": 5, "eod_exits": 14}, "status": "discard", "description": "OR=10 SL=1.5 TP=100(no cap) buffer=0.3 cooldown=1 EOD=900", "timestamp": 1785880745, "segment": 0}
{"run": 21, "commit": "b63ee0a", "metric": 1.7125, "metrics": {"win_rate": 42.1, "net_pnl": 5579.53, "total_trades": 19, "tp_exits": 0, "sl_exits": 5, "eod_exits": 14}, "status": "discard", "description": "OR=10 SL=2.0 TP=100(no cap) buffer=0.3 cooldown=1 EOD=900", "timestamp": 1785880746, "segment": 0}
{"run": 22, "commit": "b63ee0a", "metric": 2.167, "metrics": {"win_rate": 44.4, "net_pnl": 7418.56, "total_trades": 18, "tp_exits": 0, "sl_exits": 0, "eod_exits": 18}, "status": "discard", "description": "OR=10 SL=3.0 TP=100(no cap) buffer=0.3 cooldown=1 EOD=900", "timestamp": 1785880747, "segment": 0}
{"run": 23, "commit": "b63ee0a", "metric": 1.7682, "metrics": {"win_rate": 39.3, "net_pnl": 6379.78, "total_trades": 28, "tp_exits": 0, "sl_exits": 13, "eod_exits": 15}, "status": "discard", "description": "OR=5 SL=1.0 TP=100(no cap) buffer=0.3 cooldown=1 EOD=900", "timestamp": 1785880770, "segment": 0}
{"run": 24, "commit": "b63ee0a", "metric": 2.5299, "metrics": {"win_rate": 45.0, "net_pnl": 7582.12, "total_trades": 20, "tp_exits": 0, "sl_exits": 9, "eod_exits": 11}, "status": "keep", "description": "OR=15 SL=1.0 TP=100(no cap) buffer=0.3 cooldown=1 EOD=900", "timestamp": 1785880772, "segment": 0}
{"run": 25, "commit": "b63ee0a", "metric": 0.0005, "metrics": {"win_rate": 12.5, "net_pnl": -2275.48, "total_trades": 8, "tp_exits": 0, "sl_exits": 4, "eod_exits": 4}, "status": "discard", "description": "OR=60 SL=1.0 TP=100(no cap) buffer=0.3 cooldown=1 EOD=900", "timestamp": 1785880774, "segment": 0}
{"run": 26, "commit": "b63ee0a", "metric": 1.5115, "metrics": {"win_rate": 40.6, "net_pnl": 4861.59, "total_trades": 32, "tp_exits": 0, "sl_exits": 15, "eod_exits": 17}, "status": "discard", "description": "OR=10 SL=1.0 TP=100 buffer=0.0 cooldown=1 EOD=900", "timestamp": 1785880776, "segment": 0}
{"run": 27, "commit": "b63ee0a", "metric": 2.3064, "metrics": {"win_rate": 35.0, "net_pnl": 7314.89, "total_trades": 20, "tp_exits": 0, "sl_exits": 9, "eod_exits": 11}, "status": "discard", "description": "OR=10 SL=1.0 TP=100 buffer=0.5 cooldown=1 EOD=900", "timestamp": 1785880777, "segment": 0}
{"run": 28, "commit": "b63ee0a", "metric": 1.7771, "metrics": {"win_rate": 27.8, "net_pnl": 5137.92, "total_trades": 18, "tp_exits": 0, "sl_exits": 11, "eod_exits": 7}, "status": "discard", "description": "OR=10 SL=1.0 TP=100 buffer=1.0 cooldown=1 EOD=900", "timestamp": 1785880778, "segment": 0}
{"run": 29, "commit": "b63ee0a", "metric": 2.5299, "metrics": {"win_rate": 45.0, "net_pnl": 7582.12, "total_trades": 20, "tp_exits": 0, "sl_exits": 9, "eod_exits": 11}, "status": "keep", "description": "OR=12 SL=1.0 TP=100(no cap) buffer=0.3 cooldown=1 EOD=900", "timestamp": 1785880801, "segment": 0}
{"run": 30, "commit": "b63ee0a", "metric": 0.9248, "metrics": {"win_rate": 20.0, "net_pnl": -499.59, "total_trades": 20, "tp_exits": 0, "sl_exits": 11, "eod_exits": 9}, "status": "discard", "description": "OR=20 SL=1.0 TP=100(no cap) buffer=0.3 cooldown=1 EOD=900", "timestamp": 1785880803, "segment": 0}
{"run": 31, "commit": "b63ee0a", "metric": 0.0259, "metrics": {"win_rate": 21.4, "net_pnl": -4514.03, "total_trades": 14, "tp_exits": 0, "sl_exits": 7, "eod_exits": 7}, "status": "discard", "description": "OR=30 SL=1.0 TP=100(no cap) buffer=0.3 cooldown=1 EOD=900", "timestamp": 1785880804, "segment": 0}
{"run": 32, "commit": "b63ee0a", "metric": 2.4469, "metrics": {"win_rate": 42.9, "net_pnl": 7526.34, "total_trades": 21, "tp_exits": 0, "sl_exits": 8, "eod_exits": 13}, "status": "discard", "description": "OR=15 SL=1.0 TP=100 buffer=0.2 cooldown=1 EOD=900", "timestamp": 1785880806, "segment": 0}
{"run": 33, "commit": "b63ee0a", "metric": 2.8307, "metrics": {"win_rate": 44.4, "net_pnl": 8107.96, "total_trades": 18, "tp_exits": 0, "sl_exits": 8, "eod_exits": 10}, "status": "keep", "description": "OR=15 SL=1.0 TP=100 buffer=0.4 cooldown=1 EOD=900", "timestamp": 1785880807, "segment": 0}
{"run": 34, "commit": "b63ee0a", "metric": 2.0563, "metrics": {"win_rate": 21.1, "net_pnl": 6043.51, "total_trades": 19, "tp_exits": 0, "sl_exits": 9, "eod_exits": 10}, "status": "discard", "description": "OR=15 SL=1.0 TP=100 buffer=0.6 cooldown=1 EOD=900", "timestamp": 1785880808, "segment": 0}
{"run": 35, "commit": "b63ee0a", "metric": 2.5296, "metrics": {"win_rate": 45.0, "net_pnl": 7581.57, "total_trades": 20, "tp_exits": 0, "sl_exits": 9, "eod_exits": 11}, "status": "discard", "description": "OR=15 SL=1.0 TP=100 buffer=0.35 cooldown=1 EOD=900", "timestamp": 1785880842, "segment": 0}
{"run": 36, "commit": "b63ee0a", "metric": 2.8494, "metrics": {"win_rate": 35.3, "net_pnl": 8106.06, "total_trades": 17, "tp_exits": 0, "sl_exits": 7, "eod_exits": 10}, "status": "keep", "description": "OR=15 SL=1.0 TP=100 buffer=0.45 cooldown=1 EOD=900", "timestamp": 1785880843, "segment": 0}
{"run": 37, "commit": "b63ee0a", "metric": 2.848, "metrics": {"win_rate": 35.3, "net_pnl": 8103.9, "total_trades": 17, "tp_exits": 0, "sl_exits": 7, "eod_exits": 10}, "status": "discard", "description": "OR=15 SL=1.0 TP=100 buffer=0.5 cooldown=1 EOD=900", "timestamp": 1785880844, "segment": 0}
{"run": 38, "commit": "b63ee0a", "metric": 2.4445, "metrics": {"win_rate": 31.8, "net_pnl": 7710.6, "total_trades": 22, "tp_exits": 0, "sl_exits": 12, "eod_exits": 10}, "status": "discard", "description": "OR=15 SL=0.75 TP=100 buffer=0.4 cooldown=1 EOD=900", "timestamp": 1785880846, "segment": 0}
{"run": 39, "commit": "b63ee0a", "metric": 2.3741, "metrics": {"win_rate": 41.2, "net_pnl": 7155.72, "total_trades": 17, "tp_exits": 0, "sl_exits": 7, "eod_exits": 10}, "status": "discard", "description": "OR=15 SL=1.25 TP=100 buffer=0.4 cooldown=1 EOD=900", "timestamp": 1785880847, "segment": 0}
{"run": 40, "commit": "b63ee0a", "metric": 2.8494, "metrics": {"win_rate": 35.3, "net_pnl": 8106.06, "total_trades": 17, "tp_exits": 0, "sl_exits": 7, "eod_exits": 10}, "status": "keep", "description": "OR=15 SL=1.0 TP=100 buffer=0.45 cooldown=0 EOD=900", "timestamp": 1785880864, "segment": 0}
{"run": 41, "commit": "b63ee0a", "metric": 2.8186, "metrics": {"win_rate": 35.3, "net_pnl": 7971.01, "total_trades": 17, "tp_exits": 0, "sl_exits": 7, "eod_exits": 10}, "status": "discard", "description": "OR=15 SL=1.0 TP=100 buffer=0.45 cooldown=2 EOD=900", "timestamp": 1785880866, "segment": 0}
{"run": 42, "commit": "b63ee0a", "metric": 2.8665, "metrics": {"win_rate": 35.3, "net_pnl": 8181.1, "total_trades": 17, "tp_exits": 0, "sl_exits": 7, "eod_exits": 10}, "status": "keep", "description": "OR=15 SL=1.0 TP=100 buffer=0.45 cooldown=3 EOD=900", "timestamp": 1785880868, "segment": 0}
{"run": 43, "commit": "b63ee0a", "metric": 2.7595, "metrics": {"win_rate": 35.3, "net_pnl": 7755.92, "total_trades": 17, "tp_exits": 0, "sl_exits": 7, "eod_exits": 10}, "status": "discard", "description": "OR=15 SL=1.0 TP=100 buffer=0.45 cooldown=4 EOD=900", "timestamp": 1785880885, "segment": 0}
{"run": 44, "commit": "b63ee0a", "metric": 2.7765, "metrics": {"win_rate": 35.3, "net_pnl": 7910.98, "total_trades": 17, "tp_exits": 0, "sl_exits": 7, "eod_exits": 10}, "status": "discard", "description": "OR=15 SL=1.0 TP=100 buffer=0.45 cooldown=5 EOD=900", "timestamp": 1785880886, "segment": 0}
{"run": 45, "commit": "b63ee0a", "metric": 2.9983, "metrics": {"win_rate": 31.2, "net_pnl": 7563.25, "total_trades": 16, "tp_exits": 0, "sl_exits": 6, "eod_exits": 10}, "status": "keep", "description": "OR=15 SL=1.0 TP=100 buffer=0.45 cooldown=3 EOD=870", "timestamp": 1785880888, "segment": 0}
{"run": 46, "commit": "b63ee0a", "metric": 2.9667, "metrics": {"win_rate": 41.2, "net_pnl": 7477.75, "total_trades": 17, "tp_exits": 0, "sl_exits": 6, "eod_exits": 11}, "status": "discard", "description": "OR=15 SL=1.0 TP=100 buffer=0.45 cooldown=3 EOD=885", "timestamp": 1785880889, "segment": 0}
{"run": 47, "commit": "b63ee0a", "metric": 3.7725, "metrics": {"win_rate": 53.3, "net_pnl": 8946.13, "total_trades": 15, "tp_exits": 0, "sl_exits": 5, "eod_exits": 10}, "status": "keep", "description": "OR=15 SL=1.0 TP=100 buffer=0.45 cooldown=3 EOD=840", "timestamp": 1785880899, "segment": 0}
{"run": 48, "commit": "b63ee0a", "metric": 3.3097, "metrics": {"win_rate": 37.5, "net_pnl": 8461.12, "total_trades": 16, "tp_exits": 0, "sl_exits": 5, "eod_exits": 11}, "status": "discard", "description": "OR=15 SL=1.0 TP=100 buffer=0.45 cooldown=3 EOD=855", "timestamp": 1785880901, "segment": 0}
{"run": 49, "commit": "b63ee0a", "metric": 3.244, "metrics": {"win_rate": 43.8, "net_pnl": 8321.21, "total_trades": 16, "tp_exits": 0, "sl_exits": 5, "eod_exits": 11}, "status": "discard", "description": "OR=15 SL=1.0 TP=100 buffer=0.45 cooldown=3 EOD=860", "timestamp": 1785880902, "segment": 0}
{"run": 50, "commit": "b63ee0a", "metric": 3.431, "metrics": {"win_rate": 46.7, "net_pnl": 7492.06, "total_trades": 15, "tp_exits": 0, "sl_exits": 5, "eod_exits": 10}, "status": "discard", "description": "OR=15 SL=1.0 TP=100 buffer=0.45 cooldown=3 EOD=810", "timestamp": 1785880917, "segment": 0}
{"run": 51, "commit": "b63ee0a", "metric": 3.6936, "metrics": {"win_rate": 40.0, "net_pnl": 8626.33, "total_trades": 15, "tp_exits": 0, "sl_exits": 5, "eod_exits": 10}, "status": "discard", "description": "OR=15 SL=1.0 TP=100 buffer=0.45 cooldown=3 EOD=825", "timestamp": 1785880918, "segment": 0}
{"run": 52, "commit": "b63ee0a", "metric": 3.72, "metrics": {"win_rate": 40.0, "net_pnl": 8551.39, "total_trades": 15, "tp_exits": 0, "sl_exits": 5, "eod_exits": 10}, "status": "discard", "description": "OR=15 SL=1.0 TP=100 buffer=0.45 cooldown=3 EOD=830", "timestamp": 1785880920, "segment": 0}
{"run": 53, "commit": "b63ee0a", "metric": 3.6808, "metrics": {"win_rate": 40.0, "net_pnl": 8681.3, "total_trades": 15, "tp_exits": 0, "sl_exits": 5, "eod_exits": 10}, "status": "discard", "description": "OR=15 SL=1.0 TP=100 buffer=0.45 cooldown=3 EOD=835", "timestamp": 1785880922, "segment": 0}
{"run": 54, "commit": "b63ee0a", "metric": 4.0294, "metrics": {"win_rate": 46.7, "net_pnl": 9870.52, "total_trades": 15, "tp_exits": 0, "sl_exits": 5, "eod_exits": 10}, "status": "keep", "description": "OR=15 SL=1.0 TP=100 buffer=0.45 cooldown=3 EOD=845", "timestamp": 1785880924, "segment": 0}
{"run": 55, "commit": "b63ee0a", "metric": 4.0294, "metrics": {"win_rate": 46.7, "net_pnl": 9870.52, "total_trades": 15, "tp_exits": 0, "sl_exits": 5, "eod_exits": 10}, "status": "keep", "description": "OR=15 SL=1.0 TP=100 buffer=0.45 cooldown=3 EOD=842", "timestamp": 1785880942, "segment": 0}
{"run": 56, "commit": "b63ee0a", "metric": 4.0294, "metrics": {"win_rate": 46.7, "net_pnl": 9870.52, "total_trades": 15, "tp_exits": 0, "sl_exits": 5, "eod_exits": 10}, "status": "keep", "description": "OR=15 SL=1.0 TP=100 buffer=0.45 cooldown=3 EOD=843", "timestamp": 1785880943, "segment": 0}
{"run": 57, "commit": "b63ee0a", "metric": 3.4521, "metrics": {"win_rate": 37.5, "net_pnl": 8700.97, "total_trades": 16, "tp_exits": 0, "sl_exits": 5, "eod_exits": 11}, "status": "discard", "description": "OR=15 SL=1.0 TP=100 buffer=0.45 cooldown=3 EOD=847", "timestamp": 1785880945, "segment": 0}
{"run": 58, "commit": "b63ee0a", "metric": 3.4521, "metrics": {"win_rate": 37.5, "net_pnl": 8700.97, "total_trades": 16, "tp_exits": 0, "sl_exits": 5, "eod_exits": 11}, "status": "discard", "description": "OR=15 SL=1.0 TP=100 buffer=0.45 cooldown=3 EOD=848", "timestamp": 1785880946, "segment": 0}
{"run": 59, "commit": "b63ee0a", "metric": 3.4521, "metrics": {"win_rate": 37.5, "net_pnl": 8700.97, "total_trades": 16, "tp_exits": 0, "sl_exits": 5, "eod_exits": 11}, "status": "discard", "description": "OR=15 SL=1.0 TP=100 buffer=0.45 cooldown=3 EOD=850", "timestamp": 1785880948, "segment": 0}
{"run": 60, "commit": "b63ee0a", "metric": 4.0294, "metrics": {"win_rate": 46.7, "net_pnl": 9870.52, "total_trades": 15, "tp_exits": 0, "sl_exits": 5, "eod_exits": 10}, "status": "keep", "description": "OR=15 SL=1.0 TP=100 buffer=0.45 cooldown=3 EOD=845 min_or_range=0.2", "timestamp": 1785880958, "segment": 0}
{"run": 61, "commit": "b63ee0a", "metric": 4.0294, "metrics": {"win_rate": 46.7, "net_pnl": 9870.52, "total_trades": 15, "tp_exits": 0, "sl_exits": 5, "eod_exits": 10}, "status": "keep", "description": "OR=15 SL=1.0 TP=100 buffer=0.45 cooldown=3 EOD=845 min_or_range=0.5", "timestamp": 1785880959, "segment": 0}
{"run": 62, "commit": "b63ee0a", "metric": 4.5015, "metrics": {"win_rate": 50.0, "net_pnl": 10212.25, "total_trades": 14, "tp_exits": 0, "sl_exits": 5, "eod_exits": 9}, "status": "keep", "description": "OR=15 SL=1.0 TP=100 buffer=0.45 cooldown=3 EOD=845 min_or_range=0.8", "timestamp": 1785880961, "segment": 0}
{"run": 63, "commit": "b63ee0a", "metric": 4.5015, "metrics": {"win_rate": 50.0, "net_pnl": 10212.25, "total_trades": 14, "tp_exits": 0, "sl_exits": 5, "eod_exits": 9}, "status": "keep", "description": "OR=15 SL=1.0 TP=100 buffer=0.45 cooldown=3 EOD=845 min_or_range=1.0", "timestamp": 1785880976, "segment": 0}
{"run": 64, "commit": "b63ee0a", "metric": 4.5015, "metrics": {"win_rate": 50.0, "net_pnl": 10212.25, "total_trades": 14, "tp_exits": 0, "sl_exits": 5, "eod_exits": 9}, "status": "keep", "description": "OR=15 SL=1.0 TP=100 buffer=0.45 cooldown=3 EOD=845 min_or_range=1.2", "timestamp": 1785880977, "segment": 0}
{"run": 65, "commit": "b63ee0a", "metric": 8.0206, "metrics": {"win_rate": 62.5, "net_pnl": 11072.41, "total_trades": 8, "tp_exits": 0, "sl_exits": 3, "eod_exits": 5}, "status": "discard", "description": "OR=15 SL=1.0 TP=100 buffer=0.45 cooldown=3 EOD=845 min_or_range=1.5 [<10 trades unreliable]", "timestamp": 1785880979, "segment": 0}
{"run": 66, "commit": "b63ee0a", "metric": 12.4778, "metrics": {"win_rate": 71.4, "net_pnl": 11635.78, "total_trades": 7, "tp_exits": 0, "sl_exits": 2, "eod_exits": 5}, "status": "discard", "description": "OR=15 SL=1.0 TP=100 buffer=0.45 cooldown=3 EOD=845 min_or_range=2.0 [<10 trades unreliable]", "timestamp": 1785880980, "segment": 0}
{"run": 67, "commit": "b63ee0a", "metric": 23.8805, "metrics": {"win_rate": 75.0, "net_pnl": 11691.25, "total_trades": 4, "tp_exits": 0, "sl_exits": 1, "eod_exits": 3}, "status": "discard", "description": "OR=15 SL=1.0 TP=100 buffer=0.45 cooldown=3 EOD=845 min_or_range=3.0 [<10 trades unreliable]", "timestamp": 1785880981, "segment": 0}
{"run": 68, "commit": "b63ee0a", "metric": 4.2266, "metrics": {"win_rate": 57.1, "net_pnl": 9292.86, "total_trades": 14, "tp_exits": 0, "sl_exits": 5, "eod_exits": 9}, "status": "discard", "description": "OR=15 SL=1.0 TP=100 buffer=0.45 cooldown=3 EOD=840 min_or_range=0.8", "timestamp": 1785881005, "segment": 0}
{"run": 69, "commit": "b63ee0a", "metric": 3.856, "metrics": {"win_rate": 40.0, "net_pnl": 9072.68, "total_trades": 15, "tp_exits": 0, "sl_exits": 5, "eod_exits": 10}, "status": "discard", "description": "OR=15 SL=1.0 TP=100 buffer=0.45 cooldown=3 EOD=850 min_or_range=0.8", "timestamp": 1785881006, "segment": 0}
{"run": 70, "commit": "b63ee0a", "metric": 3.0459, "metrics": {"win_rate": 48.6, "net_pnl": 11557.68, "total_trades": 35, "tp_exits": 0, "sl_exits": 9, "eod_exits": 26}, "status": "discard", "description": "OR=15 SL=1.0 TP=100 buffer=0.45 cooldown=3 EOD=845 min_or_range=0.8 SHORTS=1", "timestamp": 1785881007, "segment": 0}
{"run": 71, "commit": "b63ee0a", "metric": 2.9825, "metrics": {"win_rate": 48.6, "net_pnl": 11387.71, "total_trades": 35, "tp_exits": 0, "sl_exits": 9, "eod_exits": 26}, "status": "discard", "description": "OR=15 SL=1.0 TP=100 buffer=0.45 cooldown=1 EOD=845 min_or_range=0.8 SHORTS=1", "timestamp": 1785881008, "segment": 0}
{"run": 72, "commit": "b63ee0a", "metric": 4.0542, "metrics": {"win_rate": 56.2, "net_pnl": 10093.84, "total_trades": 16, "tp_exits": 0, "sl_exits": 6, "eod_exits": 10}, "status": "discard", "description": "OR=15 SL=1.0 TP=100 buffer=0.4 cooldown=3 EOD=845 min_or_range=0.8", "timestamp": 1785881023, "segment": 0}
