{"type":"config","name":"newgen-supertrend","metricName":"profit_factor","metricUnit":"ratio","bestDirection":"higher"}
{"run": 1, "commit": "b63ee0a", "metric": 0.0, "metrics": {"win_rate": 0.0, "net_pnl": 0.0, "total_trades": 0, "tp_exits": 0, "sl_exits": 0, "eod_exits": 0}, "status": "discard", "description": "baseline tf=15 ATR=10 MULT=3.0 SL=0 TP=0 EOD=885 shorts=0", "timestamp": 1785880747.6651764, "segment": 0}
{"run": 2, "commit": "b63ee0a", "metric": 0.0, "metrics": {"win_rate": 0.0, "net_pnl": 0.0, "total_trades": 0, "tp_exits": 0, "sl_exits": 0, "eod_exits": 0}, "status": "discard", "description": "tf=15 ATR=10 MULT=2.0 SL=0 TP=0 EOD=885 shorts=0", "timestamp": 1785880772.8863895, "segment": 0}
{"run": 3, "commit": "b63ee0a", "metric": 0.0, "metrics": {"win_rate": 0.0, "net_pnl": 0.0, "total_trades": 0, "tp_exits": 0, "sl_exits": 0, "eod_exits": 0}, "status": "discard", "description": "tf=15 ATR=10 MULT=2.5 SL=0 TP=0 EOD=885 shorts=0", "timestamp": 1785880774.1051514, "segment": 0}
{"run": 4, "commit": "b63ee0a", "metric": 0.0, "metrics": {"win_rate": 0.0, "net_pnl": 0.0, "total_trades": 0, "tp_exits": 0, "sl_exits": 0, "eod_exits": 0}, "status": "discard", "description": "tf=15 ATR=10 MULT=3.5 SL=0 TP=0 EOD=885 shorts=0", "timestamp": 1785880775.2767313, "segment": 0}
{"run": 5, "commit": "b63ee0a", "metric": 0.0, "metrics": {"win_rate": 0.0, "net_pnl": 0.0, "total_trades": 0, "tp_exits": 0, "sl_exits": 0, "eod_exits": 0}, "status": "discard", "description": "tf=15 ATR=10 MULT=4.0 SL=0 TP=0 EOD=885 shorts=0", "timestamp": 1785880776.4087734, "segment": 0}
{"run": 6, "commit": "b63ee0a", "metric": 2.4798, "metrics": {"win_rate": 33.3, "net_pnl": 3382.38, "total_trades": 3, "tp_exits": 0, "sl_exits": 0, "eod_exits": 3}, "status": "keep", "description": "tf=15 ATR=10 MULT=1.5 SL=0 TP=0 EOD=885 shorts=0", "timestamp": 1785880783.2874813, "segment": 0}
{"run": 7, "commit": "b63ee0a", "metric": 0.0, "metrics": {"win_rate": 0.0, "net_pnl": -3483.02, "total_trades": 3, "tp_exits": 0, "sl_exits": 0, "eod_exits": 3}, "status": "discard", "description": "tf=15 ATR=14 MULT=1.5 SL=0 TP=0 EOD=885 shorts=0", "timestamp": 1785880784.1801128, "segment": 0}
{"run": 8, "commit": "b63ee0a", "metric": 0.0, "metrics": {"win_rate": 0.0, "net_pnl": -3483.02, "total_trades": 3, "tp_exits": 0, "sl_exits": 0, "eod_exits": 3}, "status": "discard", "description": "tf=15 ATR=20 MULT=1.5 SL=0 TP=0 EOD=885 shorts=0", "timestamp": 1785880785.2930155, "segment": 0}
{"run": 9, "commit": "b63ee0a", "metric": 4.9025, "metrics": {"win_rate": 50.0, "net_pnl": 4511.93, "total_trades": 2, "tp_exits": 0, "sl_exits": 0, "eod_exits": 2}, "status": "keep", "description": "tf=15 ATR=7 MULT=1.5 SL=0 TP=0 EOD=885 shorts=0", "timestamp": 1785880786.3708591, "segment": 0}
{"run": 10, "commit": "b63ee0a", "metric": 0.2379, "metrics": {"win_rate": 37.5, "net_pnl": -4058.69, "total_trades": 8, "tp_exits": 0, "sl_exits": 0, "eod_exits": 8}, "status": "keep", "description": "tf=15 ATR=10 MULT=1.0 SL=0 TP=0 EOD=885 shorts=0", "timestamp": 1785880787.4877627, "segment": 0}
{"run": 11, "commit": "b63ee0a", "metric": 0.0711, "metrics": {"win_rate": 22.2, "net_pnl": -6203.39, "total_trades": 9, "tp_exits": 0, "sl_exits": 0, "eod_exits": 8}, "status": "keep", "description": "tf=15 ATR=14 MULT=1.0 SL=0 TP=0 EOD=885 shorts=0", "timestamp": 1785880788.8215384, "segment": 0}
{"run": 12, "commit": "b63ee0a", "metric": 0.3346, "metrics": {"win_rate": 36.4, "net_pnl": -4595.78, "total_trades": 11, "tp_exits": 0, "sl_exits": 0, "eod_exits": 11}, "status": "keep", "description": "tf=15 ATR=20 MULT=1.0 SL=0 TP=0 EOD=885 shorts=0", "timestamp": 1785880790.0133765, "segment": 0}
{"run": 13, "commit": "b63ee0a", "metric": 0.7442, "metrics": {"win_rate": 33.3, "net_pnl": -1211.69, "total_trades": 6, "tp_exits": 0, "sl_exits": 0, "eod_exits": 6}, "status": "keep", "description": "tf=15 ATR=7 MULT=1.0 SL=0 TP=0 EOD=885 shorts=0", "timestamp": 1785880791.298232, "segment": 0}
{"run": 14, "commit": "b63ee0a", "metric": 0.7713, "metrics": {"win_rate": 33.3, "net_pnl": -255.34, "total_trades": 3, "tp_exits": 1, "sl_exits": 2, "eod_exits": 0}, "status": "keep", "description": "tf=15 ATR=10 MULT=1.5 SL=1.0 TP=2.0 EOD=885 shorts=0", "timestamp": 1785880800.650465, "segment": 0}
{"run": 15, "commit": "b63ee0a", "metric": 1.1786, "metrics": {"win_rate": 33.3, "net_pnl": 199.37, "total_trades": 3, "tp_exits": 1, "sl_exits": 2, "eod_exits": 0}, "status": "keep", "description": "tf=15 ATR=10 MULT=1.5 SL=1.0 TP=3.0 EOD=885 shorts=0", "timestamp": 1785880801.9140072, "segment": 0}
{"run": 16, "commit": "b63ee0a", "metric": 0.8117, "metrics": {"win_rate": 33.3, "net_pnl": -305.34, "total_trades": 3, "tp_exits": 1, "sl_exits": 2, "eod_exits": 0}, "status": "keep", "description": "tf=15 ATR=10 MULT=1.5 SL=1.5 TP=3.0 EOD=885 shorts=0", "timestamp": 1785880802.9303048, "segment": 0}
{"run": 17, "commit": "b63ee0a", "metric": 0.8329, "metrics": {"win_rate": 33.3, "net_pnl": -355.34, "total_trades": 3, "tp_exits": 1, "sl_exits": 2, "eod_exits": 0}, "status": "keep", "description": "tf=15 ATR=10 MULT=1.5 SL=2.0 TP=4.0 EOD=885 shorts=0", "timestamp": 1785880804.000694, "segment": 0}
{"run": 18, "commit": "b63ee0a", "metric": 1.4528, "metrics": {"win_rate": 50.0, "net_pnl": 268.4, "total_trades": 2, "tp_exits": 1, "sl_exits": 1, "eod_exits": 0}, "status": "keep", "description": "tf=15 ATR=7 MULT=1.5 SL=1.0 TP=2.0 EOD=885 shorts=0", "timestamp": 1785880804.9977295, "segment": 0}
{"run": 19, "commit": "b63ee0a", "metric": 2.2199, "metrics": {"win_rate": 50.0, "net_pnl": 723.11, "total_trades": 2, "tp_exits": 1, "sl_exits": 1, "eod_exits": 0}, "status": "keep", "description": "tf=15 ATR=7 MULT=1.5 SL=1.0 TP=3.0 EOD=885 shorts=0", "timestamp": 1785880805.897388, "segment": 0}
{"run": 20, "commit": "b63ee0a", "metric": 1.5288, "metrics": {"win_rate": 50.0, "net_pnl": 455.15, "total_trades": 2, "tp_exits": 1, "sl_exits": 1, "eod_exits": 0}, "status": "keep", "description": "tf=15 ATR=7 MULT=1.5 SL=1.5 TP=3.0 EOD=885 shorts=0", "timestamp": 1785880806.7607627, "segment": 0}
{"run": 21, "commit": "b63ee0a", "metric": 1.5687, "metrics": {"win_rate": 50.0, "net_pnl": 641.9, "total_trades": 2, "tp_exits": 1, "sl_exits": 1, "eod_exits": 0}, "status": "keep", "description": "tf=15 ATR=7 MULT=1.5 SL=2.0 TP=4.0 EOD=885 shorts=0", "timestamp": 1785880807.5806336, "segment": 0}
{"run": 22, "commit": "b63ee0a", "metric": 44.9489, "metrics": {"win_rate": 50.0, "net_pnl": 6797.14, "total_trades": 2, "tp_exits": 0, "sl_exits": 0, "eod_exits": 2}, "status": "keep", "description": "tf=60 ATR=10 MULT=1.0 SL=0 TP=0 EOD=885 shorts=0", "timestamp": 1785880818.805637, "segment": 0}
{"run": 23, "commit": "b63ee0a", "metric": 99.9999, "metrics": {"win_rate": 100.0, "net_pnl": 6971.55, "total_trades": 2, "tp_exits": 0, "sl_exits": 0, "eod_exits": 2}, "status": "keep", "description": "tf=60 ATR=14 MULT=1.0 SL=0 TP=0 EOD=885 shorts=0", "timestamp": 1785880819.468697, "segment": 0}
{"run": 24, "commit": "b63ee0a", "metric": 99.9999, "metrics": {"win_rate": 100.0, "net_pnl": 6971.55, "total_trades": 2, "tp_exits": 0, "sl_exits": 0, "eod_exits": 2}, "status": "keep", "description": "tf=60 ATR=20 MULT=1.0 SL=0 TP=0 EOD=885 shorts=0", "timestamp": 1785880820.2137277, "segment": 0}
{"run": 25, "commit": "b63ee0a", "metric": 0.0, "metrics": {"win_rate": 0.0, "net_pnl": 0.0, "total_trades": 0, "tp_exits": 0, "sl_exits": 0, "eod_exits": 0}, "status": "discard", "description": "tf=60 ATR=10 MULT=1.5 SL=0 TP=0 EOD=885 shorts=0", "timestamp": 1785880821.070203, "segment": 0}
{"run": 26, "commit": "b63ee0a", "metric": 0.0, "metrics": {"win_rate": 0.0, "net_pnl": 0.0, "total_trades": 0, "tp_exits": 0, "sl_exits": 0, "eod_exits": 0}, "status": "discard", "description": "tf=60 ATR=14 MULT=1.5 SL=0 TP=0 EOD=885 shorts=0", "timestamp": 1785880821.8607705, "segment": 0}
{"run": 27, "commit": "b63ee0a", "metric": 0.0, "metrics": {"win_rate": 0.0, "net_pnl": 0.0, "total_trades": 0, "tp_exits": 0, "sl_exits": 0, "eod_exits": 0}, "status": "discard", "description": "tf=60 ATR=20 MULT=1.5 SL=0 TP=0 EOD=885 shorts=0", "timestamp": 1785880822.837759, "segment": 0}
{"run": 28, "commit": "b63ee0a", "metric": 0.0, "metrics": {"win_rate": 0.0, "net_pnl": 0.0, "total_trades": 0, "tp_exits": 0, "sl_exits": 0, "eod_exits": 0}, "status": "discard", "description": "tf=60 ATR=7 MULT=1.5 SL=0 TP=0 EOD=885 shorts=0", "timestamp": 1785880823.5384958, "segment": 0}
{"run": 29, "commit": "b63ee0a", "metric": 99.9999, "metrics": {"win_rate": 100.0, "net_pnl": 1846.11, "total_trades": 2, "tp_exits": 2, "sl_exits": 0, "eod_exits": 0}, "status": "keep", "description": "tf=60 ATR=10 MULT=1.0 SL=1.0 TP=2.0 EOD=885 shorts=0", "timestamp": 1785880824.2138433, "segment": 0}
{"run": 30, "commit": "b63ee0a", "metric": 2.007, "metrics": {"win_rate": 54.5, "net_pnl": 2685.14, "total_trades": 11, "tp_exits": 5, "sl_exits": 5, "eod_exits": 1}, "status": "keep", "description": "tf=15 ATR=20 MULT=1.0 SL=1.0 TP=2.0 EOD=885 shorts=0", "timestamp": 1785880839.0465558, "segment": 0}
{"run": 31, "commit": "b63ee0a", "metric": 0.4504, "metrics": {"win_rate": 36.4, "net_pnl": -2818.9, "total_trades": 11, "tp_exits": 0, "sl_exits": 6, "eod_exits": 5}, "status": "keep", "description": "tf=15 ATR=20 MULT=1.0 SL=1.5 TP=3.0 EOD=885 shorts=0", "timestamp": 1785880839.7232594, "segment": 0}
{"run": 32, "commit": "b63ee0a", "metric": 0.6291, "metrics": {"win_rate": 36.4, "net_pnl": -1362.51, "total_trades": 11, "tp_exits": 0, "sl_exits": 6, "eod_exits": 5}, "status": "keep", "description": "tf=15 ATR=20 MULT=1.0 SL=1.0 TP=3.0 EOD=885 shorts=0", "timestamp": 1785880840.603219, "segment": 0}
{"run": 33, "commit": "b63ee0a", "metric": 0.3867, "metrics": {"win_rate": 36.4, "net_pnl": -3664.09, "total_trades": 11, "tp_exits": 0, "sl_exits": 4, "eod_exits": 7}, "status": "keep", "description": "tf=15 ATR=20 MULT=1.0 SL=2.0 TP=4.0 EOD=885 shorts=0", "timestamp": 1785880841.577554, "segment": 0}
{"run": 34, "commit": "b63ee0a", "metric": 0.3369, "metrics": {"win_rate": 36.4, "net_pnl": -4665.74, "total_trades": 11, "tp_exits": 0, "sl_exits": 0, "eod_exits": 11}, "status": "keep", "description": "tf=15 ATR=20 MULT=1.0 SL=0 TP=0 EOD=870 shorts=0", "timestamp": 1785880842.427263, "segment": 0}
{"run": 35, "commit": "b63ee0a", "metric": 0.1149, "metrics": {"win_rate": 27.3, "net_pnl": -7558.87, "total_trades": 11, "tp_exits": 0, "sl_exits": 0, "eod_exits": 10}, "status": "keep", "description": "tf=15 ATR=20 MULT=1.0 SL=0 TP=0 EOD=900 shorts=0", "timestamp": 1785880843.2350807, "segment": 0}
{"run": 36, "commit": "b63ee0a", "metric": 2.022, "metrics": {"win_rate": 54.5, "net_pnl": 2725.12, "total_trades": 11, "tp_exits": 5, "sl_exits": 5, "eod_exits": 1}, "status": "keep", "description": "tf=15 ATR=20 MULT=1.0 SL=1.0 TP=2.0 EOD=870 shorts=0", "timestamp": 1785880844.1034398, "segment": 0}
{"run": 37, "commit": "b63ee0a", "metric": 1.9507, "metrics": {"win_rate": 54.5, "net_pnl": 2535.24, "total_trades": 11, "tp_exits": 5, "sl_exits": 5, "eod_exits": 1}, "status": "keep", "description": "tf=15 ATR=20 MULT=1.0 SL=1.0 TP=2.0 EOD=900 shorts=0", "timestamp": 1785880845.090149, "segment": 0}
{"run": 38, "commit": "b63ee0a", "metric": 2.0766, "metrics": {"win_rate": 59.1, "net_pnl": 4641.37, "total_trades": 22, "tp_exits": 6, "sl_exits": 7, "eod_exits": 9}, "status": "keep", "description": "tf=15 ATR=20 MULT=1.0 SL=1.0 TP=2.0 EOD=885 shorts=1", "timestamp": 1785880861.6224334, "segment": 0}
{"run": 39, "commit": "b63ee0a", "metric": 0.8583, "metrics": {"win_rate": 54.5, "net_pnl": -1294.43, "total_trades": 22, "tp_exits": 0, "sl_exits": 0, "eod_exits": 22}, "status": "keep", "description": "tf=15 ATR=20 MULT=1.0 SL=0 TP=0 EOD=885 shorts=1", "timestamp": 1785880862.3797305, "segment": 0}
{"run": 40, "commit": "b63ee0a", "metric": 99.9999, "metrics": {"win_rate": 100.0, "net_pnl": 889.24, "total_trades": 2, "tp_exits": 1, "sl_exits": 0, "eod_exits": 1}, "status": "keep", "description": "tf=60 ATR=20 MULT=1.0 SL=1.0 TP=2.0 EOD=885 shorts=0", "timestamp": 1785880863.1591368, "segment": 0}
{"run": 41, "commit": "b63ee0a", "metric": 99.9999, "metrics": {"win_rate": 100.0, "net_pnl": 889.24, "total_trades": 2, "tp_exits": 1, "sl_exits": 0, "eod_exits": 1}, "status": "keep", "description": "tf=60 ATR=14 MULT=1.0 SL=1.0 TP=2.0 EOD=885 shorts=0", "timestamp": 1785880863.9251742, "segment": 0}
{"run": 42, "commit": "b63ee0a", "metric": 0.7482, "metrics": {"win_rate": 33.3, "net_pnl": -727.71, "total_trades": 9, "tp_exits": 2, "sl_exits": 5, "eod_exits": 1}, "status": "keep", "description": "tf=15 ATR=14 MULT=1.0 SL=1.0 TP=2.0 EOD=885 shorts=0", "timestamp": 1785880864.9405644, "segment": 0}
{"run": 43, "commit": "b63ee0a", "metric": 1.3822, "metrics": {"win_rate": 54.5, "net_pnl": 1479.77, "total_trades": 11, "tp_exits": 5, "sl_exits": 5, "eod_exits": 1}, "status": "keep", "description": "tf=15 ATR=20 MULT=1.0 SL=1.5 TP=2.0 EOD=885 shorts=0", "timestamp": 1785880865.823318, "segment": 0}
{"run": 44, "commit": "b63ee0a", "metric": 1.0772, "metrics": {"win_rate": 45.5, "net_pnl": 248.58, "total_trades": 11, "tp_exits": 1, "sl_exits": 6, "eod_exits": 4}, "status": "keep", "description": "tf=15 ATR=20 MULT=1.0 SL=1.0 TP=2.5 EOD=885 shorts=0", "timestamp": 1785880866.8222172, "segment": 0}
{"run": 45, "commit": "b63ee0a", "metric": 1.9076, "metrics": {"win_rate": 59.1, "net_pnl": 3912.56, "total_trades": 22, "tp_exits": 5, "sl_exits": 7, "eod_exits": 10}, "status": "keep", "description": "perturb tf=15 ATR=18 MULT=1.0 SL=1.0 TP=2.0 EOD=885 shorts=1", "timestamp": 1785880875.1693656, "segment": 0}
{"run": 46, "commit": "b63ee0a", "metric": 1.9565, "metrics": {"win_rate": 57.1, "net_pnl": 4123.36, "total_trades": 21, "tp_exits": 6, "sl_exits": 7, "eod_exits": 8}, "status": "keep", "description": "perturb tf=15 ATR=22 MULT=1.0 SL=1.0 TP=2.0 EOD=885 shorts=1", "timestamp": 1785880876.0271068, "segment": 0}
{"run": 47, "commit": "b63ee0a", "metric": 1.3253, "metrics": {"win_rate": 50.0, "net_pnl": 2071.38, "total_trades": 26, "tp_exits": 6, "sl_exits": 10, "eod_exits": 10}, "status": "keep", "description": "perturb tf=15 ATR=20 MULT=0.9 SL=1.0 TP=2.0 EOD=885 shorts=1", "timestamp": 1785880876.8883815, "segment": 0}
{"run": 48, "commit": "b63ee0a", "metric": 1.5877, "metrics": {"win_rate": 57.9, "net_pnl": 2472.93, "total_trades": 19, "tp_exits": 4, "sl_exits": 7, "eod_exits": 8}, "status": "keep", "description": "perturb tf=15 ATR=20 MULT=1.1 SL=1.0 TP=2.0 EOD=885 shorts=1", "timestamp": 1785880877.789755, "segment": 0}
{"run": 49, "commit": "b63ee0a", "metric": 2.0475, "metrics": {"win_rate": 54.5, "net_pnl": 4334.41, "total_trades": 22, "tp_exits": 6, "sl_exits": 9, "eod_exits": 7}, "status": "keep", "description": "perturb tf=15 ATR=20 MULT=1.0 SL=0.8 TP=2.0 EOD=885 shorts=1", "timestamp": 1785880878.6342745, "segment": 0}
{"run": 50, "commit": "b63ee0a", "metric": 2.0428, "metrics": {"win_rate": 59.1, "net_pnl": 4495.4, "total_trades": 22, "tp_exits": 8, "sl_exits": 7, "eod_exits": 7}, "status": "keep", "description": "perturb tf=15 ATR=20 MULT=1.0 SL=1.0 TP=1.8 EOD=885 shorts=1", "timestamp": 1785880879.6627462, "segment": 0}
