{"run": 70, "commit": "b63ee0a", "metric": 2.0884, "metrics": {"win_rate": 65.7, "net_pnl": 16643.98, "total_trades": 67, "tp_exits": 29, "sl_exits": 4, "eod_exits": 34}, "status": "keep", "description": "tf=5|fast=12|slow=26|sl=1.75|tp=1.0|cd=0|shorts=1|eod=855|cd 0", "timestamp": 1785880862, "segment": 0}
{"run": 71, "commit": "b63ee0a", "metric": 2.0884, "metrics": {"win_rate": 65.7, "net_pnl": 16643.98, "total_trades": 67, "tp_exits": 29, "sl_exits": 4, "eod_exits": 34}, "status": "keep", "description": "tf=5|fast=12|slow=26|sl=1.75|tp=1.0|cd=1|shorts=1|eod=855|cd 1", "timestamp": 1785880863, "segment": 0}
{"run": 72, "commit": "b63ee0a", "metric": 1.4935, "metrics": {"win_rate": 64.4, "net_pnl": 10635.13, "total_trades": 73, "tp_exits": 29, "sl_exits": 7, "eod_exits": 37}, "status": "discard", "description": "tf=5|fast=11|slow=24|sl=1.75|tp=1.0|cd=3|shorts=1|eod=855|perturb pair", "timestamp": 1785880878, "segment": 0}
{"run": 73, "commit": "b63ee0a", "metric": 1.9004, "metrics": {"win_rate": 63.1, "net_pnl": 13728.63, "total_trades": 65, "tp_exits": 27, "sl_exits": 4, "eod_exits": 34}, "status": "discard", "description": "tf=5|fast=13|slow=28|sl=1.75|tp=1.0|cd=3|shorts=1|eod=855|perturb pair", "timestamp": 1785880879, "segment": 0}
{"run": 74, "commit": "b63ee0a", "metric": 2.1097, "metrics": {"win_rate": 67.6, "net_pnl": 16597.17, "total_trades": 68, "tp_exits": 31, "sl_exits": 4, "eod_exits": 33}, "status": "keep", "description": "tf=5|fast=12|slow=26|sl=1.75|tp=0.95|cd=3|shorts=1|eod=855|perturb tp", "timestamp": 1785880880, "segment": 0}
{"run": 75, "commit": "b63ee0a", "metric": 1.6277, "metrics": {"win_rate": 62.1, "net_pnl": 11894.93, "total_trades": 66, "tp_exits": 27, "sl_exits": 6, "eod_exits": 33}, "status": "discard", "description": "tf=5|fast=12|slow=26|sl=1.75|tp=1.05|cd=3|shorts=1|eod=855|perturb tp", "timestamp": 1785880881, "segment": 0}
{"run": 76, "commit": "b63ee0a", "metric": 2.1622, "metrics": {"win_rate": 70.1, "net_pnl": 16946.78, "total_trades": 67, "tp_exits": 29, "sl_exits": 4, "eod_exits": 34}, "status": "keep", "description": "tf=5|fast=12|slow=26|sl=1.75|tp=1.0|cd=3|shorts=1|eod=850|perturb eod", "timestamp": 1785880883, "segment": 0}
{"run": 77, "commit": "b63ee0a", "metric": 1.9005, "metrics": {"win_rate": 64.2, "net_pnl": 15039.59, "total_trades": 67, "tp_exits": 29, "sl_exits": 4, "eod_exits": 34}, "status": "discard", "description": "tf=5|fast=12|slow=26|sl=1.75|tp=1.0|cd=3|shorts=1|eod=860|perturb eod", "timestamp": 1785880884, "segment": 0}
{"run": 78, "commit": "b63ee0a", "metric": 2.0884, "metrics": {"win_rate": 65.7, "net_pnl": 16643.98, "total_trades": 67, "tp_exits": 29, "sl_exits": 4, "eod_exits": 34}, "status": "discard", "description": "tf=5|fast=12|slow=26|sl=1.75|tp=1.0|cd=5|shorts=1|eod=855|perturb cd", "timestamp": 1785880885, "segment": 0}
{"run": 79, "commit": "b63ee0a", "metric": 1.7746, "metrics": {"win_rate": 68.2, "net_pnl": 13439.72, "total_trades": 66, "tp_exits": 29, "sl_exits": 4, "eod_exits": 33}, "status": "discard", "description": "tf=5|fast=12|slow=26|sl=1.75|tp=1.0|cd=3|shorts=1|eod=845|eod 845", "timestamp": 1785880896, "segment": 0}
{"run": 80, "commit": "b63ee0a", "metric": 1.8281, "metrics": {"win_rate": 68.8, "net_pnl": 13849.34, "total_trades": 64, "tp_exits": 28, "sl_exits": 3, "eod_exits": 33}, "status": "discard", "description": "tf=5|fast=12|slow=26|sl=1.75|tp=1.0|cd=3|shorts=1|eod=840|eod 840", "timestamp": 1785880897, "segment": 0}
{"run": 81, "commit": "b63ee0a", "metric": 1.9255, "metrics": {"win_rate": 71.4, "net_pnl": 13859.69, "total_trades": 63, "tp_exits": 27, "sl_exits": 3, "eod_exits": 33}, "status": "discard", "description": "tf=5|fast=12|slow=26|sl=1.75|tp=1.0|cd=3|shorts=1|eod=830|eod 830", "timestamp": 1785880898, "segment": 0}
{"run": 82, "commit": "b63ee0a", "metric": 2.1607, "metrics": {"win_rate": 71.6, "net_pnl": 16644.39, "total_trades": 67, "tp_exits": 31, "sl_exits": 4, "eod_exits": 32}, "status": "discard", "description": "tf=5|fast=12|slow=26|sl=1.75|tp=0.95|cd=3|shorts=1|eod=850|tp 0.95 eod850", "timestamp": 1785880900, "segment": 0}
{"run": 83, "commit": "b63ee0a", "metric": 1.7571, "metrics": {"win_rate": 69.7, "net_pnl": 13016.83, "total_trades": 66, "tp_exits": 30, "sl_exits": 4, "eod_exits": 32}, "status": "discard", "description": "tf=5|fast=12|slow=26|sl=1.75|tp=0.95|cd=3|shorts=1|eod=845|tp 0.95 eod845", "timestamp": 1785880901, "segment": 0}
{"run": 84, "commit": "b63ee0a", "metric": 2.1622, "metrics": {"win_rate": 70.1, "net_pnl": 16946.78, "total_trades": 67, "tp_exits": 29, "sl_exits": 4, "eod_exits": 34}, "status": "keep", "description": "tf=5|fast=12|slow=26|sl=1.75|tp=1.0|cd=3|shorts=1|eod=850|recheck eod850", "timestamp": 1785880902, "segment": 0}
{"run": 85, "commit": "b63ee0a", "metric": 1.6958, "metrics": {"win_rate": 68.6, "net_pnl": 13316.73, "total_trades": 70, "tp_exits": 30, "sl_exits": 7, "eod_exits": 33}, "status": "discard", "description": "tf=5|fast=12|slow=24|sl=1.75|tp=1.0|cd=3|shorts=1|eod=850|robust pair", "timestamp": 1785880916, "segment": 0}
{"run": 86, "commit": "b63ee0a", "metric": 1.6707, "metrics": {"win_rate": 68.1, "net_pnl": 12795.92, "total_trades": 69, "tp_exits": 29, "sl_exits": 7, "eod_exits": 33}, "status": "discard", "description": "tf=5|fast=11|slow=26|sl=1.75|tp=1.0|cd=3|shorts=1|eod=850|robust pair", "timestamp": 1785880917, "segment": 0}
{"run": 87, "commit": "b63ee0a", "metric": 1.7076, "metrics": {"win_rate": 60.3, "net_pnl": 11148.24, "total_trades": 63, "tp_exits": 26, "sl_exits": 5, "eod_exits": 32}, "status": "discard", "description": "tf=5|fast=14|slow=30|sl=1.75|tp=1.0|cd=3|shorts=1|eod=850|robust pair", "timestamp": 1785880918, "segment": 0}
{"run": 88, "commit": "b63ee0a", "metric": 1.9769, "metrics": {"win_rate": 70.0, "net_pnl": 15793.7, "total_trades": 70, "tp_exits": 29, "sl_exits": 8, "eod_exits": 33}, "status": "discard", "description": "tf=5|fast=12|slow=26|sl=1.5|tp=1.0|cd=3|shorts=1|eod=850|robust sl", "timestamp": 1785880919, "segment": 0}
{"run": 89, "commit": "b63ee0a", "metric": 2.0237, "metrics": {"win_rate": 70.1, "net_pnl": 15948.82, "total_trades": 67, "tp_exits": 29, "sl_exits": 4, "eod_exits": 34}, "status": "discard", "description": "tf=5|fast=12|slow=26|sl=2.0|tp=1.0|cd=3|shorts=1|eod=850|robust sl", "timestamp": 1785880921, "segment": 0}
{"run": 90, "commit": "b63ee0a", "metric": 1.7907, "metrics": {"win_rate": 61.0, "net_pnl": 8418.66, "total_trades": 41, "tp_exits": 19, "sl_exits": 1, "eod_exits": 21}, "status": "discard", "description": "tf=5|fast=12|slow=26|sl=1.75|tp=1.0|cd=3|shorts=0|eod=850|robust shorts off", "timestamp": 1785880922, "segment": 0}
