{"type":"config","name":"newgen-ema","metricName":"profit_factor","metricUnit":"ratio","bestDirection":"higher"}
{"run": 1, "commit": "b63ee0a", "metric": 1.1657, "metrics": {"win_rate": 47.0, "net_pnl": 3783.54, "total_trades": 66, "tp_exits": 16, "sl_exits": 15, "eod_exits": 35}, "status": "keep", "description": "tf=5|fast=9|slow=21|sl=1.0|tp=1.5|cd=3|shorts=0|eod=885|baseline", "timestamp": 1785880681, "segment": 0}
{"run": 2, "commit": "b63ee0a", "metric": 1.119, "metrics": {"win_rate": 48.1, "net_pnl": 1511.24, "total_trades": 27, "tp_exits": 9, "sl_exits": 11, "eod_exits": 7}, "status": "discard", "description": "tf=15|fast=9|slow=21|sl=1.0|tp=1.5|cd=3|shorts=0|eod=885|tf sweep", "timestamp": 1785880692, "segment": 0}
{"run": 3, "commit": "b63ee0a", "metric": 0.4064, "metrics": {"win_rate": 22.2, "net_pnl": -4121.94, "total_trades": 9, "tp_exits": 2, "sl_exits": 6, "eod_exits": 1}, "status": "discard", "description": "tf=60|fast=9|slow=21|sl=1.0|tp=1.5|cd=3|shorts=0|eod=885|tf sweep", "timestamp": 1785880693, "segment": 0}
{"run": 4, "commit": "b63ee0a", "metric": 0.805, "metrics": {"win_rate": 39.8, "net_pnl": -8442.09, "total_trades": 93, "tp_exits": 21, "sl_exits": 32, "eod_exits": 40}, "status": "discard", "description": "tf=5|fast=5|slow=13|sl=1.0|tp=1.5|cd=3|shorts=0|eod=885|pair 5/13", "timestamp": 1785880694, "segment": 0}
{"run": 5, "commit": "b63ee0a", "metric": 1.0475, "metrics": {"win_rate": 44.9, "net_pnl": 1220.71, "total_trades": 69, "tp_exits": 16, "sl_exits": 18, "eod_exits": 35}, "status": "discard", "description": "tf=5|fast=8|slow=21|sl=1.0|tp=1.5|cd=3|shorts=0|eod=885|pair 8/21", "timestamp": 1785880695, "segment": 0}
{"run": 6, "commit": "b63ee0a", "metric": 1.1921, "metrics": {"win_rate": 49.0, "net_pnl": 3591.29, "total_trades": 51, "tp_exits": 13, "sl_exits": 13, "eod_exits": 25}, "status": "keep", "description": "tf=5|fast=12|slow=26|sl=1.0|tp=1.5|cd=3|shorts=0|eod=885|pair 12/26", "timestamp": 1785880696, "segment": 0}
{"run": 7, "commit": "b63ee0a", "metric": 0.6483, "metrics": {"win_rate": 38.7, "net_pnl": -5414.75, "total_trades": 31, "tp_exits": 5, "sl_exits": 13, "eod_exits": 13}, "status": "discard", "description": "tf=5|fast=20|slow=50|sl=1.0|tp=1.5|cd=3|shorts=0|eod=885|pair 20/50", "timestamp": 1785880697, "segment": 0}
{"run": 8, "commit": "b63ee0a", "metric": 1.0561, "metrics": {"win_rate": 40.7, "net_pnl": 895.84, "total_trades": 54, "tp_exits": 9, "sl_exits": 25, "eod_exits": 20}, "status": "discard", "description": "tf=5|fast=12|slow=26|sl=0.5|tp=1.5|cd=3|shorts=0|eod=885|sl sweep", "timestamp": 1785880707, "segment": 0}
{"run": 9, "commit": "b63ee0a", "metric": 1.3808, "metrics": {"win_rate": 53.2, "net_pnl": 6530.71, "total_trades": 47, "tp_exits": 14, "sl_exits": 6, "eod_exits": 27}, "status": "keep", "description": "tf=5|fast=12|slow=26|sl=1.5|tp=1.5|cd=3|shorts=0|eod=885|sl sweep", "timestamp": 1785880708, "segment": 0}
{"run": 10, "commit": "b63ee0a", "metric": 1.3809, "metrics": {"win_rate": 53.3, "net_pnl": 6435.72, "total_trades": 45, "tp_exits": 14, "sl_exits": 3, "eod_exits": 28}, "status": "keep", "description": "tf=5|fast=12|slow=26|sl=2.0|tp=1.5|cd=3|shorts=0|eod=885|sl sweep", "timestamp": 1785880709, "segment": 0}
{"run": 11, "commit": "b63ee0a", "metric": 1.2688, "metrics": {"win_rate": 54.9, "net_pnl": 4155.37, "total_trades": 51, "tp_exits": 19, "sl_exits": 10, "eod_exits": 22}, "status": "discard", "description": "tf=5|fast=12|slow=26|sl=1.0|tp=1.0|cd=3|shorts=0|eod=885|tp sweep", "timestamp": 1785880710, "segment": 0}
{"run": 12, "commit": "b63ee0a", "metric": 0.8574, "metrics": {"win_rate": 42.0, "net_pnl": -3207.49, "total_trades": 50, "tp_exits": 8, "sl_exits": 17, "eod_exits": 25}, "status": "discard", "description": "tf=5|fast=12|slow=26|sl=1.0|tp=2.0|cd=3|shorts=0|eod=885|tp sweep", "timestamp": 1785880711, "segment": 0}
{"run": 13, "commit": "b63ee0a", "metric": 0.7409, "metrics": {"win_rate": 40.0, "net_pnl": -6105.17, "total_trades": 50, "tp_exits": 3, "sl_exits": 18, "eod_exits": 29}, "status": "discard", "description": "tf=5|fast=12|slow=26|sl=1.0|tp=3.0|cd=3|shorts=0|eod=885|tp sweep", "timestamp": 1785880712, "segment": 0}
{"run": 14, "commit": "b63ee0a", "metric": 1.1136, "metrics": {"win_rate": 40.0, "net_pnl": 2677.22, "total_trades": 50, "tp_exits": 0, "sl_exits": 18, "eod_exits": 32}, "status": "discard", "description": "tf=5|fast=12|slow=26|sl=1.0|tp=0|cd=3|shorts=0|eod=885|tp sweep no tp", "timestamp": 1785880713, "segment": 0}
{"run": 15, "commit": "b63ee0a", "metric": 1.2685, "metrics": {"win_rate": 53.3, "net_pnl": 4939.42, "total_trades": 45, "tp_exits": 14, "sl_exits": 3, "eod_exits": 28}, "status": "discard", "description": "tf=5|fast=12|slow=26|sl=2.5|tp=1.5|cd=3|shorts=0|eod=885|sl wider", "timestamp": 1785880722, "segment": 0}
{"run": 16, "commit": "b63ee0a", "metric": 1.233, "metrics": {"win_rate": 53.3, "net_pnl": 4407.91, "total_trades": 45, "tp_exits": 14, "sl_exits": 1, "eod_exits": 30}, "status": "discard", "description": "tf=5|fast=12|slow=26|sl=3.0|tp=1.5|cd=3|shorts=0|eod=885|sl wider", "timestamp": 1785880722, "segment": 0}
{"run": 17, "commit": "b63ee0a", "metric": 1.6143, "metrics": {"win_rate": 58.7, "net_pnl": 7671.57, "total_trades": 46, "tp_exits": 20, "sl_exits": 1, "eod_exits": 25}, "status": "keep", "description": "tf=5|fast=12|slow=26|sl=2.0|tp=1.0|cd=3|shorts=0|eod=885|sl/tp combo", "timestamp": 1785880723, "segment": 0}
{"run": 18, "commit": "b63ee0a", "metric": 0.8932, "metrics": {"win_rate": 45.5, "net_pnl": -2489.82, "total_trades": 44, "tp_exits": 9, "sl_exits": 6, "eod_exits": 29}, "status": "discard", "description": "tf=5|fast=12|slow=26|sl=2.0|tp=2.0|cd=3|shorts=0|eod=885|sl/tp combo", "timestamp": 1785880724, "segment": 0}
{"run": 19, "commit": "b63ee0a", "metric": 1.4928, "metrics": {"win_rate": 58.3, "net_pnl": 6769.29, "total_trades": 48, "tp_exits": 20, "sl_exits": 4, "eod_exits": 24}, "status": "discard", "description": "tf=5|fast=12|slow=26|sl=1.5|tp=1.0|cd=3|shorts=0|eod=885|sl/tp combo", "timestamp": 1785880725, "segment": 0}
{"run": 20, "commit": "b63ee0a", "metric": 0.9592, "metrics": {"win_rate": 45.7, "net_pnl": -900.11, "total_trades": 46, "tp_exits": 9, "sl_exits": 9, "eod_exits": 28}, "status": "discard", "description": "tf=5|fast=12|slow=26|sl=1.5|tp=2.0|cd=3|shorts=0|eod=885|sl/tp combo", "timestamp": 1785880727, "segment": 0}
{"run": 21, "commit": "b63ee0a", "metric": 1.4212, "metrics": {"win_rate": 61.7, "net_pnl": 4996.0, "total_trades": 47, "tp_exits": 23, "sl_exits": 1, "eod_exits": 23}, "status": "discard", "description": "tf=5|fast=12|slow=26|sl=2.0|tp=0.75|cd=3|shorts=0|eod=885|tp tighter", "timestamp": 1785880737, "segment": 0}
{"run": 22, "commit": "b63ee0a", "metric": 1.411, "metrics": {"win_rate": 69.4, "net_pnl": 4040.2, "total_trades": 49, "tp_exits": 33, "sl_exits": 1, "eod_exits": 15}, "status": "discard", "description": "tf=5|fast=12|slow=26|sl=2.0|tp=0.5|cd=3|shorts=0|eod=885|tp tighter", "timestamp": 1785880738, "segment": 0}
{"run": 23, "commit": "b63ee0a", "metric": 1.5523, "metrics": {"win_rate": 58.7, "net_pnl": 7172.53, "total_trades": 46, "tp_exits": 20, "sl_exits": 1, "eod_exits": 25}, "status": "discard", "description": "tf=5|fast=12|slow=26|sl=2.5|tp=1.0|cd=3|shorts=0|eod=885|sl/tp combo", "timestamp": 1785880740, "segment": 0}
{"run": 24, "commit": "b63ee0a", "metric": 1.3123, "metrics": {"win_rate": 61.2, "net_pnl": 4093.72, "total_trades": 49, "tp_exits": 23, "sl_exits": 4, "eod_exits": 22}, "status": "discard", "description": "tf=5|fast=12|slow=26|sl=1.5|tp=0.75|cd=3|shorts=0|eod=885|sl/tp combo", "timestamp": 1785880741, "segment": 0}
{"run": 25, "commit": "b63ee0a", "metric": 1.6143, "metrics": {"win_rate": 58.7, "net_pnl": 7671.57, "total_trades": 46, "tp_exits": 20, "sl_exits": 1, "eod_exits": 25}, "status": "keep", "description": "tf=5|fast=12|slow=26|sl=2.0|tp=1.0|cd=0|shorts=0|eod=885|cooldown 0", "timestamp": 1785880742, "segment": 0}
{"run": 26, "commit": "b63ee0a", "metric": 1.6143, "metrics": {"win_rate": 58.7, "net_pnl": 7671.57, "total_trades": 46, "tp_exits": 20, "sl_exits": 1, "eod_exits": 25}, "status": "keep", "description": "tf=5|fast=12|slow=26|sl=2.0|tp=1.0|cd=1|shorts=0|eod=885|cooldown 1", "timestamp": 1785880744, "segment": 0}
{"run": 27, "commit": "b63ee0a", "metric": 0.7819, "metrics": {"win_rate": 46.9, "net_pnl": -5565.13, "total_trades": 64, "tp_exits": 18, "sl_exits": 5, "eod_exits": 41}, "status": "discard", "description": "tf=5|fast=8|slow=21|sl=2.0|tp=1.0|cd=3|shorts=0|eod=885|pair resweep", "timestamp": 1785880754, "segment": 0}
{"run": 28, "commit": "b63ee0a", "metric": 1.1308, "metrics": {"win_rate": 52.5, "net_pnl": 2418.55, "total_trades": 61, "tp_exits": 20, "sl_exits": 2, "eod_exits": 39}, "status": "discard", "description": "tf=5|fast=9|slow=21|sl=2.0|tp=1.0|cd=3|shorts=0|eod=885|pair resweep", "timestamp": 1785880755, "segment": 0}
{"run": 29, "commit": "b63ee0a", "metric": 1.1965, "metrics": {"win_rate": 56.2, "net_pnl": 3118.56, "total_trades": 48, "tp_exits": 19, "sl_exits": 2, "eod_exits": 27}, "status": "discard", "description": "tf=5|fast=10|slow=26|sl=2.0|tp=1.0|cd=3|shorts=0|eod=885|pair resweep", "timestamp": 1785880757, "segment": 0}
{"run": 30, "commit": "b63ee0a", "metric": 1.3358, "metrics": {"win_rate": 54.3, "net_pnl": 4442.14, "total_trades": 46, "tp_exits": 18, "sl_exits": 2, "eod_exits": 26}, "status": "discard", "description": "tf=5|fast=12|slow=30|sl=2.0|tp=1.0|cd=3|shorts=0|eod=885|pair resweep", "timestamp": 1785880758, "segment": 0}
{"run": 31, "commit": "b63ee0a", "metric": 1.0136, "metrics": {"win_rate": 55.8, "net_pnl": 225.03, "total_trades": 43, "tp_exits": 16, "sl_exits": 4, "eod_exits": 23}, "status": "discard", "description": "tf=5|fast=16|slow=34|sl=2.0|tp=1.0|cd=3|shorts=0|eod=885|pair resweep", "timestamp": 1785880759, "segment": 0}
{"run": 32, "commit": "b63ee0a", "metric": 1.6061, "metrics": {"win_rate": 62.9, "net_pnl": 12817.84, "total_trades": 70, "tp_exits": 35, "sl_exits": 4, "eod_exits": 31}, "status": "discard", "description": "tf=5|fast=12|slow=26|sl=2.0|tp=1.0|cd=3|shorts=1|eod=885|shorts on", "timestamp": 1785880760, "segment": 0}
{"run": 33, "commit": "b63ee0a", "metric": 1.2479, "metrics": {"win_rate": 56.8, "net_pnl": 6741.24, "total_trades": 81, "tp_exits": 34, "sl_exits": 5, "eod_exits": 42}, "status": "discard", "description": "tf=5|fast=9|slow=21|sl=2.0|tp=1.0|cd=3|shorts=1|eod=885|shorts on", "timestamp": 1785880761, "segment": 0}
{"run": 34, "commit": "b63ee0a", "metric": 1.4863, "metrics": {"win_rate": 69.3, "net_pnl": 9995.25, "total_trades": 75, "tp_exits": 43, "sl_exits": 5, "eod_exits": 27}, "status": "discard", "description": "tf=5|fast=12|slow=26|sl=2.0|tp=0.75|cd=3|shorts=1|eod=885|shorts tp tune", "timestamp": 1785880771, "segment": 0}
{"run": 35, "commit": "b63ee0a", "metric": 1.5636, "metrics": {"win_rate": 63.5, "net_pnl": 12504.15, "total_trades": 74, "tp_exits": 35, "sl_exits": 9, "eod_exits": 30}, "status": "discard", "description": "tf=5|fast=12|slow=26|sl=1.5|tp=1.0|cd=3|shorts=1|eod=885|shorts sl tune", "timestamp": 1785880772, "segment": 0}
{"run": 36, "commit": "b63ee0a", "metric": 1.5637, "metrics": {"win_rate": 62.9, "net_pnl": 12244.21, "total_trades": 70, "tp_exits": 35, "sl_exits": 3, "eod_exits": 32}, "status": "discard", "description": "tf=5|fast=12|slow=26|sl=2.5|tp=1.0|cd=3|shorts=1|eod=885|shorts sl tune", "timestamp": 1785880773, "segment": 0}
{"run": 37, "commit": "b63ee0a", "metric": 0.5722, "metrics": {"win_rate": 44.4, "net_pnl": -4624.51, "total_trades": 18, "tp_exits": 6, "sl_exits": 2, "eod_exits": 10}, "status": "discard", "description": "tf=15|fast=12|slow=26|sl=2.0|tp=1.0|cd=3|shorts=0|eod=885|tf15 best sl/tp", "timestamp": 1785880774, "segment": 0}
{"run": 38, "commit": "b63ee0a", "metric": 0.717, "metrics": {"win_rate": 47.1, "net_pnl": -4697.28, "total_trades": 34, "tp_exits": 12, "sl_exits": 3, "eod_exits": 19}, "status": "discard", "description": "tf=15|fast=12|slow=26|sl=2.0|tp=1.0|cd=3|shorts=1|eod=885|tf15 shorts", "timestamp": 1785880775, "segment": 0}
{"run": 39, "commit": "b63ee0a", "metric": 1.7602, "metrics": {"win_rate": 59.5, "net_pnl": 8423.53, "total_trades": 42, "tp_exits": 20, "sl_exits": 1, "eod_exits": 21}, "status": "keep", "description": "tf=5|fast=12|slow=26|sl=2.0|tp=1.0|cd=3|shorts=0|eod=870|eod 870", "timestamp": 1785880777, "segment": 0}
{"run": 40, "commit": "b63ee0a", "metric": 1.4662, "metrics": {"win_rate": 56.9, "net_pnl": 6825.09, "total_trades": 51, "tp_exits": 21, "sl_exits": 1, "eod_exits": 29}, "status": "discard", "description": "tf=5|fast=12|slow=26|sl=2.0|tp=1.0|cd=3|shorts=0|eod=900|eod 900", "timestamp": 1785880778, "segment": 0}
{"run": 41, "commit": "b63ee0a", "metric": 1.7953, "metrics": {"win_rate": 61.9, "net_pnl": 8673.41, "total_trades": 42, "tp_exits": 19, "sl_exits": 1, "eod_exits": 22}, "status": "keep", "description": "tf=5|fast=12|slow=26|sl=2.0|tp=1.0|cd=3|shorts=0|eod=855|eod 855", "timestamp": 1785880786, "segment": 0}
{"run": 42, "commit": "b63ee0a", "metric": 1.5224, "metrics": {"win_rate": 60.5, "net_pnl": 6418.59, "total_trades": 38, "tp_exits": 18, "sl_exits": 0, "eod_exits": 20}, "status": "discard", "description": "tf=5|fast=12|slow=26|sl=2.0|tp=1.0|cd=3|shorts=0|eod=840|eod 840", "timestamp": 1785880788, "segment": 0}
{"run": 43, "commit": "b63ee0a", "metric": 1.8101, "metrics": {"win_rate": 68.1, "net_pnl": 15010.68, "total_trades": 69, "tp_exits": 33, "sl_exits": 4, "eod_exits": 32}, "status": "keep", "description": "tf=5|fast=12|slow=26|sl=2.0|tp=1.0|cd=3|shorts=1|eod=870|shorts eod 870", "timestamp": 1785880789, "segment": 0}
{"run": 44, "commit": "b63ee0a", "metric": 1.9605, "metrics": {"win_rate": 65.7, "net_pnl": 15646.02, "total_trades": 67, "tp_exits": 29, "sl_exits": 4, "eod_exits": 34}, "status": "keep", "description": "tf=5|fast=12|slow=26|sl=2.0|tp=1.0|cd=3|shorts=1|eod=855|shorts eod 855", "timestamp": 1785880791, "segment": 0}
{"run": 45, "commit": "b63ee0a", "metric": 1.6378, "metrics": {"win_rate": 60.5, "net_pnl": 7623.04, "total_trades": 43, "tp_exits": 20, "sl_exits": 4, "eod_exits": 19}, "status": "discard", "description": "tf=5|fast=12|slow=26|sl=1.5|tp=1.0|cd=3|shorts=0|eod=870|sl tune eod870", "timestamp": 1785880792, "segment": 0}
{"run": 46, "commit": "b63ee0a", "metric": 1.6843, "metrics": {"win_rate": 59.5, "net_pnl": 7924.49, "total_trades": 42, "tp_exits": 20, "sl_exits": 1, "eod_exits": 21}, "status": "discard", "description": "tf=5|fast=12|slow=26|sl=2.5|tp=1.0|cd=3|shorts=0|eod=870|sl tune eod870", "timestamp": 1785880793, "segment": 0}
{"run": 47, "commit": "b63ee0a", "metric": 1.7498, "metrics": {"win_rate": 68.8, "net_pnl": 13100.91, "total_trades": 64, "tp_exits": 28, "sl_exits": 3, "eod_exits": 33}, "status": "discard", "description": "tf=5|fast=12|slow=26|sl=2.0|tp=1.0|cd=3|shorts=1|eod=840|shorts eod 840", "timestamp": 1785880803, "segment": 0}
{"run": 48, "commit": "b63ee0a", "metric": 1.8063, "metrics": {"win_rate": 66.7, "net_pnl": 12723.58, "total_trades": 63, "tp_exits": 27, "sl_exits": 3, "eod_exits": 33}, "status": "discard", "description": "tf=5|fast=12|slow=26|sl=2.0|tp=1.0|cd=3|shorts=1|eod=825|shorts eod 825", "timestamp": 1785880804, "segment": 0}
{"run": 49, "commit": "b63ee0a", "metric": 1.7554, "metrics": {"win_rate": 66.7, "net_pnl": 12106.32, "total_trades": 63, "tp_exits": 27, "sl_exits": 3, "eod_exits": 33}, "status": "discard", "description": "tf=5|fast=12|slow=26|sl=2.0|tp=1.0|cd=3|shorts=1|eod=810|shorts eod 810", "timestamp": 1785880805, "segment": 0}
{"run": 50, "commit": "b63ee0a", "metric": 1.6079, "metrics": {"win_rate": 60.0, "net_pnl": 13056.33, "total_trades": 65, "tp_exits": 25, "sl_exits": 6, "eod_exits": 34}, "status": "discard", "description": "tf=5|fast=12|slow=26|sl=2.0|tp=1.25|cd=3|shorts=1|eod=855|shorts tp 1.25", "timestamp": 1785880806, "segment": 0}
{"run": 51, "commit": "b63ee0a", "metric": 1.5964, "metrics": {"win_rate": 70.0, "net_pnl": 10566.47, "total_trades": 70, "tp_exits": 38, "sl_exits": 5, "eod_exits": 27}, "status": "discard", "description": "tf=5|fast=12|slow=26|sl=2.0|tp=0.75|cd=3|shorts=1|eod=855|shorts tp 0.75", "timestamp": 1785880807, "segment": 0}
{"run": 52, "commit": "b63ee0a", "metric": 1.9106, "metrics": {"win_rate": 65.7, "net_pnl": 15384.0, "total_trades": 70, "tp_exits": 29, "sl_exits": 8, "eod_exits": 33}, "status": "discard", "description": "tf=5|fast=12|slow=26|sl=1.5|tp=1.0|cd=3|shorts=1|eod=855|shorts sl 1.5", "timestamp": 1785880808, "segment": 0}
{"run": 53, "commit": "b63ee0a", "metric": 1.7247, "metrics": {"win_rate": 69.9, "net_pnl": 14460.93, "total_trades": 73, "tp_exits": 31, "sl_exits": 5, "eod_exits": 37}, "status": "discard", "description": "tf=5|fast=10|slow=21|sl=2.0|tp=1.0|cd=3|shorts=1|eod=855|pair resweep2", "timestamp": 1785880820, "segment": 0}
{"run": 54, "commit": "b63ee0a", "metric": 1.6222, "metrics": {"win_rate": 64.1, "net_pnl": 13857.42, "total_trades": 78, "tp_exits": 32, "sl_exits": 6, "eod_exits": 40}, "status": "discard", "description": "tf=5|fast=8|slow=21|sl=2.0|tp=1.0|cd=3|shorts=1|eod=855|pair resweep2", "timestamp": 1785880822, "segment": 0}
{"run": 55, "commit": "b63ee0a", "metric": 1.6679, "metrics": {"win_rate": 66.7, "net_pnl": 13917.42, "total_trades": 75, "tp_exits": 31, "sl_exits": 5, "eod_exits": 39}, "status": "discard", "description": "tf=5|fast=9|slow=21|sl=2.0|tp=1.0|cd=3|shorts=1|eod=855|pair resweep2", "timestamp": 1785880823, "segment": 0}
{"run": 56, "commit": "b63ee0a", "metric": 1.769, "metrics": {"win_rate": 61.5, "net_pnl": 12464.25, "total_trades": 65, "tp_exits": 27, "sl_exits": 4, "eod_exits": 34}, "status": "discard", "description": "tf=5|fast=12|slow=30|sl=2.0|tp=1.0|cd=3|shorts=1|eod=855|pair resweep2", "timestamp": 1785880824, "segment": 0}
{"run": 57, "commit": "b63ee0a", "metric": 1.7238, "metrics": {"win_rate": 66.2, "net_pnl": 13335.86, "total_trades": 68, "tp_exits": 29, "sl_exits": 4, "eod_exits": 35}, "status": "discard", "description": "tf=5|fast=10|slow=26|sl=2.0|tp=1.0|cd=3|shorts=1|eod=855|pair resweep2", "timestamp": 1785880825, "segment": 0}
{"run": 58, "commit": "b63ee0a", "metric": 1.1508, "metrics": {"win_rate": 58.7, "net_pnl": 3343.28, "total_trades": 63, "tp_exits": 24, "sl_exits": 7, "eod_exits": 32}, "status": "discard", "description": "tf=5|fast=16|slow=34|sl=2.0|tp=1.0|cd=3|shorts=1|eod=855|pair resweep2", "timestamp": 1785880826, "segment": 0}
{"run": 59, "commit": "b63ee0a", "metric": 1.9742, "metrics": {"win_rate": 65.7, "net_pnl": 15758.93, "total_trades": 67, "tp_exits": 29, "sl_exits": 3, "eod_exits": 35}, "status": "keep", "description": "tf=5|fast=12|slow=26|sl=2.25|tp=1.0|cd=3|shorts=1|eod=855|fine sl 2.25", "timestamp": 1785880837, "segment": 0}
{"run": 60, "commit": "b63ee0a", "metric": 2.0884, "metrics": {"win_rate": 65.7, "net_pnl": 16643.98, "total_trades": 67, "tp_exits": 29, "sl_exits": 4, "eod_exits": 34}, "status": "keep", "description": "tf=5|fast=12|slow=26|sl=1.75|tp=1.0|cd=3|shorts=1|eod=855|fine sl 1.75", "timestamp": 1785880838, "segment": 0}
{"run": 61, "commit": "b63ee0a", "metric": 1.9305, "metrics": {"win_rate": 67.6, "net_pnl": 14845.04, "total_trades": 68, "tp_exits": 33, "sl_exits": 4, "eod_exits": 31}, "status": "discard", "description": "tf=5|fast=12|slow=26|sl=2.0|tp=0.9|cd=3|shorts=1|eod=855|fine tp 0.9", "timestamp": 1785880839, "segment": 0}
{"run": 62, "commit": "b63ee0a", "metric": 1.4338, "metrics": {"win_rate": 60.0, "net_pnl": 9316.92, "total_trades": 65, "tp_exits": 25, "sl_exits": 6, "eod_exits": 34}, "status": "discard", "description": "tf=5|fast=12|slow=26|sl=2.0|tp=1.1|cd=3|shorts=1|eod=855|fine tp 1.1", "timestamp": 1785880839, "segment": 0}
{"run": 63, "commit": "b63ee0a", "metric": 0.7316, "metrics": {"win_rate": 45.2, "net_pnl": -4126.34, "total_trades": 31, "tp_exits": 12, "sl_exits": 3, "eod_exits": 16}, "status": "discard", "description": "tf=15|fast=12|slow=26|sl=2.0|tp=1.0|cd=3|shorts=1|eod=855|tf15 winner", "timestamp": 1785880840, "segment": 0}
{"run": 64, "commit": "b63ee0a", "metric": 0.6849, "metrics": {"win_rate": 51.2, "net_pnl": -6942.13, "total_trades": 41, "tp_exits": 15, "sl_exits": 6, "eod_exits": 20}, "status": "discard", "description": "tf=15|fast=9|slow=21|sl=2.0|tp=1.0|cd=3|shorts=1|eod=855|tf15 9/21", "timestamp": 1785880841, "segment": 0}
{"run": 65, "commit": "b63ee0a", "metric": 0.7355, "metrics": {"win_rate": 50.0, "net_pnl": -1765.09, "total_trades": 12, "tp_exits": 5, "sl_exits": 2, "eod_exits": 5}, "status": "discard", "description": "tf=60|fast=12|slow=26|sl=2.0|tp=1.0|cd=3|shorts=1|eod=855|tf60 winner", "timestamp": 1785880842, "segment": 0}
{"run": 66, "commit": "b63ee0a", "metric": 1.8149, "metrics": {"win_rate": 65.2, "net_pnl": 14419.35, "total_trades": 69, "tp_exits": 29, "sl_exits": 8, "eod_exits": 32}, "status": "discard", "description": "tf=5|fast=12|slow=26|sl=1.6|tp=1.0|cd=3|shorts=1|eod=855|fine sl 1.6", "timestamp": 1785880858, "segment": 0}
{"run": 67, "commit": "b63ee0a", "metric": 2.067, "metrics": {"win_rate": 65.7, "net_pnl": 16485.5, "total_trades": 67, "tp_exits": 29, "sl_exits": 5, "eod_exits": 33}, "status": "discard", "description": "tf=5|fast=12|slow=26|sl=1.7|tp=1.0|cd=3|shorts=1|eod=855|fine sl 1.7", "timestamp": 1785880859, "segment": 0}
{"run": 68, "commit": "b63ee0a", "metric": 2.0615, "metrics": {"win_rate": 65.7, "net_pnl": 16444.38, "total_trades": 67, "tp_exits": 29, "sl_exits": 4, "eod_exits": 34}, "status": "discard", "description": "tf=5|fast=12|slow=26|sl=1.8|tp=1.0|cd=3|shorts=1|eod=855|fine sl 1.8", "timestamp": 1785880860, "segment": 0}
{"run": 69, "commit": "b63ee0a", "metric": 2.0098, "metrics": {"win_rate": 65.7, "net_pnl": 16045.2, "total_trades": 67, "tp_exits": 29, "sl_exits": 4, "eod_exits": 34}, "status": "discard", "description": "tf=5|fast=12|slow=26|sl=1.9|tp=1.0|cd=3|shorts=1|eod=855|fine sl 1.9", "timestamp": 1785880861, "segment": 0}
